subreddit,type,keyword,id,author,title,body,created_utc
Neoliberal,comment,genocide,i9ag09i,AutoModerator,,"Comment removed: To protect against ban evasion and spam, your account must be at least 5 days old to participate in /r/neoliberal.

*I am a bot, and this action was performed automatically. Please [contact the moderators of this subreddit](/message/compose/?to=/r/neoliberal) if you have any questions or concerns.*",2022-05-20T04:23:25+00:00
Neoliberal,comment,genocide,ke25hlj,Key_Environment8179,,"Most of the issue is with JPost, actually. See the mod sticky",2023-12-19T17:16:43+00:00
Neoliberal,comment,genocide,gyph5bv,BJJblue34,,"I agree. I think the question to ask is why? We saw this radicalization during the late 19th and early 20th century. The result was fascism and communism. So, what conditions created an acceptance toward totalitarianism? I think a plausible reason is the world had radically changed over a 100 year period. A massive number of people in the industrial world went from a farmer to a factory worker. A massive amount of wealth was created but it concentrated into a few hands. A lot of people got left behind in the process and their way of life radicaly changed. We are seeing a similar wealth concentration since the early 1970s. Now with software becoming an increasingly large part of our lives, we are seeing whole industries disappear. We also had trade policies that encouraged manufacturing to move overseas. Then you have environmental laws that have more or less killed whole industries. I think we need to acknowledge a lot of people have and are continuing to be left behind economically. And the internet, but particularly social media, has made palatable ideas readily accessible in a way that simply hasn't existed until 20 years ago.",2021-05-19T15:29:27+00:00
Neoliberal,comment,genocide,gm82wcy,tadbtd,,Ily2,2021-02-06T12:02:44+00:00
Neoliberal,comment,genocide,kx5zn0e,JumentousPetrichor,,If you want this discussion to be locked.,2024-03-29T21:29:35+00:00
Neoliberal,comment,genocide,iibtwbv,DinoDad13,,I was referring to americans.,2022-07-31T01:26:34+00:00
Neoliberal,comment,genocide,hxdpuix,SunkCostPhallus,,"Someone posted an article

Someone else said “that will show them that there’s no consent being manufactured”

I said, “How will that show them that there’s no consent being manufactured?”

*silence*",2022-02-18T00:10:35+00:00
Neoliberal,comment,genocide,i12kbef,Perico1979,,Pol Pot called. He wants his fanboy back.,2022-03-17T21:15:12+00:00
PoliticalDiscussion,comment,genocide,hcmxjyi,cryptotrader760,,"I wonder if the people who risked their lives to leave Cuba, the USSR, North Korea, Vietnam agree.",2021-09-13T01:10:16+00:00
PoliticalDiscussion,comment,genocide,cejju41,leftfourdead,,Watch Lone Survivor.  You will see what happens when military decisions are driven by the public who sit thousands of miles away thinking because they watched an hour long special on CNN that they are now an expert on a subject they know nothing about.  The idea that public opinion should drive military decisions is one of the most ridiculous ideas man has ever known.,2014-01-07T14:20:58+00:00
PoliticalDiscussion,comment,genocide,d0qa6qg,thatnameagain,,It is hurting him. He performs terribly in match ups against the dem candidates and his unfavorable a are highest all all candidates. It also helps him win the GOP nomination because anyone who thinks there hasn't been a mild undercurrent of casual racism running through the republican base's messaging for the past 8 years has their head in the sand.,2016-03-07T02:17:04+00:00
PoliticalDiscussion,comment,genocide,l567rae,pomod,,">You sound like a Hamas supporter, plain and simple. 

Don't put words in my mouth.  I'm an advocate for fundamental human rights and anti apartheid and not, you know, murdering thousands or innocent people in a blood lusty collective retribution.",2024-05-22T14:09:24+00:00
PoliticalDiscussion,comment,genocide,gszwgk7,None,,"Question is, what would a war with China look like?

Would it expand?  Would it threaten to go nuclear?

What role would cyber-warfare play in it?

Implications for the region?  For the world?

I think its something that neither side would want to chance.  For the US, China is not one of the other nations they've kicked around over the past few decades.  China is the most populous nation on Earth, has nukes, and a very substantial military.  Sure, China's military in its current state is no match for the US, but it could still become a blood bath if the war dragged on and widened.

Be sure to check out the Thucydides Trap --> [https://en.wikipedia.org/wiki/Thucydides\_Trap](https://en.wikipedia.org/wiki/Thucydides_Trap)

I guess the real question of the moment is, what would President Biden do if China invaded Taiwan tomorrow?",2021-04-01T04:40:37+00:00
PoliticalDiscussion,comment,genocide,c2sfw65,ArmchairExpurt,,">Sure, one brutal side might win over the other brutal side, but at the end of the day, do you honestly think the losers will be treated humanely?

How do you suggest we avoid such an end?",2011-10-18T14:50:07+00:00
PoliticalDiscussion,comment,genocide,k51j2jg,osnapitzstacie,,Yeah civilians half of whom are children can definitely go against terrorists with guns,2023-10-15T22:59:32+00:00
PoliticalDiscussion,comment,genocide,i1379q0,jschubart,,"They destroyed their chemical weapons. If they still had some when we invaded, we never found them.",2022-03-17T23:53:42+00:00
Politics,comment,genocide,gw2v1nu,Clutteredmind275,,YES. For fuck sake can we please stop pretending the trail of tears never happened???,2021-04-27T18:20:07+00:00
Politics,comment,genocide,kjkdvw6,itsnotnews92,,"Oh absolutely. Hamas has been very clear what their goals are, but that hasn't stopped Generation TikTok from carrying water for terrorists. It's actually scary to see just how many young people have been brainwashed into thinking ""America bad"" to the point where they side with literal terrorists.

If 9/11 happened last year instead of 2001, I'll bet at least a quarter of Gen Z would have been cheering as the planes hit the towers.",2024-01-25T21:46:11+00:00
Politics,comment,genocide,ksw8gam,SurroundTiny,,"Are they doing super delegates again? I hadn't paid attention. 

100000/600000 doesn't seem like it should equal 2/115 ( or however many Biden had ). I guess they must award delegates by district come to think of it. Then that makes sense.",2024-03-01T19:25:46+00:00
Politics,comment,genocide,kw8rg2p,throwawya6743,,"Idk, I'm sure learning the tiniest bit about the Bosnian Genocide would help you figure this out. Go read the Prosecutor v. Radislav Krstic court cases, both trial and appeal. They outline how it was determined to be a genocide despite killing only 8,372 people, and then reaffirm it during appeal.",2024-03-23T20:12:12+00:00
Politics,comment,genocide,fag6b2c,anonyfool,,From the news it appears it is to suppress criticism of the state of Israel and to withhold federal funding from places of education that have anyone criticisize the state of Israel.,2019-12-11T05:19:03+00:00
Politics,comment,genocide,f9ssipu,drunkles,,At the very least he has [financial stakes](https://www.washingtonpost.com/news/powerpost/paloma/daily-202/2019/11/13/daily-202-trump-s-little-conflict-of-interest-in-turkey-draws-scrutiny-as-he-offers-erdogan-a-generous-deal/5dcb903288e0fa10ffd20dcb/) there. It is also heavily suspected that Erdogan has proof that [Kushner approved  Kashoggi's killing](https://spectator.us/seven-whistleblowers-jared-kushner-bin-salman/) .So yes Erdogan and Turkey have substantial leverage over Drumpf and his administration.,2019-12-06T02:31:48+00:00
Politics,comment,genocide,k8tmliu,PKPhyre,,"You guys are really just replaying all the hits that lost you 2016, huh?",2023-11-11T19:11:20+00:00
Politics,comment,genocide,f7h8crt,Slobotic,,They *misplaced* 1.5 million Armenians.,2019-11-14T12:35:34+00:00
Politics,comment,genocide,k7qyygx,Commercial-Box-8922,,"God, you dumbasses.

> It's not a genocide.

Here, actual genocide scholars have termed what Israel is doing in Gaza a genocide - https://www.wrmea.org/israel-palestine/holocaust-scholars-say-israel-is-committing-genocide.html

Go tell these actual PhDs and professors in genocide history that ""it's not a genocide"".

So unless you're an actual genocide expert, your stupid logic doesn't count.

And Yemen is also considered a genocide https://www.american.edu/sis/news/20190128-the-us-s-role-in-the-hidden-genocide-in-yemen.cfm",2023-11-04T04:13:16+00:00
Politics,comment,genocide,k4xofln,af_echad,,"Yea nah I can absolutely blame Hamas. Raping and murdering people, burning people alive, taking Holocaust survivors hostage... none of these things are just ignoring ""respectability politics"". They're disgusting acts of terror and brutality.",2023-10-15T03:54:50+00:00
Politics,comment,genocide,fage9tq,stillestwaters,,"This is so silly. There’s so many fires burning right now and Trumps team is making desperate attempts at getting attention in the mean time.

It’s not even surprising anymore.",2019-12-11T07:48:19+00:00
Politics,comment,genocide,i13duwy,kabukistar,,"Something's wrong, I can feel it.",2022-03-18T00:43:19+00:00
Politics,comment,genocide,gwov70p,Jim_Dickskin,,Isn't this from last week,2021-05-02T17:57:21+00:00
Politics,comment,genocide,gvlzfbn,drvondoctor,,Erdogan... isnt he the guy who came to DC and had his body guards beat the shit out of protesters who were trying to draw attention to his human rights abuses?,2021-04-23T20:54:32+00:00
Politics,comment,genocide,fagvkf2,Catshit-Dogfart,,"People point to the episode where Lisa was the president and mentions Trump as being the time where The Simpsons accurately predicted the future, but that was just a one-off joke. The one where Sideshow Bob runs for mayor is so accurate that if they made it today it'd seem like cringeworthy and ham-fisted parody.

An infamous and unapologetic criminal who explicitly says he's going to abuse his power runs for office and gets widespread populist support. And when he continues blatantly committing crimes, doesn't just admit to it but brags about it, this only makes his supporters more enthusiastic.

The one with Lisa mentioning Trump didn't air until 2000",2019-12-11T13:55:56+00:00
Politics,comment,genocide,i111r23,__M-E-O-W__,,We are very much in a struggle to include these discussions in American classrooms today. Certain players in the conservative party are trying to prevent much of our racist history from being taught to the students. Many things I know of as an adult were never mentioned whatsoever in our classes.,2022-03-17T15:27:06+00:00
Politics,comment,genocide,i4i21cy,None,,"I’m still confused about why we couldn’t provide more support to the Ukraine prior to the invasion? We had the Intelligence for the forthcoming movement by Russia, and got hung up over some weapons technology that simply needed to be removed prior to shipping? Trump completely denied them any aid after he got caught extorting campaign trash on Biden.",2022-04-13T00:21:30+00:00
Politics,comment,genocide,grnty58,TheGreatTooth47,,"Forgot the /s.

Random comment, people sometimes wonder why the need for “/s” When a comment is so openly satirical. With the prevalecen of bots and trolls trying to swing the narrative, context helps you stand out.",2021-03-21T02:49:26+00:00
Politics,comment,genocide,fb7s2b0,None,,[deleted],2019-12-17T15:54:28+00:00
Republican,comment,genocide,f6ezg97,None,,I don't. I said the crusades were justified. As far as I'm concerned they can all go home and we can call it even.,2019-11-03T19:27:16+00:00
