subreddit,type,keyword,id,author,title,body,created_utc
Conservative,comment,antisemitic,l0w1j63,reddituser5k,,The funny thing to me is that they are the ones who call people on the right nazis 24/7 and now they are intimidating jewish students on campuses / attacking them just for existing near them.,2024-04-23T13:55:35+00:00
Conservative,comment,antisemitic,k7iz7ad,churchin222999111,,"muslims hate christians. the enemy of my enemy, kind of thing.",2023-11-02T16:35:07+00:00
Conservatives,comment,antisemitic,kczud4m,Beautiful_Honey7344,,Their friends at Qatar will make sure that there will be more suitable professors.,2023-12-12T04:08:02+00:00
Geopolitics,comment,antisemitic,k54dfmu,Ritrita,,"Respectfully, you’re wrong. Hamas is there regardless of Israel’s treatment or mistreatment of the people in Gaza. The Hamas charter is openly stating that its aim is to kill Jews and set an extremist Islamic regime in the entire world. I can also share an interview by a son of one of the founders of Hamas to corroborate it first hand. If you’re interested in his perspective. He also wrote a book.  

Another point is that Israel gives Palestinian civilians from Gaza jobs, right of passage to Israel to perform those jobs (tens of thousands of jobs btw), aid (including medical aid), electricity, water etc. none of which they have to do at all, since Gaza is independent from Israel contrary to what people think. Israel can barricade the border completely and let Egypt figure it out instead, but Egypt is not interested in this either. They literally put more cement in the wall this week to ensure no one crosses the border.  
The Arab countries of the world don’t want to offer aid or refuge to the Palestinian people. No one does. They’re stuck under the thumb of the Hamas regime and are being used for propaganda by them. They keep them in state of suffering and they WEAPONIZE the world’s empathy for their own terror infused cause.  

Ironically, our own liberal western ideals work against themselves here.",2023-10-16T14:45:18+00:00
Libertarian,comment,antisemitic,ejv8ztj,Cre8or_1,,"I didn't read all of thar because why would I waste my time like that. I do still want to respond to some things. 

Why did the Nazis punish guards who mistreated prisoners? Because they weren't *randomly brutal* , they took brutality and murder to a next level. They planned it. organized it. If some guard in the USA would torture a death row inmate, he would be punished for that (if he got caught). The same thibg happened in nazi germany pretty much. From todays perspective we view this as schizophrenic, but back then it really wasn't.

Why was there a swimming pool (and other nice stuff) in Auschwitz? Well, there could be many reasons. Maybe the guards liked to use them. Maybe they were used as a way to trick inmates into not-revolting upon arrival. Maybe they were featured in advertisement-spots for ""work camps"". Maybe there weren't any and you just made swimming pools up, I don't know.
Some of the things you mentioned were used to keep work moral somewhat high and to entertain the guards (like singing groups).

Why are there laws against denying the holocaust? I agree that those laws shouldn't exist. But they are not evidence for some ""big jewish lie"". seatbelt-laws or vaccination-laws aren't proof that driving without a seatbelt is safer or that vaccines aren't working (""why would you make it mandatory if it's safer, only things that are dangerous need to be made mandatory"")


Please, take your conspiracy theories and jew hating elsewhere.",2019-04-01T11:41:31+00:00
Neoliberal,comment,antisemitic,i7p3asq,reedemerofsouls,,"I'm not against the release of more details bc that would make the case stronger. I think some skepticism is good. However, it doesn't seem fishy to me. It seems likely to be true.",2022-05-07T17:03:26+00:00
Neoliberal,comment,antisemitic,l2b2o4k,PerturbedMotorist,,"> my family lives in Tel Aviv…should be politically unthinkable worthy of private and public condemnation likened to historical and contemporary segregationist movements. 

Seems like this pretty clearly only falls under the two controversial clauses.",2024-05-02T21:34:21+00:00
Neoliberal,comment,antisemitic,gv4q830,TheKlorg,,"It’s not a perfect research paper (ignoring Israel’s domestic laws and saying they discriminate against Muslims without citation, for example), it is big and interesting. I’m really glad this study was made.",2021-04-19T21:36:32+00:00
Neoliberal,comment,antisemitic,egplm8i,Continuity_organizer,,">That being said, I think that Israel as a nation, is a power drunk, hyper reactionary military state with some ultra-nationalist policies which make it impossible for any modern social liberal to tolerate.

Easy for you to say when you're not surrounded by hundreds of millions of people openly calling for your death.

If Israel adopted the kinds of policies you'd prefer, it would wiped off the map by Arab/Iranian aggression.",2019-02-18T04:55:31+00:00
Neoliberal,comment,antisemitic,im9ikw0,jaroborzita,,20% of the Israeli electorate is non-Jewish. Those with Palestinian citizenship naturally can't vote in Israeli elections. Or do you not recognize Palestine?,2022-08-29T15:04:24+00:00
Neoliberal,comment,antisemitic,injrpdq,TransGerman,,"Sorry, only saw this now. Israel does have their version of the 14th amendment. This is from the Israeli Declaration of Independence, it doesn’t have a constitution but the Declaration is used as one: 

“[This country] will be based on freedom, justice and peace as envisaged by the prophets of Israel; it will ensure complete equality of social and political rights to all its inhabitants irrespective of religion, race or sex; it will guarantee freedom of religion, conscience, language, education and culture; it will safeguard the Holy Places of all religions; and it will be faithful to the principles of the Charter of the United Nations”  
…  
“We appeal – in the very midst of the onslaught launched against us now for months – to the Arab inhabitants of the State of Israel to preserve peace and participate in the upbuilding of the State on the basis of full and equal citizenship and due representation in all its provisional and permanent institutions.”
 (1948)",2022-09-08T04:28:07+00:00
PoliticalDiscussion,comment,antisemitic,kd2najo,iamrecoveryatomic,,">I think the main issue is if they were asked the same thing about if it's acceptable to protest on campus advocating for the lynching of all Black people (and let's say they limited it to specifically all Black people in ""Southern states"" so that it's technically not targeting the students on campus), every one of those presidents would have had zero issue saying that that behavior constitutes harassment of their Black students.

If they were asked ""lynching all the Jews in Israel"" they'd probably agree that's harassment.

The problem is that the current debate has people who would equate ""Free Palestine"" to how it was used at one point in time in another country to say yup, that means ""lynch all Jews in Israel"" kick them out of college and blacklist them.  A good chunk of people using it mean to free Palestinians from Israeli occupation and blockade, because no matter what Israeli security entails, they are in fact occupying and blockading a group of people in a grossly vile manner.  Which at this point is absurd, you can't even say free an oppressed group/country because people take it to mean genocide of the oppressors?  At this point, even being pro-Palestinian, every phrase is assumed by this side of the debate to be ignorant or veiled attempts at the lives/wellbeing of Jewish students.

The issue is a hotbed, because any solution that's ""right"" for one side will arguably imply the possible cleansing or continued violation of the other.",2023-12-12T18:57:50+00:00
PoliticalDiscussion,comment,antisemitic,e5k01fo,Enterprise_Sales,,"> I would 100% disagree with any similar agreement being made for any group, including Muslims or more specially Hamas which you are talking about.

My comment is about Labor party and leftist groups that seems so concerned about possible hampering of their ability to call Jews/Israel Nazi, while being pally with organizations that with both their words and action do things that Nazis were infamous for. 

> I think there’s an element of punching down to it. People tend to give more leeway to the weaker of two sides and hence are the ones oppressed by the other. 

That is certainly true and more so for the leftists. However, it requires horse blinders to see Palestinians as the weaker side. From 1948 wars till now, Palestinians aren't alone, but are actively (armies, money, political and diplomatic support) supported by most of the Muslim world. For a lot of people it is a religious fight and not a territorial fight. 

Even for Palestinians the fight has serious religious connotations as in 1948 their army was called Holy army, and for decades they have celebrates martyrs (Shahid), teach value of martyrdom and augment the rewards of afterlife by adding financial benefits of martyrdom on earth as well. 

> I am firmly against all Islamic political organizations, particularly ones like Hamas.

Look at the rhetoric of Corbyn against Jews/Israel/Jewish organizations/""Zionists"", and then compare that with his rhetoric for terrorist organizations like Hamas. You will see a huge disparity in volume, intensity and frequency on those two fronts. 

Alas, as leftists have decided that 1.8 bn Muslims are the Davids in this fight they will ignore terrible words and deeds from the organizations supporting them. ",2018-09-07T13:49:30+00:00
PoliticalDiscussion,comment,antisemitic,c6d9k9f,CobraStallone,,"I mean, any part of your post pre assumes that America must have a prescence in the Middle East. I think discussing American-Israeli relations without questioning whether American interventionism in the Middle East is a necessity is hardly a political discussion of depth, but suit yourself.",2012-09-25T17:13:52+00:00
Politics,comment,antisemitic,k4c45uq,os_kaiserwilhelm,,"> You can’t just ignore the humanitarian cost of the conflict. People are going to die because they don’t have water. What about depriving 2 million innocents of water is taking steps to reduce civilian causalities?

This point is entirely irrelevant to my comment and the part of your comment I am contradicting. I very specifically and clearly set that point aside to address the other point being made in your comment. 

> Every innocent person that dies due to Israel’s military action is the fault of both hamas and Israel.

Yeah, that's how war works.",2023-10-10T22:04:47+00:00
Politics,comment,antisemitic,kcxy5jm,serpentinepad,,"Ok, have fun dying on this hill then.",2023-12-11T20:34:06+00:00
Politics,comment,antisemitic,l2atgli,Fermented_Butt_Juice,,"Well you can ""consider"" anything you like to be genocide. Doesn't make it actually true.",2024-05-02T20:39:50+00:00
Politics,comment,antisemitic,l3bcqn8,jgilla2012,,Did the teacher keep her job?,2024-05-09T18:07:46+00:00
Politics,comment,antisemitic,kccvvlm,WeigelsAvenger,,"Here's the proof of Israeli propaganda campaigns:

BBC

The Prime Minister's office is reportedly spending around £540,000 recruiting more than 500 students to respond to social media posts calling for boycotts and sanctions against the country, the Jerusalem Post says. Those with foreign language skills who receive these scholarships"" would not identify themselves as being in the pay of the government. Instead, Israel's Haaretz newspaper says, the plan is to make the programme appear to be based on the activity of politically-neutral students, with the Prime Minister's Office also hoping to recruit from pro-Israel student groups from around the world. USA TODAY

JERUSALEM (AP) - Israel is looking to hire university students to post pro-lsrael messages on social media networks - without needing to identify themselves as government-linked, officials said Wednesday.

HUFFINGTON POST

Students will be organised into units at each university, with a chief co-ordinator who receives a full scholarship, three desk co-ordinators for language, graphics and research who receive lesser scholarships and students termed ""activists"" who will receive a ""minima' scholarship"",

IRISH EXAMINER

""Haaretz posted what it said were four screen shots of his recent posts. In one of them, Mr Seaman wrote: ""Does the commencement of the fast of the Ramadan mean that Muslims will stop eating each other during the daytime?"" In another, he uses profanity in a comment about the chief Palestinian peace negotiator.""

BEN NORTON

""Mr Netanyahu's aides said the main topics the units would address related to political and security issues, combating calls to boycott Israel and combating efforts to question Israel's legitimacy. The officials said the students would stress Israeli democratic values, freedom of religion and pluralism.""

PEOPLES DISPATCH

'Israel pays thousands of students and pro-Israel activists online to spread favourable propaganda on social media and the larger internet.""

INDEPENDENT

The students making the posts will not reveal online that they are funded by the Israeli government, according to correspondence about the plan revealed in the Haaretz newspaper.

THE SIDNEY MORNING HERALD

""Staffed by approximately 400 student volunteers the project which goes by the name 'Israel Under Fire"", claims to have succeeded in closing anti-lsraeli pages on Facebook and challenging propaganda from Hamas, the organisation that governs the Gaza Strip and whose military arm is firing rockets at Israel.""

LINKS: https://www.bbc.com/news/blogs-news-from-elsewhere-23695896.amp

https://www.usatoday.com/story/news/world/2013/08/14/israel-students-social-media/2651715/

https://www.huffingtonpost.co.uk/amp/entry/israel-pay-students-propaganda_n_3755782/

https://bennorton.com/israel-pays-students-tospread-propaganda-on-social-media/

https://www.haaretz.com/2013-08-13/ty-article/.premium/social-media-hasbara-worth-millions/0000017f-dee6-df9c-a17f-fefed0690000

https://www.irishexaminer.com/world/arid-30603647.html

https://www.irishexaminer.com/world/arid-30603647.html

https://peoplesdispatch.org/2018/09/19/the-noxious-effects-of-israeli-propaganda/

https://www.independent.co.uk/news/world/middle-east/students-offered-grants-if-they-tweet-proisraeli-propaganda-8760142.html",2023-12-07T12:31:16+00:00
Politics,post,antisemitic,1cncrek,aresef,"GOP campaign staffer ""liked"" antisemitic memes",,2024-05-08T19:13:40+00:00
Politics,comment,antisemitic,k4amy8t,WalesIsForTheWhales,,"""YOU DON'T LIKE ISRAEL? YOU HATE THE JEWS AND LOVE TERRORISM!""


Israel is an apartheid state with a corrupt government who got hit by terrorism due to their actions.  It's a tragedy with human consequences.  It's a cycle of endless blame and violence.",2023-10-10T16:45:00+00:00
Politics,comment,antisemitic,l2b8kbf,Trashman56,,"🎶 Don't diddle kids, it's no good diddling kids, gotta be younger than my wife, but older than my daughter 🎶",2024-05-02T22:10:26+00:00
Politics,comment,antisemitic,l3otqom,Sardanapalooza,,"Agree. He's capable, sensible, and reasonable. Really impressed by him.",2024-05-12T09:24:36+00:00
Politics,comment,antisemitic,kcaeyu2,Holy__Funk,,Your priorities are a little confusing.,2023-12-06T22:29:47+00:00
Politics,comment,antisemitic,kexjikj,Jaded-Lawfulness-835,,They don't have a claim on that land anymore than I have a claim on Germany.,2023-12-26T01:22:09+00:00
Politics,comment,antisemitic,kciwi2m,Elestra_,,For sure. I can't for the life of me understand why that simple question was so challenging for them to answer.,2023-12-08T17:30:13+00:00
Politics,comment,antisemitic,l1s4ncp,Mataelio,,"For instance the pro-Israel protestor yelling “death to Jews” where the pro-Palestine protestors were, resulting in the Palestine protestors being accused of anti-semitism and arrested the next night.

https://www.yahoo.com/news/pro-israel-agitator-shouts-kill-163956737.html?guce_referrer=aHR0cHM6Ly93d3cuZ29vZ2xlLmNvbS8&guce_referrer_sig=AQAAAGM9cFyH3gyKuvqVJysEFa8W14GqJxNQ0usxAfOVRmV1Y4JDB_r7N6cvr0SCU6uTwZ3qy0PoSorsAtYAZ4RTlVL-zTeKSAAvw38DbRSZBhRvIcVvj5n1J_iPepXXfwYtHwfVJ_J27VZ5wFJpxuDOiv5X1RDwzjvCBLklhJr1zKot",2024-04-29T13:07:11+00:00
Politics,comment,antisemitic,kryfzmb,DrHugh,,"Does this mean Putin will launch a special military operation to CPAC any moment now? You know, to stop the Nazis?",2024-02-24T18:56:18+00:00
Politics,comment,antisemitic,l1pb24a,FlemethWild,,"You and I are really similar except that I consider my self a Zionist. 

I don’t agree with the actions of the Israeli state and I don’t believe that what Israel is doing and has done is right.

But nonetheless, I am a Zionist because I think that Jews should have a place where they don’t need to fear persecution or another holocaust.",2024-04-28T22:06:32+00:00
Politics,comment,antisemitic,l1ib4zg,gimperion,,The president we should've had.,2024-04-27T14:59:05+00:00
Politics,comment,antisemitic,kryghg7,ProtectionContent977,,They’re conservatives. It’s what they do!,2024-02-24T18:59:14+00:00
Politics,comment,antisemitic,k9wn4u6,Ebolatastic,,"""Money would never say that! I mean Musk!""",2023-11-19T16:48:19+00:00
Politics,comment,antisemitic,l1zvhd2,None,,[deleted],2024-04-30T20:52:53+00:00
Politics,comment,antisemitic,l0tfktq,Pennsylvanier,,"Literally just walk through the park, they’re all on signs that are pretty visible from the main walkway.",2024-04-23T00:16:39+00:00
Politics,comment,antisemitic,k86ecxh,honuworld,,"Historically, ethnic Muslims were in control of the contested areas before ethnic Jews. Note: this was long before Islam or Judaism was invented.",2023-11-07T05:16:44+00:00
Politics,comment,antisemitic,l1jxrot,Athlete-Extreme,,Imagine US Israeli relations if Bernie had won.,2024-04-27T21:08:37+00:00
Republican,comment,antisemitic,k6ceijd,Ultimo_D,,Maybe something honest 🤷‍♂️,2023-10-25T02:57:27+00:00
Conservative,comment,genocide,jb3wb4c,SassySesi,,"Honestly, I think it's because MN has a huge population of Scandinavians, and in fact has the largest populationof Norwegians outside of Norway. Most caucasians who love here, including myself, are within 2 generations of immigrants from Norway and Sweden. 

As it is today, those countries are very socialist and left leaning, so when they immigrated here, they brought that part of the culture with them and that's why it's so liberal. It's very red when you get outside of the cities though.",2023-03-06T06:02:00+00:00
Conservative,comment,genocide,l30u9iu,bladefist2,,US stopped helping Israel after Hamas violated the cease fire again from rafah,2024-05-07T19:20:14+00:00
Conservative,comment,genocide,hzl90lg,dave5124,,Lots of companies happily did business with Nazi Germany also. It's all about trying to look good for publicity. They don't care about either side of the conflict.,2022-03-06T16:21:42+00:00
Conservative,comment,genocide,l373rv9,Swagastan,,Here is the evacuation map [https://www.jpost.com/breaking-news/article-800026](https://www.jpost.com/breaking-news/article-800026),2024-05-08T22:11:33+00:00
Conservatives,comment,genocide,hnkj60a,Wiegraf09,,"I was going to say this, they want it here for anyone with two neurons to rub together.",2021-12-07T07:54:20+00:00
Geopolitics,comment,genocide,jzuwaio,T-nash,,"You haven't read your own link.

>The Protocols required ratification from parliaments of both countries. In an effort to de-link issues, the protocols did not mention the conflict between Armenia and Azerbaijan over Nagorno-Karabakh. They also did not include a deadline for ratification.[5]
On 12 January 2010, the Constitutional Court of Armenia approved the Protocols while making a number of observations that the Turkish side viewed as containing ""preconditions and restrictive provisions which impair the letter and spirit of the protocols"".[6][7] The Turkish side also began to tie the normalization process with the Nagorno-Karabakh conflict, with Turkish Prime Minister Recep Tayyip Erdoğan stating that the Turkish-Armenian border would not be opened without the withdrawal of Armenian forces from Azerbaijani territory.[6]",2023-09-09T19:51:24+00:00
Geopolitics,comment,genocide,ek1xs1f,InfiniteCosmos8,,"What war crimes has China committed? They aren't fighting any imperial wars, unlike the US and to a lesser extent Russia. 

Genuine question. ",2019-04-03T20:54:51+00:00
Geopolitics,comment,genocide,d437c5u,Damianiwins,,"For people interested in the history of it.

https://youtu.be/NSURlsI4brU",2016-06-10T03:11:08+00:00
Geopolitics,comment,genocide,krpbgub,Illustrious_Ad_5406,,"Right.  So a collective punishment of civilians, a genocide against tens of thousands of people, is a proper, moral and justified response?  Gross.",2024-02-23T02:02:41+00:00
Geopolitics,comment,genocide,kjujhmj,WhoopingWillow,,"Israel has released Palestinian prisoners as bargaining chips, does that mean Israel isn't committing genocide against Palestinians in your view?",2024-01-27T19:49:27+00:00
Libertarian,comment,genocide,hdibhqw,Blue_winged_yoshi,,"Eugenics is directly genocide. Eugenics intrinsically values some types of people other others and values certain characteristics while aiming to cut certain characterises out of existence. 

Those characteristics that are cut out are always the same, folks who are LGBT+, neuro-divergent, of the wrong ethnicity or race. Eugenics was what directly  inspired the Holocaust.

It should go without saying that everyone should be equally entitled to reproduce without interference from outside influence. Eugenics should send a shudder down the spine of every freedom minded person. Not now. Not ever.",2021-09-19T20:38:31+00:00
Libertarian,comment,genocide,kkbtuwb,Falco_Evn,,"Perhaps, the idea that the early Soviet Union’s biggest opponent, Adolf Hitler, who banned the German Communist and Socialist parties, would be less hated by modern day commies than Javier Milei is hilarious. The Horseshoe curve explains this. The ideologies furthest away from each other are actually the most similar to one another on many policy issues.",2024-01-30T22:36:29+00:00
Libertarian,comment,genocide,kwntjn1,zldkr,,"people under socialism don't have that right to choose.
once people choose socialism they don't have a chance to choose others any more. they are passengers on an airplane hijacked by terrorists.",2024-03-26T16:21:35+00:00
Libertarian,comment,genocide,h04kq86,None,,"Nope.  The difference is that defense is a necessity, while execution is a choice.",2021-05-31T21:58:57+00:00
Libertarian,comment,genocide,hsl5rl0,locri,,"[Yes.](https://en.wikipedia.org/wiki/Xi_Jinping_Thought)

Edit: downvote if you like, but the leader of China is very adament that China is a socialist state. This is a man who has spent his entire life studying socialism, what it means and how it's actually practised. His conclusions are authoritarian.",2022-01-14T04:31:36+00:00
Libertarian,comment,genocide,hsl2w9e,Cannacology,,"To some degree yes. They control many naturals resources that cannot be obtained through other means or supply chain (ie super conductors) let alone affordably. Then we can address how this country is composed of capitalist who by moral couldn’t possibly use anything but the most profitable, cost effective choice of labor and obtaining goods and natural resources. It’s a real catch 22. “We want made in America” that will cost 500% more “well I couldn’t possibly pay my employees that little”. From a capitalistic standpoint- yes rich Americans have to do business with China and Chinese corporations to make as much profit as they can. It’s not about the people, our country or or economy. It’s about individuals becoming even more filthy rich than they already are. In a way, it’s impossible for them not to do business with China.",2022-01-14T04:08:07+00:00
Libertarian,comment,genocide,hnkh8pf,albertobbg,,Telling I’m not seeing this reported on places such as the daily wire,2021-12-07T07:28:47+00:00
Libertarian,comment,genocide,f310gy4,UniverseCatalyzed,,"What we definitely know is that America told the Kurds to remove fortifications along the border to create a ""safe zone"" for refugees with the promise of American defense against Turkish aggression. Then we know in this latest announcement Trump/his administration completely backstabbed them by reneging on that promise and leaving the Kurds unfortified and undefended. To me that implies this decision was made by Trump based on political expediency, in spite of a preconceived plan to stay in place to defend the Kurds after the establishment of the safe zone.",2019-10-08T20:16:11+00:00
Neoliberal,comment,genocide,i11wziz,xesaie,,"It was substantially more valuable than his political career (even if some of his theories are in eclipse now), so it's still a pity.",2022-03-17T18:46:18+00:00
Neoliberal,comment,genocide,j9nrawe,radiatar,,One of the few good things about this high inflation period is that we haven't heard from MMT pundits in over a year.,2023-02-23T07:50:07+00:00
Neoliberal,comment,genocide,gsancs3,Ritz527,,Lots of worldnews folks are a bit... off. I got heavily downvoted the other day for pointing out India was a Hindu nationalist country that was pushing discrimination against Muslims.,2021-03-26T14:33:55+00:00
Neoliberal,post,genocide,1by72w5,NarutoRunner,Kagame blames world's 'cowardice' as Rwanda remembers 1994 genocide,,2024-04-07T15:25:10+00:00
