subreddit,type,keyword,id,author,title,body,created_utc,parent_id
LabourUK,comment,IPCC,i3evlnw,CornSquares_,,">Malthus was wrong in the 18th century and it's still wrong now.

Regardless of Malthus, surely it is harder to bring carbon emissions down to acceptable levels with twice as many people. Synthetic fertilizers have allowed us, through carbon intensive processes, to essentially manufacture food synthetically, beyond what the Earth would otherwise support.

&#x200B;

>The problem isn't too many humans it's a small percentage and the economic system they built that chases profits at the expense of all else.

I agree that rampant consumerism is also the problem. With half as many people, and nearly clean electricity, they would just mine more bitcoins until the Earth was reduced to ash. To be clear I should have mentioned that all of the green, sustainable and responsible policies should still be pursued. It is not enough to have less people. A change of attitude is needed. My point was that if these policies were adopted, I dont think the current population would be sustainable. Hence why overpopulation makes it uneconomical to pursue these green policies. 

&#x200B;

>And this is a part of it, because people look at these issues not through a material lens, but an economic one.

Economics is material. If the economy shrinks, it means less stuff is produced. If it shrinks a lot, people will suffer a lot. Just look at the cost-of-living crisis. Economics shouldnt be disregarded as just some vague abstraction.",2022-04-04T22:27:31+00:00,t1_i3esk2d
europe,comment,climate change,gob7yp6,RELAX05,,Village? Wow,2021-02-22T05:36:32+00:00,t3_lp1rk2
AskUK,comment,warming,k6plqj4,HonkyBoo,,"That’s a funny story, not an expensive mistake!",2023-10-27T17:50:53+00:00,t3_17h272c
europe,comment,emissions,if20n48,LordBruschetta,,We don't need food! We need less emissions!,2022-07-06T09:52:57+00:00,t3_vsjzfm
ukpolitics,comment,coal,gju88np,Patch95,,"No you still need the heat to melt the reduced iron and allow the reaction to take place (if you flow CO over FeO at room temperature you'll be there a while).

Steel accounts for 10% of global CO2 emissions, something needs to be done to decarbonise the process.",2021-01-19T15:42:59+00:00,t1_gju7rsm
unitedkingdom,comment,environment,f2ej3e4,eairy,,Why don't you support it?  We already effectively have a ~180% tax on petrol which amounts to a per mile tax.,2019-10-04T13:44:50+00:00,t1_f2e52ur
europe,post,greenhouse,8aha9x,Gsonderling,France to open record-breaking greenhouse,,2018-04-07T10:41:49+00:00,
AskUK,comment,warming,k1fl01v,InviteAromatic6124,,"Stephen Fry. He comes across as a delightful chap on camera, but off-camera he can be quite unpleasant and rude.",2023-09-20T16:02:10+00:00,t3_16ni1qz
europe,comment,pollution,kot5j50,GeneralCommand4459,,"Buy diesels they said

It's lower CO2 they said

...",2024-02-04T00:10:40+00:00,t3_1ahs7fo
ukpolitics,post,coal,viqxds,Falmouth_Packet,Johnson hints that new coal mine for Cumbria will get go-ahead,,2022-06-23T07:11:28+00:00,
ukpolitics,comment,coal,e1qpxpf,LaoBa,,"~~Lancashire~~ Scotland leaving the UK would be just as problematical.

",2018-07-03T21:12:25+00:00,t1_e1pxs89
AskUK,comment,greenhouse,gjm4g8k,chocolatepig214,,Thanks everyone; looks like I have some planning to do this week!,2021-01-17T16:49:14+00:00,t3_kz4pv4
brexit,comment,environment,f52368m,ADRzs,,"Well, Westminster would not grant Scotland another referendum opportunity.  However, Scotland can request the same consideration as Northern Ireland, to remain within the EU single market and customs union.  Then, the border would be drawn between Berwick and Carlyle, not just in the Irish sea.  I just do not see BoJo rolling over easily on this one.  And what I know of the Scots, they are unlikely to go on with any ""campaign"" of civil disobedience.  It would be tough for Scotland to break away.  I can foresee trouble on that one.",2019-10-24T19:54:02+00:00,t1_f50ne7f
europe,comment,coal,ido9nua,Fix_a_Fix,,"Upvoted because finally someone called the anti nuclear German complete idiots, as it should had been done long ago.",2022-06-25T10:44:00+00:00,t1_idkws2s
northernireland,comment,warming,kwj7qlr,_BornToBeKing_,,McDowell the thorn in the Shinners' backside it seems.,2024-03-25T19:38:45+00:00,t3_1bmpu5r
ukpolitics,comment,coal,epmpqz8,TheAnimus,,"> Infact it even spells out that the 800k is from renumeration

The question is where the money came from.

What is misleading about it?

is the:

> the £1.6m compensation payments paid to the union on behalf of invalided-out miners had been frittered away to a fraction of their original levels

Not true?",2019-05-31T15:20:33+00:00,t1_epmnvlq
europe,comment,ecological,fx7lmsh,kuikuilla,,I'm referring to these guys: https://www.viite.fi/english/,2020-07-07T15:03:38+00:00,t1_fx7kfew
unitedkingdom,comment,warming,doyr08s,Right-Of-Centre,,You seem to be going off on one about something I've not even said.,2017-10-27T13:44:44+00:00,t1_doyqi2k
AskUK,comment,carbon,ivz4y7a,mammamia42069,,"Cuz they pay rent for the office and want to feel like they’re getting their moneys worth, and also it’s easier to observe your employees in person. Thats it really",2022-11-11T18:15:02+00:00,t3_ysg2nh
unitedkingdom,comment,climate change,g71ncnx,jimmycarr1,,The M&S plant kitchen chicken pieces are really really good.,2020-09-29T10:04:28+00:00,t1_g71mb5k
Scotland,comment,climate change,cvupuac,macswiggin,,"I think most economists agree that 'rent ceilings' are generally pretty bad. Rent controls is a broad term though and I think there is a lot that can be done legally to ensure more rights and protection for renters. We are headed in the wrong direction with housing policy.
",2015-10-10T12:33:06+00:00,t1_cvuo449
AskUK,comment,environment,kwjtj1e,avocadopro,,"Could it be partly because it's become more acceptable to express these sorts of feelings now? Which is kind of a good thing in some ways perhaps? Teens have always been dismissed in the past as being stroppy and moody and spending all their time in their rooms. Maybe that's because they're having a hard time? I don't know why this is never considered. And now kids are speaking out about their feelings. It's true though, kids have so much to deal with now. 

I'm 35 and had depression, an ED, and self harmed as a teen in the 00s. My parents would never have entertained my MH issues for a second. Would have told me to pack it in and stop feeling sorry for myself. So I never told them and essentially self-medicated/worked my own stuff out over the years. Which has been tough. I've been diagnosed with ADHD as an adult, so looking into neurodiversity could be a start, as others have suggested.

Many of my friends at school/uni had terrible MH too - some had experienced serious trauma or abuse that was totally swept under the carpet at home. The concept of counselling/therapy was kind of taboo. Which is tragic. I just wish we could support young people better and could offer them more... life. I really hope things can get better for your daughter and she can get some support she needs.",2024-03-25T21:39:33+00:00,t3_1bnjtwc
brexit,comment,warming,gig84rc,brexitwillsuck,,"Also re evaluating brexit will be forever.  We are now locked in to never ending renegotiations as that is a clause the EU added because Boris is such a pathological liar. The EU are not idiots, they don't trust him... They did however trust May, I may not agree with her either politically, but I would take her deal any day because it's the best we could have gotten under the circumstances.",2021-01-07T18:20:38+00:00,t1_ghv8gzk
AskUK,comment,environment,iwp5wp0,ThyssenKrup,,"I don't have any kids, so I'm as good as it gets in the western world.",2022-11-17T08:26:15+00:00,t3_yxjx6v
unitedkingdom,comment,carbon,gme51ht,Blank3k,,"I'm no master of physics, but underfloor heating makes all the sense in the world...mean while a lump of metal bolted to one wall & filled with hot water, really seems like a ridiculous idea.

Underfloor heating please!",2021-02-07T10:03:56+00:00,t1_gmctmdl
AskUK,comment,ecological,iinaj38,benkelly92,,"Saving the planet just has no vibes man, sorry.",2022-08-02T14:26:38+00:00,t1_iin5pvc
ukpolitics,post,warming,r238nf,tyroncs,David Goodhart in 'The Road to Somewhere' on refugees,"Numbers could get far higher. There is the apparent paradox that as
poorer countries get richer they develop a larger middle class, many of
whom are desperate to leave and often have the means to do so. The gulf in
income and stability between rich and poor places will remain for many
decades or even centuries. Professor Dani Rodrik points out that poor
people in rich countries (meaning the bottom 10 per cent) are three times
richer than rich people in poor countries (meaning the top 10 per cent).3
Moreover, as Ivan Krastev observes: ‘The spread of the internet has
made it possible for young Africans and Afghans to see with one click of a
mouse how Europeans live. People no longer compare their lives with those
of their neighbours but with the planet’s most prosperous inhabitants. They
dream not of the future but of other places’.4

There are also unknowable factors relating to future conflicts or the
effects of global warming on poor countries. Africa’s population is
currently a little over 1 billion and it is expected to stabilise at anywhere
between 3 billion and 4.5 billion—if it stabilises at the higher number, or
even higher, it may produce unstoppable pressures to move.
Thanks to its geographical position Britain was partly insulated from the
European refugee crisis of 2015/2016 (though asylum claims rose to over
40,000 in the year to September 2016 making it the sixth highest recipient
in the EU). But British governments have been arguing, rightly, that seeking
to protect someone who may be in danger or in a war zone does not
necessarily require offering them a place to live in Britain or a similar rich
county. Instead Britain has put money, more than £1 billion in the last two
years, into improving refugee camps in the Middle East and elsewhere,
from where small numbers of the most vulnerable can be selected and
brought to Britain.

Rich, liberal, Christian countries like Britain feel a moral obligation to
suffering humanity—both politicians and the general public. But there are
many ways in which those obligations can be fulfilled—through foreign aid
to poor and fragile states, through helping countries to trade their way out
of poverty, through military intervention to restore order, and through
providing either temporary or permanent refuge to people in trouble.
Too much emphasis has been placed on this last method for helping the
desperate: we have the resources and technology to help at a distance. We
can fulfill our moral obligations without disrupting our own societies and
tempting the most able and dynamic people from the poor societies that
desperately need them. And every dollar spent helping someone in a poor
country goes a lot further than it does in London.

For decades the grounds for claiming refuge or asylum have been
steadily widened. The 1951 Geneva Convention, established during the
Cold War as a signal to Soviet dissidents that they would not be returned to
their countries, has been subject to constant legal evolution and it has been
supplemented by the EU’s 2004 Humanitarian Protection directive, and
underpinned by the European Convention on Human Rights. According to
former Labour home secretary, Charles Clarke, there are now ‘hundreds of
millions’ who could legitimately claim permanent protection in Europe.
Such open criteria for seeking asylum could only be feasible in an era when
people were too poor or ignorant or too locked up in prison states like Iraq
or Libya to take advantage of this theoretical generosity.

In 2015 Europe’s bluff was called and about 1.3 million people walked
through Europe’s half-open back door (with some encouragement from
Angela Merkel). In doing so they exposed the promise to give shelter to
refugees not as a foundation stone of European civilisation, as the refugee
lobby claims, but as an embarrassing example of European hypocrisy and
wishful thinking.

We need different rules to reflect our somewhat more mobile times and
to keep numbers to a level that is broadly acceptable to European publics—
that means keeping the offer of permanent refuge to individuals facing state
persecution (as described in the 1951 Convention)—people such as African
opposition leaders, many Ahmadiyya Muslims in Pakistan or NATO
interpreters in Afghanistan—but not extending it to everyone who lives in
an authoritarian state or whose country is experiencing some kind of
conflict.

Britain, and countries like it, should also continue to offer at least time
limited refuge to those caught up in particularly all-consuming natural
disasters or conflicts like Syria. Though even in the Syrian case we should
select the most needy—not allow the most mobile and affluent to select us,
as we do now—and for the rest turn camps into decent, temporary small
towns with schools, clinics and jobs, where people can remain as close as
possible to their homes and prepare to rebuild once peace returns",2021-11-25T18:38:06+00:00,
europe,comment,CO2,cxem0tq,TheEndgame,,Tesla will absolutely decrease profit in the Danish market when no one can afford their cars anymore.,2015-11-27T10:20:48+00:00,t1_cxejsr4
LabourUK,comment,pollution,jt3buae,QVRedit,,It was ‘in the bag’ for Labour to win.  The ULEZ issue very predictably turned it upside down.  Yet this seems to have come as a late revelation to Labour - who just hadn’t thought it through.,2023-07-23T06:35:05+00:00,t1_jt08kjn
Labour,comment,warming,ghim5zr,totterdownanian,,"Surely if they're Tories, by definition they wouldn't join the Labour party?",2020-12-30T17:32:00+00:00,t1_ghhomwf
brexit,comment,environment,ezujhdt,LovisaMay,,"Estonia was under German rule for quite a long time (read about Hanseatic League and Deutscher Orden in Livland).

And as far as I'm aware the Berlin Wall came down before Estonia left the USSR.

:) And yes I'm grateful, there's always opportunities for learning.",2019-09-10T22:13:42+00:00,t1_ezuiwst
europe,comment,climate change,jiv9u1t,jimmy17,,Wow Germany ranking at the bottom on all but one of those questions.,2023-05-04T19:14:32+00:00,t1_jiuk5i6
ukpolitics,comment,coal,h7wr6n1,Ardashasaur,,I doubt Thatcher would have furloughed people as well.,2021-08-06T07:24:28+00:00,t1_h7wmd6o
europe,comment,pollution,gjrrjw4,Geraziel,,The problem with badly seasond wood is that it's not hot enough. So i would recommend a bit of piri  piri and some tabasco.,2021-01-18T23:22:15+00:00,t1_gjqljx0
Scotland,comment,environment,ckdbq68,Alwaysfair,,">In fact if you look at the resources they consume they are awful things for counties

But looks at how much more productive they are, Paris for instance stands a a gdp per capita of 76,146.


> If we put the right conditions in place Scotland is massively attractive.

Correct, **IF** which is going to be difficult as the UK as a whole has never looked so competitive and safe against the backdrop of other developed european nations. Scotland would really have to go to some length to convince companies who are solidly base geographically closer to Europe there key market. 


>3) our economy is well diversified, oil, renewables, 25% of European computers are made here, specialist engineering services that are world leading, we export knowledge and expertise, manufacture, food and beverages. We have more than you think going on already

Thats great and all but Scotland's budget relies heavily on the tax from energy exports as we know to the tune of 10/20%, that is a big deal. Rebalancing is difficult the union would help support this, look at what Dubai has had to do to rebrand itself for the future 


>Trust me people know who Scotland is and find us to be far more likeable than the uk.

Yep because the world works on who is nice to each other, loads of people hate the US but they have to deal with it because of its size and influence, the same argument can be made on a much smaller level for the UK. 


>Will we have influence maybe not but are we planning on invading somewhere? 

This is Salmond stuff, stop it for god sake, you are clearly a bright informed guy/gal. 



>our nation and professionalism is well known. Scots expats work in almost every industry in almost every country in the world. That enough influence

Well I would argue you can never have enough and that again it is size and scale something which Scotland will not have in this next century, by shear demographics alone Scotland will loose influence. 


>The world stage, ever hear of Norway or New Zealand? Yup so has everybody else.

European century, they have been very lucky, in the future you will hear people refer to Indonesia for business deals and Malaysia for high tech industries. You are under the impression that the world does not change, it does, 30 years ago nobody consider that the USSR would collapse, 25 years ago everybody thought Japan would surpass the USA. The world is not set it changes rapidly and the relative decline of Europe is going to happen, it is happening. 


>We will be a small self sufficient nation content to export, trade and generally not invade every fucker we fancy

You undermine yourself with this, it demonstrates my exact fear about the low level media and political war that has waged against Westminster over the years.",2014-09-09T11:12:56+00:00,t1_ckdbd24
unitedkingdom,comment,carbon,f5syu6z,SimoneNonvelodico,,"They're equivalent to eating meat *for one person* - but much less people uses them than eats meat.

In addition, not all gases that are greenhouse are also as long lived as CO2. CO2 stays in the atmosphere a long time. These propellants are complex molecules that probably get broken up by UV rays or chemical reactions in a few weeks. So my guess is it's probably not as serious as it sounds, but still, if it can be avoided, it should where possible.",2019-10-30T14:42:07+00:00,t1_f5sbvmp
unitedkingdom,comment,warming,di96d9i,Kitchner,,"lol

All you've done is when you've been confronted with the truth that Corbyn is not like Bernie Sanders, you've performed some frankly impressive mental gymanstics to totally move the goal posts, explain why those goal posts always existed despite no one mentioning them until you brought it up, and then to simply accuse me of changing my answer, when I haven't. 

Corbyn isn't like Sanders for many, many, many reasons. The first person asked if Corbyn was like Sanders, someone replied he was, and that he even had his own smears like Hilary. I said he wasn't like sanders, and subsequently I posted a comment with four of those, and your only response is ""Yeah well Sanders is best known for moving political conversation to the left"" (he isn't).

People like you are why I don't bother putting any effort into pointing out when people were wrong. I can tell pretty much from the first reply whether of not it's going to be worth the time or whether they are going to put their fingers in their ears and shout loudly. Honestly I should never have even bothered replying to you at all, but I guess I hoped I was wrong.

You clearly don't actually have a grasp on both UK and US politics and you can't perform an objective comparison, or at least you're unwilling to because you don't want to admit you were wrong. I'm just going to leave this ""conversation"", in the loosest sense of the word, here.",2017-05-31T02:14:22+00:00,t1_di966h9
AskUK,comment,warming,jadddh9,coin__operated,,"I was the single mum with 2 small kids....mine loved pasta with a jar of sauce and a tin of sweetcorn covered in cheese.

Another was the pack of 2 garlic baguettes, some ham stuffed in the 'slits', tomato puree and cheese, in the oven for 10 mins.",2023-02-28T17:03:49+00:00,t3_11e7fpb
europe,comment,fossil,hdmrnyu,Not_Real_User_Person,,"Yeah, but US NG is produced locally, so it’s also cheaper locally. Shipping LNG expensive, and Russia provides most of the NG via pipeline to Europe. The US energy mix is also different, with  only about 25% of US electricity being generated by Natural Gas. Germany, and much of Europe, imports almost all of their natural gas. 

There’s also the premium that Europe pays in gas transit fees because of Ukraine, Belarus, and Eastern Europe.",2021-09-20T20:04:08+00:00,t1_hdmpl5q
europe,comment,environment,f2736d6,HBucket,,"It's not just Brazil. Leftist parties have been declining in influence across South America in recent years, and it's these parties that have been the most hostile to US influence. Most of South America is now governed by various flavours of conservative government, and relations have been improving in many countries, most notably Argentina.",2019-10-02T15:21:45+00:00,t1_f26zoq5
Scotland,comment,Antarctic,hme48eh,violetvelouria,,My parents got locked out of their house yesterday because their electronic security system can't let them in the house because of the powercut (and now the snow isn't helping). They've had to go and stay at my Aunt's for a few days as Scottish Power has stated it could be a few days till the downed electricity line is repaired. Absolute nightmare.,2021-11-28T11:57:43+00:00,t3_r40c7q
ukpolitics,comment,coal,e1pnxen,Buckeejit67,,Guess where Northern Ireland gets most of it's power from ?,2018-07-03T11:55:03+00:00,t1_e1pnv00
