subreddit,type,keyword,id,author,title,body,created_utc,parent_id
northernireland,comment,warming,kfu17ww,Little_Kitchen8313,,The flu is vicious. Literally unable to walk to the kitchen for days. I get the jab every year now. I had it three times and never want to go through that again.,2024-01-01T14:16:08+00:00,t1_kfo11a7
ukpolitics,comment,fossil,e4hlv7g,lets_chill_dude,,"But if you’re concerned about policing outcomes, wouldn’t legalisation mean much more money in tax for police funding, and massively cutting funding to criminals? ",2018-08-19T23:44:12+00:00,t1_e4hlpps
ukpolitics,comment,warming,hbupxcc,baddinaa,,"If the only way Labour can get in to power is to become Conservatives, then they may as well disband and just let the actual Tories run the country",2021-09-06T21:00:25+00:00,t1_hbudua7
unitedkingdom,comment,emissions,jtuusyj,WynterRayne,,"""Heey Laser Lips. Yo mama was a snowblower!""

Also, I just realised I'm old and that very few people are likely to understand that reference. Buuut, if you do... enjoy it. :)",2023-07-28T21:01:31+00:00,t1_jtu0xp8
Scotland,comment,coal,h7yumwa,erroneousbosh,,"Can you clearly and lucidly point out anywhere where I even suggested ""Maggie was good for the environment""?

You need to work on your functional literacy as well as your scientific literacy.",2021-08-06T18:53:27+00:00,t1_h7x9ur8
unitedkingdom,comment,environment,gbkeny9,SuperCucumber,,"Why do people love to pretend multinational corporations exist out of thin air? They only exist to fill a demand people have. If you don't like how a company works, boycott them. If you don't like the impact of animal agriculture on the environment, go vegan. Simple as that. Crying on the internet about how had corporations are does not do jack shit.",2020-11-08T06:09:33+00:00,t1_gb3m8a4
AskUK,comment,drought,ijc4vd0,not-much,,"> in 50 years time it could be other domestic usage

50 years? I think we have an optimist here.",2022-08-07T17:50:37+00:00,t1_ijanw2p
unitedkingdom,comment,emissions,k9vymra,Gerodog,,"From the telegraph's wiki page:

>The Telegraph has published multiple columns and news articles which promote pseudoscientific views on climate change, and misleadingly cast the subject of climate change as a subject of active scientific debate when there is a scientific consensus on climate change.[122] It has published columns about the ""conspiracy behind the Anthropogenic Global Warming myth"",[119] **described climate scientists as ""white-coated prima donnas and narcissists,""**[119][120] and claimed that ""global warming causes about as much damage as benefits.""[121] In 2015, a Telegraph news article incorrectly claimed that scientists predicted a mini-ice age by 2030.[120] **Climate change denying journalist James Delingpole was first to use ""Climategate"" on his Telegraph blog for a manufactured controversy where emails were leaked from climate scientists ahead of the Copenhagen climate summit and misleadingly presented to give the appearance that the climate scientists were engaged in fraud.[123]**

So this is par for the course really.",2023-11-19T13:33:33+00:00,t3_17yx03z
europe,comment,coal,kfpevrn,Zonkysama,,"Ah well lets check numbers.

12 month: 434g CO2eq/KWh

6 years: 473g CO2eq/KWh

reduction 39g

France

12 month: 52g CO2eq/KWh

6 years: 90g CO2eq/KWh 

reduction 38g

lol",2023-12-31T15:15:53+00:00,t1_kfp6egk
unitedkingdom,comment,fossil,g63ak4j,JavaRuby2000,,"The ones I can see for sale at the moment are from 2015 so only half a decade.

Nissan guarantee the battery for 8 years or 100,000 miles but, just because it is out of guarantee doesn't mean that it'll automatically fail.    You can also have batteries checked.  There is evidence of Leafs used as high milage fleet vehicles in Europe still having battery efficiency of 98% after 160,000 miles of Taxi use.

Also all the horror stories about how much a replacement battery could potentially cost are from 2014.  The cost of a Nissan Leaf battery has halved since then.  Still a few grand but, comparable to an engine swap in an ICE vehicle.",2020-09-21T11:46:15+00:00,t1_g639g37
ukpolitics,comment,fossil,fdhb2uy,CyclopsRock,,The UKs offshore wind sector has been a huge success.,2020-01-07T17:46:28+00:00,t3_el5rjt
ukpolitics,comment,pollution,jvz4xrb,voyagerdoge,,"so far the government didn't lift a finger

they're their friends after all",2023-08-13T07:22:47+00:00,t1_jvy3jny
AskUK,comment,carbon,jhjttu4,ConfusionAgreeable64,,"Yeah, same founder, sold Howies to Timberland and then did Hiut. They're okay jeans for the money, but the real value is in the free repairs for life thing.",2023-04-24T18:21:23+00:00,t1_jhik1ku
europe,comment,carbon,gc0clqm,7elevenses,,"Needs more pixels, half of the text is unreadable.",2020-11-12T04:35:43+00:00,t3_js5kf7
unitedkingdom,comment,climate change,hjr5b9a,MerePotato,,That won't mean much when resources and habitable land become scarcer and scarcer,2021-11-08T02:01:16+00:00,t1_hjqwvw4
europe,comment,CO2,iolayat,S7ormstalker,,"What should be the link to the report is instead a local link to the pdf in the reporter's PC.

> https://c/Users/benjamin.wehrmann/Downloads/sd-2022-09-mier-erdgaspreise-strompreise-klima.pdf

How about we take time to read and fact-check the content before sharing it, instead of posting only because the title fits the agenda?",2022-09-15T22:33:08+00:00,t3_xf7l68
AskUK,comment,environment,kwbvisc,AutoModerator,,"**Please help keep AskUK welcoming!**

- Top-level comments to the OP must contain **genuine efforts to answer the question**. No jokes, judgements, etc.

- **Don't be a dick** to each other. If getting heated, just block and move on.

- This is a strictly **no-politics** subreddit!
        
Please help us by reporting comments that break these rules.

*I am a bot, and this action was performed automatically. Please [contact the moderators of this subreddit](/message/compose/?to=/r/AskUK) if you have any questions or concerns.*",2024-03-24T12:18:15+00:00,t3_1bmjezv
unitedkingdom,comment,CO2,gzd9nm4,redcondurango,,"As a follow up to yesterday's news of a paltry £30m for studies on which trees to plant where, which gravel absorbs CO2 best while rusting etc, etc....

The real story is the UK govt spent £bns baling out the City of London in the last recession. The financial sector remain the biggest threat to the climate, funding projects which emit double the UK's carbon emissions per year.",2021-05-25T07:46:04+00:00,t3_nkjzjv
unitedkingdom,comment,coal,cttckry,fiercelyfriendly,,There is huge story here that is just starting to come out. It is going to end up going to the heart of government . This charity was spending tens of millions that should have gone to social services. ,2015-08-06T07:44:26+00:00,t1_ctsn211
AskUK,comment,biodiversity,j4cm7bx,Celestia90,,O thank you! Will certainly do! :),2023-01-14T19:37:20+00:00,t1_j4c3hhu
AskUK,comment,pollution,ilfnoal,tryingmydarnest,,"> Probably not what what you want to hear 

Nah, am prepared for someone sharing that I'm better off without this item, given the challenges in securing transportation without breaking my bank. 

The photos look charming though. Would love to visit one day.",2022-08-23T09:26:51+00:00,t1_ilfj70b
Scotland,comment,warming,k1keznh,BesottedScot,,"> Spyres

+1",2023-09-21T14:16:26+00:00,t1_k1jqkjp
AskUK,comment,carbon,iw6d0wb,misterjakelee,,"Because you only have to use Zoom to see how unpleasant it is. If anything, it would cheapen COP27. If something is important, you meet to discuss it don't you? Imagine on Christmas the family got together via Zoom. Imagine we held funerals via Zoom. Zoom is worst than  a phone call, because at least during a phone I can talk while walking around and doing other things. The worst thing about Zoom is you have to give your undivided attention.",2022-11-13T08:10:37+00:00,t3_yt7zze
ukpolitics,comment,fossil,i3a8z9c,Not_Alpha_Centaurian,,"I don't know how many years we are from the last economically viable oil field being discovered, but running the risk of discouraging exploration has to rank as a pretty low concern by now.

As for discouraging extraction.... maybe it would, maybe if we extracted £x billion in taxes from these companies there'd be £y billion fewer barrels of oil on the market next year. But my gut tells me y is less than x in this equation, and I vastly prefer it as an alternative to anti-progressive NI increases.",2022-04-03T23:19:28+00:00,t1_i3a80f8
unitedkingdom,post,emissions,8uisa8,Wagamaga,"The UK could fail to hit legally binding emissions targets if it does not take ""urgent action"", the government's official advisers have warned.",,2018-06-28T12:11:49+00:00,
europe,comment,Antarctic,dlofnh2,Red_Hoiz,,"- No Austro-Hungarian Empire -
 TRIGGERED",2017-08-15T23:45:48+00:00,t3_6tautn
AskUK,comment,pollution,jkjihuu,Parking-Wing-2930,,Are you trying to.rin a free party?,2023-05-17T19:46:13+00:00,t3_13kbght
unitedkingdom,comment,carbon,hdvzkzl,postuk,,Wales*,2021-09-22T20:51:49+00:00,t1_hdvn182
europe,comment,coal,hf411n2,rewrite-and-repeat,,"1 - yes, but its about the future impact, if the mine will be going through 2044 the operator or polish goverment must provide guarantees in case people are affected, that is not that unreasonable

2 - okey, not sure what they tell you in polish media, but czech side also wants to get it over. Poland paying fines will achieve nothing for the villages around. Last negotiations this week were not successfull, when polish side wanted the right to terminate the contract after 2 years, while czech side wants the contract will be valid till the mine ends operation in 2044(which is a demand from the beginning of this debate while polish side claimed in your media its something new)

3 - no discussion here, it is valid point",2021-10-02T16:07:47+00:00,t1_hf404un
northernireland,comment,environment,ka4ppwt,fullmoonbeam,,"That's not a great career. Low enough pay, very high stress, terrible hours and work life balance, difficult patients, risk of violence, blood, trauma. It may be rewarding in other ways but there's a reason the ambulance service can't recruit new paramedics.",2023-11-21T07:18:01+00:00,t1_ka4idtc
AskUK,comment,warming,ki9xjsb,as93lfc,,"Yes, an electric blanket seems to be the most popular suggestion and the one I'm most likely to try out first. Just a case of saving up for it - times are tough, as you probably know.",2024-01-17T13:23:43+00:00,t1_ki9h69n
unitedkingdom,comment,environment,fi1wiyh,Thyrotoxic,,"http://www.bom.gov.au/climate/change/#tabs=Tracker&tracker=trend-maps&tQ=map%3Dtmean%26area%3Daus%26season%3D0112%26period%3D1910

http://www.bom.gov.au/climate/history/temperature/",2020-02-18T22:50:35+00:00,t1_fi1vhar
unitedkingdom,comment,warming,ez8tw80,inevitablelizard,,"I remember him asking for firm evidence in the early stages of that incident, what was so unreasonable about that? Unless there's something else he said that I've forgotten.",2019-09-06T08:41:50+00:00,t1_ez8s4a0
europe,comment,IPCC,hcswbs3,norgiii,,Bingo,2021-09-14T10:05:16+00:00,t1_hcqgcd5
europe,comment,coal,h958321,bene20080,,"What a joke, you do not even know that there are other kinds of energy storage besides batteries.
Oh boy, duning Kruger is striking again.",2021-08-16T11:35:34+00:00,t1_h955zo6
europe,comment,coal,j1d9wwv,plant_gen,,What about GAS ?,2022-12-23T13:23:55+00:00,t3_ztbgiz
europe,post,climate change,xwvjpf,fly_in_the_soup,"Climate change made Europe’s extreme drought 20 times more likely, scientists say",,2022-10-06T04:00:30+00:00,
ukpolitics,comment,climate change,gouuwpd,worotan,,"No, it’s because the science says that’s the only path we have left now, because of the decades that the right have spent playing dumb about the problem and letting it get to this state.

Having a party when we should have been fixing the roof in the face of the coming storm. And then claiming to be the responsible ones. Pathetic.",2021-02-26T17:49:11+00:00,t1_gotnk9n
ukpolitics,comment,pollution,emtymqc,NotSoBlue_,,"This perspective from 1985 is an incredibly interesting political debate to watch given current events. Specifically regarding the environment, the EU and British Exceptionalism.",2019-05-08T14:27:11+00:00,t3_bm5wn2
unitedkingdom,comment,pollution,l50r4v8,Academic-Bug-4597,,"> Stopped wild swimming a few years back, don’t even kayak anymore.

That's an overreaction. Obviously pollution in rivers needs to come down, but swimming is still safe.

> So sad when you see families blissfully unaware of the dangers.

They are ""blissfully unaware"" because one can swim in these rivers every day and come to no harm. As long as you aren't guzzling down the water and you take basic precautions after swimming, like taking a shower, you will be fine.",2024-05-21T13:52:08+00:00,t1_l4zo8pc
unitedkingdom,comment,climate change,ik4soo1,x-Spitfire-x,,"I’ve read the article and how would this affect our winters? It says we will have drier winters but it also says we will have wetter winters? Can someone explain? Also, would a drier winter mean we get more snow as opposed to rain/ice?",2022-08-13T14:41:01+00:00,t3_wneetd
europe,comment,coal,kk3s1o3,Waryle,,"> Because of long term planning: uranium isn't infinite and uranium in sale countries is even less, so keeping renewables to keep the research going would be useful for when 4th gen reactors will have to be closed after like a century.

- We have centuries worth of uranium available
- Uranium is available worldwide, we're not tied to a few dictatorships
- Breeder reactors and MOX fuel already exists, whether in the form of 100% functional prototypes or in outright civilian operation, making nuclear virtually renewable",2024-01-29T13:59:49+00:00,t1_kk3pjz5
Scotland,comment,Antarctic,e3efe67,Bottle_O_ginger,,"Yeah, jokes on all you Glaswegians. Imagine begin born in the most populated urban area in the country.",2018-08-01T07:33:31+00:00,t1_e397d87
tories,comment,environment,fcnmjpe,OurSaviourMechaJesus,,Yeah but he was PM for six years and we still have a massive deficit let alone the debt. Public spending is still insanely high. And his government was not good on civil liberties either.,2019-12-31T17:45:33+00:00,t1_fcm8ig9
europe,comment,coal,kyygzu6,sonofeark,,"They got nothing else left to cling to, since nuclear isn't cheaper and we don't actually need their contribution to the base load.",2024-04-10T18:22:26+00:00,t1_kyy3c4k
europe,comment,warming,htigsve,Otinanai456,,Putin will listen to Erdogan when Erdogan wins that [Nobel prize](https://www.duvarenglish.com/pro-govt-columnist-claims-erdogan-will-win-nobel-prize-for-economic-policy-news-60152) for his economic policies,2022-01-20T21:29:14+00:00,t3_s8sm35
europe,comment,emissions,l0kbfbb,ballimi,,"The title says that the emissions of Ryanair etc have grown. That's unrelated to the graph, which shows how much each airline pays for their emissions. And that is the result of the law, which has nothing to do with airlines doing better or worse.",2024-04-21T06:52:42+00:00,t1_l0k9ws0
ukpolitics,comment,pollution,feddpth,chrisjd,,Capitalism has become a death cult.,2020-01-14T13:30:37+00:00,t1_feddkgc
europe,comment,warming,ff5nck8,LiverOperator,,Brb gotta make dem finns pay for my great grandfather 🔫😎🔫,2020-01-21T10:12:41+00:00,t1_ff57nxc
AskUK,comment,environment,ip2vj22,Judgy__,,Lol no not one of them luckily,2022-09-19T16:08:25+00:00,t1_ip2pl0h
ukpolitics,comment,climate change,gbh58b2,GlimmervoidG,,So a solid majority believes in human driven climate change?,2020-11-07T18:46:13+00:00,t1_gbh53tj
unitedkingdom,comment,coal,h7x3pj5,Uniform764,,">Instead they chose an ideologically driven war, and lost.

I can believe that. I've seen one union argue for a deal that resulted in more hours for less pay and less perks compared to the deal management offered, just because management must be opposed.",2021-08-06T10:21:29+00:00,t1_h7x2kd5
AskUK,comment,warming,iztlj2v,rice_fish_and_eggs,,It forces your body to pump more blood to your feet to warm them up.,2022-12-11T19:28:09+00:00,t1_iztla23
europe,comment,emissions,ikx47lh,lapzkauz,,Just go downhill 🤪,2022-08-19T11:18:39+00:00,t1_ikuzcqv
AskUK,comment,environment,kwnvpj0,SurlyTemp1e,,"I am a therapist for kids.  I am also in the US and what you describe for your daughter I see here as well.  It’s interesting but not surprising this exists across the pond.  How much social media does she use ?  I would tell you immediately to really try and listen to her and not make a lot of commentary back about what she’s says.  Validating her feelings is critical.  And understand the times kids are in right now are not the same as it was for us ,, no matter how old you are.  It’s very very stressful.",2024-03-26T16:33:25+00:00,t3_1bnjtwc
AskUK,comment,environment,iixkg49,Miss-Hell,,"I used to think it was cruel keeping them indoors but over the years my opinions have changed. There are too many cats in built up areas. I’ve seen too many dead cats hit by cars. I’ve seen how much wildlife cats destroy.

We want to get a cat one day but won’t while we have dogs that are in and and out so it would be impossible and very annoying to try and keep
A cat indoors. I will only consider an outdoor cat if we move to a very secluded house (which is our aim) where our cat will
Be the only cat in a 2 mile radius.

More and more people are changing their opinions as the years go on as well!",2022-08-04T16:10:30+00:00,t3_wfybxc
Scotland,comment,environment,ckdl57t,Alwaysfair,,">I don't quite appreciate the fact that you're continuously equating Norwegian industrial and political build-up as ""luck"" 

I use Norway simply because it is used for most things in this independence discussion, I have nothing against the country or its people.


>""lesser-developed""

No simply surpassed in economic terms and influence 


>GDP per capita as some proof of anything other than relative state wealth, then you're using your statistics wrong.

I am not so no fear, I don't place much emphasis on per capita as I think it is pointless as it fail to consider wealth distribution. 


>sanctions even though it directly affected our salmon industry, Norway has still made it clear that it doesn't ""meekly"" abide to Russia's whims.


Well for good reason, Russia is dam close, no I take you point but Russia is perhaps a bad example as geography dictates policy more, China and asian nation perhaps present a better case, but I think you understand my point.


>but you aren't making any compelling arguments either to explain even the current events, so...

Could you expand on that?",2014-09-09T17:31:26+00:00,t1_ckdjquq
europe,comment,warming,jfve3d5,Longelance,,Europe isolated....🙄,2023-04-11T20:06:31+00:00,t3_12iusfd
northernireland,comment,environment,g8lv2dc,fermango,,"Well you're wrong. It came straight from my mouth with the evidence I've read, the training I've received, the journals I've read and the experiences I've had. You know why? Because I work in the health service and I've many years of experience with airborne illnesses and masks. I also know how to keep up to date with research and think critically instead of following some person on YouTube who uses words like sheeple and scamdemic. I think I'm qualified to talk on this and unlike you, my words don't come straight from someone else's mouth.",2020-10-12T17:01:07+00:00,t1_g8kbr8b
unitedkingdom,post,warming,3s561d,SweatyBadgers,Top economist says the cost of living would fall by 8% on day one if we left the EU,"> A professor of Applied Economics at Cardiff Business School has blown the lid open on the debate surrounding Britain’s membership of the European Union (EU) by revealing in testimony to the House of Commons Foreign Affairs select committee that the cost of living for those in the United Kingdom would drop by eight per cent “on day one” if Britain leaves the EU.

> The session on the costs and benefits of the UK’s membership of the European Union took place on November 3rd, during which several participants were asked to submit evidence on the subject. Prof. Patrick Minford of Cardiff Business School opened up a new front for anti-EU campaigners by revealing that Britain would actually be more well off as a nation if we left the EU.

> His economic modelling will come as a major blow to pro-EU campaigners who constantly warn that Britain’s economic security is threatened by a Brexit.

> Prof. Minford, who spoke at length about global free trade, said: “What people are saying is that if we leave the EU it is disastrous, because we’ll lose leverage, blah blah blah. But the truth is we’ll move, if we’ve got any sense, to a liberalised economy, fundamentally under free trade.

> “It isn’t in our interest not to have free trade,” he added, before skewering the pro-EU arguments.

> “It pays us to be a global player under free trade. It pays us to sell our goods to other people in the world market and to take their goods at world prices. That will lower our cost of living.

> **“We have actually done a simulation of leaving the EU and the first thing that comes out is an eight per cent drop in the cost of living on day one. Because of the move from EU prices to world prices. Now that is really worth having.”**

> Prof. Minford, who is a world renowned economist, was even educated at the pro-EU London School of Economics, as well as Balliol College at Oxford University.

> His comments have been warmly received from anti-EU campaigners.

> Andy Wigmore of the Leave.EU campaign told Breitbart London: “This is just another illustration of how big business the their lobbyists just don’t get. It blows the myth that we will be worse off out the EU, and it’s about time they started being honest about it.”

http://www.breitbart.com/london/2015/11/09/watch-top-economist-says-cost-of-living-will-fall-by-8-per-cent-if-britain-leaves-the-eu-on-day-one/
",2015-11-09T15:36:42+00:00,
unitedkingdom,comment,pollution,j30f25t,lordaldwych,,"Yes but this is exactly how I became — UNDERGROUNDMAN

Breathing in huge gulps of steel filings and with a cape made of Piccadilly line seat fabric

Able to pay for multiple zones

Is it a cat? Is it a builder? No! It's UNDERGROUNDMAN!",2023-01-05T04:47:48+00:00,t1_j2z7240
europe,comment,warming,ixgx5ib,Swinepits,,That’s certainly how it’s portrays itself. I doubt this guy is talking about over half euro countries I just don’t see most baltic/ Balkan countries being an easier spawn than Singapore,2022-11-23T10:36:02+00:00,t1_ixetuz2
Scotland,comment,warming,k1ltpqh,TheIronScott,,I need to see supernaturals music in more Scottish media,2023-09-21T19:14:19+00:00,t3_16ocavz
europe,comment,coal,hthh1el,voyagerdoge,,finally,2022-01-20T17:43:31+00:00,t3_s8gymz
ukpolitics,comment,pollution,fabbqo6,TheAnimus,,"So something that's not happened, is worse than something which has, which generates far, far more pollution.

Can't help but think you aren't on the level.",2019-12-09T19:46:27+00:00,t1_fabbkoq
ukpolitics,comment,IPCC,h8a0swy,CyclopsRock,,And the worst part is that you ended up in Cardiff.,2021-08-09T12:18:44+00:00,t1_h89w2z2
ukpolitics,comment,CO2,fjf8h11,Rulweylan,,"Worth looking into what is being replaced though. Gas power produces about 60% of the CO2 per kWh that even the best new coal plants manage, so helping poor countries transition from coal to gas isn't a terrible idea.",2020-03-04T01:48:46+00:00,t1_fjevq3c
europe,comment,fossil,id6b88b,Ok-Personality-1888,,Five idiots not 'young people'. Typical guardian garbage headline.,2022-06-21T12:35:18+00:00,t3_vh7vlo
ukpolitics,comment,climate change,hif6s22,DirtyNorf,,Are you implying that crypto is a pyramid scheme or that an equal proportion to proponents of crypto amongst the general population would fall for a pyramid scheme?,2021-10-28T19:44:26+00:00,t1_hiev5ik
europe,comment,warming,l0ufysv,JourneyThiefer,,"Wow where? It was 20 degrees here in Sunday, but back down to 13 again in Monday :(",2024-04-23T04:32:33+00:00,t1_l0pnl8b
europe,comment,coal,kyd2tor,whats-a-bitcoin,,"On the graph I'm adding up Stromsteur, MWSt and ""Sonstige Abgaben und Umlagen"", that's only 29% (probably 29.x%, and why the article rounds it to 30%). Where's the other 11-12%, I'm not sure from your article?",2024-04-06T19:15:15+00:00,t1_kyd1l52
unitedkingdom,comment,climate change,ihc7dq1,Tryignan,,"The fact that women's rugby banned all trans women from competing in rugby when there was only 5 trans women that played showed that this is nothing more than an attempted culture war by the far right. There's a big difference from banning trans athletes with high hormone levels from competing in the olympics and banning trans people from any organised sports. People are going way too far and bullying trans people just for a political win. Bigotry is back in the mainstream and being celebrated by a loud minority of this country, and that's never ok.",2022-07-23T16:28:49+00:00,t3_w649m6
Scotland,comment,environment,j5s17vw,workshy101,,movable objects are always being moved,2023-01-25T03:47:31+00:00,t3_10kfqb2
ukpolitics,comment,coal,fcy8dp5,Evolations,,Oh hey I'm in that thread. What a blast from the past.,2020-01-03T18:30:36+00:00,t1_fcy1zpu
