subreddit,type,keyword,id,author,title,body,created_utc,parent_id
europe,comment,CO2,em0f895,Lagomorphix,,"People care about impact of nuclear because it's local so it's your country that's contaminated. People don't care about emissions because it's global, and thus ""nobodys fault"".",2019-04-28T21:38:31+00:00,t1_em09a0w
europe,comment,fossil,fwov2ae,Order_99,,I always knew that we were the first Neanderthals in the Balkans,2020-07-02T12:49:16+00:00,t3_gi9hj8
europe,comment,climate change,gqgqvxx,LastHomeros,,Jesus it’s like a sth from another world.,2021-03-10T16:59:54+00:00,t3_m1p89k
LabourUK,comment,carbon,icibyfi,purplecatchap,,Do I look like a goat?,2022-06-15T21:59:38+00:00,t1_ici994k
LabourUK,comment,carbon,it1o9re,Portean,,"Fracking isn't really a viable option anyway. 

https://theconversation.com/fracking-if-liz-truss-wants-a-major-shale-gas-industry-she-is-280-million-years-late-190421

https://www.nature.com/articles/s41467-019-11653-4.pdf",2022-10-20T08:29:19+00:00,t3_y8qpb1
unitedkingdom,comment,warming,cmyjtfm,GoatFuckYourself,,Stop appearing on every sub! Every thread I see you! ,2014-12-18T13:43:10+00:00,t1_cmygmup
ukpolitics,comment,climate change,h7x5ada,DavidSwifty,,Wouldn't trust the Tories to organise a piss up in a brewery.,2021-08-06T10:42:27+00:00,t3_oz4407
europe,comment,climate change,hk4g8hc,100ky,,"France ""stagnated"" decades ago, since that's when they mostly decarbonized their electricity production. This has saved a huge amount of CO² over the decades. Their cheap carbon free electricity has also allowed them a fairly high level of electricity based heating. So, it's no wonder if they are ""stagnating"".

Mayor areas of improvement for France would be electrification of transportation, and further improvement in buildings (isolation, switching from gas to heat pumps etc). Industry and agriculture are also areas where France has to improve (like everyone else).

For comparison, note Germany had more than 50% higher GHG emissions than France 2018.",2021-11-10T21:52:35+00:00,t1_hk1q43a
AskUK,comment,environment,jsh8cou,newtonbase,,Lack of money is stressful for me so money would make me happier.,2023-07-18T17:29:30+00:00,t3_152u1u8
AskUK,comment,carbon,h8dwwmj,destria,,"They're awful to read, the websites are unbelievably annoying to use and very poor quality. The only thing I occasionally use them for is travel alerts because they're often the only way to get live updates on local traffic.

Just to add East Anglia does have Cambridge Live...",2021-08-10T07:44:53+00:00,t3_p1bct3
unitedkingdom,comment,climate change,hjoi72s,I_miss_Chris_Hughton,,"also the process to start fixing all of them already exists. Apply a carbon tax/dividend, and the market suddenly prioritises lower emissions. Carbon just isn't priced.",2021-11-07T15:05:12+00:00,t1_hjnwc2r
brexit,comment,environment,gr3rc8m,ink-ling,,">She highlighted the example of air quality, an issue on which ministers have been taken to court successfully several times under EU legislation. Ministers have promised to improve air pollution, but have not agreed to sign up to World Health Organization standards. “We don’t see why they won’t,” said Williams.

Well, now the ministers don't have to worry about being taken to court anymore and really focus their saved time on saving the environment. /s",2021-03-16T08:56:30+00:00,t3_m64fwr
AskUK,comment,environment,j0wnzwg,PipBin,,"I thought I liked it when I was young, but looking back I really just wanted to be at home. Now I’m pushing 50, I was planning a get together with some female friends last week. We ended up opting to meet at 3pm so we would be home by the evening. 

Go big or go home? Taxi!",2022-12-19T23:41:28+00:00,t3_zq3uys
unitedkingdom,comment,drought,ik1mjkg,LowQualityDiscourse,,"When there's a shortage, we ration by price.

The poorest in the world will go hungry first.

The most fragile states will collapse, because people always raid before they starve.

A wave of refugees and explosion of conflict the likes of which we've never seen before.

Amid the inflation, danger and turmoil, democracies seeking easy answers will probably turn to genocidal authoritarianism.

Starvation is a long way off for *most* westerners, although a staggering reduction in living standards and malnutrition is definitely on the cards. Westerners will not ration to ensure provision for Africans.

I hate all of this so much.",2022-08-12T20:50:36+00:00,t1_ik1iws3
brexit,comment,carbon,gq7n3xl,Obulgaryan,,How the fuck is that even an issue? The identity politics of the whole thing is beyond absurd...,2021-03-08T14:19:32+00:00,t1_gq7mw01
europe,comment,environment,l44tt5c,Wulfstrex,,What?,2024-05-15T09:50:29+00:00,t1_l40k9zu
AskUK,comment,environment,kf70vlh,Double_Cost4865,,"Thank you, very much appreciated. I’ll have a look at these tomorrow morning",2023-12-27T23:47:24+00:00,t1_kf6fnrx
unitedkingdom,comment,climate change,glz276g,dwair,,">One of the problems with environmental activism is some of the worst carbon crimes happen out of the public eye, inevitably leading to soft targets like heritage steam.

I think you are right here.  Heritage steam really is a very low hanging fruit in the grand scheme of things.",2021-02-04T10:26:39+00:00,t1_glz1t9u
europe,comment,biodiversity,ey2d3xv,the_gnarts,,Why not invite him in that role then?,2019-08-25T12:18:07+00:00,t1_exz2jwj
europe,comment,emissions,iyijdyt,jhjacobs81,,"I’m gonna assume they will make it next to impossible for a lot of farmers to operate in a normal way. Thus “forcing” them to sell.

They’ll probably invent some new laws, taxes, whatever they can do to make it hard for you to do descent farming.

A part of me is “for” it. Especially if its better for the environment. At the same time.. there are other sectors and other country’s that could do a whole lot more.. No need for us to be the brave, ever saintly people.",2022-12-01T17:40:11+00:00,t1_iyidmuc
AskUK,comment,environment,kz3rynt,Mafalos,,"Please OP, see what this poster did and go to your GP.",2024-04-11T17:17:00+00:00,t1_kz34ljp
unitedkingdom,comment,climate change,g675se0,Grayson81,,"He doesn’t say it is.

You seem to be linking two separate things he said and accusing him of mistaking one for the other!",2020-09-22T09:19:35+00:00,t1_g66uvc1
AskUK,comment,warming,ize2hbj,AffectionateFig9277,,Tbf I can’t walk and do anything at the same time! I would probably choke on my food if I tried eating while in motion,2022-12-08T12:52:20+00:00,t1_ize1ujt
europe,comment,emissions,hpkejfx,tjhc_,,"It really depends on what we get out of finger pointing. If we say ""look China is so bad and we so good, so we are done here"" I completely disagree, if we point with the intention to create a structure that forces or nudges China to improve, I approve the finger pointing.",2021-12-22T15:38:03+00:00,t1_hpke7mh
AskUK,comment,warming,ju23fb7,ColdShadowKaz,,Friday I got to go out and walk down to town which I don’t do often. I got to walk in the rain. Real rain.  It was warm enough that the rain felt really good in the warmth we did get. I liked that. Normally summer to me is just too hot and I end up frying myself in the sun despite all the sun screen I use.,2023-07-30T10:38:53+00:00,t3_15dfgvq
ukpolitics,comment,ecosystems,ko9h4k9,KingJacoPax,,Some will turn coat. Others will fling even more shit than they do at the moment. And a couple (we all know which ones) will jump right into the conspiracy theory deep end.,2024-01-31T10:13:33+00:00,t3_1aemnng
AskUK,comment,biodiversity,j4dxkpq,Wgh555,,"DON’T CALL ME LEN, YOU LITTLE BOLLOCKS",2023-01-15T00:58:13+00:00,t1_j4c8gm2
unitedkingdom,comment,fossil,k59wnkq,ObeyCoffeeDrinkSatan,,Life prospects.,2023-10-17T16:12:02+00:00,t1_k59vl33
Wales,post,warming,10ld99a,Kagedeah,Cost of living: Woman puts cat down jumper to keep warm,,2023-01-25T23:31:56+00:00,
ukpolitics,comment,drought,dipxqyg,spacedog_at_home,,"A lot of people feel they have a voice with Corbyn so politics is suddenly relevant now. I'm afraid you might be stuck with us.

Your flair is now hilarious.",2017-06-10T15:48:15+00:00,t3_6gfvcv
europe,comment,carbon,jgutq5q,worotan,,"Oh no, someone is acting to deal with climate change, ‘what a tragedy for ordinary people’.",2023-04-19T08:11:56+00:00,t1_jguqrpb
northernireland,comment,environment,jtkf51a,UK-USfuzz,,"The footage the other day with the lad with the GAA shirt on and dog, trying to cross the road again... They were wearing black shirts and tan pants with an iron cross on the back of their neck. The iron cross was used by the Nazis. So no, no crap fabricated here, except your gaslighting that they JUST HAPPEN to be wearing B&T uniforms and that it's just a coincidence...",2023-07-26T19:49:43+00:00,t1_jtkcv0k
AskUK,comment,environment,iwr7ei8,IntellegentIdiot,,No one said it was the cheapest option,2022-11-17T19:11:08+00:00,t1_iwr6ur7
europe,comment,greenhouse,e3n68my,Quintilllius,,"From space:
https://i.redditmedia.com/4K3c8eQvL6MdAga-r6qrey2ZBQ-zcgum2BU6znCE95o.jpg?fit=crop&crop=faces%2Centropy&arh=2&w=960&s=e0609f88d074b725c0c60afa936519f2

1974 vs 2000
http://www.iberianature.com/material/photos/almeria_greenhouses.jpg",2018-08-05T12:27:00+00:00,t3_94nf3o
unitedkingdom,comment,emissions,k7mo1e7,fr1234,,"The goal was to reduce the number of polluting cars from the roads as the pollution is bad for health. 

ULEZ expansion aimed to remove these polluting cars, thus reducing pollution, thus reducing harm to the public. It’s been proven that the initiative has reduced the harmful pollution. 

What _else_ is there to it that you think I’m missing?",2023-11-03T09:41:53+00:00,t1_k7kjwef
europe,comment,environment,j9gjo8f,pixelburger,,Maybe *listen* to the reasons that are being expressed instead of dismissing them.,2023-02-21T20:08:26+00:00,t1_j9gchkm
unitedkingdom,comment,pollution,j9zlyng,liamnesss,,"All those schemes either only affect a very small area, only apply to certain categories of vehicle. They're not going to have a significant effect on traffic levels.",2023-02-25T19:03:01+00:00,t1_j9zbh5o
ukpolitics,comment,climate change,gkmmm51,heresyourhardware,,Buy Robert Jenrick a pack of Werther Originals and he will push through whatever policy you want.,2021-01-24T20:10:03+00:00,t3_l46hm5
europe,comment,CO2,em05gfq,MothOnTheRun,,"> A problem that has persisted for now about 70 years

And can persist for the next 70 years and everyone will keep being fine. The waste is perfectly safe where it is now. Well, safe for us anyway. 

And if there's a catastrophe that destroys modern society to the point that we can no longer keep those temporary storage facilities safe then nuclear waste is the least of our problems. Like worrying about a paper cut when your arm has been cut off.",2019-04-28T19:44:01+00:00,t1_elzuy24
AskUK,comment,coal,kulsgh6,Crochet-panther,,"Tomato soup, cream crackers (with a bit of cheese spread if feeling up to it), original flavour lucozade.",2024-03-13T00:21:50+00:00,t3_1bd8day
ukpolitics,comment,climate change,gbiq85g,SwanBridge,,[Absolutely howling... ](http://imgur.com/gallery/N8t3Pb4),2020-11-08T00:09:39+00:00,t3_jpudtn
AskUK,comment,environment,kupeta2,decentlyfair,,"Happiness is something imo that isn’t sustainable continually but you can find happiness for moments in time. Enjoy the moment if you like. When I met my husband  and we were both skint we would go out on his motorbike, sit on a hill and look at the view then go for a cup of tea. Walking my dog and seeing her tail wagging as we go makes me happy. Lots of small moments of enjoyment build up, I am looking at my furry arsehole cat contentedly lying by feet and that makes me happy. Look for the moments.",2024-03-13T17:25:54+00:00,t3_1bdp56e
unitedkingdom,comment,drought,ilud3ry,1SP80,,"Farmers should inform the public as to what ' Ideal growing conditions' are . Every year it's either too wet, too cold ,too hot, too dry, too windy, They constantly raise prices to suit!",2022-08-26T07:48:25+00:00,t3_wy1801
europe,comment,carbon,hi52k8c,Jlib27,,"It's about relating an implication to its cause.

I'm gonna use your same logic reversa and say you're rewarding economic inactivity by measuring and penalizing it per capita wise.",2021-10-26T17:42:28+00:00,t1_hi51f5w
LabourUK,comment,emissions,l4gvew2,Old_Roof,,"It’s because the amount of energy needed globally is going to skyrocket at the exact moment we need to decarbonise. AI isn’t some little stupid project that can be put back in its box unfortunately 

https://www.bbc.co.uk/news/technology-68664182.amp

Basically here in the UK we need a shit ton of on & offshore wind power, nuclear power and a massive roll out of pylons.",2024-05-17T15:30:59+00:00,t1_l4gt7c4
unitedkingdom,comment,warming,eurupg9,Thyrotoxic,,Might not need it but I've been wonderfully cool the last week or so and been able to get a full night's sleep. It's great. Not like the UK is getting any cooler either. This is the new norm.,2019-07-24T20:13:28+00:00,t1_eurmg5u
unitedkingdom,comment,drought,cts3vy5,PoachTWC,,"Their definition of ""subsidy"" is exceptionally, I'd say excessively, broad and liberal. ",2015-08-05T08:12:25+00:00,t3_3fqt0u
northernireland,comment,environment,hlms1rw,DessieG,,"Throwing money at it could put out an immediate fire but it's ignoring the route cause. Healthcare needs massive reform and they've known this for years but no politician has been willing to make the unpopular decisions that are necessary to create better healthcare here.

We should be able to run a much better health service with the current level of funding but politicians choose not too.",2021-11-22T12:43:40+00:00,t3_qzgugt
europe,comment,warming,hc6anvu,kartvelifairy,,Looks nice!,2021-09-09T12:37:53+00:00,t3_pkdhxt
europe,comment,coal,kg07gao,Stabile_Feldmaus,,Wind will overtake nuclear in 2024.,2024-01-02T17:59:33+00:00,t3_18wun6f
unitedkingdom,comment,IPCC,jleng5q,Potatopolis,,"100%. This isn’t anti establishment, it’s “I shouldn’t suffer consequences for my actions”.",2023-05-24T10:00:40+00:00,t1_jldvdy5
unitedkingdom,comment,IPCC,d40pta7,moonflower,,"This comes across as half a story, which leaves out some rather important information, and raises a lot of questions ... I would want a lot more information before condemning the police for restraining an 11 year old who cannot control her behaviour",2016-06-08T11:07:06+00:00,t3_4n4943
ukpolitics,comment,warming,fbylnfw,DaveChild,,"I think you might be taking the joke a bit too seriously.

But you're still wrong, volunteer work requires a visa.",2019-12-24T20:40:59+00:00,t1_fbyleil
ukpolitics,comment,carbon,glyzib3,troopski,,"I don't really understand people who leave their entire home heated all the time. I don't have a fancy thermostat, but since moving into our house I just have the heating on auto and then just turn the radiator on in the room im in for a bit.. okay, it does get quite toasty in my office, like a frog boiling in water, but that is one of 10 radiators on..

Maybe those fancy thermostats are the way forward. Makes me feel ill thinking that people just have their heating on for the whole house all day.",2021-02-04T09:44:45+00:00,t1_glyys8o
unitedkingdom,comment,environment,g84a5dz,Roryf,,"Even before Covid times, with loaves of bread getting chucked in skips and the like. Boils my piss.",2020-10-08T15:50:41+00:00,t1_g83i5ei
europe,post,drought,11jt881,astiiik111,"Droughts in France, winters 21/22/23",,2023-03-06T08:42:03+00:00,
AskUK,comment,environment,j5kib5g,the_falling_leaf,,"The issue you mentioned is your employer asking all employees to add them to directory pages.

The thing the rest of us are discussing is one person's CV.

It's ridiculous to suggest that their CV is contributing to the completely different thing you describe.

It's like you have made your mind up and are retrospectively attempting to apply logic to it.",2023-01-23T17:36:43+00:00,t1_j5kewis
unitedkingdom,comment,climate change,fwl6e6p,cliffski,,"ive done tons :D Electric car, solar power, insulated house, loads of retirement investments in wind farms and solar famrs, and offset any flights I take. Also no kids, which may actually be the biggest contribution.",2020-07-01T14:49:32+00:00,t1_fwknfbh
unitedkingdom,comment,IPCC,hc2vbgy,OfficerDarrenWilson,,"\> ""Equity and justice are important enabling conditions for effective climate mitigation. Institutions and governance that address equity and supporting narratives that promote just transitions can build broader support for climate policymaking""  


Demonstrating that that these 'scientists' have little to do with scientists; they are purely motivated by politics.",2021-09-08T17:01:57+00:00,t3_pk6wve
AskUK,comment,environment,jj2kesr,Have_Other_Accounts,,"Yeah cycling in London is completely different to most places. A complete novice, with no lights or signalling can just jump on a bike and be okay there. Do that in a normal town and it's literally suicide.",2023-05-06T09:47:55+00:00,t1_jj2itoq
europe,comment,emissions,hpjrlc6,espanaviva,,"Don’t care. Tarifas for all those countries until they can be more sustainable and environmentally conscious.

It’ll also bring jobs back to Europe, reduce shipping costs and pollution, and further support European efforts, again, to clean the world up.",2021-12-22T12:21:50+00:00,t1_hpjraum
europe,comment,CO2,fg1bahi,Telodor567,,I wish we Germans didn't abandon it :(,2020-01-30T22:41:43+00:00,t1_fg0mfph
europe,comment,carbon,jgvcjr9,Er_Eisenheim,,"""the problem is how much co2 is emitted. if we emit less, that number goes lower and thus it is effective in its goal."" 

Of course I agree with that, I'm not saying otherwise, but I want to stress the point about the goal, which I think is completely idiotic. We manage to lower emissions, but on what scale? The world's emissions will go down, or at least we'll manage to make a significant difference? Of course not when we're not the major player, nor we'll be in 30 years (even less so on today's state of things, even more less so with this decision).


In 30 years African and Asiatic GDPS are predicted rising more then ours. Pollution from production doesn't care if it can be retraced to EU money or not. It is pollution. 


I think we are actively reducing our chances in a future in which wealth is necessary to tackle those problem this decision is trying of act on, but instead of making a significant difference on climate change, it will make it on our pockets and on EU's superpower status.",2023-04-19T12:10:39+00:00,t1_jgv6tph
europe,comment,environment,kcg5sch,newaccount134JD,,"It’s mostly heating, as shown in the lockdown",2023-12-08T02:22:28+00:00,t1_kcesv1v
europe,post,climate change,129tim6,tyw7,Man ends his life after an AI chatbot 'encouraged' him to sacrifice himself to stop climate change,,2023-04-02T18:25:01+00:00,
ukpolitics,comment,carbon,hpqatjp,FloatingVoter,,That is all factually correct actually.,2021-12-23T21:22:28+00:00,t1_hpadpk2
AskUK,comment,environment,jqnajo3,flytotheleft,,I love how people are just naming random British films but none are really what OP is looking for. Is the well of these types really that shallow?,2023-07-04T16:04:01+00:00,t3_14q9jum
unitedkingdom,comment,climate change,ihcvb0g,Osgood_Schlatter,,">Science is pretty clear that gender is a social construct and that the roles given to people are based on those social constructs.

It's not gender that matters when it comes to sport though, it's sex. Your gender identity doesn't - in and of itself - affect your ability or your physiology.",2022-07-23T19:20:39+00:00,t1_ihc3sc1
Wales,comment,coal,hep9od4,Animal__Mother_,,It’s profitable to recycle them.,2021-09-29T08:56:08+00:00,t1_hep9evi
europe,comment,drought,idsnw6s,tiita,,"This is what it is supposed to look like (surrounding area anyway)

https://www.google.com/search?q=tezze%20sul%20brenta&tbm=isch&tbs=rimg:CYR1F3DoomdLYROyvTMLR1PL8AEAsgIMCgIIABAAOgQIARAA&client=ms-android-coosea&prmd=mniv&hl=en&sa=X&ved=0CBIQuIIBahcKEwjA5Kf3g8v4AhUAAAAAHQAAAAAQBg&biw=360&bih=660",2022-06-26T11:41:00+00:00,t3_vky9hp
europe,comment,CO2,hpo24lf,MilkaC0w,,"Yea I know what per capita means and why it's useful (see last sentence). Yet the user asked to have historic emissions expressed as per capita, which makes no sense to me. That's why I asked what would be gained by having historic emissions per capita and how the population would be calculated.",2021-12-23T10:21:07+00:00,t1_hpo0bsv
unitedkingdom,comment,ecosystems,exk5w2u,Charlie_Mouse,,"iPhones are still 30-40% of the U.K. smartphone market. That’s a vast chunk of the population. 

Some vendors have different challenges when you’re dealing with than others. Some 3rd party hardware is trickier then others to work with. Most private businesses plan for that accordingly. There is no fucking excuse for not being ready, particularly with years of advance notice.",2019-08-21T08:03:20+00:00,t1_exk54xf
unitedkingdom,comment,emissions,kf9w3ha,Wagamaga,,"More toxic air pollution has been averted by London’s ultra-low emission zones than is produced by the capital’s airports or its river and rail transport combined, according to a new analysis of the effects of the Ulez.  
The report showed that improvements in air quality between 2019 and 2022 from lowering motor vehicle pollution – even before the expansion of the Ulez throughout the capital since August – rivalled the potential savings from entirely cleaning up London’s aviation or industrial and commercial heat and power generation.",2023-12-28T15:13:45+00:00,t3_18sw5u3
tories,comment,carbon,igouj64,bolshybrit878,,"I supported Brexit when I was a Labour supporter, and my grandfather did too but again a generational thing but Labour men of his generation opposed the EU.  When I was in the Labour party i was described as ""blue labour"". Read Paul Embery's *Despised* book. My favourite MP, certainly my favourite Labour MP, is Paul Cruddas whose constituency is very close to my own. If he was Labour leader and if Labour stopped with the identity politics BS I would probably go back to them. But a lt of it for me is localism. For all their faults in my area, the current Tory administration seems to be driving through much needed re-development, bringing us a cinema after 22 years of not having one, building new shops etc, meanwhile the Liberals and Labour would probably try and push through something like a public consultation and ask every single person in the town what kind of shop they wanted and they'd get nowhere.

I'm supporting Badenoch because she is the bst of of a bad bunch. I might have supported Jeremy Hunt if he was still in it, I don't like Tudgenhat and he got out anywhere. I am very much anti any kind of covid restrictions, so I like Steve Baker in that regard but I fear he would tear up all the environmental work the current administration has done. For all my inital concerns that Boris Johnson would be terrible for the environment, he has admittedly, impressed me.",2022-07-18T20:44:14+00:00,t1_igohdbi
ukpolitics,comment,warming,fbz6wzw,redrhyski,,"Last year:

https://twitter.com/YouGov/status/1077686122019463168",2019-12-25T01:22:42+00:00,t1_fbyzkxy
europe,comment,coal,jyfrdlc,cheeruphumanity,,"Those wind mills were over 20 years old. A single modern turbine might have the output of all 8 that get dismantled.

Don't make this bigger than it is. 

Time to speed up construction anyway. Currently 1GW PV gets added each month to the German grid but wind is lacking behind. Those old ones don't make any difference.",2023-08-30T22:00:16+00:00,t1_jyfq6ak
europe,comment,carbon,ideichs,chairmanskitty,,And that 40% circulates into the EU economy as higher purchasing power from factory workers and more tax income.,2022-06-23T06:49:16+00:00,t1_idehqnm
AskUK,comment,warming,l04w22a,Breakwaterbot,,Easy solve there. Don't get high at work.,2024-04-18T12:42:29+00:00,t1_l04jkca
ukpolitics,comment,pollution,ejbv74t,Cyanopicacooki,,"Last Friday we had in Edinburgh a trial of a [""bike bus""](http://citycyclingedinburgh.info/bbpress/topic.php?id=19521) where a few parents accompany a gaggle of children as they cycle to school.  Initiatives like this could be the way forward.

JGPS in the title is James Gillespie Primary School.",2019-03-25T10:29:15+00:00,t1_ejbt21f
europe,comment,warming,eeok956,Saeria,,Fins living the life with their hot wheels. ,2019-01-22T10:04:59+00:00,t3_aijz35
europe,comment,pollution,ka2bxj2,Desperate-Following3,,"The only reason the majority of poor people don't have a bigger footprint is they can't afford it. That's why focusing on this doesn't help at all, every one of this people you're thinking about will increase their footprints once they manage to get their economics better. And, since poverty is expected to keep decreasing through the years, is just a matter of time until this becomes irrelevant. We are in this together. Keep the focus: Clean energy generation and Clean Construction Materials (for example: cement) are what's going to make the real difference.",2023-11-20T20:44:15+00:00,t1_ka2b3kb
ukpolitics,comment,CO2,f0vt6nb,gotnolegs,,This has got to be a top down thing. Stop the monsatos of the world feeding crap to everyone for vast profits and it will fix itself. It shouldn't be upon the poor to heal the world.,2019-09-20T14:52:59+00:00,t1_f0vgbof
europe,comment,coal,k59ym2t,morrikai,,"Yes, so we should be allowed to just cut the energy export to Germany which our main energy company want do in the middle of wintern but is not allowed because of EU regulations",2023-10-17T16:24:01+00:00,t1_k59vq4r
europe,comment,pollution,k88g6tn,Dizzy-Kiwi6825,,Cool,2023-11-07T16:54:22+00:00,t1_k88b9qa
