subreddit,type,keyword,id,author,title,body,created_utc,parent_id
Climatechange,comment,warming,kdvfdk2,clfcrw,,"Actually, *raises finger like an annoying smart-ass*, it should totally be enough to convince anybody to take action against climate change that the current economic and political world order will collapse and many many people will die and massively suffer from direct and indirect effects in the ongoing climate crisis.
""We are ALL gonna die"" is either unscientifically overdramatic or simply banal.

I know, totally different point, of course, and I share your position completely. I just don't understand why, apparently, we as a civilization nowadays need the abstract pop cultural sci-fi bogey man of total annihilation to take any action against anything. What is it with people that real drastic and dramatic consequences that change the economic political social and literal climate/landscape -- consequences that we can actually talk about -- are not enough?",2023-12-18T09:41:38+00:00,t1_kduwqzh
Politics,comment,drought,d3pqod4,ThouHastLostAn8th,,"She is. Large sections of her stump speeches involve highlighting and mocking whatever latest idiocy Trump spews out. You never see anything about it because any articles w/ neutral (or positive coverage) of her events are instantly downvoted to 0, and then r/politics automated ""bot removal"" kicks in and outright removes/hides the submissions:

https://www.reddit.com/r/politics/comments/4j5wh0/may_2016_metathread/

>""We will now be having a bot remove unreviewed posts that are at 0 points or fewer when they are 6 hours old. ... If you see a submission that has been auto-removed by a bot (it'll have a ""bot removal"" flair)""",2016-05-31T00:00:53+00:00,t1_d3pm7y0
Neoliberal,comment,warming,haooabz,kirblar,,The Turkish Airlines lounge is great.,2021-08-28T14:22:20+00:00,t1_hank3yo
Conservative,comment,environment,gambubo,laylamiller,,"Ahhhhhh okay got you. Um...well I study languages independently in my spare time. NYC has many language institutes...with great libraries. Alliance Francaise, Goethe Institute, Institute De Cervantes and Columbia's Mathematics library are really the only reasons I'm here tbh. I couldn't give less fucks about the people at this point.",2020-10-30T17:32:45+00:00,t1_gallk5u
Conservative,comment,climate,kas8rdw,louiexism,,I bet the Taliban would love to have them. These protesters would be treated like royalty in Afghanistan.,2023-11-26T02:29:34+00:00,t1_karxf5v
PoliticalDiscussion,comment,climate change,h8a7elg,mister_pringle,,"The question was about Democrats, not Republicans.   
Apparently there is no need to build consensus.",2021-08-09T13:21:26+00:00,t1_h89t513
Politics,comment,climate,kwjsu8y,DamnItJon,,Is this how climate change is solved?,2024-03-25T21:35:37+00:00,t3_1bnc3ee
USpolitics,comment,drought,ipcmkxx,hedgerow_hank,,"Next on CBS news - ""water wars - and how politics was busy regulating women's pussies and lying about election results while letting the nation die due to climate change... film at 11:00"".",2022-09-21T16:34:56+00:00,t3_xk2ugc
Conservative,comment,climate,ka6j05i,Sauvignon_Bleach,,How dare you!!,2023-11-21T17:08:14+00:00,t3_180jt51
Conservative,comment,climate,kxk40cm,Mobiosity,,"Actually, higher temperatures will ensure LARGER harvests.",2024-04-01T15:50:00+00:00,t3_1bq149l
Conservative,comment,emissions,gmo44xu,None,,Yeah what if it's all one big Eli11tist hoax and we create a better cleaner world for nothing!!1!1! Those goddamn liberals,2021-02-09T05:43:12+00:00,t1_gmo3ljs
Climatechange,post,CO2,104so6k,Friendly-Ad5331,Hope to continue fighting,"Whales capture carbon by invigorating phytoplankton populations with their poop and by stirring up nutrients from the deep ocean with their dives. A single large Baleen whale absorbs 33 tonnes of CO2 in its lifetime. 

Good news - some populations of grey and humpback whales have nearly returned to their pre-hunting numbers. Fin whales have upgraded from endangered to vulnerable.

There is hope.



(Note: I believe climate change is a serious and immediate threat. I also believe the disproportionate focus on bad news breeds hopelessness and inaction. Read Hope Matters by Elin Kelsey)


https://www.bloomberg.com/news/articles/2019-11-20/one-whale-is-worth-thousands-of-trees-in-helping-save-the-planet

https://www.iucn.org/news/species/201811/fin-whale-mountain-gorilla-recovering-thanks-conservation-action-iucn-red-list",2023-01-06T12:12:19+00:00,
Politics,comment,disasters,j8n1lu8,TheCrazyPriest,,"Ah, fair enough. My apologies as your original comment came across that way to me at first, but now I understand.


Just tired of all the fence-riding and inaction on important issues in the US",2023-02-15T14:53:02+00:00,t1_j8n0npo
Climatechange,comment,warming,k9k3cvv,Infamous_Employer_85,,"Here is the interactive graph

https://nsidc.org/arcticseaicenews/charctic-interactive-sea-ice-graph/

Select the year from the right

Here is the graph with 2012,  2013, and 2023 shown: https://i.imgur.com/VKuLtMg.png",2023-11-16T21:45:40+00:00,t1_k9k2d3z
PoliticalDiscussion,comment,pollution,ggzt5xq,AutoModerator,,"[A reminder for everyone](https://www.reddit.com/r/PoliticalDiscussion/comments/4479er/rules_explanations_and_reminders/). This is a subreddit for genuine discussion:

* Please keep it civil. Report rulebreaking comments for moderator review.
* Don't post low effort comments like joke threads, memes, slogans, or links without context.
* Help prevent this subreddit from becoming an echo chamber. Please don't downvote comments with which you disagree.

Violators will be fed to the bear.

---

*I am a bot, and this action was performed automatically. Please [contact the moderators of this subreddit](/message/compose/?to=/r/PoliticalDiscussion) if you have any questions or concerns.*",2020-12-25T15:52:10+00:00,t3_kk12te
Neoliberal,comment,climate,kkbr89o,ZCoupon,,"We are not selecting for ""low-skilled."" It's harder to immigrate legally, especially in Canada, if you do not have an education. They still come anyway, cause they exist and want to make a living.",2024-01-30T22:21:28+00:00,t1_kkammo3
Conservative,post,climate change,150h9mz,yuri_2022,"Kamala Harris Slips Up on Goal of Climate Change Agenda: ""Reduce Population""",,2023-07-15T17:06:57+00:00,
PoliticalDiscussion,comment,climate change,g9pq92y,soulexpectation,,Not too mention they’re unable to even work with the charity in New York after being caught pilfering from it,2020-10-23T01:40:58+00:00,t1_g9pq4i0
Libertarian,comment,NOAA,duumok0,OffMyFaces,,"That entire is article is completely fucking idiotic.

It claims arctic sea ice is increasing - and uses a graph that shows a clear 35 year decline.

It then claims arctic ice thickness in increasing and gives 2 yearly charts that show seasonal ice build up in **winter**. That claim is basically ""climate change is false because winter is still colder than summer"".

",2018-02-26T13:47:14+00:00,t3_80d0ii
Liberal,comment,climate,jonja8t,cbih,,"It's not a flaw, it's a feature.",2023-06-19T01:31:40+00:00,t3_14cvu3k
Conservative,comment,warming,jnql26s,soupyandgoopy,,peepee poopoo,2023-06-11T03:25:10+00:00,t3_146em90
Politics,comment,temperature,euc2y35,None,,[The rich are gonna move to the high ground](https://youtu.be/IXl4ZwakAgQ),2019-07-20T23:00:15+00:00,t3_cfplrh
Politics,comment,environmental,j9oebde,marhamm,,I can’t even with this F’er,2023-02-23T12:45:29+00:00,t3_119me5v
Politics,comment,drought,dbi9pii,10per,,Oh the humidity. ,2016-12-22T15:28:33+00:00,t1_dbi662c
PoliticalDiscussion,comment,environment,jhzowwx,Zebrehn,,"The issue I’ve always had is that I’m not a liberal or conservative. I’m an actual Socialist, not what Conservatives call anyone that disagrees with them, but a legitimate Socialist. Both parties are Capitalist, which leaves me with no true party to vote for. All I really have is the social issues to vote on, so I vote “left.” lol",2023-04-28T00:24:19+00:00,t3_130tzcu
Politics,comment,disasters,ho0lx07,Standard_Gauge,,"> She was already old and with a history of illness at that point. Should have gone and done the right thing

Do you feel the same way about Antonin Scalia? He was also old (in his 70's) with a history of heart disease, sleep apnea, and who knows what else. Bizarrely, when he died in his sleep, the right-wing loons declared that he must have been poisoned ""to silence conservatives"" or some such.",2021-12-10T18:23:31+00:00,t1_ho0hxtp
Politics,comment,disasters,kotpadx,haixin,,They’ve actually exported this style to us Canadians up North and its only seems to continue having a strong hold,2024-02-04T02:29:35+00:00,t1_kotnmfu
Libertarian,comment,climate,hfbmcry,Argercy,,"Honestly this is the only way. Nuclear is the future, we have the science to keep it safe. The only real negative at this point is all those crypt keepers in office won’t have any pull over big oil. We can stand behind nuclear energy but nothing will be done about it til generational turnover.",2021-10-04T06:18:25+00:00,t1_hfakebr
Politics,comment,pollution,gapnpxw,donerwth,,We’ll have to be pushing Biden hard if he wins.,2020-10-31T16:58:13+00:00,t3_jllmmi
Geopolitics,comment,disasters,k2dmaqm,Ok_Fee_9504,,">That pipeline went through international waters and through other countries waters. It is easy to access and attack.

Can't imagine if there was actual armed conflict, given those pipelines stretching thousands of miles, that they wouldn't be able to find easily accessible points to attack. Especially if they're overland and with the advent of drones and PGMs.",2023-09-27T02:36:33+00:00,t1_k2de446
Climatechange,comment,glaciers,j8nd9el,Future-Sherbert6145,,Imagine caring about this and not ohio rn,2023-02-15T16:12:35+00:00,t3_10zbic0
Conservative,comment,emissions,gv9mw77,tramasa,,"This has to be the most disastrous, divisive and terrible presidential administration in history.

It almost feels like they're rushing towards some kind of acceleration.",2021-04-21T00:05:15+00:00,t3_mv3l07
Politics,comment,climate change,jfcuk41,CGordini,,"How do you reconcile the recent push of modern libertarians as Tea Party-esque, with a promotion of self-interest over all else?

Or, put less kindly, ""fuck you, I got mine"", and their desire to limit government so that *no one else* can be pulled up?",2023-04-07T19:33:28+00:00,t3_12etn3d
Neoliberal,comment,emissions,k982tjp,Here4thebeer3232,,"Chinas argument would also probably be what about historical emissions? Yeah, it's great that you have low emissions now, after you spent decades in the #1 spot.

https://www.carbonbrief.org/analysis-which-countries-are-historically-responsible-for-climate-change/",2023-11-14T15:43:38+00:00,t1_k8w5pt1
Libertarian,comment,environmental,kdv1e8w,a-helixscuttlebutt,,This is awesome,2023-12-18T06:41:26+00:00,t3_18kvca1
Conservative,comment,environmental,jtvwtb2,realTrump3tt3,,"Cut them off like a gangrenous foot. Then build a big beautiful wall around Victoria.

Throw in a DMZ too",2023-07-29T01:34:12+00:00,t1_jtvtila
Neoliberal,comment,disasters,kv0ja77,Cgrrp,,The Hamas members in UNWRA was all over the news and like every big donor country ceased funding to UNWRA until last week when some announced the resumption of funding. What are you talking about??,2024-03-15T16:48:28+00:00,t1_kv09ysb
Climatechange,comment,pollution,is6jlbc,Bad_Luck__Charm,,Thanks for this! I'll definitely read through it in more detail after work.,2022-10-13T17:42:01+00:00,t1_is6fr1j
Libertarian,comment,environment,h6qwu4g,Blue_winged_yoshi,,"So many people have the same issues you’ve had with drugs with many alcohol. Alcoholism is serious and ruins lives, nobody denies that. Cigarettes do cause cancer, they curtail lives, nobody denies that. Banning alcohol was tried, it went reeeaallly badly. Banning drugs has gone just as badly and ruined so many lives. Your job is to look out for yourself. You do this now. You have access to seriously high quality tequilas, rums, whisk(e)ys, wines, etc. You show self control every day. Same applies to cocaine. This isn’t a difficult one.",2021-07-27T20:15:40+00:00,t3_osu7b0
PoliticalDiscussion,comment,environment,gu495a6,Rottendog,,Assuming he has insurance.,2021-04-11T04:30:04+00:00,t1_gu48qap
Libertarian,comment,environment,g4juib2,lilhurt38,,"What you’re arguing for is the state or others to shut down dissent. That’s the problem with your argument. Boycotts are a part of that discussion. They are free speech. The country was not founded on the idea that all ideas can co-exist peacefully. It was founded on the idea that all ideas can be discussed without the government stepping in. Naturally, bad ideas will be discarded. Boycotts don’t limit free speech at all. People are free to say whatever they want and people are free to react in a non-violent manner towards it. If It’s a bad idea, people are not going to react positively and it would be an infringement on free speech to limit that non-violent reaction.",2020-09-09T14:52:06+00:00,t1_g4ii4ed
PoliticalDiscussion,comment,pollution,dji3g9w,bhenchoood,,"Many of these people have money invested into these currencies. It's in their interest to  attract more investment. From my experience with BTC, its price solely depends on the whims of a few large investors who got in early.

",2017-06-28T08:11:09+00:00,t1_dji2jki
Democrats,post,climate change,d3k2sw,Marisa_Nya,I wish Democrats would hold back with the eating each other,"On r/politics on every post about the debate, all I've seen is ruthless negativity. While I myself was a Bernie voter and now soon to be a Warren voter, I understand that it's also important not to eat each other to the point that we forget the real sources of our woes. Things like climate change denial need to be at the forefront before talking about 100% renewable energy vs 50%. We need to talk about gerrymandering by Republicans before we talk about the problem with conservative X-Gen moderates. Etc. I just don't feel like this negativity is necessary right now. We WILL lose this way.",2019-09-13T04:33:16+00:00,
PoliticalDiscussion,comment,environmental,csfp34w,genebeam,,"You should read *A Conflict of Visions* by Thomas Sowell, as it addresses exactly the question you raise. It opens with:

> One of the curious things about political opinions is how often the same people line up on opposite sides of different issues. They may range from military spending to drugs to monetary policy to education. Yet the same familiar faces can be found glaring at each other from opposite sides of the political fence, again and again.

Most of the first chapter is available in the [Amazon preview](http://www.amazon.com/Conflict-Visions-Ideological-Political-Struggles/dp/0465002056). 

Spoiler: Sowell's conclusion, which I find very convincing if a tad biased towards conservatives, is that stereotypical liberals and conservatives are operating from different foundational assumptions about the nature of man; particularly, the degree to which we can engineer society to improve people's behavior.",2015-06-23T07:52:50+00:00,t3_3aqyvh
Climatechange,comment,climate change,ku8qw9u,DocQuang,,"Stabilization, reassessment, and relocation.   When the world becomes stable in regard to climate, it will be necessary to understand how the world has changed and what ""firs better"" in the mew world.

For example, a warming planet may create vast new areas in Canada that can be farmed.  How do we get farmers there and what restriction or aid can we give them?",2024-03-10T17:09:03+00:00,t3_1bbc2i8
Conservative,comment,disasters,j8sqeuo,dazedANDconfused2020,,This Pete dude is asleep at the wheel and needs to be fired over this.,2023-02-16T18:11:17+00:00,t3_113wlkf
Climatechange,comment,warming,kdf8px7,None,,"Would have been better if the governments allowed machinery like they used to do, to build cut lines to slow the burn instead of just letting it all burn down. but that would be counter productive to their agenda of worsening climate change by reducing the carbon syncs we have in the trees. Just like bill gates wants to slash and bury millions of acres of trees. Reducing our ability to covert co2 to oxygen further.  What you’re trying to do though doesn’t work on the likes of me because I can guarantee I’ve done way more research and am a fuck of a lot smarter than you.  I’ve dug in a did the math and I know for a fact that just with the amount of trees, grasslands, mangroves and the amount of co2 the oceans absorbs and converts is way more than mankind’s global output of co2.  I also know that the natural sources far outweigh what mankind emits and we do have a problem and I’m not saying that we shouldn’t do anything but China will NEVER get on board without force and no one wants to fuck with China so yall better just settle In and deal with climate change cuz it ain’t going anywhere.",2023-12-15T04:37:44+00:00,t1_kde4x9b
Conservatives,post,climate,10gd06r,keypuncher,‘Distasteful Masterclass In Hypocrisy’: Climate Group Shreds World Economic Forum Attendees For Flying In On Hundreds Of Private Jets,,2023-01-19T20:57:07+00:00,
Politics,comment,wildfires,hff2zbk,tkshow,,"I'd suggest not getting an abortion then.

It's your choice.",2021-10-04T23:45:04+00:00,t1_hfe4pjs
Politics,comment,temperature,c0iylac,None,,"True about the marginal rate, I wasn't clear in my original post. Imo there is a risk in setting the slope too steep, i.e. the dollar amount too low. 59% on 75k would wipe out most of southern california as 75k is not that far from what college grads in electrical engineering start at. Of course the other side of the issue is that I don't trust the government to spend my tax dollars intelligently. I'd be willing to give the Danes the benefit of a doubt.

EDIT: It's like in WarCraft 3 where they have the tax on units. You're better off attacking with the smaller force rather than sitting around trying to build up to bigger armies.",2010-01-18T17:42:35+00:00,t1_c0iy7f6
Libertarian,comment,environment,i3cijsx,Sapiendoggo,,"I mean I can scroll through just this year's (it's only april) GoP actions and they clearly show authoritarian big government actions. Florida for example sayings its going to arrest parents for taking their kids to therapy for transgenderism, and arresting teachers for admitting gay people exist. Take the entire trump admin for instance, he expanded the deficit with tacit party support by over 6 trillion. Gave out hundreds of billions of dollars in free money to corporations and businesses in corporate socialism, slashed saftey regulations for businesses all while he restrictited the second amendment for us poors.",2022-04-04T13:02:42+00:00,t1_i3cekwi
Neoliberal,comment,climate,jtyutu3,FoulmouthedGiftHorse,,"Diversification of energy resources would also make energy cheaper, more competitive, and less susceptible to a single source of attack or failure.",2023-07-29T17:32:25+00:00,t1_jtxlgu5
Climatechange,comment,warming,k8srkmq,Tpaine63,,Actually the 4.5C number is within the range of the IPCC projections for both the SSP3-7.0 and the SSP5-8.5 projections for 2100 which is well within a century. And the IPCC is known to be conservative.,2023-11-11T16:08:03+00:00,t1_k8pygww
Progressive,comment,climate,h2zx902,CantankerousOrder,,"Nothing.

You can't be a rational person in today's GOP.",2021-06-25T14:16:50+00:00,t3_o7fo64
Politics,comment,warming,kptkefy,23jknm,,"Read *Democracy In Chains*, it talks about this and how their court got compromised, and hey, so is ours now, we are really on that path if enough don't pay attention and vote Dem.  It's important as always for to get court nominees approved, we need the senate and president.",2024-02-10T19:27:54+00:00,t3_1anh8tf
Libertarian,comment,disasters,g958yln,th_brown_bag,,"is ""I know you are but what am I"" the first thing they teach you at induction?",2020-10-17T21:48:30+00:00,t1_g952u10
Climatechange,comment,warming,kbj5jbn,_melancholymind_,,Aren't we already past 1.5°C ?,2023-12-01T10:43:10+00:00,t3_188889n
Politics,comment,disasters,kqr41li,L0000000gie,,Good News today: their little orange Fascist in Chief has to pay yet more money to some people who's lives he ruined.,2024-02-16T22:19:37+00:00,t1_kqprxb7
Geopolitics,comment,environment,k03f9zn,aventus13,,">No, your parallel is ridiculous

Hi there. Please learn how to disagree with someone politely and then I'll be more than happy to have a conversation with you.

[https://englishlive.ef.com/blog/english-in-the-real-world/five-useful-ways-disagree-politely-english/](https://englishlive.ef.com/blog/english-in-the-real-world/five-useful-ways-disagree-politely-english/)

[https://kidshealth.org/en/teens/tips-disagree.html](https://kidshealth.org/en/teens/tips-disagree.html)

There is much more useful information available online that can easily be found with quick googling. Good luck!",2023-09-11T11:07:36+00:00,t1_k03a6mu
Climatechange,comment,wildfires,iq0nld6,leisurechef,,Underground,2022-09-26T20:34:36+00:00,t3_xoiqcs
Neoliberal,comment,emissions,gqlnqet,AutoModerator,,"This submission has been flaired as an effortpost. Please only use this flair for submissions that are original content and contain high-level analysis or arguments. [Click here](https://reddit.com/r/neoliberal/search?sort=new&restrict_sr=on&q=flair%3AEffortpost) to see previous effortposts submitted to this subreddit.

Good effortposts may be added to the subreddit's featured posts. Additionally, users who have submitted effortposts are eligible for custom blue text flairs. Please [contact the moderators](https://reddit.com/message/compose?to=%2Fr%2Fneoliberal) if you believe your post qualifies.

*I am a bot, and this action was performed automatically. Please [contact the moderators of this subreddit](/message/compose/?to=/r/neoliberal) if you have any questions or concerns.*",2021-03-11T18:36:29+00:00,t3_m2xbtr
Politics,comment,climate,k9g4spb,TheTruthTalker800,,"Gregory and company doing that Tex-ass thing, as usual, his forte.",2023-11-16T02:25:36+00:00,t3_17waxjo
PoliticalDiscussion,comment,environmental,i19ng0n,Froggy1789,,People here don’t understand inflation. Go to the FRED site and look at the long trend of consumer price index. The reason we are seeing 7-8% inflation is because it measures same quarter prior year. Well guess what last year we were in a deflationary recessionary period. So of course a reversion to normal or slightly above normal looks like massive inflation. If you average the FED’s 2.2%  yearly target which before this period we never hit we are just about at the target. This inflation is much more perception (as is usually the case then economic fundamentals).,2022-03-19T11:01:03+00:00,t1_i18nylm
Politics,comment,warming,ice17sl,wylee_one,,probably just from exasperated gasps of the left lol,2022-06-14T23:12:07+00:00,t3_vcg5mx
Geopolitics,comment,temperature,e5hurb2,ameya2693,,"Wow. This is an interesting and worrying development. It is important from a geopolitical perspective as events like this increase political unrest and leave greater room for strongmen to take power and wars to take place, especially in fragile political entities in Africa.",2018-09-06T14:21:51+00:00,t3_9dghbm
PoliticalDiscussion,comment,climate change,icwfhta,RockhoundHighlander,,This guy for president!,2022-06-19T02:12:17+00:00,t1_icvdin9
PoliticalDiscussion,comment,environment,gu451kj,BillyisI,,"I think if a woman has full control over abortion it being her body and all, then it should be her responsibility to pay. That being said the man should help pay regardless of a law.",2021-04-11T03:45:19+00:00,t3_mog0uh
Climatechange,comment,IPCC,iit4onc,Environmental_Ad1802,,"Thank you, didn't know that author",2022-08-03T17:40:00+00:00,t1_iimt8hz
Politics,comment,environment,f766e3e,James_t_Martin,,"He should stop trashing the Democratic Party; the party he refuses to join unless he's running for president.   He has been opposed to the party his whole political career.  This was going on way before he ran the first time.

He should have spent the last 4 years as a **registered Democrat** and worked on building relationships with his colleagues and other important people in the party.  Instead he takes shots at, or has his surrogates take shots at popular real Democrats like Barack Obama, Hillary Clinton, or Joe Biden.  Build bridges man.

That whole independent outsider, ""I'm too good for the Democratic Party"" bullshit will not help you win a primary.  He's running against the Democratic Party, and from what I see on reddit, his fans seem to detest the party as much as he does.  He thinks he can mold the party in his image and purify it.  

Fuck that noise; we're a big tent comprised of leftists, progressives, liberals, moderates and a few slightly conservative Democrats.  He expects win a general and hold a majority of both houses with just some progressives and the left.  M4A or GTFO?? Not gonna happen.

Bernie people don't make up the majority of registered Democrats who actually show up to primaries. The Democratic party will not get ""Trumped"" the way the GOP did.  Loyal Democratic voters will pick the person they trust.  We will not be swayed by populism, pie-in-the-sky promises, or a cult-of-personality.

I say this as a person who is on the left end of the spectrum within the party.  Bernie Sanders? No thanks.",2019-11-10T22:09:17+00:00,t1_f75ef8n
Neoliberal,comment,disasters,hvxxs6e,TurdFerguson254,,"This one has a dude dressed like a sheep. Carly fiorina is a nutjob

https://youtu.be/Wo_Ejfc5hW8",2022-02-07T13:32:42+00:00,t3_smi7m6
Climatechange,comment,Antarctic,k0fld7v,JDNM,,"Is Amazon part of those 100 companies?

To be fair, pretty much everyone buys from these companies and keeps them in business because of the society and way of life we’ve collectively built over the past 200+ years.",2023-09-13T17:32:55+00:00,t1_k0fahco
