subreddit,type,keyword,id,author,title,body,created_utc,parent_id
Geopolitics,comment,disasters,ddfdv6x,Roy-Thunder,,"You are almost right. The problem is that usually you won't be able to find the author of the article, as it's a CCP tradition to use alias on People's Daily editorial bylines. 

In general, most of editorials of People's Daily represent the official stance of CCP, and should be taken seriously. Editorials from other sources, especially the Global Times, which has been abused in the western media, should be taken with a grain of salt. ",2017-02-07T02:40:58+00:00,t1_ddeg3wg
Climatechange,comment,warming,kwavvkl,Sea-Louse,,I am much more worried about chemical pollution than I am of a slight average temperature increase.,2024-03-24T05:16:18+00:00,t1_kw9z5vi
Politics,comment,drought,dh73fib,Xenofiler,,You reap what you sow.,2017-05-06T05:09:44+00:00,t3_69is6s
Climatechange,comment,emissions,k5v8u71,Kingzer15,,"Ideally, that land is returned to its native state with a revival of the American BIson. If something like that were to happen, do we know how that natural habitat would contribute to emissions?  I don't expect it to grow back to 30 million, but I'm just interested to see if we track that information with other herd animals.",2023-10-21T18:58:22+00:00,t3_17d2y88
Climatechange,comment,wildfires,k4b7qo3,ftwanarchy,,"Have you heard  of the fire triangle and the fire cycle? Fuel is the main ingredient of a large fire. 100 years of forest fire suppression has led to an unprecedented FUEL build  up due to disrupting the natural fire cycle. More material is more fuel, more fuel is more material to dry out, more odds of ignition. The only cause of forest fires to increase year after year is human caused http://nfdp.ccfm.org/en/data/fires.php",2023-10-10T18:49:18+00:00,t1_k2xhxts
Neoliberal,comment,pollution,imansiq,I_like_the_word_MUFF,,"""At the beginning of his governorship, Romney opposed same-sex marriage and civil unions but advocated tolerance and supported some domestic partnership benefits.[168][200][201] A November 2003 Massachusetts Supreme Judicial Court decision, Goodridge v. Department of Public Health, required the state to recognize same-sex marriages.[202] Romney reluctantly backed a state constitutional amendment in February 2004 that would have banned those marriages but still allowed civil unions, viewing it as the only feasible way to comply with the court's ruling.[202] In May 2004 and per the court decision, he instructed town clerks to begin issuing marriage licenses to same-sex couples. But citing a 1913 law that barred out-of-state residents from getting married in Massachusetts if their union would be illegal in their home state, he said no marriage licenses were to be issued to people not planning to move to Massachusetts.[200][203] In June 2005, Romney abandoned his support for the compromise amendment, stating that it confused voters who opposed both same-sex marriage and civil unions.[200] Instead, he endorsed a ballot initiative led by the Coalition for Marriage and Family (an alliance of socially conservative organizations) that would have banned same-sex marriage and made no provisions for civil unions.[200] In 2004 and 2006, he urged the U.S. Senate to vote for the Federal Marriage Amendment.[204][205]""

It's complicated with Mittens, but in no way is he ever or was ever socially conservative.",2022-08-29T19:40:51+00:00,t1_imanaul
Geopolitics,comment,disasters,fwzykpv,shanshani,,"China wasn't even a losing party, it was on the winning side of WWI. I agree though that to the extent China was the US's to ""lose,"" the loss happened way before 1949, and the failure to return Shandong to China was probably the most significant single event.",2020-07-05T14:01:44+00:00,t1_fwz5ws1
Libertarian,comment,climate,h8ptcj9,Inferno_Crazy,,"Nuclear technologies are already good enough to handle most of our power generation needs. It's because of regulation that it is so expensive to implement. Most importantly it's the cleanest non renewable power source by a long shot. A carbon tax is just another dumbass instrument to price out fossil fuels when there is currently no other alternative (really there isn't). 

 The ""So what?"" Is taxes are actively creating inefficiencies in the underlying market. Green energy is a made up problem.",2021-08-12T23:17:09+00:00,t1_h8pnn53
Neoliberal,comment,emissions,hc8h7k2,DorisKearnsWoodwind,,"I said ""many"" not ""all."" Obviously, if you need to haul a lot of groceries or the conditions are too hazardous, take a car. But it seems disingenuous to act like there is no situation where the average American could replace some car trips with a more sustainable alternative.",2021-09-09T21:58:58+00:00,t1_hc8dij3
Climatechange,comment,warming,kh2o4kd,PintLasher,,"Growing zones have also been updated.... Shocker of shockers, they're gonna have to be updated again very very soon. And then again. And then again. And then again. And then nobody will be keeping track of stupid shit like that.",2024-01-09T16:58:21+00:00,t3_192j7e2
Libertarian,comment,environment,g4a5140,Anuspimples,,The political compass is the dumbest thing since trying to fit real people into DnD alignment charts,2020-09-06T23:47:28+00:00,t1_g49jdus
Conservative,comment,emissions,gxbkowu,Jew_Brooooo,,Don't you know? It's just a cultural norm and we need to respect that /s,2021-05-07T21:35:17+00:00,t3_n73cqi
Neoliberal,comment,environment,kaduuj8,gnomesvh,,"Tilburg and Den Haag crazy though

I guess Schilderswijk?",2023-11-23T02:00:38+00:00,t1_kadu0pj
Climatechange,comment,emissions,k4uxuqi,Successful-Street380,,"Here in Canada, they have developed smaller Nuclear Reactors. But as any catastrophe if it goes it goes!",2023-10-14T16:14:44+00:00,t3_177eiqv
Politics,comment,climate,l48p5ob,disasterbot,,DeSinkus,2024-05-16T00:55:13+00:00,t3_1csu2ey
Politics,comment,drought,jkxvl03,Aeterial,,What outcome is he even hoping for with this investigation?,2023-05-20T19:34:30+00:00,t3_13n3xx1
Conservative,comment,emissions,fld9wc8,None,,Thank you my brother.,2020-03-24T14:27:12+00:00,t1_fld9mu1
Climatechange,comment,climate change,l3eplud,sundancer2788,,Same in NJ.,2024-05-10T09:34:00+00:00,t1_l3d679t
Politics,comment,disasters,jwbizi5,Warhawk137,,"Well, to get in a fight in New York City, first someone would have to acknowledge your presence, and that's fairly unlikely.",2023-08-15T18:28:59+00:00,t1_jwbij74
Politics,comment,warming,h2xoh1o,Helicase21,,"Not so much actually. When political scientists check into what staffers believe about their constituents those staffers are consistently wrong, wrong in one direction (assume constituencies are more conservative than they are actually) and moreover contact from constituents does basically nothing to correct those errors (as opposed to contact from businesses which can actually shift opinion)",2021-06-24T23:20:00+00:00,t1_h2xnn61
Politics,comment,temperature,e0jp55k,EmpNSFW,,just voted in VA\-10. hopefully we can get this scumbag Comstock outta here come november,2018-06-12T15:38:21+00:00,t3_8qjm43
Conservative,comment,climate,kywxxj9,LivingTheApocalypse,,"I care. EVs are a bullshit answer. The problem is the people pretending to care are focused on making extreme profits in companies they push funding towards to create short bursts of high growth. 


Imagine pushing that money to something that would change greenhouse emissions instead of stock portfolios. ",2024-04-10T12:53:46+00:00,t1_kyws8dz
Climatechange,comment,warming,l2fy0q7,TheIdealHominidae,,"Great comment, this is indeed the most reasonable thing one could say freebytes.

However you have to understand something that nobody understand, that is, there exist a scenario where the main driver of global warming isn't CO2.

If this unidentified agent X is natural and non human controlled we might be f\*cked. However statistically and via paleo data, it most likely is by far that either this is natural climate variability and it will therefore to match paleo data stop/plateau very soon (unlikely) or most likely that this agent X is indeed anthropogenic (human driven).

Climatologists hyperfocus on the greenhouse effect but there are other ways mankind can alter the climate.

By emitting a molecule that makes either:

1. clouds dimmer (less albedo)
2. clouds less stable (half life)
3. clouds less prone to form (accretion)
4. that alter the population of certain types of clouds (some having a net warming effect)
5. One of the most important one: by catalysing or blocking the process of cloud seeding/nucleation AKA the physical process that is necessary for rain. Clouds cannot rain naturally without an anisotropy that is provided by a forein molecule (e.g. a pollutant) in fact we can make cloud rain on demand via e.g. iodine or solid co2.
6. previous ones either altered cloud albedo efficiency or cloud surface or ability to rain,

then there are mechanisms that can alter the ability of water to evaporate.

For example alteration in salinity, but most importantly effects of molecules on plants biology,

fNitrous oxide emissions, water vapor increase, temperature and co2 all independently and synergetically catalyze plant growth.

The effects of a CO2 doubling (end of century) on plants is insane, it increase mitochondria number by 2.8 times, reduce respiration rate by 15% (this effect considerably yet partially capture future emissions (IIRC something like one third), accelerate plant growth by 40% (end world hunger), reduce water need by 50% and reduce plant transpiration rate of water by \~40% (IIRC).

The thing is, this is extremely huge, tropical forests, like the amazonia have 50% of their surrounding atmospheric water vapor that comes from plant evapotranspiration and that is concomitantly one of the most moist zone on earth. Therefore, plant evapotranspiration is a major driver of atmospheric humidity level.

Arguably it logically follows the extremely suprising result but empirically based, that CO2 increase would lead to a drier atmopshere and since water vapor is the biggest greenhouse gas (hence why the sahara is extremely cold at night), it follows that a co2 increase should cool the earth, and much more potently so than its mild greenhouse gas effect.

Strinkingly this is not (yet?) observed, water vapor is increasing (albeit is lowering in amazonia) and temperature too.

One extremely understudied explanation for this basic paradox is the fact that plants have specific symbiotic bacteria on their leaves.

Water vapor level is regulated by the ratio between evaporation rate and nucleation rate (raining) (and temperature), it could be argued hypothetically that those symbiotic bacteria secrete (along with evaporation) molecules that catalyze cloud seeding (something quite easy to do) which would allow bacteria, plants and mammals to thrive by promoting rain.

It could be that the empirically observed major reduction in plant evapotransporation, would also reduce emission of those cloud seeding molecules, if so then the effect could backfire by reducing raining rate and therefore overcompensate for the loss of water vapor, which would lead to an actual increase in water vapor consistent with observation. Those cloud seeding molecules could also independently of raining, alter cloud formation, albedo, etc albeit less likely.

The effect of CO2 of plant evapotranspiration cannot be just ignored, a 40% reduction is insanely huge and is clearly more impactful than the intrinsinc greenhouse effect of CO2, sadly very few climatologists study biology.

Regardless of point 6), there are countless pollutants (including but not only aerosols) that can potently alter point 1 to 5)

So yes as you said, CO2 is likely to have a role (albeit probably for the biological reason) but regardless it is urgent and essential that we understand how we impact anthropogenically points 1 to 6).",2024-05-03T19:29:38+00:00,t1_l2frnnl
Politics,comment,disasters,k8di11p,TanguayX,,"Gonna have to step up those election subversion, you guys. This open and fair elections is just not working for tou.",2023-11-08T16:28:53+00:00,t3_17qnz2h
Politics,comment,environmental,h1jplzi,AutoModerator,,"
As a reminder, this subreddit [is for civil discussion.](/r/politics/wiki/index#wiki_be_civil)

In general, be courteous to others. Debate/discuss/argue the merits of ideas, don't attack people. Personal insults, shill or troll accusations, hate speech, **any** advocating or wishing death/physical harm, and other rule violations can result in a permanent ban. 

If you see comments in violation of our rules, please report them.

 For those who have questions regarding any media outlets being posted on this subreddit, please click [here](https://www.reddit.com/r/politics/wiki/approveddomainslist) to review our details as to our approved domains list and outlet criteria.

***


*I am a bot, and this action was performed automatically. Please [contact the moderators of this subreddit](/message/compose/?to=/r/politics) if you have any questions or concerns.*",2021-06-12T19:43:21+00:00,t3_nyeoww
Politics,comment,warming,fvg0tv5,Synergy_404,,Is this more of these so called “Good Police” i have been hearing about.,2020-06-20T14:56:36+00:00,t3_hc6m3i
Climatechange,comment,CO2,j5bwrsn,mcbowler78,,"Yes there is.  It's easier to grow plants in more harsh conditions with less water with more c02 vs less.  Plants grow in a greenhouse and that is why they pump co2 in a greenhouse.  Everywhere has had extensive greening in the last 40 years.  North America, Europe, China.  It's so obvious you can see it in pictures from space.  You know what we had less of when co2 was multiples higher than it is now?   ICE AGES.  I don't know if low co2 contributes to shorter ice ages, but glacial periods are a bigger threat than the tropical climate we are trending to.  Free the co2 molecules.  They have been trapped long enough.",2023-01-21T21:55:39+00:00,t1_j5akmty
Politics,comment,temperature,cg59x90,BizarroDiggtard,,Think of the children... hurt the poor... racism....zzzzzzzz!,2014-03-18T01:52:55+00:00,t3_20mgg0
Politics,comment,environment,hy9qmbe,None,,[removed],2022-02-24T18:04:18+00:00,t3_t0fxk3
Neoliberal,comment,climate change,imsrtb0,spidersinterweb,,Nuclear pls,2022-09-02T14:12:21+00:00,t3_x4236r
Libertarian,comment,disasters,ipqo3ud,ACOrange,,"I'm only surprised there haven't been a ton more articles from the media about this ... oh wait, what was I thinking, it is after all California.",2022-09-24T17:39:08+00:00,t3_xmwry0
Libertarian,comment,warming,e28bl3x,ESPN_outsider,,No it can't you moron.  If you don't believe in capitalism then get out of our sub.,2018-07-12T01:56:05+00:00,t1_e28288o
Climatechange,comment,climate change,kumd86i,evolvedpotato,,Weather extremes that occur frequently and in different ends of the spectrum does not equate to better habitability lmao,2024-03-13T02:36:08+00:00,t1_kuifbna
Politics,comment,environment,iu8312q,ChessIsForNerds,,It's unhelpful to criticise those who have changed their mind away from a really dumb position.,2022-10-29T07:58:29+00:00,t1_iu7quga
PoliticalDiscussion,comment,climate change,h8de5k5,cryptolipto,,Are you sure? I thought the original provision was worse than any amendment (both of which did not pass),2021-08-10T03:56:31+00:00,t1_h8d6du5
Climatechange,comment,temperature,kpn1tc4,NyriasNeo,,"So is anyone still gullible enough to talk about the ""1.5C target"" anymore? Time to move the goal post to 2C, which I bet we will hit pretty soon. Heck, we already blew through 2C, abate briefly.",2024-02-09T14:40:51+00:00,t3_1aml6ga
GreenParty,post,climate,ooscmx,howie2020,"As Extreme Weather Rages Globally, Climate Groups Demand Biden and Congressional Democrats Fund a Robust, Ecosocialist Green New Deal",,2021-07-21T15:35:28+00:00,
Neoliberal,comment,warming,kzl9e5r,DEEP_STATE_NATE,,Laaaame,2024-04-14T21:24:03+00:00,t1_kzl4qkm
Climatechange,comment,ecosystems,gw978hj,cintymcgunty,,">droughts globally are actually decreasing 

Source?

>appears to just be repeating previous cycles 

What cycle? What natural processes have driven previous cycles? Can you explain what natural processes are driving this ""cycle""?

>All simple logical reasons rather than blaming it on a 0.7C increase in temperature 

With no evidence to suggest any of those reasons are the cause.

>Also doesn't make sense to blame it on a global warming when the droughts are not global and specifically aren't globally increasing and may have even decreased. 

You stated earlier that droughts have definitely decreased. Now it's a ""may""? Again, no sources.

>It seems more logical to say it's a natural cycle

Handwaving at cycles isn't science and doesn't give you any credibility. Claiming it's ""logical"" without providing evidence doesn't meet the standard of logic.

>crop yields world wide are at records year on year 

Farming techniques continually improve. CO2 fertilisation plays a part. 

>This year specifically I think we will see a dip in crop yeilds \[sic\]

Or for any number of reasons.

>harsh cold winters that have hit early and are breaking records day by day 

Source? Silly for asking, when it's so easy to find it. Oops. It appears this winter has been the eighth warmest on record: [https://www.climate.gov/news-features/featured-images/february-2021-wraps-northern-hemispheres-eighth-warmest-winter-record](https://www.climate.gov/news-features/featured-images/february-2021-wraps-northern-hemispheres-eighth-warmest-winter-record)

>Not overly unexpected in a naturally changing climate 

Again, what's forcing the climate to change? Or are you just making stuff up. Again.

>But a bit unexpected when CO2 levels are so high and temps should be rocketing. 

Strawman arguments are your bread and butter aren't they? :) No science states that temperatures should be ""rocketing"". Again, you misrepresent the science.",2021-04-29T03:18:59+00:00,t1_gw7ler1
Politics,comment,temperature,dee0w11,indeedItIsI,,"But global warming definetly exists because a record high temp was recorded?

To be clear I do believe in global warming I just don't think a record high temp is proof. ",2017-03-01T22:59:00+00:00,t1_dedy2c4
Conservative,comment,emissions,gvjin6e,Nasty2017,,Did you read about how he would do it? I'm guessing you didn't. Go ahead and read about how mush mouth plans to do it.,2021-04-23T07:17:42+00:00,t1_gvji0qb
Conservatives,comment,warming,f3zi9se,IBiteYou,,"https://taxfoundation.org/taxes-on-the-rich-1950s-not-high/

https://www.aei.org/economics/returning-to-the-90-top-tax-rates-of-the-1950s-would-probably-be-terrible-for-the-us-economy/",2019-10-16T23:47:55+00:00,t1_f3zh58a
PoliticalDiscussion,comment,CO2,c8x0ry9,jellicle,,Alarmism is excessive or exaggerated alarm.  The alarm being raised about global warming is much less in scale than the situation warrants.,2013-03-17T01:46:15+00:00,t1_c8wdu98
Neoliberal,comment,climate,jinl8qy,stormdelta,,"> Mate it seems like youve looked at bitcoin maxis and extrapolated it across the entire industry. 

I guarantee I'm not just looking at bitcoin maxis.

> Ethereum is famously both european slanted but also left slanted. Especially socially, but also, somewhat, economically. 

I can't tell if you're trolling at this point or if you somehow genuinely believe this.

Ethereum was created through the funding of Peter Thiel - hardly someone I'd call ""left wing"", and their consensus protocol is _explicitly_ plutocratic. The main technical leader behind its development has a very clear libertarian slant.

The big premise of the ""smart contract"" functionality it was one of the first to implement was the idea of monetizing nearly everything - again, hardly a left-wing ideal. Extreme versions of libertarianism pervade the entire ecosystem, to the point it practically has it's own slogan: ""code is law"".

I really don't know how much more blatant it can be.",2023-05-03T03:43:13+00:00,t1_jinjweg
Politics,comment,wildfires,g4tg9nk,cheddarsalad,,"The west coast was hit by a freak, once a century wind storm on labor day that went on late into Tuesday. This knocked down power lines and accelerated pre existing fires. People want big “aha!” Reasons behind big events but sometimes shit is just dumb luck.",2020-09-11T12:35:35+00:00,t3_iqic6n
Climatechange,comment,glaciers,kr31l4u,Honest_Cynic,,Google is a good link.  Mann sort of apologized later.,2024-02-19T02:51:59+00:00,t1_kr1qadw
Republican,comment,climate,kg58efw,AutoModerator,,"/r/Republican is a partisan subreddit.  This is a place for Republicans to discuss issues with other Republicans.
To those visiting this thread, we ask that unless you identify as Republican that you refrain from commenting and [leave the vote button alone](https://www.reddit.com/r/MetaRepublican/comments/5t017a/this_sub_is_for_republicans_if_you_do_not/). Non republicans who come to our sub looking for a 'different perspective' [subvert that very perspective with their own views when they vote or comment.](http://i.imgur.com/XqL0wfR.jpg)

*I am a bot, and this action was performed automatically. Please [contact the moderators of this subreddit](/message/compose/?to=/r/Republican) if you have any questions or concerns.*",2024-01-03T16:37:59+00:00,t3_18xnm2e
Politics,comment,disasters,ho9whto,moss_nyc,,“How dare the partisan media bring up the things I said publicly  and the ways I voted over the years and declare me a hypocrite when that issue now effects me. ” Sen. Rand Paul ~probably,2021-12-12T18:13:57+00:00,t3_rehdj5
PoliticalDiscussion,comment,climate change,h8suuya,Graymatter_Repairman,,They've been encouraging delusional layman climate science denying for decades and counting too.,2021-08-13T16:42:52+00:00,t1_h8sumti
PoliticalDiscussion,comment,warming,cfjhwvp,RenlyIsTheFury,,"Also, to reply specifically to the drones thing, because that's the most factually incorrect argument you had and I can't not reply to it:

Drones are really very expensive, as are the missiles they fire (no, I don't have exact prices on me, look them up yourself, my internet is too shitty to bother right now). As for the ""civilian deaths"" thing... ALL of the drone deaths are civilian deaths. ""Insurgents"" or not, they were civilians. Not in uniform, usually unarmed citizens of a foreign, sovereign nation, going about their lives. Also, even if you're not considering insurgents civilians, there are still PLENTY of innocent lives lost as a result of mis-information, splash damage, missing the target, etc. Women, children, the elderly, etc. are dying because we choose to use drones to rain missiles down on people in countries that we shouldn't even be in, by any rights.

And innocent death, in warfare or otherwise, is too many innocent deaths.",2014-02-19T20:32:59+00:00,t1_cfj4jdd
Climatechange,comment,ecosystems,h7agzp5,NoOcelot,,"No, the microbes won't be primarily involved with the basalt.  It's a chemical reaction the rock has with air. So this is a good upside compared to what the Salk project is trying to do.",2021-08-01T07:29:31+00:00,t1_h78swnt
Politics,comment,ecosystems,ewknwwl,XoXSmotpokerXoX,,"I dont give a fuck what you believe, I am just stating facts. Tell you what, you find me one single guide on the Kenai that thinks fishing is better now than it was 20 years ago, you cant. Now find me a guide that wants more restrictions on fishing pressure on the river. I dont have to assume anything, they all complain about dwindling returns, and continue to put pressure on the river. They care about paying their bills, if they actually cared about the fish in the river they would be looking for another business.

I know people that homesteaded in that area, third generation, the writing is on the wall. And the rest of the state is not much different. I know people that do fishing and wildlife viewing where the pebble mine will be as well, they know it will kill off the area, but they also know they will get rich during the process and welcome it.",2019-08-11T02:12:26+00:00,t1_ewkm03x
Politics,comment,disasters,i4ufad0,JohnDunstable,,"I think the headline could read that "" Trump is an authoritarian toxic candidate that could spoil close elections for republicans who have no idea but to inflict pain on women and other helpless people to make up for republicans' sad lack of self-esteem""",2022-04-15T15:52:22+00:00,t1_i4u9jez
PoliticalDiscussion,comment,emissions,db4g17d,Hillary__Bro,,I think a better word than 'expensive' is 'impossible'.  Its like taking a piss in Lake Superior and then a week later filtering out the uric acid out of the entire lake.  At a concentration of 400 parts per million CO2 you'd have to process 2500 tons of air to remove one ton of CO2 or about 31000 cubic feet of air to remove one ton of CO2.  Multiply that by 10^12 and then you will be processing enough air to return CO2 levels to pre-industrial times.,2016-12-13T01:32:48+00:00,t1_db46u0h
Politics,comment,climate change,jjw0e70,jphamlore,,"Like I said below, I live in what is supposedly one of the most ""progressive"" areas, only it has utterly rejected what the Asian part of the Pacific Rim has embraced:  When apartment buildings are built here, they are at most maybe 5 stories, whereas in Asia they would be 40 stories.  The density simply will never be there.",2023-05-12T16:08:53+00:00,t1_jjvzukm
Climatechange,comment,pollution,kjeeyrl,akshullyyourewrong,,"I wasn't able to relax all summer, because you know, my whole fucking country was on fire and we couldn't go outside.",2024-01-24T20:42:21+00:00,t1_kjdz4x7
Politics,comment,NOAA,ezva82o,Vladius28,,Lol no. It definitely wasnt. The writing was too good,2019-09-11T03:10:34+00:00,t1_ezv4e33
