subreddit,type,keyword,id,author,title,body,created_utc,parent_id
Politics,comment,environment,fem3qkt,JaxxonJaymes,,Dumbfellas,2020-01-17T05:25:50+00:00,t1_fem2o0i
Neoliberal,comment,pollution,jg1p3w3,MinderBinderCapital,,Yeah a 25% weight difference is huge.,2023-04-13T02:54:07+00:00,t1_jfzzzdo
PoliticalDiscussion,comment,climate,g2ytn9a,Randaethyr,,They aren't the sole group o Never Trumpers. Literally Colin Powell was invited to speak at the DNC.,2020-08-26T23:42:15+00:00,t1_g2ys87b
Neoliberal,comment,climate change,i88chan,BlueBeachCastle,,It's a Democracy when one jackass can prevent action that the majority of the country wants done because he personally has a coal fetish.,2022-05-11T20:33:33+00:00,t1_i889i2p
Politics,post,drought,pbp5to,nbcnews,"Western lawmakers call on Biden, FEMA to declare drought disaster",,2021-08-26T01:22:08+00:00,
Politics,comment,wildfires,ffeobv3,Riversmooth,,Imagine that,2020-01-24T09:12:42+00:00,t3_et7rn0
Politics,comment,emissions,iwgbii2,Pimpwerx,,"JFC, what an idiot.",2022-11-15T12:54:20+00:00,t3_yvjxoq
USpolitics,comment,disasters,hog2hdz,gaberax,,Would SOME reporter/Congress member please remind Rand Paul of his voting record on aid to other states to his BITCHASS face?,2021-12-13T23:59:50+00:00,t3_rfmg0j
Politics,comment,disasters,jm6g7sj,tungtingshrimp,,Unexpected Dumb and Dumber reference,2023-05-30T08:43:56+00:00,t1_jm5emzm
Politics,comment,wildfires,f6edb4u,wrongmoviequotes,,"Welp, time for California to hold on to their 456.5 Billion dollars in federal contribution then.",2019-11-03T17:39:22+00:00,t3_dr1012
Libertarian,comment,climate,h8ws2ni,Maldorant,,Solar production byproduct is also massively toxic to the environment,2021-08-14T13:50:17+00:00,t1_h8wmj8i
Politics,comment,environment,gifjdfk,ParadiseRegaind,,"Both my wife and I were born into Republican families. We were both raised on conservative values. We voted for Trump in 2016. We’ve watched Fox News most of our lives, as our parents and grandparents still do.

This morning, we submit paperwork to change our political affiliation to the Democratic Party. We have two young children and we can never vote Republican again (or listen to the bs spewed by Fox News) again. We want to protect their future, and the Republican Party is not the way. We’re so sorry for our role in enabling the last four years.",2021-01-07T15:13:56+00:00,t3_ks9iz4
Climatechange,comment,wildfires,jw8mq2y,Honest_Cynic,,"Is that bad, given there are no scientific studies to support such a claim.  More likely due to dry invasive weeds and high winds.  Ditto for CA forest fires, which have been fairly minor the last 2 years.  The Caldor Fire was unique in that high winds blew directly up the S. Fork American River Canyon which is a wooded area between granite slopes which have kept all other fires from crossing the Sierra Nevada peaks to reach the Lake Tahoe basin.",2023-08-15T03:46:39+00:00,t3_15qzgrq
Conservative,comment,environment,i24da48,HighCaliberMitch,,Quite the dichotomy you've constructed there.,2022-03-25T22:01:07+00:00,t1_i232eop
Politics,comment,disasters,kqq1rei,randomcanyon,,"Blames both Democrats and repub extremist for hijacking his virtue signal for their own use. 

Turds gonna turd.",2024-02-16T18:39:42+00:00,t3_1asbzid
Conservative,comment,ecosystems,jniqwp5,Panzershrekt,,"Democratic country?

He's locked up members of the opposition party..",2023-06-09T12:15:41+00:00,t1_jnil6j6
Libertarian,comment,temperature,fnvfb92,adjusticemoon,,"I'm definitely interested in nuclear options, but have some concerns about general safety, setup time and cost, and long-term nuclear waste storage.",2020-04-19T10:12:34+00:00,t1_fnvam0e
Neoliberal,comment,emissions,gje4nb5,kaclk,,"I mean the thing is that not all regulation is bad. 

Occupational health and safety regulations exist and do slow down things. But they also make sure people don’t die because now we require people to do safety hazard assessments and tie off while working at heights and put on proper PPE while working. That means you have to hire a safety person and buy equipment and prepare plans and SOPs and do safety orientation training, but it absolutely reduces workplace injuries and deaths.

Environmental regulations are another kind because it helps account for *externalities*. It also helps with problems of companies dumping environmental problems on taxpayers while taking all the profits (it’s a real problem with oil and gas wells here as companies go bankrupt before cleaning up old wells), something which most people would find an unfair trade off.

Not everything is about “most efficient”. We should aim for efficiency, but sometimes other considerations come first.",2021-01-15T22:26:20+00:00,t1_gje3txn
PoliticalDiscussion,comment,climate change,hsnhark,TheMikeyMac13,,"The voting rights bill is an attempted to extend the old voting rights bill and nationalize voting choices, there is nothing conservative about that.

And you are using a BS number for the support West Virginians have for BBB. They like the child tax credit checks, which were tied to BBB to try and force it through with all the other garbage.",2022-01-14T17:20:09+00:00,t1_hsneqzm
Libertarian,comment,pollution,fr0urgr,IPredictAReddit,,"Nothing says ""libertarian"" more than making rights up out of thin air.

I'll put your ""unconditional right to access public land at any time under any circumstances"" next to Bernie's ""right to healthcare"". Making up rights is fun!",2020-05-18T13:07:07+00:00,t1_fr0t5z6
Politics,comment,disasters,l5uqliz,Managed-Democracy,,"No. He craves praise. It's why the white house had to fill his press briefs with articles flattering him or he'd lose attention and quote ""wander away from cabinet meetings""  ",2024-05-27T07:19:46+00:00,t1_l5uakd6
Climatechange,comment,climate change,kx5d751,fiaanaut,,"You make a very good point about HSR: time is money, and longer trips aren't going to be supported by folks who need to get wherever yesterday. I would be very interested to see a breakdown of cost/sustainability effectiveness of developing an HSR network from an existing rail grid (like in Europe or India) or situations like the US where the railways are so poorly maintained we'd almost need to start from scratch. I'll keep looking, but if you find anything, I'd love to see it.

I would also be interested to see that breakdown directly compared with anticipated development time in comparison to ""greener"" aviation power.",2024-03-29T18:56:24+00:00,t1_kx4iyb0
Geopolitics,comment,pollution,ddhlmhs,lovebus,,"Regardless of motive, having ""large population centers that aren't underwater"" will probably pay dividends geopolitically, compared to countries that aren't investing",2017-02-08T15:18:56+00:00,t1_ddhgyp1
Liberal,comment,disasters,cwjzd77,GoddessWins,,"I am certain that we will differ on what you define as a fact and that does not give you license to demand that any other person do so. It is actually bullying to make that demand, unless the person making the claim is attempting to seek your agreement for financial or other purposes. 

Example:  I tell you President Obama is a good man and a fine President.  
You demand evidence:  I can say, hey that is my opinion, at that point the only correct response from you to to note that you disagree.  You can but I suspect  you don't as you didn't here, support your own claim with evidence or admit it is only your own differing opinion.  

And what is wrong with disagreeing,  that is the only place there is any real fun in any discussion. 


*than/that
",2015-11-01T00:46:17+00:00,t1_cwjz8pr
PoliticalDiscussion,comment,disasters,cqb2d9m,Revolution1992,,"No it isn't.  The third parties are weaker now than they've been for a long time.  Ross Perot and Ralph Nader, both, got way more of the vote than any of the third parties have received in over a decade.  ",2015-04-13T18:24:44+00:00,t1_cqaxjob
PoliticalDiscussion,comment,disasters,gplnudx,Apprentice57,,52% voted Leave in the referendum. It was 48% that wanted to remain. Just FYI.,2021-03-04T01:10:16+00:00,t1_gpkohyf
Climatechange,comment,CO2,j64x1gc,Toheal,,"Ok, so this would put it on them to come up with an alternative explanation for the specific warming phenomena  considering that provided context?",2023-01-27T19:05:10+00:00,t1_j64tj0c
Politics,comment,disasters,iwejdhj,Isosceles_Kramer79,,"College graduates making up to $125k/a are hardly the ""poors""",2022-11-15T01:24:50+00:00,t1_iwdwkap
Libertarian,comment,climate,hqwlh3b,Pepestone,,Javier Milei it’s the onlyone who doesn’t theft. In argentina we doesn’t have capitalist politicians. Only comunism. The Javier milei’s position it’s supported by data.,2022-01-02T06:10:08+00:00,t3_r4ocb2
Conservative,comment,drought,ikfh1yk,fordr015,,They also tore up the grass etc.,2022-08-15T20:30:03+00:00,t1_ikedp4t
Liberal,comment,disasters,e0aht9z,tsdguy,,"Which states? 

Reallly. Most people use their 50 round mag AR for deer hunting? 

People hunt because they like killing things. ",2018-06-07T21:16:56+00:00,t1_e09s6i8
Politics,post,environment,ssgi52,aslan_is_on_the_move,US files 1st USMCA environment case on Mexico over porpoise,,2022-02-14T17:44:44+00:00,
Climatechange,comment,warming,kr9admc,The360MlgNoscoper,,"It’s an intentional understatement. Hence the large amount of ""very""’s.",2024-02-20T06:17:21+00:00,t1_kr99jte
Politics,comment,CO2,dyilgux,WatchingDonFail,,"> (China/India/etc), it remains far cheaper to use fossil fuels than clean energy sources.

That depends on who computes the costs. However, China is moving to renewables much faster than we are. Look at some of the articles in this google search

https://www.google.com/search?q=China+going+to+renewable+energy+faster+than+the+US&ie=utf-8&oe=utf-8&client=firefox-b-1

> Right now in Massachusetts it would cost me three times the amount for electricity to switch to clean energy. 



And who made this chdecision about cost?",2018-05-06T01:21:30+00:00,t1_dyig87o
Politics,comment,temperature,cj3b63z,hankandpearl,,Seriously?  That's your comeback after watching this idiot stammer and stutter through two and a half minutes of pure nonsense?  Have a source with him explaining that he was just yucking it up during official house business?  Because it didn't look like anyone else in the room thought he was joking.  Or is that just wishful thinking on your part?,2014-07-21T10:50:59+00:00,t1_cj373bn
PoliticalDiscussion,comment,warming,d77jiot,wrc-wolf,,"At this point this isn't even a question, it *will* happen, the question is only when. We're far past the point of being able to do anything to prevent catastrophic climate change.",2016-09-03T01:48:24+00:00,t1_d76ytnl
Politics,comment,climate,jxliq2w,Blah_McBlah_,,"I believe that the Mets will win the world series. I believe that I'll win this hand of poker. I know that humans have adversely effected the global climate, from ozone deletion, and chemical dumps, to CO2 and greenhouse gas releases.",2023-08-24T19:49:19+00:00,t3_15ztrgk
Libertarian,comment,climate,hl16mc7,cicamore,,"This seems like a very weird thing to get angry about. Should we literally do nothing to help climate change or just pray to the spaghetti monster that it will be ok?

Every item in my bag that is not the food I ordered goes directly to landfill. Tell me how this is a bad thing to reduce waste? Is it because you have to ask for it now? Is this the woke things you keep yelling about?",2021-11-17T20:31:30+00:00,t3_qw5rva
Neoliberal,comment,pollution,ima093b,Paullesq,,"I think neither of us are actually completely correct with this. My description of EPA tier emissions does contain a number of errors. Tier 1 was superseded by tier 2 and so on. Things become complicated because these tiers do not supersede each other at the same time for all applications.  EPA Tier 3 for instance still does actually covers road cars and light trucks. Tier 4F covers non road mobile machinery. The US is not good at writing laws that are both effective AND simple.  


I will admit that it has been 10 years since I worked for a company that built diesels in the US and we did not do on-road diesels. I think since then, European regulations have closed the gap, but there are still significant numbers of older diesels running around.   


While Europe does have a higher population density, it is actually slightly less urbanised that the US.  I think the most important factor is what percentage of the population live in a city where the air pollution tends to be. I do think that US emissions laws really help. And I think what would demonstrate this most is if we were able to see this graph evolve year on year. I think the EU will catch up in a few years older diesels get scrapped.  


https://www.statista.com/statistics/270860/urbanization-by-continent/",2022-08-29T17:02:09+00:00,t1_im9rlxy
Geopolitics,comment,environment,es7ezzu,YangWen-li800,,Iron law of wages on display,2019-06-27T21:05:13+00:00,t1_es63ade
Climatechange,comment,anthropogenic,ffelz5v,kikokukake,,"I have a rough Idea, why do you ask?",2020-01-24T08:16:01+00:00,t1_ffeluak
Climatechange,comment,climate change,l3j7u6t,blssdnhighlyfavored,,"I have a 9yo and he’s moderately aware of things going on. He’s aware of some of the harm humans have caused and how things we’re still doing to harm the planet. I have alluded to bigger impacts but all he concretely knows is stuff like wildfires happening a lot (we live in the west coast of the US) and other local effects, like the effects of dams on salmon populations and stuff. 

But, the way that I’ve balanced this, aside from not telling him the really big picture, is making sure to balance it all with hope. Kids need to know that it’s not a lost cause and they need to feel like they have some control. Giving kids concrete ways to take action will help protect them from being traumatized from this info. 

It’s definitely a difficult balancing act, but just start with their own personal experiences (like when they ask “why do we have so many wildfires?”) and give them hope. I got this book called “Good News Planet Earth!” that talks about a bunch of cool stuff people are doing around the world to help with climate change and that really helps ease his anxiety.",2024-05-11T04:24:09+00:00,t3_1coz95c
Politics,comment,disasters,jpb6sos,RuggedQuod,,This guy is still around?,2023-06-24T04:00:16+00:00,t3_14h7n16
Libertarian,comment,environmental,ftht383,much_wiser_now,,"Politics is about solving problems. Congratulations, if your ideology doesn't offer anything to help someone with the largest problems they face, they'll seek elsewhere. That you object to where they go isn't really material.

Why isn't this considered to be a market based solution?",2020-06-09T17:11:33+00:00,t3_gzqfy1
Politics,comment,environmental,hvzblr8,None,,"Then what the fuck exactly do you want people to do? There's no solution. You cannot work with Republicans if they don't want to work with you. So you're effectively complaining because you want us to waste time trying to get Republicans to do something we know they never will. Just vote in more Dems? Oh yeah, REAL FUCKING EASY when every time in the past several months mentioning the midterms had been met with ""the party that just won the election always loses the midterms"". In addition to that, the apathy the general public is going to have for voting when Biden's failed to deliver on almost every significant campaign promise he made.",2022-02-07T19:13:56+00:00,t1_hvyy53j
Conservative,comment,disasters,iomkri3,woopdedoodah,,"Public education was designed to combat Catholic education.

Catholic education has a thousand year long history of teaching the true good and beautiful 

Public education does not.",2022-09-16T04:39:12+00:00,t3_xf6e2z
Libertarian,comment,climate,kqsi316,DrunkShimodaPicard,,"The fact that you think there are ulterior motives of politicians trying to mitigate climate change has no bearing on the evidence that climate change is real, whether those ulterior motives exist, or not.",2024-02-17T04:03:34+00:00,t1_kqs9m2s
Republican,comment,environment,eyhszej,spmahn,,"I’m pretty concerned about the environment, but the way I’ve always looked at it is that the human race is quite resilient and innovative, so we’ll survive the effects of climate change one way or another. There will be a free market solution to the problem and I’m sure some people will become very rich finding it.",2019-08-29T15:24:27+00:00,t3_cx00gh
Politics,comment,environmental,gucglug,GileadGuns,,"God, some people just suck.",2021-04-13T06:52:16+00:00,t1_guasx4o
Liberal,comment,disasters,i629h6l,Walk1000Miles,,Yes. We watch and read about the news. You would be surprised how many people do not.,2022-04-24T23:24:37+00:00,t1_i60v48y
Politics,comment,disasters,igayrv7,ivejustabouthadit,,He'll be dead soon because he's old. It's not his anymore. It's yours.,2022-07-15T19:42:18+00:00,t1_igav1e4
Climatechange,comment,warming,koirl54,49thDipper,,This is the way. We have to enjoy our finite time here. That’s our purpose.,2024-02-02T00:56:03+00:00,t1_kogz0t5
Climatechange,comment,environment,inq0nz1,ApeMeApe,,I was just trying to say I agree. And that there is no need to worry about that. Worry about inflation and what processes/people are allowing it to proliferate.,2022-09-09T13:09:50+00:00,t1_inq0bm9
Climatechange,comment,anthropogenic,kr1t63d,CrispyMiner,,"> We haven't slowed down on our co2 emissions yet.


We absolutely have slowed down emissions, albeit not as much as we should. Emissions have basically plateaued and 2024 is expected to be the year that [emissions finally peak](https://archive.ph/tX3h1)",2024-02-18T21:55:50+00:00,t1_kr1shnp
PoliticalDiscussion,comment,environmental,ci3tomu,mrhymer,,"Yes, it is hypocritical.

Liberals nearly always ooze with desire to be more like the French except when it comes to power generation.",2014-06-10T13:01:21+00:00,t3_27pekz
Politics,comment,environment,fjytjsq,sbrider11,,"Sanders as President would be an economic disaster.  Not to mention 4 years of gridlock with zero of his fantasy agenda seeing the light of day.  

You can't welcome division in party plus demonize near any and all forms of capitalism, wealth and success and expect to be President.",2020-03-08T21:51:20+00:00,t1_fjyfzgs
Neoliberal,comment,environment,kacqbjw,JulioCesarSalad,,"There’s a nonzero chance that we might have an impromptu DnD game at Thanksgiving tomorrow

This would be with my cousins who have never played, and my niece and fiancée who have both played a single session mostly improved in the basement using only one set of dice 

Are there any one shot modules and pre made characters you all would recommend for first time players?

I would probably be DM

!ping RPG",2023-11-22T21:15:58+00:00,t3_181h2i2
Climatechange,comment,wildfires,jx7jvvz,Honest_Cynic,,"I have heard that statement, based on solar activity and earth's slightly changing orbit, with wags adding that perhaps we should add even more CO2 to the atmosphere to stave off another ice age.  No need, since another volcano will erupt to temporarily cool the planet, at least the hemisphere it is in (northern and southern hemisphere air doesn't mix much).",2023-08-22T00:38:23+00:00,t1_jx7gv9u
Climatechange,comment,warming,ko8lb6g,WannaBeRichnRipped,,purely anecdotal.  Friend of mine selling equipment to solar panel installation company in MI who is clearing trees to make room for solar farm.,2024-01-31T04:31:06+00:00,t1_ko8k39i
Climatechange,comment,warming,kkbkcyn,fiaanaut,,Can you articulate why we need it and why it's better than the alternative?,2024-01-30T21:43:19+00:00,t1_kkbcn5g
Geopolitics,comment,climate,hzg99y6,H4xolotl,,"But it shows that despite calling themselves a ""Sinologist"" the author knows less about  China or Chinese culture than the average person found on the street. 

""Phrenology for words"" is a pseudo-intellectual technique authors use to analyse foreign cultures by milking out meaning from observations of foreign language, often while getting all the etymology wrong.

&nbsp;

This technique is so prevalent that [Foreignpolicy](https://foreignpolicy.com/2021/07/06/chinese-characters-phrenology-orientalism/) wrote an article criticizing it;

>Phrenology for words, like the phrenology of the past, examines the mystic structure of characters and words themselves in an attempt to extract wider political and philosophical meaning. It often smacks of Orientalism, with proponents implicitly positing that the character-based languages of the East operate on some deeper, meta-semantic level that appears inscrutable in contrast to the logic of alphabet-based languages in the West.

Despite being written in 2021, the article addresses Victor H. Mair's argument almost presciently 

>By far the most popular target of Chinese word phrenology is the word for crisis, 危机. There is an entire Wikipedia entry on the Chinese word for crisis, in fact, because dating back to at least John F. Kennedy, Westerners have loved to awe at the fact that the two constituent characters are “danger” plus “opportunity.” 

And the final nail in the coffin for ""Phrenology for words"" type arguments:

>This is technically true in the same sense that the opposite of pro-gress is Con-gress: It’s a selective interpretation of morphemes divorced from actual etymology and is best left for a fortune cookie or motivational horoscope.",2022-03-05T13:52:47+00:00,t1_hzehl2p
Conservative,comment,climate,kwk2h4f,Weed_Exterminator,,"In Jeff Spicoli’s voice……..Frozen waves dude. 
https://www.youtube.com/watch?v=sKrpl-KBTzQ",2024-03-25T22:31:21+00:00,t1_kwdajpw
Climatechange,comment,warming,kccb196,No_Job_5208,,Projections and guesstimations based on assumptions of speculations and misguided calculations without considering ALL variables.,2023-12-07T07:59:08+00:00,t1_kcbq87o
PoliticalDiscussion,comment,climate change,gby5w0g,talino2321,,I was thinking some along the line of huge infrastructure initiative or lead on Bidencare.  But she needs whatever she can get to up her street cred.,2020-11-11T16:40:24+00:00,t1_gby5l14
Neoliberal,comment,pollution,gqulxyr,Sir_Francis_Burton,,"That’s a cool idea. Do carbon-capture, and then have guilt-free emitting! As long as you sequester at least some of it instead of releasing it again the more you run it the cleaner the air gets. But yeah, that’ll have to be a motivator for carbon sequestration, that’ll never make economic sense all in its own, but in combination with a carbon tax that uses the proceeds to buy sequestered carbon? Then something like that might just be the nudge that makes that work.",2021-03-14T00:07:42+00:00,t1_gquj8kp
Politics,comment,disasters,jyros0b,None,,It's funny but I can't tell if he disagree or agree with me,2023-09-02T04:54:13+00:00,t1_jyro36a
Politics,comment,disasters,jm5gsvb,BetterRedDead,,"…and that’s why mob lawyers always end up going to jail. You can defend anyone against anything, but you can’t cover up for or become a party to their crimes. Real lawyers know that it would be impossible to stay clean representing him, so they steer clear.",2023-05-30T02:23:45+00:00,t1_jm4uepl
Politics,comment,drought,h0ylkcf,creative1love,,"Yep. I wish they would go even further and include single-family homes personally, particularly given the dire cirumstances they are in.",2021-06-07T21:56:14+00:00,t1_h0yijvi
Climatechange,comment,climate,l5y5k99,shittimwood,,I don't think the sea has risen by 12 inches only in NYC. A quick google search shows parts of the island is sinking. That is not climate change.,2024-05-27T22:57:02+00:00,t1_l5xij2w
Climatechange,comment,temperature,k3ll4nl,Infamous_Employer_85,,and by 50 you mean 8.,2023-10-05T17:07:15+00:00,t1_k3lk54u
Climatechange,comment,anthropogenic,khqjghk,4shadowedbm,,"Scientists agree that smoking causes cancer but can't identify a point of no return. 

The consensus on anthropogenic climate change is that it is bad and we need to act. Not being able to pinpoint a timeline is a distraction and the debate is mostly an academic exercise. 

Like quitting smoking, every step to reduce emissions reduces the likelihood of hitting worst case scenarios.",2024-01-13T23:19:25+00:00,t1_khqc3ck
Politics,comment,NOAA,gajpm1q,TheLaGrangianMethod,,Back pay or partial back pay would be a decent idea. If it was a blatantly political firing. Obviously the dude caught with a dead hooker in the freezer doesn't get welcomed back.,2020-10-29T23:33:44+00:00,t1_gaixndo
Climatechange,comment,warming,kwx5unb,EmbarrassedWalk5798,,"wow what a great answer, because that really tracks with him. he *is* smart and i think thats part of why I'm always confused with his views. he never shows any emotion, so I don't think he has ways of dealing with any sort of emotional pain.",2024-03-28T06:50:01+00:00,t1_kwvgnet
Neoliberal,comment,climate,jsg5im3,FYoCouchEddie,,Then who’s going to eat all these bugs??,2023-07-18T13:00:04+00:00,t1_jserci1
Politics,comment,disasters,ka1oqpz,DubyaWolf,,And do you think Joe Manchin cares about anyone other than Joe Manchin?,2023-11-20T18:21:14+00:00,t3_17zmsny
Conservative,comment,climate change,jhk75vx,None,,"Has anyone ever provided ""authoritative information"" backing up their climate conspiracy theories?",2023-04-24T19:49:02+00:00,t3_12xsnk8
Neoliberal,comment,climate,k76e8ij,SterileCarrot,,"Solely because of what happened to Florida, 100% this map is the answer.",2023-10-31T02:14:34+00:00,t1_k75yt56
