subreddit,type,keyword,id,author,title,body,created_utc,parent_id
Politics,comment,disasters,krnxs0u,drunkshinobi,,They aren't using the actual definition of the word is how. Their definition of socialist is the same as communism and woke. To them the only thing these words mean is scary Democrat that's going to take my fantasy world away from me and make me give a shit about other people. So all they would have to do is say that they did something that a Republican wouldn't like and that will prove it to them.,2024-02-22T21:04:20+00:00,t1_krnp9kf
PoliticalDiscussion,comment,climate,howfamy,Fausterion18,,"Nope, every fossil fuel lobby combined is less powerful than the AARP.

You seriously do not understand how powerful the AARP is.",2021-12-17T10:06:28+00:00,t1_howd0xd
Politics,comment,disasters,jm52648,keyjan,,Good,2023-05-30T00:35:44+00:00,t3_13v9sqq
Politics,comment,disasters,jwdy4zo,bizarrogreg,,"""Make sure you use plenty of star wipes.""",2023-08-16T04:13:54+00:00,t1_jwbbfg1
Politics,comment,temperature,efeev4t,ThatJerkThere,,"“Proof, Motherfucker, do you have it?!”",2019-01-30T23:37:29+00:00,t1_efea9v6
Libertarian,comment,environmental,hxsg1sk,paulbrook,,"Someone violently suppressed the BLM riots?

I didn't notice that.  Must have been the burning Federal buildings and CHAZ that distracted me.",2022-02-21T03:39:27+00:00,t3_sxa51l
Climatechange,comment,IPCC,f8t4jdw,banter_hunter,,"Hey, doesn't the conclusion depend on the extrapolating of data from a crazy amount of interdependent variables and the model you used to formulate it? 

Certainly there has to be a scientifically valid range of projections predicting a 4°C increase, as like with all predictions, they are based on various assumptions that may or may not play out depending on a trillion of other factors?

Just asking here without having read the paper, just on the basis of basic scientific theory.

It may be more or less probable, but 4°C is not impossible. Neither is a 1000°C increase, of course, but I don't see a 4°C as completely out of the question, even though it is on the less probable side of our current predictions.",2019-11-26T19:13:57+00:00,t3_e20jsh
Climatechange,comment,IPCC,e9k85kc,saund1pe,,"It makes sense that the hemispheres are warming at different rates given the difference in land-water ratio. Southern hemisphere has more water, and since water has a higher heat capacity than land, it will heat up as a slower rate.",2018-11-12T16:49:35+00:00,t1_e9k4rww
Politics,comment,wildfires,g54fk6e,None,,The forests are federal land managed by the US Forestry Service.,2020-09-13T15:40:34+00:00,t1_g54cdie
Conservative,comment,wildfires,jxbxfah,Springer0982,,I bet when we see over numbers it’s above 200 dead,2023-08-22T21:51:52+00:00,t3_15yjcac
Politics,comment,disasters,jm5w0db,BigJSunshine,,"Two migratory coconuts, iirc.",2023-05-30T04:32:24+00:00,t1_jm5hhbv
Climatechange,comment,CO2,jjfb86m,technologyisnatural,,"Direct link to paper ...

*Exceptional stratospheric contribution to human fingerprints on atmospheric temperature*

https://www.pnas.org/doi/10.1073/pnas.2300758120",2023-05-09T03:13:52+00:00,t3_13cdr2d
Liberal,comment,environment,ilvd1t2,KarmicComic12334,,I feel better now. I pretty much disowned my country when we invaded iraq. But during this probably brief intermission between invading foreign nations I have no problems with the flag. But i still consider America the beautiful my national anthem and will never sing that other song.,2022-08-26T14:00:55+00:00,t3_wy9mdt
Politics,comment,wildfires,g5ebf65,BitterFuture,,"Already came close at least once, probably more than once.

https://www.peninsuladailynews.com/crime/family-harassed-in-forks-after-being-accused-of-being-members-of-antifa/",2020-09-15T20:17:28+00:00,t1_g5e91co
Politics,comment,wildfires,g56qpkd,Max_Insanity,,"Summer is nearing its end and winter is closing in, spelling an end to these fire in our hemisphere... only to start again in Australia and elsewhere in the Southern Hemisphere.

This is just the beginning of what scientists have been warning us about for decades.

Things will only get worse from here and the time will soon come when everyone is touched by the effects beyond uncomfortably hot summers and depressing news from elsewhere.

We weren't prepared for a pandemic, we aren't prepared for this and there is no vaccine that can save us from this one and you can't just ignore it and hope only the ""weakest"" in society are affected.

I fucking hate how the future has turned from hopeful opportunity to dread.",2020-09-14T01:12:18+00:00,t3_isapd0
Climatechange,comment,climate change,kuv9che,Infamous_Employer_85,,"During interglacials we never see temperature increases at a rate of 2.3C per century, but since we've increased CO2 by 50% we are now seeing exactly that.  CO2 has not been this high since humans have been on the planet.",2024-03-14T17:56:33+00:00,t1_kuv5sps
Politics,comment,emissions,gzzi0b0,aquarain,,But the warheads in the rockets are.,2021-05-30T16:03:10+00:00,t1_gzzhsnf
Climatechange,comment,environment,kh7w3lb,sebnukem,,Mass extinction (already underway). Loss of land. Famine. Just to name a few.,2024-01-10T15:41:05+00:00,t3_192uw1t
Climatechange,comment,warming,khn0ren,sensible_right,,Yes famines like the one in sri lanka pushed by ignorant leftists.,2024-01-13T07:11:22+00:00,t1_khkxdjb
Geopolitics,comment,climate,ggr1de5,Elbeske,,Leaving behind the 99%,2020-12-23T01:04:26+00:00,t1_ggr09x6
PoliticalDiscussion,comment,climate change,ext8klq,vargo17,,"Yeah, it's 100% NIMBY ism. Nobody wants to live next a landfill or a recycling center. Even though living next to both would be perfectly safe.",2019-08-23T12:47:27+00:00,t1_exst4fh
Conservative,comment,environment,gp4m1wa,None,,"It'll always be the Peabody, and I'll always miss the ducks.",2021-02-28T05:25:31+00:00,t3_lu3qyk
Conservative,comment,emissions,hbvmzkc,DelilahHelilah,,"I celebrated my birthday with 20 of my close friends by organizing a party outside in a public park near my house! I also made some new friends during the pandemic during my walks with my dog. I’m actually more social now than before the pandemic lol

Exactly what rights did I lose during the pandemic?

Oh and if you didn’t know, the whole abortion law didn’t happen because of the pandemic so…",2021-09-07T01:27:10+00:00,t1_hbvmnfv
Politics,comment,environment,if37heu,jackie2pie,,">found that people who lived in jurisdictions that consistently voted Democratic fared better than those that voted Republican.

More proof that God \^hates\^ the reprobates called republicans.  What is God's plan for the reprobates? Let's ask John Calvin himself and see:   /s

>For he is speaking of the greatness of God, whose pleasure it is to inflict punishment on fools and transgressors though he is not pleased to bestow his Spirit upon them.

John Calvin the Institutes of Christianity

Pity them, for God will not.",2022-07-06T15:59:51+00:00,t3_vsrs9l
Democrats,comment,climate,ikl33nb,Alex72598,,"Wowee, that is a lot! And people say Dems don’t get things done. Let Democrats govern for more than 2 years at a time and I bet you’d see just how much they can get done. That’s why these midterms are so important to continuing the great momentum of this year. So please vote, everybody!

Democrats - build back better

Republicans (in the words of their hero) - “American Carnage” 

I know which message sounds better to me!",2022-08-16T23:11:34+00:00,t3_wq4apd
Libertarian,comment,environmental,f0zizt7,justme285,,"All the information has been removed from online, at least from what I can tell. Even all the news reports seem to not exist online anymore. You would have to search a news archive or contact the MN Historical Archive to get copies of the information. Jessie Ventura has made public comments about the situation after he left the Governors office so there might be quotes or videos of him online referring to the information.

Edit: If it's any help, Ventura cancelled the State's emission tests on cars based on the research. There are several articles on the web criticizing him about it. Of course those criticisms are still online.",2019-09-21T20:09:25+00:00,t1_f0ze4bw
Climatechange,comment,anthropogenic,kfr3ey9,zagdem,,"I'd start with evidence regarding pollution, species extinction, and the reduction of the number of animals (aka mass killing). 

Not only is that easier to understand, but doing so gives tools that are useful to understand climate change. Moreover, it is a bigger issue right now.",2023-12-31T21:33:19+00:00,t3_18v1z4y
Climatechange,comment,NOAA,jxbtv3u,RightSideBlind,,Humans are really bad at understanding exponential curves.,2023-08-22T21:28:45+00:00,t3_15ydgmu
Neoliberal,comment,warming,hlmigyk,Average_GrillChad,,Hiking or playing volleyball or some shit.,2021-11-22T10:43:54+00:00,t1_hlm1ps6
PoliticalDiscussion,comment,disasters,ky1z5ms,neerok,,"I agree that the world is becoming more multi-polar as the USA is gradually withdrawing from it's post cold-war ""role"" as world police. I'm skeptical that this is a good thing for all states, and states that face famine. I think a more multi-polar world will have more conflicts as states try to assert regional dominance which may exacerbate the downstream effects, like starvation.",2024-04-04T18:55:25+00:00,t1_kxyvbwe
Politics,comment,disasters,jbfvvhe,sakima147,,It’s understaffed that’s why. It was gutted in the Trump Admin.,2023-03-08T19:25:48+00:00,t3_11lz8sl
Politics,comment,wildfires,jyf3h6b,da90,,"Yup, sorry, I didn’t mean any offense to you, just trying to give you some insight.",2023-08-30T19:37:55+00:00,t1_jyf1v4i
Politics,comment,drought,eh2k1wb,AutoModerator,,"
As a reminder, this subreddit [is for civil discussion.](/r/politics/wiki/index#wiki_be_civil)

In general, be courteous to others. Attack ideas, not users. Personal insults, shill or troll accusations, hate speech, **any** advocating or wishing death/physical harm, and other rule violations can result in a permanent ban. 

If you see comments in violation of our rules, please report them.

***


*I am a bot, and this action was performed automatically. Please [contact the moderators of this subreddit](/message/compose/?to=/r/politics) if you have any questions or concerns.*",2019-02-23T00:41:07+00:00,t3_atp5fj
PoliticalDiscussion,comment,climate,kzocw87,Kronzypantz,,"Point one is irrelevant because I never proposed some sort of ethnic determinism for who should have a say. Address my argument rather than your strawman, please.

The Normans and Saxons aren’t identifiable people suffering from observable, ongoing harm. The continued existence of Northern Ireland as a colony of Britain is such an observable, continuing harm. 

Also, you pretend I’m saying Ulster gets zero say or that not getting a veto on unification means some horrific potential.",2024-04-15T13:32:43+00:00,t1_kzoahcc
PoliticalDiscussion,comment,climate change,czgktcw,dekuscrub,,">Many, like myself, have zero confidence that a carbon tax would be used wisely by Government to actually reduce emissions in a significant way.

A carbon tax would reduce emissions on its own by making activities that cause emissions more expensive. It doesn't matter what the government does with the funds... well, so long as they don't use it to buy and burn fossil fuels.",2016-01-29T17:23:08+00:00,t1_czgcl5a
PoliticalDiscussion,comment,environment,d449s4m,Muspel,,"One month is short enough that nothing major is likely to change between picking a party and the actual primary, but long enough to give the registrar of voters and/or the parties to sort through all of the paperwork and get everything set up.",2016-06-10T23:07:42+00:00,t1_d43zab7
Libertarian,comment,emissions,jwfd0ux,Aer0spik3,,Cipher,2023-08-16T13:14:22+00:00,t3_15sons0
Conservative,comment,environment,jo5gz40,lyingforlolz,,"There were so many different communist organizations and different ideas. 

There were like 8 mergers of communist parties between world war 2 and the korean war. 

There was so much in fighting, eventually one person gained military control and took over the entire country. 

Literally the same thing that happens to every single communist country. 

It's the same fucking story dude.",2023-06-14T21:19:18+00:00,t1_jo34efl
Climatechange,comment,climate change,l3vxvws,Financial_Exercise88,,"I would say food prices. That cocoa spike is gonna *hurt.*

And then it's the plethora of problems that occur when one major political power in my country is actively trying to destroy my government, rather than try to make it better. The neglect & sabotage saturates every level of my daily experience. They've inspired an entire generation of quitters who won't fix things because everything's impossibly broken, and they'll be damned if they're going to let someone else try and fix things. That would make them look... wrong.",2024-05-13T18:30:21+00:00,t3_1cr56ve
PoliticalDiscussion,comment,climate change,d3wh7vp,tossme68,,"I think Warren will replace DWS as head of the DNC.  And as you said, once everything is settled we are going to see a full court press like no other the Obamas, the Bidens, the Sanders, Bill and Warren all ripping into Trump on a hourly basis.  It will be coming from so many different directions he won't know wear to ""counter punch"".  Add to the fact that all of her surrogates are much more popular than Trump (and Clinton) anything he says will just make him look worse to a swing voter.",2016-06-05T03:53:48+00:00,t1_d3vyfn4
PoliticalDiscussion,comment,environmental,d0av1f1,ClockOfTheLongNow,,"> The cost of buying a few reusable bags is so tiny, it's not going to make any go broke. 

Go broke, no.  Go without something they might actually need?  Yeah.

>  Or if you are really so concerned about that, you can make it revenue neutral, and give the money back to low income families somewhere.

Or, you know, not tax bags.",2016-02-23T18:27:01+00:00,t1_d0aus3l
Climatechange,comment,disasters,kjpg78u,Tpaine63,,But you only accept evidence that supports you world view. That way you don't have to answer who should decide which scientific theories are the correct ones.,2024-01-26T20:13:24+00:00,t1_kjnqabo
Politics,comment,climate,l32cdr0,DexterityZero,,"“we need 10 IRAs in the next 15 years if we want to actually achieve our goals,”

Just like on almost every other issue when we need a car he delivers half a bicycle.",2024-05-08T00:53:17+00:00,t3_1cmbpau
PoliticalDiscussion,comment,climate,j715c3n,Mrs_Mourningstar,,"Because the Republicans have gotten much shittier over the years and hell bent on making this country shitty. I really miss the days of George Bush and his goofy ass, I would even prefer a Cheney or McCain  to these conspiracy theorists and MAGA morons",2023-02-03T09:14:35+00:00,t3_10rz96b
Climatechange,comment,climate change,kw5a6dg,No_Elephant541,,"worlds going to be fine, you’re right.  humans won’t.",2024-03-23T02:53:01+00:00,t1_kw51fl2
Climatechange,comment,climate change,l25vox4,NV101Manual,,"May deoxygenate oceans 400 - 4000 meters down, where cold & deep abyssal waters crucial downwelling & upwelling fail. Killing the seas already more green than blue from the ISS - International Space Station - in areas larger than Earth surfaces altogether.",2024-05-01T22:44:56+00:00,t3_1chqel4
Climatechange,comment,warming,k6mygz9,CarBombtheDestroyer,,Why assume anything with no evidence when there are scientists whos job it is to make these predictions? Not some crazy off the rails nonsense. It doesn't help people take this seriously.,2023-10-27T03:52:32+00:00,t1_k6m3zwv
Conservative,comment,disasters,jopv9uj,glitchboard,,Not at all.  The type of person oh so subtly smuggling a set of shaving razors under their shirt is completely different from an armed robber sticking up the register.,2023-06-19T16:06:02+00:00,t1_jopfxm9
PoliticalDiscussion,comment,disasters,hattb25,jtaustin64,,"I think the Taliban had a *long* list of Afghans to terrorize before they start attacking foreigners. If there is anything China's actions in Xingjiang, as long as you terrorize your own citizens no one gives a damn.",2021-08-29T17:42:15+00:00,t1_hatp4vp
Neoliberal,comment,environment,l5c21oj,UnskilledScout,,"> The sources said Arab American leaders didn’t leave entirely empty-handed, however. Grenell “promised” leaders that Trump wouldn’t enact a “Muslim ban,” as he called for in 2016, according to these sources.

GREAT SUCCESS",2024-05-23T15:22:54+00:00,t3_1cymmwr
Climatechange,comment,emissions,k4uqu0x,Blam320,,"Extraction, refinement, and storage of nuclear fuel is very messy.   There is also very little room for error if you want to prevent dangerous radiation leaks.  Not to mention the plant itself can harm the local environment depending on where and how it is built, for example San Onofre in California, which was wreaking havoc on giant kelp forests from discharging hot water directly into the ocean.",2023-10-14T15:28:28+00:00,t3_177eiqv
Climatechange,comment,warming,k8pd6eu,Lastbalmain,,"The way we're heading, they'll still be here to watch it happen.",2023-11-10T21:56:37+00:00,t1_k8p00kl
Climatechange,comment,climate change,l1v24ao,Marti1PH,,"No sense casting pearls before swine, princess….",2024-04-29T23:34:54+00:00,t1_l1v1sd6
Liberal,post,climate,4sb6uf,RealRepub,"TTIP leak rebuts EU pledge to tackle climate change, say green activists",,2016-07-11T14:32:46+00:00,
Climatechange,comment,warming,kcfe74g,None,,What point are you trying to make exactly?,2023-12-07T23:04:26+00:00,t1_kcdmypm
Politics,comment,temperature,e79a35i,None,,"Nah, the heat death of the universe will eventually get them. ",2018-10-06T04:21:44+00:00,t1_e79a07w
Climatechange,comment,glaciers,iq4q344,sarcasmismysuperpowr,,Well it’s all relative. It’s worse in the south and southwest. The Great Lakes big plus is the lakes help moderate the extreme weather more than other places,2022-09-27T17:46:44+00:00,t1_iq4oo1y
Politics,post,emissions,pqk9wc,RavenGurlHere,US and EU pledge 30% cut in methane emissions to limit global heating,,2021-09-18T10:51:32+00:00,
PoliticalDiscussion,comment,temperature,cyfbpfa,NotNowImOnReddit,,"I'm always up for a healthy discussion on political viewpoints. I'll address two things. First, your use of the word ""legitimate"". Secondly, one reason why Sanders continues to be popular.

How are we considering any of the current candidates to be ""legitimate""? What metrics are we using? 

If we're measuring by credentials such as time spent in government, bill proposals sponsored in congress, involvement in government committees and commissions, etc., then yeah... Sanders is a legitimate candidate. More legitimate than Trump, Carson, Fiorina, etc. He has served in political office for 34 years, 24 of those at a national level. He's got the experience of being a congressional leader (more than our last two Presidents have had). As an Independent, he's worked with both Democrats and Republicans, and he's well respected by nearly everyone on Capitol Hill. His home state approval ratings are consistently favorable.

If we're measuring by current polling data, Sanders is beating out Republicans and is gaining ground on Hillary, overall. Is he going to win? I'd be very surprised if he did, but it's a mistake to count him out before Iowa and New Hampshire. His campaign has at least enough legitimacy to make him a contender there. If he can win those two states (polls are showing he does have a chance), then I'd be surprised if we don't see an even bigger surge in popularity for him.

You obviously disagree with his proposed policies, of which there's a lot of pros and cons that could be discussed, but you're using that disagreement to attack his legitimacy. Sorry to say, but that's a weak move. You're comment here, and the wording of your original post, are phrased very similarly to the language one could expect in an attack ad. It only serves to discredit the rest of your arguments. Attack the feasibility of his policies, but not his legitimacy.

Now let's look at Sanders ongoing popularity. 

People don't vote policy. People should vote policy, but people don't vote policy. Sanders touts himself a champion of ""let's focus on the issues"", but that's still not focusing on policy. He is, however, focusing in on a lot of issues that the majority of Americans are actually concerned with in their everyday lives, and he's especially focused on the issues that matter to the age group that you'll find on reddit. Thus, his popularity. **""I'm gonna talk about issues that nobody else is gonna talk about, and then I'm gonna fix 'em!""** *Oooooh. I like him. He talks about issues that nobody else is talking about, and he has a plan to fix them.* It really is that simple.

Half the reason we don't vote policy is because the candidates don't run on policies. They're smart enough to know (especially the Dems right now) that any proposed policy will have to make it through the gerrymandered, corporate owned congress, which is currently a shitshow of inefficiency. Instead, the candidates run on their character, on their record, and on denouncing the character and the record of their opponents. They play the polls, analyze the data, and shift their strategies accordingly. 

The other half is that the corporate owned media isn't going to focus on the nitty-gritty details of proposed policies. That's not good entertainment, thus it's not ""news"". They'd rather turn this into a reality show. It's a popularity contest. It's [American Idol: Presidential Edition](https://www.youtube.com/watch?v=gQaO5ZCwryI). 

Campaigns play towards the media, and the media plays towards entertainment. This leads us to a lot of campaign ""promises"" that (while they make for great sound bites) are not completely thought out, and some that will simply be unachievable. 

(As a side note, it's really not surprising that the corporate owned media isn't treating the anti-corporate candidate as ""legitimate"". With something like 67% of the population not trusting mainstream media [Source: heard that mentioned somewhere], it's not surprising that there's a growing popularity for Sanders on the ""anti-media"" internet)

Pick any current candidate and one could find legitimate opposition against their proposed policies. Whichever candidate wins, we could meet back here in 4 years and see what percentage of the winner's campaign promises were fully and completely implemented as promised. We don't even **expect** that number to be 100%. We know that they're not going to do everything they say they're going to do. That's how presidential campaigns work. When they tell you what they ""will"" do, they mean that it's what they'd ""want"" to do. Whether it's feasible or not is something they usually worry about after the election. 

The general populace doesn't think this through, though. They don't think through the feasibility, they latch on to the sound bites and form opinions based entirely on emotional reactions. Simply by discussing the right issues, Sanders appeals to that level of ""baseline thinking"" more so than Hillary, and more so than any Republican candidate with the possible exception of Donald Trump.

**tl;dr** - You may agree or disagree with the feasibility of Sanders' campaign ""promises"", but it's disingenuous to suggest he's not a legitimate candidate. Also, Sander's popularity isn't difficult to dissect if you really think about it.",2015-12-29T20:30:38+00:00,t1_cyf68se
Climatechange,comment,environmental,k1lf2je,bkydx,,"The mainstream narrative is we are screwed and everything is worse and anything bad that happens is 100% because of climate change.

&#x200B;

Much of the planet is experiencing improved weather and longer growing seasons and improved crop yields and the planet is greening and has 40% more plants then 40 years ago.

As a planet weather is shifting not intensifying. Tornado alley gets significantly less tornado.  


I deny shitty future speculation.  I believe data and facts and looking at the bigger pictures and not shitty narratives.",2023-09-21T17:51:12+00:00,t1_k1ibw0d
Climatechange,comment,climate change,ku5xb03,elchemy,,"And at this point the logical solution is \*Piped Water\*. Of course this has a different business model and much different economics.  
I say this to point out most of our environmental problems already have solutions, we just want to have our cake and eat it too.  
eg: Want to live in a desert (or a city), but want to drink pure mountain water from a bottle that will last 10,000 years and you only want to use it once - no problem!  
All our man made environment problems are the predictable outcome of solutions to other problems.",2024-03-10T02:22:48+00:00,t1_ku5dre9
Politics,comment,disasters,iaydm59,RSwordsman,,"Just moved here in the past few months from Florida, and I love it. Doing my best to represent.",2022-06-02T20:29:26+00:00,t1_iaydduj
Neoliberal,comment,climate,k4k8x00,-The_Blazer-,,"I don't like that you're equating wind and solar here. Wind is much, much easier to build at home than solar and, conversely, is harder to export.

Somewhat ironically, the manufacturing and trading scalability of solar is the same thing that makes it a national security nightmare (in addition to its other issues).",2023-10-12T13:55:04+00:00,t1_k4ja865
Geopolitics,comment,climate,koxq8mg,RealTruth7483,,"I understand that, but it seems very unlikely to me. Not impossible, it could happen, but I seriously doubt Russia would do that considering how much they're struggling with Ukraine.",2024-02-04T21:46:31+00:00,t1_koxq2ck
Neoliberal,comment,warming,ieikh6w,Unlearned_One,,That's a monumental embarrassment.,2022-07-01T23:32:27+00:00,t1_iei1o0a
