subreddit,type,keyword,id,author,title,body,created_utc,parent_id
PoliticalDiscussion,comment,naturalization,h020cc0,TableGamer,,"1. Empty units need to be taxed at a punitive level. These only serve to create scarcity, and threaten to make homeownership out of reach for the middle class.
2. Unlike assessment increases, which increase property tax and benefit the community, rent increases only benefit owners. A rent increase should trigger a higher tax rate. On the flip side, holding rent steady could cause tax to decrease ( to some limit ). This is a new idea I haven't thought about before, but the idea is to align incentives for the owner with the renter.
3. Tax large owners at a higher rate. This will incentive smaller owners. Which appear to be less aggressive on rent increases, and also decentralizes their political power. In markets which are already dominated by large owners this could have unintended side effects. Potentially need hard limits on number of units owned.
4. Prohibit foreign ownership. You should have to live in country to own. Maybe an exception for a single vacation property. Companies with any foreign ownership, prohibited from owning. REITs must guarantee they have no foreign investors.

The problem with rent is it always keeps increasing, which acts like a tax slowing your ability to build wealth.",2021-05-31T06:04:27+00:00,t3_noh7zs
Politics,comment,passport,e531o5c,JayInslee2020,,Everybody's selfish and think  injustices happening to someone else will never happen to them.,2018-08-30T07:20:47+00:00,t1_e531bbq
Politics,comment,Immigration,kpi80eb,readonlyuser,,"If they were really in it for the money, they'd make more money lobbying on K Street.  Politicians are in it for the prestige and power.

Only a select few get 'on-the-level' money via Hillary Clinton-level speaking fees or book deals that actually pay well (look at MTG's recent book sales as an example).",2024-02-08T16:51:02+00:00,t1_kphmk49
Libertarian,comment,I-130,fl45suy,Indiana_Curmudgeon,,"Now stupid, try to prove I'm trolling, fail, then what?",2020-03-21T16:02:18+00:00,t1_fl3v168
Conservative,comment,citizenship,iduz139,xHangfirex,,I knew Sweetin liked her dope and booze.  I didn't know she was into killin babies too..,2022-06-26T22:34:05+00:00,t3_vlfqaj
Politics,comment,naturalization,kqwcbi8,ragmop,,"This is a good point. The Democratic nominee was spontaneously the last line between normalcy and authoritarianism. Not exactly something anyone planned on. 


Really the fault falls on Republicans. They failed to gatekeep their party against a despotic figure, in turn failing to gatekeep democracy. This is all on them and their twisted ambition. ",2024-02-17T21:23:13+00:00,t1_kqvo9yk
Politics,comment,passport,e52rahd,sluttttt,,"I don’t think I’m naive on this front. It’s just scary that we’re at a place where it’s becoming *legal* to essentially say, “Juan Gomez, eh? Are you an immigrant?” We all know that it’s constantly being thought about people with Hispanic/Latinx names/appearances, but once people are complacent with it being verbalized... I honestly don’t know what to say to that. Maybe other than, “America is fucked.”

I live in San Diego and I’ve personally gone from, “I’m really scared for my friends with Mexican heritage” to “Holy shit, you could easily disappear tomorrow”. I have a friend in TJ who crosses the border each day for work (legally, if it matters). She loves San Diego, but I’m worried that she’s just going to vanish, or she’s going to lose her job and in-turn lose her housing... The idea of her being detained worries me even more since she’s gay. This fucking timeline... “Hope” is something that left when Obama did.",2018-08-30T03:07:37+00:00,t1_e52q20r
Neoliberal,comment,Visa,jbj3bw9,NarutoRunner,,"The problem as countless others have highlighted is that people don’t view immigration from a logical or sensible point of view. 

There is a big segment of British society (and the same in many countries) that oppose immigration on racial grounds. Regardless of social progress, they see people of colour as the “other”. You are unlikely to find this data on surveys as very few British people would actually admit their racial views as open racism still has a stigma for most of the population. 

Many have tied “Britishness” to the White Anglo-Saxon paradigm and nothing will change their mind on that. A classic example is the Tory party member who called LBC and essentially explained why Sunak is not fit to be PM on racial grounds. I highly doubt that he is in the minority holding that opinion, he just managed to say it out loud. 

Speak to any British person of colour and they will tell you plenty of stories about how they are often asked “where are they are really from?” despite many having been in Britain for multiple generations. 

Let’s also not forget that Brexit was driven in part by intolerance of even Eastern Europeans, so a country that has trouble with a Polish neighbour, imagine what they really think about a neighbour from Senegal or Bangladesh!",2023-03-09T12:25:07+00:00,t3_11m9mg9
Politics,comment,citizenship,jnau98q,hitman2218,,Yup.,2023-06-07T20:05:58+00:00,t1_jn9ucd6
PoliticalDiscussion,comment,naturalization,ebstdne,Cranyx,,"If Spain's unemployment has always been bad, then isn't kind of hard to conclusively say that their post-Aznar problems were caused by his policies? I'm not trying to argue that the labor policies *are* the cause of the high unemployment, but you should be able to point to some cause of the persistently high unemployment pre-Aznar, post-Aznar, and post-recession relative to other European countries.",2018-12-14T20:27:31+00:00,t1_ebsrito
Politics,comment,passport,geqsz6g,DrSchmolls,,"The ""issue"" here (being the devil's advocate) isnt that trans people can't travel but that they can't be recognized as who they are. So they go to get on a plane with a passport that doesn't match up with what they look like and they are asked to provide additional identification. This identification may or may not match what the person looks like or the passport. Confusion and discomfort ensue.",2020-12-05T22:27:44+00:00,t1_gep8zp9
PoliticalDiscussion,comment,naturalization,ir7a4qn,SirScaurus,,">People like to argue that the US has been some oligarchy all along an still is. But looking back, and we just don't see the actual top of the top rich holding much political power.  
>  
>Going back to the founders. More than 1 of them had to have friends buy them suits so they could attend the continental congress. These men weren't the starving poor by any means. But, they weren't rich. In the parlance of our day, they were lower middle class.

I'm sorry, but this is somewhat revisionist and is a furthering of our foundational myth of the founding fathers being 'ordinary people'. But in reality, that just isn't the case:

[https://www.politifact.com/article/2015/jul/02/founding-fathers-ordinary-folk/](https://www.politifact.com/article/2015/jul/02/founding-fathers-ordinary-folk/)

&#x200B;

>After consulting several scholars and other sources, we found that -- with some exceptions -- central figures in the nation’s founding generally came from privileged backgrounds, attended college at a time when very few people did and, by 1776, were prominent and wealthy.  
>  
>""They weren't ordinary,"" said Brown University emeritus history professor Gordon Wood, author of ""Creation of the American Republic,"" ""Revolutionary Characters: What Made the Founders Different"" and other books. ""They were the elite of the day, involved in highest levels of the society.""

More than any major lower- or middle-class uprising, the Revolutionary War was overwhelmingly about a usurpation of colonial control from the Old World elites back in Continental Europe by the New World elites who actually lived here. The original Constitution reflects this, in that the constitutional convention of 1787 was itself a right-wing counterrevolution that installed an oligarchical state with only the visual trappings of democracy.

It's only become a full democracy over time on account of people working hard to reform the system and make it so.",2022-10-05T21:10:18+00:00,t1_ir3q3kv
Democrats,comment,Immigration,fvgmxs7,cworth71,,"Yep, delusional.",2020-06-20T18:20:54+00:00,t1_fvgmia9
Neoliberal,comment,Immigration,kj7o7ae,DMNCS,,"I grew up in a very conservative family and initially considered myself a conservative too. I really wanted McCain to win in 2008 (I just barely missed being able to vote). 

By 2012, I had already started moving away from the Republicans. Republican obstructionism in Congress and the debt ceiling fight really frustrated me. Mitt Romney's 47% comment really turned me off. And I didn't want to blow up the ACA (maybe somewhat selfish since I could stay on my parent's insurance). I started considering myself a liberal Republican. 

By 2015 I was just pretty much over Republicans in general. I had become more socially liberal. My major sticking point was actually foreign policy. Obama's was terrible. I wanted Jeb! to win the nomination and honestly I probably would have ended up voting for him in the general (because of emails, socially he was too conservative). 

Once Trump broke out. I was completely done with Republicans. I didn't want Bernie, so I supported Hillary. And I actually liked her. Socially liberal, pro-free trade, and strong on FoPo. I milled around r/HillaryClinton and r/politicaldiscussion during the 2016 election season.

I hung out in r/VoteBlue and r/VoteDem until post 2020, but was way more center left than most of the people there. I eventually came here when one of the Thunderdomes hit popular and have been here ever since. I'm planning on staying until the inevitable tankie/fascist takeover that happens to all political subreddits.",2024-01-23T16:25:22+00:00,t3_19doe51
Democrats,comment,Immigration,fojgn3a,__FinalBoss__,,Lizard Boy🦎,2020-04-25T13:12:36+00:00,t3_g7qx9v
Libertarian,comment,naturalization,hofv9s9,Dudehitscar,,"1870 - 1913?    

lol.   so libertarian that women couldn't even vote!",2021-12-13T23:07:11+00:00,t1_hofmcdl
Conservatives,post,immigrant,18746jx,intelligentreviews,"Gov. Abbott Says Texas Will Bus Another 70,000 Immigrants To Democrat-Run Cities",,2023-11-30T00:02:37+00:00,
PoliticalDiscussion,comment,naturalization,hsy60u6,UsedElk8028,,"Um... Biden won West Virginia with 65% vs. Bernie’s 12%.

https://en.m.wikipedia.org/wiki/2020_West_Virginia_Democratic_presidential_primary",2022-01-16T20:58:53+00:00,t1_hsvzr9b
Neoliberal,comment,passport,i5x1ygg,BloodySaxon,,White knighting for Snowden in Neolibland is...surprising.,2022-04-23T20:21:33+00:00,t3_ua7imc
Conservative,comment,Immigration,kvgc1aj,straiight-n-right,,"Not because he’s changed, he was and still is a total POS.",2024-03-18T17:21:59+00:00,t3_1bhr91r
PoliticalDiscussion,comment,citizenship,h0muxwp,ReefaManiack42o,,"That's fine, but I don't want anymore of my money going to them, I'll always vote against Israel, missiles and murder every single time.",2021-06-05T00:53:03+00:00,t1_h0lhplh
Democrats,comment,Immigration,krd9lc3,Ok-Week-1259,,If he gets elected we will all be in chains,2024-02-20T23:19:44+00:00,t3_1avmc45
Conservative,comment,Visa,hagxsdn,Frank_the_NOOB,,"How the hell did we give up Bagram air base, the most important strategic asset in the region and permitted the evacuation of a landlocked nation to a, at the time, civilian run airport in the middle of a large metro area",2021-08-26T20:31:47+00:00,t3_pc6pu7
Geopolitics,comment,naturalization,eix6ror,NutDraw,,"Well you requested a hypothetical ""why would this sub be targeted,"" so to fitting facts into a narrative was the whole idea of my posts. 

The idea behind targeting a place like this sub actually does have some research behind it. Malcolm Gladwell wrote a popular science book called ""Tipping Point"" that pulled a lot of research together about how ideas and trends spread.  It's only gotten more refined since it was written with real data from social media to test and verify theories.. I think most people might be a little frightened if they understood how far this field has advanced in the past 10 years or so.

As for the geopolitical motivation, China both wants and *needs* respectability on the world stage. Without it they will have a harder time politically setting up the parallel institutions needed to break US economic hegemony.

Like I said if China were to wage such a campaign I would see their motivations more focused on establishing the Chinese model as a viable and acceptable alternative to western liberalism than anything else. Would they be any good at it? How much effort would they put into it? I don't know the answers to those questions. But honestly some form of this kind of influence campaign focused on raising a nation's stature has a long, long, history so I wouldn't be at all surprised if it was happening.",2019-03-20T00:12:47+00:00,t1_eix3pbn
Politics,comment,naturalization,ij2ho8w,stonge1302,,Cost of doing business I guess.,2022-08-05T16:02:51+00:00,t3_wgz0d9
PoliticalDiscussion,comment,Immigration,g2welko,stefankruithof,,">Their founder was a raging antisemite.

[So was the founder of protestantism](https://en.wikipedia.org/wiki/Martin_Luther_and_antisemitism), but I did not learn about this in my protestant high school nor in the protestant church I attended as a teenager.",2020-08-26T11:24:59+00:00,t1_g2vpxy4
Neoliberal,comment,Visa,hzqicgt,rukqoa,,"Not sure if it's been posted but

> [Latvia wants permanent U.S. troops, foreign minister tells Blinken](https://twitter.com/Reuters/status/1500861406731816977)",2022-03-07T18:46:58+00:00,t3_t8jhny
Politics,comment,green card,dtzwx1p,DBDude,,"He was convicted of a felony, which is a no-no for green card holders. Those who serve have a pretty easy path to citizenship, but he apparently never availed himself of it. ",2018-02-09T18:37:36+00:00,t1_dtzursi
Politics,comment,Visa,g6h17b6,entropy_generator,,But I was told we wanted merit based immigration. This makes it pretty transparent what they consider to be 'merit'.,2020-09-24T21:46:08+00:00,t1_g6h0jgq
Republican,comment,naturalization,gv53gmc,AutoModerator,,"/r/Republican is a partisan subreddit.  This is a place for Republicans to discuss issues with other Republicans.
Out of respect for this sub's main purpose, we ask that unless you identify as Republican that you refrain from commenting and [leave the vote button alone](https://www.reddit.com/r/MetaRepublican/comments/5t017a/this_sub_is_for_republicans_if_you_do_not/). Non republicans who come to our sub looking for a 'different perspective' [subvert that very perspective with their own views when they vote or comment.](http://i.imgur.com/XqL0wfR.jpg)

*I am a bot, and this action was performed automatically. Please [contact the moderators of this subreddit](/message/compose/?to=/r/Republican) if you have any questions or concerns.*",2021-04-19T23:21:36+00:00,t3_mudc38
Politics,comment,naturalization,ipo5c4q,notFREEfood,,"The last rolling blackouts we had were two years ago, and that was because the state had relaxed reserve requirements, then we lost significant generating capacity when loads hit their peak.  Before that, we last had statewide rolling blackouts when Enron manipulated the state electricity market and fucked us over.

We came close to having statewide rolling blackouts a few weeks ago (and there were localized blackouts due to transmission line failures), but greater reserve requirements and voluntary conservation saved us.  It's also worth noting that we had record demand for several days straight, and the demand on the worst day smashed the all-time record.

However demand in the winter, which will go up with people shifting from gas heating to electric, is significantly lower.  So while some improvements need to be made, the grid isn't in terrible shape.",2022-09-24T02:10:48+00:00,t1_ipnprlc
Libertarian,comment,citizenship,f3hegnu,fullbloodedwhitemale,,"Is this type of stuff a surprise anymore? And, it's only going to get worse.

...Harvard sends recruitment letters to African-American, Native American and Hispanic high schoolers with mid-range SAT scores, around 1100 on math and verbal combined out of a possible 1600, CNN reported. Asian-Americans only receive a recruitment letter if they score at least 250 points higher — 1350 for women, and 1380 for men. 

https://www.cnn.com/2018/10/15/politics/harvard-affirmative-action-opening-arguments/index.html",2019-10-12T23:22:14+00:00,t1_f3hdxrj
Conservatives,post,immigrant,1c53qr3,intelligentreviews,Tax Day: Illegal Immigration Costs American Taxpayers over $150 Billion,,2024-04-16T01:29:42+00:00,
Geopolitics,comment,naturalization,hnl6lzq,cavscout43,,"Really detailed analysis around the geographic factors.   


There are some other ones in play, however.   


Fertility rates have mostly dipped below replacement rates, including in Brazil, and South American being overall stuck in the Middle Income Trap means the immigration appeal simply isn't there to offset it. A greying and in the future shrinking population means fewer bodies for war, less appetite for adventurism, and generally a more domestic focus.   


Historical grievances have been mostly ""settled"" at this point, South America doesn't have the freshly redrawn borders like the Post WW2 areas such as Sub-Saharan Africa and South Asia, which saw a sudden removal of their European imperial overlords and hastily redrawn borders. Likewise, the ""melting pot"" of Spanish/Portuguese colonial legacy has had centuries to gradually erase major distinctions between ethnic groups and religions. Yes, there are endemic and lingering racism issues around skin color, but overall Brazilians are Brazilians, Peruvians are Peruvians, and so on. Without the cross border issues of ethnic groups lacking a unified nation state, there are less reasons for border conflict.   


The Elephant in the Room is the Monroe Doctrine: the US has seen fit, and had ample power projection to do so, to intervene and influence South American affairs for a century and a half. The reality is that not only would the US intervene in a large scale shooting war to shape events in their favor, former imperialist powers in Europe may also do so as they have continued to do in Africa and the Middle East.   


On top of all of that, a very mixed economic development cycle has happened over time: around WW1, Argentina's GDP per capital was potentially higher than Western Europe's and even the USA's..obviously that's not the case today. Likewise South America looked to be on a rapid rise, but now with China (a large export market for resources) slowing down and becoming more domestically focused, C19 hitting tourism and globalization hard, it's changing. 2004 - 2018 saw countries like Chile triple their GDP, but now that trend is in question. Brazil's GDP is \~60% of what it was in 2011. Argentina's is similarly down the same amount, but only since 2017.    


South America overall suffers from a paradox of being once nearly at parity with Europe, because it shared very robust bonds with the continent, and also having lost economic steam as those ties weakened by the decade. As China ages and becomes wealthier, we may see manufacturing and supply chains somewhat migrate there, but Africa & South Asia (Climate change risks aside) have vastly more cheap labor, and younger, at hand to entice those.   


Apologies for going all over the board here, but there are many macro level factors at play in keeping South America ""peaceful"" in terms of interstate conflict beyond geography. Cheers!",2021-12-07T12:57:30+00:00,t3_raf7jx
Conservative,comment,Immigration,ktipj0n,Bukook,,>*let them eat the Left*,2024-03-05T22:10:52+00:00,t1_ktgwyzi
Neoliberal,comment,Visa,gmysw5y,groupbot,,"Pinged members of IMMIGRATION group.

[About & group list](https://reddit.com/r/neoliberal/wiki/userpinger/documentation) | [Subscribe to this group](https://reddit.com/message/compose?to=groupbot&subject=Add%20yourself%20to%20group%20IMMIGRATION&message=addtogroup%20IMMIGRATION) | [Unsubscribe from this group](https://reddit.com/message/compose?to=groupbot&subject=Unsubscribe%20from%20group%20IMMIGRATION&message=unsubscribe%20IMMIGRATION) | [Unsubscribe from all groups](https://reddit.com/message/compose?to=groupbot&subject=Unsubscribe%20from%20all%20groups&message=unsubscribe%20)",2021-02-11T18:26:49+00:00,t1_gmysv4c
PoliticalDiscussion,comment,Immigration,kgzxp8j,Bullxdog34,,"From what I’m reading everyone is afraid of what Trump can do, but those same people aren’t afraid of what the democrats are doing?",2024-01-09T03:02:38+00:00,t3_190esz7
Politics,comment,green card,e47lajn,Inside_my_scars,,"Evers is a good dude. Really think he'll be the one to finally oust Walker. I wanted Flynn, but I'll happily support Evers. Pulling for you Wisconsin bros to join the blue wave in MN!",2018-08-15T02:08:23+00:00,t1_e47kz8t
Politics,comment,Visa,k0ui0p8,Error_404_403,,"He is crazy and worse than Trump, however impossible that sounds.",2023-09-16T15:18:59+00:00,t3_16k51kv
Politics,comment,Visa,kid8dtb,ChelseaG12,,"He'll dismantle any agency that seems to help average people or regulate corporations. I can definitely see the FTC and FCC being first on the block. Then any systems in place to regulate wall street, hedge funds and big banks.",2024-01-18T00:54:49+00:00,t1_kib866b
Politics,comment,consulate,e7zxzjs,ScrupulousVoter3,,"They probably added each piece to the ""kill bag"" they wear around their necks.  Just another trophy from a successful job :-)

Given how brazen the Saudi's have been - having a cleaning crew pull up right in front of reporters - I'm surprised they just didn't park a wood-chipper in the back parking lot and skip the bone saw.",2018-10-18T13:53:47+00:00,t1_e7zor7v
PoliticalDiscussion,comment,naturalization,hjbfr35,keithjr,,"It's a bit of a Gordian knot.  The fastest way to do that would be to get the pandemic under control, but the only lever he can use for that is vaccine mandates.  These would work and are totally the right thing to do, but they're unpopular politically. 

Global supply chain issues just have to work themselves out over time, there's absolutely nothing anybody can do about it.",2021-11-04T18:56:28+00:00,t1_hj9tu0x
Politics,comment,green card,fo4szul,thweet_jethuth,,*whispering,2020-04-21T23:10:27+00:00,t1_fo4qwj7
PoliticalDiscussion,comment,Immigration,gxai5di,PsychLegalMind,,"> think republicans are struggling on ho

Yes, things are a little different this time around. Biden has learned.",2021-05-07T16:41:36+00:00,t1_gx9l6ss
Conservative,comment,Visa,g2pay8m,ShoutingMatch,,"Incompetent visa workers in IT?  No problem!  They all hide in large groups doing next to nothing until their contract is over.  Want them to execute a change procedure?  No can do, tea time!",2020-08-24T15:58:03+00:00,t3_ifrj9w
Liberal,comment,immigrant,kwae2v6,ExaggeratedCalamity,,"The current state of MAGA is roughly where the Nazis were in ~1933, before the camps.",2024-03-24T02:44:41+00:00,t1_kwa0h7n
Democrats,comment,Immigration,kdtk0st,Thrilleye51,,But I've seen some black people saying they'll vote for him. Obviously they don't know about Project 2025 which hinges on him winning,2023-12-17T23:31:57+00:00,t1_kdthlcd
Neoliberal,comment,naturalization,jbmu0oi,Top_Lime1820,,"To be honest I'm not 100% clued up on tribal and homeland politics. There is another party called UDM run by Bantu Holomisa, former homeland leader of the Eastern Cape. Zulus have always been the most independence minded of all tribes, and they are the biggest tribe. So that factors into it. But I think an ANC stalwart might just say that Buthelezi exploited his position uniquely and was willing to undermine the main, all-black movement. And that might be something a Zulu ANC person says. I stand to be corrected though. I'll have to read about it.

I'm not too informed on Botswana politics other than the broad outlines. Once I do my last ANC effortpost I'm gonna read up about other countries because reading your own country's politics gets scary and exhausting after a while!",2023-03-10T04:09:27+00:00,t1_jbm825b
PoliticalDiscussion,comment,Immigration,gecofsi,Revydown,,"A country is literally defined by its borders. If you ain't going to enforce them another country would gladly gobble it up. Look at China and India or China with many of it's other neighbors. The US is lucky it so incredibly powerful that it's neighbors know not to fuck with it. When the nazi's tried to get Mexico to attack the US, they were like ""fuck no, we're not messing with them!""",2020-12-02T08:47:54+00:00,t1_gecejy4
Politics,comment,naturalization,g3e0424,zzzigzzzagzzziggy,,"""Person, woman, man, camera, TV.""",2020-08-30T19:31:34+00:00,t3_ijh52z
Neoliberal,comment,Visa,h0jgqgh,CarlosDanger512,,Pretty sure it's a book store actually,2021-06-04T07:07:01+00:00,t3_nrweua
Politics,comment,naturalization,hlmd7yg,Krisay,,Damn you got some hate in your heart.,2021-11-22T09:26:18+00:00,t1_hllc28a
Libertarian,comment,naturalization,hpr0n0o,User125699,,"I agree totally.  I’m saying that’s how those people are painted, typically by their opponents.  

I think many anti mandate but are branded as anti-vax.  As one of the other folks that replied to you here noted, they actually have a definition of it for what it’s worth.  

I’m not sure what the % of the population in each camp is, but there are some that are straight up anti-vax and some that are anti-Covid-vax.  

Regardless, I believe these camps follow party lines pretty closely.  There aren’t many anti-vax democrats or pro mandate republicans, at least not in my experience.",2021-12-24T00:39:51+00:00,t1_hpqthet
