subreddit,type,keyword,id,author,title,body,created_utc,parent_id
Neoliberal,comment,Visa,hyyitss,MicroFlamer,,"https://twitter.com/nolanwpeterson/status/1498759267091771396?s=19 

>From a Ukrainian soldier on the front lines in the Donbas: 

>‘We're doing comparatively good on the ground. But unless we get direct air support immediately, we're f...ed.
The Russians are too many...
Especially in Air force and cruise missiles.’",2022-03-01T20:44:17+00:00,t3_t420jd
Geopolitics,comment,Immigration,kwx9rlq,kirjalax,,"Every year you conscript young women doing basic childcare/nursing in some sort of state institutionalized orphanages, like men do mandatory military service in camps for a year.",2024-03-28T07:39:08+00:00,t1_kwwv57n
PoliticalDiscussion,comment,naturalization,jy8gsjh,bleahdeebleah,,"Yes, but I was focused on our discussion and what's the administrative cost of food stamps.   TIL people cheat on their taxes.",2023-08-29T14:31:05+00:00,t1_jy8ftuq
Republican,comment,naturalization,gvkhysw,sharpshooter999,,I'm surprised they didn't fire on the whole group the moment they stepped inside......kinda makes me wonder if that whole area 51 raid thing would've worked if that was how the government handles stuff like this 🤔,2021-04-23T14:21:49+00:00,t1_gvkcx0s
Liberal,comment,immigrant,d0jifkp,Og_The_Barbarian,,"Overall, I still think Sanders has been more consistently liberal than Hillary. I just wish he and his supporters wouldn't build the narrative that he's perfect, the anti-politician. He should stand on his record and policies as they are, no need to embellish.",2016-03-01T16:55:43+00:00,t3_48hcdc
Conservative,comment,green card,cf3s3gy,CarolinaPunk,,"Maybe, immigration quotas should be tied to the GDP number then? ",2014-01-31T19:03:22+00:00,t1_cf3r6td
PoliticalDiscussion,comment,naturalization,gvxdzrv,EmptyAirEmptyHead,,The argument I read is it is a different section of the constitution from normal business.,2021-04-26T13:28:03+00:00,t1_gvw27uh
Conservative,comment,Visa,iighep6,wdwest74,,"I’m from Tennessee, I like it here but if I were to move it would be Idaho or Oregon.",2022-08-01T02:02:13+00:00,t3_wd1oja
Politics,comment,Immigration,kqc5tku,peterpeterllini,,"I already see the headlines now: 

MAJOR PROTEST BREAKS OUT DURING DEMOCRAT VICTORY SPEECH- HOW THIS IS BIDEN'S FAULT NEXT AT 11",2024-02-14T03:38:13+00:00,t3_1aq71pi
Politics,comment,CBP,f6syj16,PinkSlimeIsPeople,,What would you suggest?,2019-11-07T15:45:23+00:00,t1_f6shhgg
Politics,comment,immigrant visa,d7mxhu8,wyldcat,,"Pence is more high energy than Trump, who knew!",2016-09-14T20:52:58+00:00,t1_d7mwjar
Climatechange,comment,naturalization,jnqbgy1,randomhomonid,,"OP is a firm 'climate is changing' proponent, and rocksolid 'CO2 is causing it' skeptic.

the longest running continuous temperature record (the CET) is a good, simple example of why:

[https://c3headlines.typepad.com/.a/6a010536b58035970c0120a7c87805970b-pi](https://c3headlines.typepad.com/.a/6a010536b58035970c0120a7c87805970b-pi)

can you see the correlation between co2 and temp rise?",2023-06-11T01:57:54+00:00,t1_jno71np
Politics,comment,Immigration,kwkzh9r,HeadTax7593,,"Mayorkis can say whatever he wants. He has no power to change it. He had the opportunity to do his job, and didn't, so we relieved him of that obligation. 
 The Supreme Court has ruled it constitutional. 
Thank goodness, because I live 6 miles from the border in Texas and have no doubt we are in the middle of a crisis/ invasion. If anyone doubts it, they should pay us a visit. Mayorkis has done nothing but put American citizens in danger. ",2024-03-26T01:56:22+00:00,t3_1bn2ygv
Neoliberal,comment,naturalization,iui4qeq,sourcreamus,,"Putting a price on things clarifies the trade offs involved. You could say I enjoy browsing book stores and want Amazon taxed, but if bookstores charged an admission fee would you pay it? That is the insidious part of NIMBYism, other people pay the price for your preferences. In such cases it is easy to see why such activities are overindulged.",2022-10-31T14:44:22+00:00,t3_yicha0
Libertarian,comment,Immigration,kavaaye,JuanMurphy,,"As long as we acknowledge that at some point prior to birth that the unborn is a human child, defining exactly and legally is a must.",2023-11-26T18:56:48+00:00,t1_kaulbbe
Politics,comment,immigrant visa,dhqt1e3,Osklington,,"Hey Mark, you are human garbage. Have a shitty day.",2017-05-18T23:05:26+00:00,t3_6bozjc
PoliticalDiscussion,comment,Immigration,hrp5w2l,WinsingtonIII,,"The US-Mexico border is a bit different from the Lithuanian or Polish border with Belarus. For one thing it’s much, much longer, and for another there are sections of the US-Mexico border that are hundreds of miles of uninhabited, remote desert. Even setting aside the logistical issues with building a wall in these remote areas in the first place (which would result in higher than expected construction costs), in a remote desert area a wall is easily defeated by a 4x4 pickup and a ladder on each side. Or even just a couple collapsible ladders without the pickups. Rendering the wall largely a symbolic gesture which cost billions of dollars.

Trying to man such a wall with regular enough guard posts to stop crossings would be a large commitment of funds and manpower for relatively small gain given the vast nature of the border and the very remote areas encompassed along it.",2022-01-07T22:21:44+00:00,t1_hrolv83
Libertarian,comment,naturalization,joza2k7,No-Entrepreneur4499,,"This is completely wrong in every sense. It's wrong because States and Companies are completely different (one produces wealth, other leeches it, to start with something). But also because companies don't get less efficient the bigger they are. Actually most startups are incredibly indebted. So it makes zero sense.",2023-06-21T16:36:45+00:00,t1_joz9c1a
Neoliberal,comment,I-130,k4akmlj,RaidBrimnes,,"[Four French nationals are now confirmed dead](https://www.liberation.fr/checknews/morts-disparus-et-otages-probables-qui-sont-les-francais-victimes-de-lattaque-du-hamas-en-israel-20231010_WUQFQAA6FJA4DNBHQMI64J545I/) per the Minister of Foreign Affairs according to a new tally, and 13 are missing.

Among the confirmed dead is [Avidan T.](https://twitter.com/Meyer_Habib/status/1711670139081421290?ref_src=twsrc%5Etfw%7Ctwcamp%5Etweetembed%7Ctwterm%5E1711670139081421290%7Ctwgr%5E0950ff7b6f3686b6fe22ae6075bdac9db611bd9b%7Ctwcon%5Es1_&ref_url=https%3A%2F%2Fwww.liberation.fr%2Fchecknews%2Fmorts-disparus-et-otages-probables-qui-sont-les-francais-victimes-de-lattaque-du-hamas-en-israel-20231010_WUQFQAA6FJA4DNBHQMI64J545I%2F), a 26 yo Bordeaux native and lover of EDM who helped organize the Supernova festival in Re'im.

Among the missing is a 12 yo boy, [Eitan, who was abducted by Hamas terrorists with his father, Ohad](https://twitter.com/i24NEWS_EN/status/1711411428849074361?ref_src=twsrc%5Etfw%7Ctwcamp%5Etweetembed%7Ctwterm%5E1711411428849074361%7Ctwgr%5E0950ff7b6f3686b6fe22ae6075bdac9db611bd9b%7Ctwcon%5Es1_&ref_url=https%3A%2F%2Fwww.liberation.fr%2Fchecknews%2Fmorts-disparus-et-otages-probables-qui-sont-les-francais-victimes-de-lattaque-du-hamas-en-israel-20231010_WUQFQAA6FJA4DNBHQMI64J545I%2F), who is also still missing, and his mother and two sisters, who were fortunately able to get away to safety.",2023-10-10T16:31:05+00:00,t3_174hiz4
Conservative,comment,passport,h869uv6,Bipolar_Buddha,,"“Out of 164million people currently vaccinated, we can expect somewhere in the tens of thousands for breakthrough cases.”
Given that we’re past 35 million cases so far, going down to the “tens of thousands” of cases is still a massive improvement. Still, I’m confused about the new guidance from the CDC about masks. They now encourage you wearing masks in public settings, but not in private settings with immunocompromised people, despite the fact that they’ve said the masks only prevent you from transmitting the disease, not getting it. If anything, I feel like “have masks on around the immunocompromised” should be the guidance.",2021-08-08T14:45:31+00:00,t3_p0ei33
Politics,comment,Immigration,kfldmsz,Select_Recover7567,,Poor tax payer are picking up the tab.,2023-12-30T19:29:55+00:00,t3_18uimus
Climatechange,comment,naturalization,kw7t8rx,Infamous_Employer_85,,"What is your research?  You claimed that it is colder, based on what measurements?",2024-03-23T16:45:15+00:00,t1_kw46nx5
Politics,comment,Visa,h9bi5um,AhHorseSpit,,Tubby is in the Senate. When that vote happens I'm sure he will be added to the list.,2021-08-17T18:46:38+00:00,t1_h9bgncm
Libertarian,comment,Immigration,kjok6er,unluckilyy,,"I think that we are seeing now that no, we can't trust the government to protect the border themselves, which has caused Arizona and Texas to build their own walls. I think that if the right person is elected we CAN rely on the government to protect the border, but we shouldn't. If California wants to allow undocumented immigrants in, that's their issue, not Texas', not Arizona's. 

I have no issue with immigration, this nation was built on immigration. But we need to document immigrants and we need to provide a quicker path to citizenship and not incentivize people to come illegally.",2024-01-26T17:11:24+00:00,t3_1abn040
Politics,comment,immigrant,l6ce7pu,carbon_14c,,Bingo.,2024-05-30T16:20:49+00:00,t1_l6cdd58
Politics,comment,I-130,dyd6zpj,scigs6,,"""I didn't know that!"" - Hannity. Fucking hilarious ",2018-05-03T04:36:19+00:00,t3_8gndwn
Neoliberal,comment,Immigration,l59puyx,DiogenesLaertys,,"The moderating mechanism is them losing.  

Over and over.  

Badly.",2024-05-23T02:52:43+00:00,t3_1cydvgm
Politics,post,green card,7wf9r3,wwabc,Rauner denies clemency to Army veteran with green card who is facing deportation,,2018-02-09T18:00:35+00:00,
PoliticalDiscussion,comment,Visa,c9h6vki,sarcasmandsocialism,,"""Suppress wages and benefits"" seems like unnecessarily harsh language.  All corporations want to hire workers for as little money as they can. A simpler way of putting it would be that it is cheaper for them to hire foreign skilled/STEM workers than it would be to pay salaries high enough to encourage more Americans to get sufficient training in the field.

That said, some corporations *have* been donating some money to help fund STEM education in public schools.",2013-04-17T19:28:25+00:00,t3_1cjjtd
Climatechange,comment,naturalization,jyi8phn,Infamous_Employer_85,,"> The abstract doesn't mention why the ice broke free, 

It specifically says climate-related",2023-08-31T11:38:38+00:00,t1_jyh4tta
Democrats,comment,naturalization,h05ru1d,thepinkbunnyboy,,"Yes, it was a record turnout. 18-34 was still the lowest bracket, unfortunately.

But, yes, I hope it is turning a new page. We'll see in six months and again in 2022 if it sticks.",2021-06-01T04:44:30+00:00,t1_h05rmwd
Climatechange,comment,naturalization,inwi221,CptnCrnch79,,"The issue isn't the amount of carbon per se. The issue is that we're adding the carbon at such a rapid rate. Life requires stability to thrive.

In the past it took 10s of thousands of years to do what we've done in 200.",2022-09-10T20:48:44+00:00,t3_xaufiz
Politics,comment,naturalization,gbgrn8o,jtamale,,Van Jones straight up making me cry,2020-11-07T16:35:47+00:00,t3_jptq5n
PoliticalDiscussion,comment,naturalization,ibod993,bjdevar25,,"Most of the pay and benefits the largest employers offer (Walmart, Amazon, Target, Tesla) are not out of their generosity.  It is out of fear of being unionized.  If unions didn't exist, most hourly wages would be way lower than they currently are, and good luck with paid time off.",2022-06-09T00:45:01+00:00,t1_ibmyl6p
Libertarian,comment,Immigration,hp795pt,Carche69,,"Ok but in most states in the US, illegal immigrants aren’t eligible for welfare. Yet they pay taxes and contribute to the economy without receiving the same access to benefits as the rest of us do. So again, where is there a victim here, unless it’s the illegal immigrants themselves?",2021-12-19T19:14:31+00:00,t1_hp789s4
Libertarian,comment,Immigration,hwcvm4u,USAFmuzzlephucker,,"Actually what you described is what most libertarians would like to see in some modified form. ""Open Borders"" is a scary catch phrase that is grasped by the same people that clung to and insisted that ""Defund the police"" as ""getting rid of all police"". Open Borders and that portrayal of ""Defund the Police"" are vast over simplifications of the solutions that are actually being proffered. 

When people say what they are looking for is an easier and cheaper path to citizenship, not to break up families and an ""Ellis Island"" style entry system, people who don't want that say, ""OPEN BORDERS?! YOU WANT OPEN BORDERS?! GOD YOURE SO STUPID, THE WELFARE STATE WILL NEVER SUPPORT THAT!"" (never aknowledging that the welfare state is what they have a problem with, they are just blaming immigrants unfairly)

It's the same when people say the police state is vastly over funded, unfairly traget minority communities, provide uneven and disproportionate prison sentences, and are propped up by military equipment as well as an unsustainable budget for prisons that focus wrongly on PUNISHMENT and not REHABILITATION. Most police budgets could be slashed and that money out to better use in the community in the form of outreach, education, treatment and rehabilitation... But it's oversimplified to simply ""Defund the Police"" and people automatically tune out.",2022-02-10T12:10:59+00:00,t1_hwb4wya
PoliticalDiscussion,comment,Immigration,kaof7ct,Critical-Savings-830,,Lack of immigration doesn’t increase or decrease control.,2023-11-25T09:22:41+00:00,t1_kaof4dn
Politics,comment,citizenship,gelxon2,exoticstructures,,NY has like \~20mil afaik 8.4 is just nyc :),2020-12-04T16:32:44+00:00,t1_geliv6s
Politics,comment,naturalization,ikcr2yp,Hurrikraken,,"Hard upvote for yerp.

Plus you're absolutely right. Nature's growth is amazing and provides for everyone. Capitalist growth is a cancer on this planet.",2022-08-15T07:00:18+00:00,t1_ik96kqv
Politics,comment,citizenship,f7cma10,monkeywithgun,,"They lied again, imagine that.",2019-11-12T21:49:16+00:00,t3_dvgq74
Geopolitics,comment,consulate,kzh23qd,whawhales,,"Yes. Hopefully, it won't escalate further. The middle east is already under so much pressure as it is.",2024-04-14T01:44:50+00:00,t1_kzh1h20
Politics,comment,citizenship,g7dq6n1,rndomfact,,"It's how they'd get rid of political dissidents if they had the chance. 

All the POC who stick up and out would suddenly have dubious citizenships.",2020-10-02T08:02:17+00:00,t1_g7cdux9
Politics,comment,tourist visa,cxeq97v,BullsLawDan,,"Even if I accept your position, so the fuck what? 

The point of the article remains: acting like there's any significant chance that people seeking to flee their home country are going to hurt us is idiotic.",2015-11-27T14:43:55+00:00,t1_cxe28xk
Climatechange,comment,naturalization,kzpkkb7,hollisterrox,,"Coal mines produce a significant amount of methane as well, the right answer is always ""leave it in the ground""",2024-04-15T17:46:13+00:00,t3_1c4mbo1
Politics,comment,citizenship,jvkvklb,ReturnOfSeq,,Wild times when a Republican acknowledging the constitution is headline news.,2023-08-10T12:58:17+00:00,t3_15mnfnt
Conservative,comment,passport,gwjexy3,Com3dyAnimati0n,,Good for them. I don’t want anything to do with their bullshit vaccines. My immune system would take Covid’s lunch money.,2021-05-01T13:38:19+00:00,t3_n25uf4
Libertarian,comment,passport,h8lnu4e,TalionTheRanger93,,"Ohh. You seem to forget the TV people said voter ID is racist. So ya. Maybe you should just listen to the TV people more, and stop being such a sheep.",2021-08-12T00:14:39+00:00,t3_p2kye5
Neoliberal,comment,immigrant visa,fjw88po,envatted_love,,"Description:

> Reforming the immigration visa system is crucial for the future of the United States. In late 2019, Rep. John Curtis (R‑UT), supported by Gov. Gary Herbert, introduced a bill to create a state‐​based visa system. Curtis’s proposal adopts a major component of the Canadian immigration system: visas sponsored by individual states rather than the federal government. Under the legislation, the federal government maintains control over admissions, security checks, and other necessary criteria, while the state governments gain power to select individual migrants and regulate their activity within the state. Each state would get an average of 10,000 visas a year: 5,000 guaranteed for each state and an additional number assigned based on population.

> With the partisan gridlock that has characterized Washington politics for at least the past two decades, can and should states lead the way on immigration by utilizing a state‐​based visa system? Join the Cato Institute’s Alex Nowrasteh for a panel discussion with Representative Curtis and Governor Herbert for a policy deep dive on how state‐​based visas can reform our nation’s broken immigration system.",2020-03-08T03:02:05+00:00,t3_ff6eal
Republican,comment,Immigration,kwe73lm,BlacksmithDazzling29,,Unfortunately it didn’t happen to his family. What a piece of shit the Governor of Massachusetts is.,2024-03-24T21:10:28+00:00,t3_1bmoncj
PoliticalDiscussion,comment,Immigration,jhyn7mm,FizzyBeverage,,"You can take solace that most moderate dems have no particular interest in taking away guns.

I think in 2040 that tide may shift, but for now it's seen as a losing issue. They focus on abortion, it's easier to understand and more comprehensively hurts the GOP.",2023-04-27T19:58:14+00:00,t1_jhxzc1h
Politics,comment,passport,gwu8s5q,hippyloves,,Can someone explain what the difference is between a Vaccine passport and a Immunization card ?,2021-05-03T22:46:28+00:00,t3_n44p6e
Politics,comment,Immigration,kva44aa,Bigking00,,I have the feeling if Barrack was named John Smith it would have sent them over the edge.,2024-03-17T14:00:41+00:00,t1_kva2j6z
Conservative,comment,naturalization,j3u7gtd,StillWill18,,This is ridiculous.,2023-01-11T02:21:02+00:00,t3_108k9la
PoliticalDiscussion,comment,Immigration,kg51kn8,KoldPurchase,,[Barb wire](https://en.wikipedia.org/wiki/Barb_Wire_(1996_film)) don't cost too much.,2024-01-03T15:56:46+00:00,t1_kg3t86k
Politics,comment,Immigration,ke6lp10,OldDesmond,,Him not reading something is probably the most believable statement he’s ever uttered.,2023-12-20T14:31:18+00:00,t3_18msmh8
Conservative,comment,USCIS,f7v3ey5,mythrowxra,,"Nope, lose daca if you violate laws.",2019-11-17T19:51:16+00:00,t3_dxfxli
Conservative,comment,naturalization,kjp05fl,Cultural-Treacle-680,,Greta from Sweden is a nepo baby pretending to be austere.  Taylor Swift’s activism reminds me of her.  Granted I think Greta is at least means well more than most of the John Kerry’s and Al Gores.,2024-01-26T18:41:30+00:00,t1_kjokkwo
Geopolitics,comment,naturalization,kedybvi,RumbuncTheRadiant,,"Having spoken to some Russians who actually like Putin... I think the west is missing something.

Russians, with considerable historic justification, feel very threatened by the west. They love the fact Putin did way way more to ""Make Russia Great Again"" after the collapse of the USSR than Trump ever did for America.

I wouldn't trust Putin further than I could throw him.... but clearly he is one of the more intelligent world leaders. 

Don't get me wrong, I really don't like him, he is not a good guy, but in terms of current leaders in the world... he is probably one of the most competent. 

...but watching his actions of the decades I suspect he conflates the interests of Russia with his own.

So what is his ""exit strategy""? I'm not sure. 

Biden and Trump if they really cared about the US would have both stepped aside years ago.

The difference between Trump and Putin is Trump _only_ cares about Trump. 

Putin cares about Russia but believes what is Good for Putin is also Good for Russia.

We are cursed with that ancient curse.... we're living in interesting times.",2023-12-21T22:41:41+00:00,t1_kedmx18
Politics,comment,Immigration,kvnmb0d,tensinahnd,,I wonder which lobby is funding his next vacation,2024-03-19T23:27:50+00:00,t3_1biyjx8
