subreddit,type,keyword,id,author,title,body,created_utc,parent_id
Politics,comment,citizenship,faif5wv,sandwooder,,Will it include a question asking if you are being Jewish?,2019-12-11T23:19:36+00:00,t3_e9f1jz
Libertarian,comment,Immigration,kbhsmh2,Real_Calligrapher_22,,"Even if you are considered property by your parents, you should still be treated as a living being",2023-12-01T02:31:06+00:00,t1_kb5tj3g
Neoliberal,comment,Visa,hzgkyxt,WantDebianThanks,,"Update from my job doing content moderation for a social media company:

People continue to decide that an illegal war of aggression in which war crimes keep happening, civilians keep being murdered and gangraped, and civilian infrastructure is being shelled for no reason is the perfect opportunity to take out their irrelevant and often petty squabbles! Ukraine didn't vote to sanction your regional rival for building nuclear weapons (which I'm pretty sure would have been in the 70's or 80's, btw), guess should post memes demanding our government adamantly support Russia! Russia never started any wars in your country but the west did? [Better make sure to post memes about how this is all NATO's fault!](https://imgur.com/ii0J6jI) Hate American military activity in the middle east? Better post about how Obama is personally responsible for a million Syrian deaths so a few thousand Ukrainian deaths isn't anything to worry about (pretty sure there haven't been a million deaths in the Syrian Civil War, that Russia a combatant, and that *Syrians have agency in that war*). Haven't paid any attention to what's going on and want to blame America because it's clearly the only country with any agency? Well, *obviously* the whole war is because America has forced itself onto Ukraine and refused to negotiate with Russia! There have been reports of racial minorities being discriminated against while trying to flee? Guess it's a good thing the Russia's are in Ukraine to de-nazify it then! Want to talk about western hypocrasy? OK, then let's just mention a few wars the US has been involved in the last few decades and ignore any context so that that list can include Korea and Serbia. Also, as the Serbians will be happy to tell you, all Americans are colonialist, genocidal war criminals, so anyone they don't like must be doing a good thing, therefore, kill all of the Ukrainians.

And no matter what, make sure to include about Zelenskyy is the single most corrupt and incompetent human being ever, that this is his fault, and that he is destroying Ukraine

And this isn't even touching on all of the pieces of shit unironically circulating ""Ukraine is a nazi regime"", over the top antisemitism, or westerners who are incapable of criticizing Russia without *also* criticizing America/the West/Capitalism. 

I fucking hate people.",2022-03-05T15:29:50+00:00,t3_t73u0h
PoliticalDiscussion,comment,Immigration,go2t0kq,Silent-Gur-1418,,"They have also backtracked on a large number of very prominent campaign promises, the promises that were what motivated turnout.  While it may not be *fear* motivating them, that's how it will be spun.",2021-02-20T02:29:38+00:00,t1_gnx5x20
Conservative,comment,Visa,hah1l9e,G3twokegobroke,,It makes me sick,2021-08-26T20:57:27+00:00,t1_hags2bc
PoliticalDiscussion,comment,naturalization,gvwy087,kingjoey52a,,People are literally trying to put it on the ballot. It was supposed to be on the ballot last year but I think it got bumped for a technical reason. It is absolutely an active campaign to split up California.,2021-04-26T10:28:08+00:00,t1_gvwv6xw
Neoliberal,comment,citizenship,fcrbe08,n_eats_n,,true most dont some do. I know for myself it would influence a hiring decision. It shows that they were willing to put in a bit of extra effort. For the record I do not hold a PE or FE. Dont forget that the petro industry loves PEs.,2020-01-01T17:25:10+00:00,t1_fcqmbnw
Politics,comment,naturalization,kqv11hj,ArthurFraynZard,,"It's so damn sad when you encounter someone who still thinks ""if only they knew the real facts about Trump surely they wouldn't still support him!""  Like, you feel such sympathy for those people because they have such good kind hearts, but also some anger because such baseless extreme naivety puts us all in great danger.

*Of course* the KKKultists know the facts about Trump and exactly what he's about.  They don't worship him out of ignorance.  They worship him because they're irredeemably evil subhuman fucks, and Trump really genuinely does represent them better than anyone else in American history.",2024-02-17T17:03:42+00:00,t3_1at5hrc
Politics,comment,passport,e55r70j,ByronicAsian,,"Yea, the State Dept site was telling me non-expedited was gonna take 6-8 weeks but it just blazed through for me. ",2018-08-31T15:07:21+00:00,t1_e544uee
Liberal,comment,naturalization,cd0bjnt,partiallypro,,and many comments like yours come from similar ignorance.,2013-10-27T00:20:13+00:00,t1_cd088ky
Geopolitics,comment,Immigration,kcr774e,Crow4u,,Something something nuclear weapons something.,2023-12-10T11:31:28+00:00,t1_kcoaw4k
Politics,comment,naturalization,ikj26zm,I-goes-to-eleven,,He’s caution has caused irreparable damage. He’s a disappointment.,2022-08-16T15:17:32+00:00,t3_wpjusi
Libertarian,comment,naturalization,iad4khz,therelldell,,Amen to this THANK YOUUUU,2022-05-28T22:42:28+00:00,t1_iacpca6
PoliticalDiscussion,comment,Immigration,fs4t20q,seeingeyegod,,Gargamel's quote from the Smurfs intro?,2020-05-28T21:33:36+00:00,t3_grvfei
Politics,comment,naturalization,gc2dh9z,Khelek7,,Agreed. That headline seems misleading and overly innocent.,2020-11-12T17:45:40+00:00,t1_gc1tp23
Climatechange,comment,naturalization,l1tvld6,BusyWorkinPete,,"It’s actually Andrew McIntyre.  Nice to see you’re so willing to resort to the logical fallacy of shooting the messenger though.  I’m sure you’re completely open minded and willing to examine scientific findings in an unbiased way with an open mind, even if they conflict with your current understanding of the science, right?",2024-04-29T19:16:27+00:00,t1_l1tt9f2
Conservative,comment,naturalization,j1ar7n1,knotty1999,,"She called for it to be ""hard to be unvaccinated"". It now needs to be ""hard for her to practice medicine"".",2022-12-22T22:36:59+00:00,t3_zsuv50
Neoliberal,comment,naturalization,jlhc6xu,All_Work_All_Play,,"Your assumptions there are

A. voting pressure does not provide competitive pressures 

and

B. people's internal drive for excellence is weaker than their inherent laziness

Surely you know some people who are not ""coin operated"".",2023-05-24T21:23:35+00:00,t1_jlh97dk
Politics,comment,CBP,eveaabz,UOThief,,Can they just pass out the MAGA arm bands and skip all the pretense?,2019-07-30T04:19:33+00:00,t3_cjkqzl
Politics,comment,consulate,fz23sf9,miskoschiff,,I am sure many Americans are happy to come home and were expecting the order.,2020-07-24T04:23:27+00:00,t3_hwuy1s
Geopolitics,comment,naturalization,hovvu6w,Beat_Saber_Music,,"Yeah, the South American geograohy makes conflict quite awful to wage.

Only the former Bolivian coast and the Pampas have been cl flict hot spots, with the Bolivian coast region being pacified by Bolivia losing hard, while the Pampas I already explainwd on the post",2021-12-17T06:11:42+00:00,t1_hovd9wp
Neoliberal,comment,Immigration,kismrtk,AstridPeth_,,"Also, taco isn't originally American, which means the type of cultural entanglement we like",2024-01-20T21:27:54+00:00,t3_19bjroe
Libertarian,comment,naturalization,hkrpiq4,Master-Mycologist747,,Bwahahahah,2021-11-15T21:17:34+00:00,t1_hkrpfk6
Neoliberal,comment,citizenship,gkui1sh,DoctorEmperor,,"So in other words, the meme should go:

>“Wait, you’re saying immigrants *don’t* pose a threat to our society?!”

>“Yes! And I’m tired of pretending otherwise!”",2021-01-26T17:51:25+00:00,t3_l5e1jd
PoliticalDiscussion,comment,Immigration,jdoqrc9,Tired8281,,"So, you truly believe that anyone who says they want to make the world a better place, is lying?  That everyone, deep down in their heart of hearts, doesn't want the world to be a better place at all?  Is that true for you, personally?  Do you want the world to burn?",2023-03-26T00:21:26+00:00,t1_jdo3oes
PoliticalDiscussion,comment,naturalization,gcwdcd7,rwk81,,"You literally cannot trust the information coming out of China, use just about any other country as a comparison other than China.",2020-11-20T02:00:34+00:00,t3_jwu1fc
PoliticalDiscussion,comment,naturalization,hckpmhj,bronzeaardvark,,"Whether or not this was a subtle condemnation of the incident at the Capital (even the FBI doesn't consider it an insurrection), my biggest issue is the difficulty of finding domestic terrorists. A strategy that helps ""expose"" these terrorists is basically to get someone to rile their online forum up, collect evidence, and stand them in front of a judge and talk about how they saved the country from another 9/11. Which begs the question, are they stopping terrorism or making it?

If we look specifically at the events that started in the summer of 2020 to the present I notice in the comment section that there is an exclusive concern that the far right will be the source of domestic terrorism. I don't remember seeing the proud boys/Qanon/etc burning down small businesses, shooting someone who doesn't share their political beliefs, and launching fireworks at liberal rallies in DC. In fact I can't remember any time where the right went out to disrupt left-leaning political rally. It's not like these attacks are coming from one side of the political spectrum.

Should be we concerned about domestic terrorism from the far right like white nationalists and QAnon? Absolutely. Is the threat of domestic terrorist mostly from the far right? I'd have to disagree. Even though these sources are coming from the FBI I'm willing to bet they're using methods exactly or similar to what I typed in the first paragraph to make that conclusion and they could be exclusively monitoring these groups as well. If they went out and targeted groups like Antifa they'd probably get similar results.",2021-09-12T15:53:33+00:00,t3_pmgr93
Libertarian,comment,citizenship,i1yzp90,aelwero,,"Your comment has some very sketchy undertones to it...  I don't believe that's intentional at all, because I'm generally an optimist about that kinda thing, but it's definitely there.

What kind of differently abled are you alluding to?  And if we changed the hypothetical trait from race to party affiliation, would your comment still be the same?

IOW, if the hypothetical is that they used the ability to establish standards in order to oust people of a specific party affiliation, that's very obviously inappropriate.  Is that saying the same thing you're saying?",2022-03-24T19:43:24+00:00,t1_i1yxxzi
Politics,comment,Immigration,kp7h90v,BabyFestus,,"""For the purposes of this case, former President Trump has become Citizen Trump...""

\*chef's kiss\*",2024-02-06T17:53:37+00:00,t3_1akcm4e
Republican,comment,naturalization,kv5y1f8,AutoModerator,,"/r/Republican is a partisan subreddit.  This is a place for Republicans to discuss issues with other Republicans.
To those visiting this thread, we ask that unless you identify as Republican that you refrain from commenting and [leave the vote button alone](https://www.reddit.com/r/MetaRepublican/comments/5t017a/this_sub_is_for_republicans_if_you_do_not/). Non republicans who come to our sub looking for a 'different perspective' [subvert that very perspective with their own views when they vote or comment.](http://i.imgur.com/XqL0wfR.jpg)

*I am a bot, and this action was performed automatically. Please [contact the moderators of this subreddit](/message/compose/?to=/r/Republican) if you have any questions or concerns.*",2024-03-16T17:32:01+00:00,t3_1bgbeff
PoliticalDiscussion,comment,naturalization,kpn9ece,baxterstate,,"The way to solve it is to use the method the IRS uses to achieve “voluntary” income tax payments.

Every now and they audit someone and if they haven’t paid their taxes make their lives a living hell. Freeze all bank accounts and credit card accounts and garnish their wages. Never happened to me, but I knew someone to whom it happened. Obviously, the IRS hasn’t the manpower to audit everyone, but most people know someone who’s run afoul of the IRS; it’s fear of the IRS that results in most people voluntarily paying.

Enforce littering laws to the max, publish their names and addresses in public media. Then anyone else will fear the consequences. Right now there are no consequences.",2024-02-09T15:28:40+00:00,t3_1amcems
Conservative,comment,citizenship,j9k80d5,neverending_debt,,"The stuff I mentioned comes up with a google search of her name.  

So given a more full picture, do you believe that she should be allowed back consequence free and given access to the better life she denied to others?",2023-02-22T16:21:26+00:00,t1_j9k7oja
Libertarian,comment,passport,gwiul0z,ChaddestChaddington,,They should fine the CEO instead,2021-05-01T09:00:56+00:00,t3_n25ucz
Libertarian,comment,naturalization,hqpwd4a,Daneosaurus,,LLCs make a ton of sense for small businesses,2021-12-31T19:45:23+00:00,t1_hqprrlq
Climatechange,comment,naturalization,kvocetd,Queasy_Fall5326,,"If being a “denier” means one who thinks, or one who doesn’t follow the hysterical crowd, than I am proudly one. The weather where I live is the same it’s been for y0 years. The water level at our dock is the same too, after 70 years. And there’snreally nothing to worry about. Sorry if you’re disappointed that the end isn’t neigh, but there it is;\]",2024-03-20T02:14:32+00:00,t1_jvprfa0
Liberal,comment,naturalization,ekskzit,mjhrobson,,"Your problem is you think information changes minds. I assure you it does no such thing...

Consider the shift in mainstream shifts in views on homosexual marriages. The facts of the matter haven't changed over the years what changed is people coming out. Now when most people think of gay marriage they actually have a narrative in place. It is no longer no body that they are stopping from getting married, it is Peted and Jim from down the street and those guys are bad guys my kids can go swim in their pool? They obviously should be allowed to get married. What shifted mainstream opinion on homosexual marriages was that sort of thing, it was actually meeting gay people having dinner with them and doing normal day to day stuff around/with them.

The thing is if I had stayed within the Catholic community I would have probably found a partner (a wife whom I love). Now I have some people on the internet calling me sexist, what do you think I do? I would go to my wife and asked her ""babe I am sexist?"" Now she is a Catholic or similar, she says to me ""No don't be silly"" (or something similar). This then tells me everything I need to know about your information. It will do NOTHING.

As with shifts in views on homosexuality people need a story to attach their views to. You want to change minds there is ONE way... inviting people to do everyday things with you. As what happened in the feminist reading group to me. Here I see not ""femi-nazi harpies"" or whatever negative slur you think, but I see Lisa, Julie, Kathy my friends who are human beings.

This is why early movements in feminism used mothers, sisters and daughters in the rhetoric around the activism. Do I hate my sister, do I think my daughter shouldn't have the right to vote. Is my mother stupid, etc... and that narrative was ultimately undeniable with respect to getting the vote. Of course my sister should be allowed to vote. I have a daughter, of course she should get a good education. But the sad reality is you have present information as inviting narratives. Without that you're not changing minds more than they have been.

Most people are going, but women have the right to vote. A rich white dude thinks about his daughter studying to be a doctor (or something)...You cannot tell him with information he is sexist. He does not see how that could be. You have to give him a narrative he understands involving people he identifies with. This is how people are. 

Information availability is nothing.",2019-04-13T13:00:03+00:00,t1_eksighw
PoliticalDiscussion,comment,naturalization,isaui89,Skeptical0ptimist,,"If the concern is really about incapacity of politicians at old age, rather than discussing 1 time retirement of an office holder, we should have a general discussion of age limit in all federal offices.  Should SCOTUS, VP, Speaker of the House, etc.  Some of these offices are in the line of succession, and would have to assume the top office in moments of crisis.

If one tries to confine discussion to this one special case, I don’t think one can avoid the perception that the motivation is not based on the concern of the country as a whole.",2022-10-14T15:39:48+00:00,t1_is9itk0
Climatechange,comment,naturalization,kw4y6x7,Illustrious-Ice6336,,"Sure.  In the US let’s convince he population to live as those do in developed worlds.  Don’t use a car. Eats beans, rice, live in small simple homes.  Never gonna happen.  Rich folks live like the poor in the US and give your resources to others.  Republicans who fight science, vaccinations for COVID and anything else now, climate change is a thing to let Hillary, Obama, Biden, take power etc.  5g towers cause cancer.",2024-03-23T01:26:36+00:00,t1_kw3w4zq
Conservatives,comment,citizenship,kfpsu2n,amibugnu3,,"What is cps? Child Protective Services? Pardon my ignorance, but what is wrong in that department? I don't hear it mentioned much.",2023-12-31T16:48:20+00:00,t1_kfd0znc
Politics,comment,naturalization,g2wgoej,Indigoh,,Using a presidential pardon as a campaign tool sounds illegal.,2020-08-26T11:54:05+00:00,t3_igx0ah
Politics,comment,passport,haqizb2,Jorycle,,"You can get a vaccine and an ID card literally for free, at just about every corner pharmacy or grocery store at this point.

The same is not true for the type of IDs required by the criticized voter ID laws.

Let's keep our equivalencies equivalent.",2021-08-28T22:36:39+00:00,t1_haq1mwe
PoliticalDiscussion,comment,citizenship,h8bnghn,LittleBitchBoy945,,"Amen to that, what an exciting time to be alive. The biggest progressive legislation in half a century at least is being passed. And this time without a Vietnam blunder lol",2021-08-09T19:41:06+00:00,t1_h8bn5jx
PoliticalDiscussion,comment,naturalization,jnevxtm,no-mad,,What is sad and hilarious is these guys only have a shot if Trump is out of the picture. They have to appear supportive while praying to god he is indited. DeSantis is windmilling. Its like saying he will be tough on Space Aliens if they try to take our jobs. It is a nothing burger. He has nothing to do with extradition to another State. It is a Federal matter covered under The Constitution. If he tries to stop them he will be in jail.,2023-06-08T16:31:04+00:00,t3_143liyj
Neoliberal,comment,Visa,l5a3tph,PandaLover42,,"What I’ve learned from this sub from the last couple days is that rules-based order is when you use any and all *rules* you can against Israel to *order* it around and then say that’s *based*.

Yes, this sub has quickly lost its collective mind regarding the I/P issue after these past couple months.",2024-05-23T04:46:58+00:00,t1_l56hjyq
Neoliberal,comment,Immigration,ki0o3i4,CricketPinata,,"Where are English speakers having difficulty functioning?

The amount of people who speak english less than 'very well' is in the single digits. 

Their children learn it immediately since they are fully immersed in it in their education. 

I have to deal with a lot of non-english speaking delivery drivers since cabbies and delivery drivers are still easy jobs for new immigrants to get. 

They all have google translate out on their phone and type out their needs if they have a question or a specific request for us. 

The kitchen knows enough basic Spanish to make most of that unnecessary. 

We have universal translators in our pockets, it causes about as much issue as a deaf person typing or writing out requests or notes for me, as in it causes no issues and it fairly rare.",2024-01-15T20:34:31+00:00,t1_khzhm22
PoliticalDiscussion,comment,SSN,c8eecu3,Outlulz,,">Get rid of the backscatter body scanners in airports--and preferably the millimeter wave ones as well.  
  
There's too much money lobbying for these to ditch them.  Being perceived as not tough on terrorists is also a bad political move.",2013-02-13T09:15:28+00:00,t3_18ebd8
PoliticalDiscussion,comment,Immigration,iqc9hk8,Helphaer,,Ehhh that's one excuse but it doesn't influence as many countries as companies want to claim. For some reason mass price gouging is occurring and apparently no laws exist to stop it that are enforced.,2022-09-29T07:22:52+00:00,t1_ipzjtqv
PoliticalDiscussion,comment,Immigration,h6yc27y,PsychLegalMind,,They had to give a reason when the court had no problem with the vote registration from 70's formula for decades and most recently it was just fine under the Bush administration. Court rejected what the Congress had no problem with. We now know how valid the formula is considering what happened since.,2021-07-29T13:25:17+00:00,t1_h6xrvim
Politics,comment,CBP,esygas6,456afisher,,"  Not to mention that 3 people were detained and jailed over night in a new children's facility just outside Carrisco Springs, Texas.",2019-07-05T16:12:42+00:00,t3_c9fyhk
Politics,comment,citizenship,gem97ed,mittensofmadness,,"I was surprised ""people who vote for them"" wasn't on the list as well.",2020-12-04T18:03:41+00:00,t1_gelbgha
Libertarian,comment,passport,h8m6dlh,RogueThief7,,Fun fact: The only 2 nations on the planet which don't currently impose voter ID is the US and Australia.,2021-08-12T04:11:05+00:00,t3_p2kye5
Politics,comment,green card,ecvlr45,Argos_the_Dog,,"Didn't Trump's grandfather flee the Kingdom of Bavaria to avoid military service? Draft dodging, a family tradition...",2018-12-30T15:46:20+00:00,t1_ecvjaqh
PoliticalDiscussion,comment,naturalization,hv38cti,Bshellsy,,"That’s impressive, maybe it’s being a New Yorker but I don’t know anyone with less than a $2000 deductible",2022-02-01T03:58:11+00:00,t1_hv385ci
Democrats,comment,Visa,dmoamgy,Berserkr1,,Prevent any new illegal immigration obviously and give the millions here (who have been here for many years) a path to citizenship so they can start paying taxes. In that path to citizenship they should be properly vetted. That is my opinion. ,2017-09-07T06:27:42+00:00,t3_6ykgy4
Politics,comment,passport,ejzpagw,cooneyes,,Very legal and very cool.,2019-04-03T01:10:25+00:00,t3_b8r15y
Libertarian,comment,Immigration,gtu9fbv,StrangleDoot,,you're a republican.,2021-04-08T18:32:50+00:00,t3_mmy50g
Politics,comment,Immigration,kf5atrv,PhalanX4012,,"See guys? He doesn’t even know enough about Hitler to be doing it on purpose, he just sounds like a genocidal dictator by accident!",2023-12-27T17:28:51+00:00,t3_18s3tpx
Libertarian,comment,naturalization,hk4lr9r,The_True_Libertarian,,"Go from 400ppm to 1200ppm in your greenhouse on 2 separate days with similar outdoor temperatures and cloud cover, and check the temp inside the greenhouse without some other form of air temp control. That's the issue people are trying to bring attention to, not that CO2 itself as a chemical is bad.",2021-11-10T22:29:22+00:00,t1_hk3mtnz
Climatechange,comment,naturalization,k0bn0n1,zen88bot,,"They might be right.

Almanacs going back a couple centuries can verify climate changes",2023-09-12T22:15:33+00:00,t3_16grmzm
PoliticalDiscussion,comment,Immigration,g7ldemy,tutetibiimperes,,"I wouldn’t want a ‘voting eligibility’ question.  For some people such a question would seem like a potential trap and make them less likely to respond, leading to inaccurate results.  I would support a constitutional amendment allowing permanent US residents who aren’t citizens to be able to vote, but I don’t see that happening.",2020-10-04T01:31:42+00:00,t3_j4hfc4
Politics,comment,immigrant visa,drasru4,BUNKBUSTER,,Was Trump the guy picking the McDonalds monopoly winners for years or was that another criminal?,2017-12-15T18:20:05+00:00,t3_7k1he7
Climatechange,post,naturalization,159d04f,screendoorblinds,Warning of a forthcoming collapse of the Atlantic meridional overturning circulation - Nature Communications,,2023-07-25T16:15:37+00:00,
Politics,comment,CBP,fdravcj,NoKidsItsCruel,,"> The smell is like a thousand rotting corpses,” one homeowner told a reporter after a vulture colony set up shop at a South Florida country club, forcing the family to leave their $700,000 vacation home.

Aww, life's tough.",2020-01-10T18:44:51+00:00,t3_emv7g6
PoliticalDiscussion,comment,naturalization,h0yi661,PsychLegalMind,,">doctor but they’re against universal healthcare. Etc. Et

Not that long, but have always taken an interest in learning. I always thought of them as the party of the very rich and corporations. A party that liked wars and cutting taxes for the rich. This was based on actions I observed, I concluded they were anti-Blue collar; anti-veterans except for when they were sending them to wars in foreign lands. They have opposed basic healthcare; whenever they can they have cut benefits to the very poor. Blaming poverty on them instead of lack of opportunities. They even went so far to discuss cutting back school lunches for the hungry kids. 

I could have easily been a Republican if I thought only of myself and some monetary gains; but after the last 4 years; it will not happen even if I lived to be a hundred years. We have to take care of those most vulnerable in our society, the kids and the elderly, the poor and the disabled. I am a Moderate Democrat, but after the recent stunts by Republicans; even AOC is starting to sound better than the best of Republican Leadership.",2021-06-07T21:30:38+00:00,t1_h0y9mgx
