subreddit,type,keyword,id,author,title,body,created_utc,parent_id
Conservative,comment,citizenship,hw07mpv,Wtfjushappen,,Can't wait until she is confronted with subverting that was tolerated in California but not in China.,2022-02-07T22:42:23+00:00,t3_sn31iw
Politics,comment,naturalization,hl16404,ExcitedFool,,Did Bob Good just say the media cares about the video?  I'm pretty sure they care about Gosar getting censure.  weird statement,2021-11-17T20:28:09+00:00,t3_qw4ouu
Politics,comment,passport,hibeb0p,saltyleftist,,"The old wisdom that was borne out of the West was forsaken. Kings made tombs more splendid than the houses of the living and counted the names of their descent dearer than the names of their sons. Childless lords sat in aged halls musing on heraldry or in high, cold towers asking questions of the stars. And so the people of Gondor fell into ruin. The line of Kings failed, the White Tree withered, and the rule of Gondor was given over to lesser men.",2021-10-27T23:58:36+00:00,t3_qh1zfa
Neoliberal,comment,Visa,jqqsqa8,groupbot,,"Pinged IMMIGRATION ([subscribe](https://reddit.com/message/compose?to=groupbot&subject=Subscribe%20to%20IMMIGRATION&message=subscribe%20IMMIGRATION) | [unsubscribe](https://reddit.com/message/compose?to=groupbot&subject=Unsubscribe%20from%20IMMIGRATION&message=unsubscribe%20IMMIGRATION) | [history](https://neoliber.al/user_pinger_2/history.html?group_name=IMMIGRATION&count=5))


[About & Group List](https://reddit.com/r/neoliberal/wiki/user_pinger_2) | [Unsubscribe from all groups](https://reddit.com/message/compose?to=groupbot&subject=Unsubscribe%20from%20all%20groups&message=unsubscribe)",2023-07-05T11:23:44+00:00,t1_jqqspsc
Libertarian,comment,passport,gszmhly,TheSelfGoverned,,"60%+ of medical staff are antivax.

I was congratulated by both nurses and my doctor when I refused vaccinations for my newborn.

Odd that we ignore their advice, and instead trust politicians and Bill Gates.",2021-04-01T02:56:32+00:00,t1_gsy00gm
Conservative,comment,citizenship,g9x0iap,AIDS-Sundae,,Probably even set you up with healthcare and education. And free housing while we’re at it! Welcome to America make sure you vote blue!,2020-10-24T14:58:41+00:00,t1_g9x09ts
PoliticalDiscussion,comment,Immigration,kjt0sj5,Away_Simple_400,,Apparently you’ve never heard of executive orders. Biden immediately ended trumps remain in Mexico policy.,2024-01-27T13:57:15+00:00,t1_kjqyx5m
Politics,comment,Visa,gopt1pq,Hunterrose242,,"It took him over a *month* to do this.  The failures of this administration, I tell you.",2021-02-25T15:49:51+00:00,t3_ls5wfm
PoliticalDiscussion,comment,naturalization,hexidci,LittleBitchBoy945,,"I hope he can be negotiated upward but if 1.5 were to be the final number, I’d recommend progressives reluctantly accept it and make sure everything in the bill are provisions that can begin immediately so that the effects are extremely clear by the midterms.",2021-10-01T02:43:15+00:00,t3_pyx4j4
Libertarian,comment,Visa,ct2q09l,Shamalamadindong,,They just invaded an extra 2km.,2015-07-14T08:27:16+00:00,t1_ct2p0wi
Libertarian,comment,passport,h8okg33,TheAzureMage,,"Just because two different records both have your social security number in them doesn't mean there's any good way to correlate the two. 

For instance, your taxes are typically for the prior year when you file. If you have moved, you may be paying taxes to a different state than where you'll be voting this year. This would affect a pretty decent amount of people.

It also wouldn't necessarily identify you correctly for districts smaller than state level. Typically, this is town, county, school district, and districts for both US and state senators and reps. 

And those things often aren't things that can simply be assumed from a zip code, either. 

The overall electoral system is fairly complex, and just knowing what state someone paid income taxes in is almost entirely unhelpful for getting them set up for voting.",2021-08-12T17:58:04+00:00,t1_h8mnzta
Politics,comment,green card,ddnmptw,ByWillAlone,,"There are a lot of other comments claiming the punishment is too harsh because she didn't know she wasn't allowed to vote, but it sounds like she knew exactly what was legal, and then did the opposite after it didn't work. It sounds like she is guilty... and shame on the registration process for not having any minimal checks to prevent this.",2017-02-12T18:30:18+00:00,t1_ddn99rv
Libertarian,comment,Visa,c9kqas1,libertarian_reddit,,This is wrong just so everybody knows. The borders should be free and open.,2013-04-23T03:37:49+00:00,t3_1cv9fx
Libertarian,comment,passport,gsuhy7m,TreginWork,,It sure is little buddy,2021-03-30T21:32:28+00:00,t1_gsuhwyp
Liberal,comment,immigrant,e4cly1r,trumpisstillacuck,,"Wrong sub bro! Also, he was hand picked by the Kochs. Also, Trump hates America.",2018-08-17T12:50:24+00:00,t3_981qil
Libertarian,comment,citizenship,e8rf6i5,rchive,,"Republican is a party, not an ideology. You can be a libertarian (ideology) and be a member of the Republican Party. ",2018-10-31T00:46:00+00:00,t1_e8qfqjc
Neoliberal,comment,naturalization,ki5640j,SportBrotha,,"Yes, I completely agree. I think it's probably silly to look at land as being perfectly inelastic, I was just trying to explain how I understood one of the above comments. I think, in addition to zoning and institutional issues, technology can also effect the supply of land. i.e. in 1700 if I want to buy land which I can use to commute to the nearest city centre, I need to buy quite close so I can walk or ride a horse there, but after the invention of trains, automobiles or even elevators in highrises, I can now buy land further away from the city centre without it being less convenient. It's as if the supply of available land has expanded. For all intents and purposes, if I want to live and work in or near Toronto, I don't care how much land is available in northern Ontario, but institutional and technological changes can absolutely expand my available options near or in the city.

Also there are probably substitutes to buying more land i.e. building taller buildings to gain more floor space on the same plot of land.",2024-01-16T16:37:16+00:00,t1_ki4kyhw
Geopolitics,comment,Immigration,l69dc77,SpecialistLeather225,,"Overshadowed with the May 19 helicopter crash that killed the Iranian President and Foreign Minister, was the reason why they were visiting the region in the first place. They announced the start of a large cross-border project, which presumably is part of a broader deal. Azerbaijan is a regional foe of Iran, and a strategic ally of Israel. Or at least they were?

[https://www.intellinews.com/iran-azerbaijan-open-border-hydro-dam-on-shared-river-325884/](https://www.intellinews.com/iran-azerbaijan-open-border-hydro-dam-on-shared-river-325884/)",2024-05-30T01:00:38+00:00,t3_1d3n9me
Conservative,comment,passport,ihdhfgq,TheGame81677,,"They’re wearing them like crazy in my area, don’t know why.",2022-07-23T22:01:56+00:00,t1_ihdez28
Neoliberal,comment,Visa,k5dwh2k,novelboy2112,,Hamas doesn't backtrack because they know people are going to believe them at face value anyway.,2023-10-18T10:56:32+00:00,t1_k5dspbg
Conservative,comment,CBP,hyc0560,AmosLaRue,,">the Biden administration is seeking to divert Customs and Border Protection officers from the southern border crisis to an overseas conflict, this time to help process people fleeing the Russian assault on Ukraine.

I thought Biden said all those people were on their own for evacuation. Biden is such a fucktard",2022-02-25T03:10:11+00:00,t3_t0hnej
PoliticalDiscussion,comment,Immigration,gvy1luo,androuglas,,"Obama, Biden, and Clinton are not on the left of the Democratic party. The left of the party includes people like Sanders, AOC and the rest of the squad, and maybe Elizabeth Warren (though she is less ""left"" than the others). Clinton, Obama and Biden are all centrist/establishment Democrats, the side of the party that is further to the right.",2021-04-26T16:24:57+00:00,t1_gvwh1vp
Politics,comment,citizenship,jpnv4h5,YourUncleBuck,,I was always confused how I knew more about America than my American born classmates.,2023-06-27T00:48:05+00:00,t1_jpns6xg
Conservative,comment,naturalization,k0qtr62,Kered13,,Who was the first?,2023-09-15T20:07:36+00:00,t1_k0qjipk
Politics,comment,passport,e537ggm,onwuka,,"Nice citizenship test there. 

Official: I don't know if you're a US citizen... 

US Person: I'll ducking sue you. 

Official: Ah, yes. Welcome home. ",2018-08-30T10:44:27+00:00,t1_e5352oi
Climatechange,comment,naturalization,jkllr2x,iamasatellite,,"Probably better to get an EV if you want to be totally optimal (it puts this ICE vehicle into someone's hands who wants one, instead of someone buying a new ICE which proabably causes an extra ICE to be built at some point...).

But like.. don't ruin your finances for a minimal effect in the grand scheme of things. Make your next car an EV when you actually need a new one.",2023-05-18T05:20:40+00:00,t3_13kmaj8
PoliticalDiscussion,comment,naturalization,kufwuk1,No-Scientist7422,,"In 2000, disgruntled progressives, unhappy that their concerns were not being addressed quickly enough, sat out the election or voted third party to teach the Democrats a lesson. The result was the disastrous Bush administration.

In 2016, disgruntled progressives, unhappy that their preferred candidate had been rejected by the party, sat out the election or voted third party to teach the Democrats a lesson. The result was the even more disastrous Trump administration.

In 2024, disgruntled progressives, unhappy that their preference for the Palestinians over the Jews is not being addressed adequately by the Democrats, may well sit out the election or vote third party to teach the Democrats a lesson. The result may be the end of American democracy.

I don't want to blame the progressives (I'd much rather blame the Republicans who have essentially abandoned democratic principles and gone over fully to the Dark Side) but the handwriting is on the wall and the progressive wing of the Democratic Party does not appear to have learned from past debacles. If they had held their noses and voted for Hillary in 2016, we'd have a $20 minimum wage and Medicare for All. If they'd done the same thing in 2000 for Gore, we'd have atomic-powered flying cars and colonies on the Moon.",2024-03-11T23:09:33+00:00,t3_1bakyaa
Politics,comment,green card,ecvig1z,7point7,,This doesn’t seem like the most reliable source...,2018-12-30T15:02:14+00:00,t1_ecvhlry
Politics,comment,passport,e5dl92p,Garbolt,,"Americas history has almost always been like this in some regard. Be it justification for enslaving people, or cause to go to war with others, america has always hated and has always been vicious towards anyone not white. Look what happened to the Japanese Americans that never spent a day out of America in their life. Some were straight executed on the spot for no reason. They were corralled and thrown into camps just like the nazis did to the Jews. America has always been bigoted. Maybe for a small time period in the 90s and 2000s it wasn't horrible, but really it's always been pretty racist. Everywhere non liberal you can almost guarantee in America is not a place you want to be if you're black, or spanish. 

This is anecdotal but I used to live in New Salisbury Indiana 20 years ago. A black family moved in our town because the father of the 3 kids, who were amazingly educated by the way, way more than the hicks in the town had a job managing the factory there. Every Sunday there was at least 40 people outside their house. They weren't doing anything in the daylight, just standing at the edge of the property intimidating the family. The kids got attacked by the other kids every single time they left the property or went to school. The other parents even tried encouraging me to  get in on it. At the time I was 19, and the cops there were already looking the other way when 20 year olds were beating on these 5th grade to 8th grade kids. I never did, always thought those people were fucked up, even though I loved them, grew up with them I knew they were intolerable people and that I couldn't be around them. They would set parts of their property on fire. One night a guy purposefully crashed into the father's car driving home. With a bucket truck and damn near killed the man. The police took 10 minutes to get there, then another 10 to even start helping the guy off the ground. They wouldn't let anyone get near them, so I ran to the payphone and called 911. I even asked if the officers had already called and they said they had not received any calls for the ambulance in the last 2 hours. So I knew that they had lied when they said they called the ambulance for him. When I got back to the scene he was on his back dragged off to the side on the sidewalk and they were sitting by the patrol car, one of them smoking on a cigar. They yelled st me when I asked the man if he was alright. 

Not only where those people racist, but they were actively attempting to kill this man AND his family because he was black. He was really well kept, he was educated, worked hard and smart. Very nice, religious and they still didn't accept him. He was black. He needed to be removed. Plain and simple. These are the same people to claim to be real Americans, to be the embodiment of America. These are the people who think they are the only true Americans anymore. The supposed followers of christ. Lovers of all. In my experience this has been true in most areas like my home town. Off grid farm country, back wood stix kind of place, almost always racist in some way. Well, back then anyway, I haven't been up that way in little over 20 years. ",2018-09-04T14:29:42+00:00,t1_e5d9vv1
PoliticalDiscussion,comment,citizenship,csvv8yq,sshhhentrepreneur,,Yes on H1-B. and NO!,2015-07-08T04:42:31+00:00,t1_csvu2t9
PoliticalDiscussion,comment,consulate,c67503q,bartink,,"This is a problem of religion too, folks. Look at the absurdity of what they were upset about. If this had been a film mocking Christ and being blasphemous against Christianity or any other religion in the world, you would not see this response.",2012-09-12T15:53:36+00:00,t3_zrh8b
Politics,comment,naturalization,fzczmmf,Sweaty-Budget,,"Clinton’s lead in 2016 is really not comparable to Biden’s currently. She was at +0.2 as of today in 2016, Biden’s at +9.1 ...",2020-07-27T01:30:38+00:00,t1_fzckame
Conservatives,comment,immigrant,kvxc58r,bigby2010,,"Have fun in prison, ese",2024-03-21T18:24:20+00:00,t3_1bkdbrj
Conservative,comment,Visa,iov9lgn,SealTeamFish,,"If you would of asked this question 10 years ago i would have told you generally speaking it wouldnt be bad for the us other than telling the world that breaking the law has no consequences.  Also, i do believe there would be a negative impact on the poorer communities if done but this is debatable.

Today is a different story.  The open border is now a political pawn the Democrats are using to change the outcomes of future elections.  They believe if they can get enough in and then give them amnesty they would control that community's vote for the years to come.  Democrats are using these people to solidify their power for future elections and they don't care how many die to make it happen.  Evidence by the US now having the deadliest border in the whole world...",2022-09-18T01:05:20+00:00,t3_xgz2db
PoliticalDiscussion,comment,Visa,cfurzf9,uncannylizard,,Just wait.,2014-03-05T05:50:00+00:00,t1_cfuqt29
Libertarian,comment,naturalization,l3y9hmj,deltavdeltat,,"We have mutual aid agreements with jurisdictions throughout the state. However, in my county, one district is also a city department. One particular truck was purchased with city tax money and it isn't allowed to go on calls in that district or other country districts. Only city use. ",2024-05-14T03:17:13+00:00,t1_l3xtbqx
Libertarian,comment,Immigration,hqkb91i,imjgaltstill,,"> For example, I 100% want universal health care in the US. Every other first world country has it.

Appeal to common practice is a logical fallacy. Having others pay for your healthcare is not remotely libertarian. 

>For me, it means the freedom to receive health care without going into massive debt

Once you begin the mental gymnastics to justify healthcare anything is possible.",2021-12-30T16:44:45+00:00,t1_hqjp4w1
Libertarian,comment,passport,h7xk5qc,notoyrobots,,"> Sputnik is better than AZ or J&J!?

Is this a statement or a question? Spuknik doesn't have a plethora of data on the variants one way or another.

>Now you're below 80% and not over 90% anymore for the best vaccines. 

Which is again, semantics. It prevents hospitalization in the vast majority of situations.

>But if that's the case, how can someone be for mandatory vaccines for young and healty?

I'm not arguing that, I believe it should be up to businesses if they want to serve unvaccinated people or not. 

The practical reality of why they are mandating everyone is because of spread (and to your point on that, vaccinated people infect others at a dramatically reduced rate, so you can't just handwave that away) and because the more you make the rule specific on age/comorbiddities/etc the likelyhood of non compliance due to feeling singled out increases.",2021-08-06T13:19:35+00:00,t1_h7xipde
Conservatives,post,naturalization,qdnxf6,RedBaronsBrother,Lancet COVID Origins Investigator Wins $1 Million Chinese Prize For Claiming Virus Developed Naturally,,2021-10-22T19:08:24+00:00,
Libertarian,comment,passport,gm2x7ho,PM_ME_SPICY_DECKS,,Covid also causes permanent respiratory damage,2021-02-05T04:38:57+00:00,t1_gm1ighp
Democrats,comment,naturalization,diyd9ll,VegaThePunisher,,That is not required. No where in the Constitution does it say a declaration is required. ,2017-06-15T20:14:01+00:00,t1_diyd5eu
Politics,comment,Visa,ip9th72,Hrmbee,,">U.S. District Judge Tanya Chutkan granted a preliminary injunction overturning a policy announced last year by U.S. Customs and Border Protection officials that barred Mexican visitors from participating in what had become a multibillion-dollar business along the border.
>
>Judge Chutkan ruled that CBP officials had “failed to consider” the extent to which blood plasma companies were relying on Mexican donors and that they had failed to adequately justify the policy.
>
>In issuing the preliminary injunction, the judge found that the companies had shown they had a “likelihood of success” to overturn the ban if the case went to trial. She noted that the costs of opening collection centers in other regions to make up the shortfall — $2.5 million to $4 million per center — would be “substantial.’’
>
>A spokesperson for CBP declined to say whether the agency planned to appeal the ruling, saying “this matter is still under litigation.”
>
>U.S. officials had long acknowledged that the role of Mexican citizens in the blood plasma business along the border was a “gray area”in immigration law, with some Border Patrol agents refusing to let people enter the U.S. for donations while others allowed it.
>
>Many people living on the Mexican side of the border hold visas that allow them to come to the United States to shop or visit relatives. After the CBP imposed its ban, they risked losing those visas if they were caught selling blood plasma.
>
>...
>
>Some donors interviewed by ProPublica said they would welcome the legal clarity provided by the court decision. “Finally, we can cross without fear,” said Gamaliel, a resident of Ciudad Juárez who previously told his story of being a donor. “It was always so risky.” Nevertheless, he said, he would still only go back to donate in case of a financial emergency, because of the health risks associated with frequent plasma donations. As ProPublica and ARD found, frequent plasma donation was harming the health of some Mexican citizens who relied on the system for money. Some frequent donors were underweight and showed low levels of antibodies.

For me, there's a lot to unpack here. On one hand, having clarity at the border is only fair, and should be implemented post-haste. On the other hand, having critical parts of the healthcare system relying on those in financial need sacrificing their health to make ends meet is also deeply disturbing. I don't know if there is a good way forward from this, but at the very least there should be a clear and consistent system at the border in place.",2022-09-21T01:15:45+00:00,t3_xjqh29
Politics,comment,naturalization,g3xzvxz,FuftyCent,,I’m not “defending” anyone.  What in the hell are you talking about?,2020-09-04T03:31:39+00:00,t1_g3xt7bz
Healthcare,comment,I-485,fkpem4e,WeCanBreakTheseCuffs,,Source?,2020-03-17T01:24:32+00:00,t1_fkpeiyk
Politics,comment,green card,dt1itip,insignificantsecret,,"""Niec reportedly pled guilty to the charges under the Holmes Youthful Trainee Act, which helps young first-time offenders keep charges off of a criminal record, but ICE does not honor the state plea agreement.""

Really? This is the kind of people ICE is targeting? WTF.",2018-01-22T02:26:28+00:00,t3_7s0rij
Libertarian,comment,Immigration,hlj7ycq,TheAynRandFan,,"Yes, we need a security check first and check to see if children are being trafficked. THEN let them in. A lot of immigrants hate socialism even more than we do, having experienced it and all",2021-11-21T17:45:35+00:00,t3_qyfffv
Neoliberal,comment,I-485,jpcobx5,ManavonSolos,,"“The Chechens… yes…. The Chechens will save us,” Putin said, increasingly nervous",2023-06-24T14:26:43+00:00,t3_14hlzdo
Politics,comment,Visa,gowb6kz,LogicCure,,The US loves dictators. You can bribe them and they'll keep to themselves and keep those evil commies out.,2021-02-26T22:11:43+00:00,t1_gowaqoq
Neoliberal,comment,Visa,k5elqai,l_overwhat,,"https://twitter.com/Resist_05/status/1714569969248440359?t=QoyCr2zFrKZ-fTeYpVxoNQ&s=19

Someone doctored this video to show the rockets going the opposite way from the hospital explosion.

I don't say this lightly. People are fucking insane.",2023-10-18T14:19:28+00:00,t3_17akg59
PoliticalDiscussion,comment,naturalization,jy8dpyp,baxterstate,,Do you have to buy crap with your snap? That’s my objection. I don’t eat crap. Buy some all bran with your snap. I do.,2023-08-29T14:11:11+00:00,t1_jy85rda
Politics,comment,Immigration,kq0v5p4,Civil-Finance2289,,There you go,2024-02-12T02:04:40+00:00,t1_kq0rys3
Politics,comment,passport,e378g60,gpl2017,,The United States is a evil country.,2018-07-28T19:45:42+00:00,t3_92opbq
Libertarian,comment,Immigration,h9lwamz,bobbyrickets,,"> they need to go through the proper channels to become a citizen.

I'm sure they tried but their situation is unique and that's why it became such a national concern. They are a valuable part of American society and that's really what pisses you off isn't it?

Facts;

> Research has shown that DACA increased the wages and labor force participation of DACA-eligible immigrants[11][12][13] and reduced the number of undocumented immigrant households living in poverty.[17] Studies have also shown that DACA increased the mental health outcomes for DACA-eligible immigrants and their children.[14][15][16] There are no known major adverse impacts from DACA on native-born workers' employment, and most economists say that DACA benefits the U.S. economy.[19][54][55]

https://en.wikipedia.org/wiki/Deferred_Action_for_Childhood_Arrivals#Impact",2021-08-20T01:24:27+00:00,t1_h9lq0fq
Libertarian,comment,consulate,eyy0udq,DetroitRedBeans,,">That's the point. China is in breach of the agreement it signed with the UK in 1997. We haven't even released a statement condemning that.

The Agreement was an ultimate result of British invasion and opium trade

But our libertarian whites obviously gonna leave that part out. 

Again, NAP my ass",2019-09-04T03:30:26+00:00,t1_eyvflj6
Conservatives,comment,immigrant,l0x5gt4,Lord_Long_Rod,,1 holdout; the other 7 members of the jury wanted to acquit.,2024-04-23T17:44:24+00:00,t3_1cb371p
Neoliberal,comment,Immigration,kge0tgh,ApproachingStorm69,,🇺🇸,2024-01-05T04:36:13+00:00,t1_kgdvz0x
PoliticalDiscussion,comment,naturalization,gvwf3re,mimaiwa,,"I mean they can still get moderates like Larry Hogan elected in Maryland, but that likely goes away entirely with adding DC. 

Definitely agree that it’s purely politics that prevents DC residents from gaining their deserved representation. To me it feels like the opposition to statehood is almost entirely about preventing Democrats gaining two senators and a representative. 

Tbf, I fully believe that if DC was super conservative, the parties would have essentially opposite positions.",2021-04-26T05:40:51+00:00,t1_gvweitm
PoliticalDiscussion,comment,naturalization,f6qvmc3,pear1jamten,,"The big thing for me was decriminalizing border crossing.  Warren had all my support, I agree with her tax..medicare. plans but she caved to the left on that issue, which was never a big part of her platform.  And now shes locked into a promise that will alienate a lifelong voting democrat.",2019-11-07T00:37:51+00:00,t1_f6qveyp
Politics,comment,SSN,c1vawwq,momzill,,"> Please. Most medical problems are lifestyle realted

I sincerely hope that you do not live to regret those words.  Out of intellectual curiosity, may I ask how old you are?",2011-05-21T21:58:16+00:00,t1_c1vavqv
Politics,comment,green card,dfwq7ez,SnarkOff,,"The probe will be taken over by Reps. Michael Conaway (R-Texas), Trey Gowdy (R-S.C.) and Tom Rooney (R-Fla.).

Something tells me Republicans think this helps them ",2017-04-06T14:06:59+00:00,t3_63t450
Libertarian,comment,naturalization,hqpladj,ThomasRaith,,*Mens Rea* is still a legal concept.  If I come to you and say that I need to hire a hit man to kill someone and I need a $20000 loan and you give it to me then yes you are liable.,2021-12-31T18:29:25+00:00,t1_hqpl0vg
