subreddit,type,keyword,id,author,title,body,created_utc,parent_id
Geopolitics,comment,IRS,e2wl961,arruacas,,"You could make an argument for war with Iran from the points you mentioned, but IMO I think keeping a balance of power in the ME is the end goal. Just how friendly would a Saudi Arabia with unchecked growth be? Iran also acts as a deterrent for hostility towards Israel. We've seen a warming up of relations from arab states towards Israel in recent years, and I think this has to do with how useful they perceive Israel to be in the face of a common enemy.",2018-07-23T20:22:38+00:00,t1_e2wib4e
Politics,comment,minimum wage,h1lxcoj,Ender16,,"But why servers? They v already make great money to about any comparable job.

The industry is shit. I work in it. I'm all for sorry businesses going under because they don't want to pay well. But as a cook im already underpaid COMPARED to servers. 

How about my wages reflect my years of experience cooking and at least get the people like me just at the same level that servers make. You know so that an 18 year old with literally no work experience doesn't out earn me per hour when I've been doing this for years.

Let's do that before we start whining about servers who already make good money.",2021-06-13T10:32:16+00:00,t1_h1lq97y
USpolitics,comment,tax,l3eaaeb,BernerDad16,,"What does that have to do with what I said?

Tax cuts are simply letting people keep more of their own money. Framing the issue as what it ""costs"" the government to let people keep what they earned is quite a tactic. That's all.",2024-05-10T06:21:51+00:00,t1_l3e9xek
Liberal,comment,minimum wage,dizc16q,mackinoncougars,,Can't even get a one bedroom on minimum wage by the 30% equation.,2017-06-16T12:34:53+00:00,t3_6hftn9
Neoliberal,comment,income tax,hsivrto,HarveyCell,,It’s PPP-adjusted,2022-01-13T19:12:54+00:00,t1_hsiqw3w
Neoliberal,comment,income tax,kvy9qy2,brainwad,,"Are you sure? I once had a job where the default plan was by Westpac, and it seems they still have super funds: https://www.westpac.com.au/personal-banking/superannuation/. Also my current bank, ING, seems to have super funds: https://www.ing.com.au/superannuation/living-super.html.",2024-03-21T21:28:56+00:00,t1_kvy6824
Politics,comment,income tax,gsq8hpo,h2f,,That's ridiculous. Wealth and income has been growing for the top since the 1980s at a far faster pace than for the middle. The [richest actually pay a lower percentage](https://www.nytimes.com/interactive/2019/10/06/opinion/income-tax-rate-wealthy.html) of their overall income (not including hidden income like that in this report) than the median. Corporate taxes have actually declined too. What rates haven't been cut? Regressive ones like the payroll tax.,2021-03-29T20:44:09+00:00,t1_gsq5e2g
Politics,comment,social security,ja8yvkk,Ch1Guy,,"There are lots of perfectly legal ways to manage your tax liability...

For example, why do you think companies do stock buy backs instead of paying dividends?   The answer is avoiding tax liability.",2023-02-27T18:52:36+00:00,t1_ja8t2ta
PoliticalDiscussion,comment,income tax,czg6w90,ThereIsReallyNoPun,,">the worker benefits a bit financially from the employer paying payroll tax vs. the whole burden being placed on the worker

A very small bit perhaps. The incidence of payroll taxes falls almost entirely on the worker, irrespective of who pays it nominally.

",2016-01-29T08:23:22+00:00,t1_czg6ei6
Libertarian,comment,taxation,hitnjxj,obstruction6761,,Do children count as individuals or are they property?,2021-10-31T23:24:47+00:00,t3_qjsj4w
Politics,comment,social security,im5j7tp,hniinuefrwer,,Stereotyping is never helpful tbf,2022-08-28T17:45:36+00:00,t1_im5b6gu
PoliticalDiscussion,comment,social security,d3l9aus,karmapuhlease,,"I'm a millennial who hates giving my money to Boomers too, but that's exactly why I don't want to pay into SS anymore. I would prefer to wind the system down and cut my losses rather than pay out the nose for SS (12.4% of the first ~$125k of my earnings for the next 20 years is a lot, but if they either eliminate the cap or raise the rate it'll be even worse).",2016-05-27T01:52:22+00:00,t1_d3kvffz
Libertarian,comment,IRS,girpkiz,NetherTheWorlock,,All they had to do is read the law suits.  It's clear that what was being claimed in press conferences isn't what was being claimed in the legal pleadings and that the courts examined the evidence fairly.,2021-01-10T15:33:19+00:00,t1_giqj67g
Conservative,comment,taxpayer,j02bv6t,RedWhiteAndScrewed,,"They literally play by no rules, and we let them get away with it",2022-12-13T16:07:38+00:00,t3_zkugjf
PoliticalDiscussion,comment,income tax,egvwc1p,drock4vu,,"Agree with pretty much all of this. Especially subsidizing nuclear and free college being a joke of a concept. If you made college free it would literally be a subsidy to the upper-middle class who can afford to send children to private schools or live in areas with good public schools. With free college, entry would become *much* more competitive, and low-income areas are the ones that would continue to see lower-acceptance rates. An investment of that magnitude would be better spent on improving primary schools in rough areas or even free pre-k for all. To your point as well, bachelors degrees have already lost a ton of value over the last couple of decades with the government getting involved in paying for tuition (along with the massive spike in tuition and related fees). If you made college free for all, the vast majority of the population would have a degree of some kind, and it's not like there would magically be more jobs for degree holders. We would see even more people with college degrees working in retail and coffee shops.",2019-02-20T16:24:19+00:00,t1_egvtfgc
Politics,comment,social security,jey2mg2,superdecent1113,,"""We're getting multiple reports from sources close to the matter saying that when morning comes, the sun will continue to rise in the east. More at 11.""",2023-04-04T17:57:22+00:00,t1_jey17pz
Conservative,comment,minimum wage,kyu5yh5,vpkumswalla,,">At a certain point of regulation and compliance costs, the barriers to entry or profitability for business become impossible to overcome

We turned down a client in NY because of regulation and dealing with NY taxes.  We also had a client (HQ in flyover state) with location in Vermont get screwed over on a transaction where Vermont went against case law.  Client just didn't want to deal with it and paid the bogus tax anyway.",2024-04-09T22:25:39+00:00,t1_kyu374y
Libertarian,comment,taxpayer,gohf4m5,Either_Individual_82,,"> I don’t want to pay for your domestic spawn either 

Good. I'm glad you agree. Thanks!",2021-02-23T17:34:36+00:00,t1_gohesc4
Conservative,comment,income tax,h9p39xo,arbitrageisfreemoney,,What? This seems crazy to me,2021-08-20T18:58:10+00:00,t1_h9o5ri9
Neoliberal,comment,social security,l609uix,JohnSV12,,I wonder who has done more long lasting damage? Again could be close.,2024-05-28T10:50:11+00:00,t1_l605mde
Politics,comment,taxpayer,hl2s0mg,Vans_Action,,"That’s a lie in the headline.  It’s a contract, which is substantively different than a handout.  

Too big to fail was a handout.",2021-11-18T03:32:31+00:00,t3_qwcn3x
Libertarian,comment,minimum wage,gh75oec,WearyManufacturer860,,Agree! It’s probably the most efficient system if we are to have a government program!,2020-12-27T17:02:08+00:00,t1_gh75jkb
Politics,comment,taxpayer,hl2hb2v,grumpy_grodge,,"They can cut military expenses for that, but we do need to invest into practical space programs (like SpaceX). Already scientists and city planners have thought of self sustaining city concepts that not only would work on Mars, but could also help save out planet. Elon Musk actually has something to offer, Bezos is measuring his tiny dick.",2021-11-18T02:10:03+00:00,t1_hl25nvw
Libertarian,comment,minimum wage,kqt8wgw,IronSmithFE,,"i wish people in government were truly intelligent and loyal to the peoples best long term interests. unfortunately they are idiots, evil or both.",2024-02-17T08:33:53+00:00,t3_1asvwjw
PoliticalDiscussion,comment,taxation,c2dknzk,newfederalist,,"Interesting point, and I do acknowledge that some similarities exist.  I remind you, however, that the corporate elite are relatively few in number and are not the only members of the 'producer' class.  The middle and even much of the lower class would still be considered members of the 'producer' class because they are contributing funding to the federal government through the payment of taxes.  This will prevent the danger of 'decimating' them as you have suggested.  It will only be those who take more from the government than they contribute to it who would be ineligible to vote.  ",2011-08-19T04:27:38+00:00,t1_c2def59
Politics,comment,tax,ku1sfo7,themanebeat,,"Yup. They have this in my country, it's limited to new build properties no second hand

So I bought my house and the government paid €30,000 ($32.8k) of the deposit on it as a tax rebate (so if I had paid less than that amount in the previous 5 years for example it would have been a lower amount)

Before it was capped at €15,000. I bought just after they changed the law to double the amount

And guess what? Developers just added the extra to the overall cost. They still get the same amount they wanted for the house they built and now get to pocket your tax rebate

And what can you do? It's a popular idea, it's cheap for the government to implement, and people will use it - I was hardly going to refuse the €30k on principle

But it is a fake economy",2024-03-09T09:30:48+00:00,t1_ktz1eys
PoliticalDiscussion,post,tax,jzsq10,89saint,Did ACA cause Dems to lose House in 2012 and Senate in 2014?,"Last weekend I was watching a series of PBS Frontline interviews (worth watching) regarding the politics of Obama and Trump. 

The themes echoed was
1. Bailout of Wall St by Tax payers money caused the Occupy Wall St and Tea party populist movements.
2. Trump, Palin, Bernie & Obama was a reaction against the establishment and latter became a part of it soon enough.
3. Affordable Care Act was a blow that GOP could never forget.
4. Trump even though was an elite, he gave voice to forgotten men and women.
5. Both establishment RNC and DNC have become a party of elites pretending to be a party of the middle class - so another populist candidate always has a room to run the show.

In my limited understanding, I neither completely agree or disagree with the statements except for ACA. 

Or was it just the need for a change that prompted US voters to flip the House and Senate?

Edit 1: My apologies, got the date wrong it was 2010 when the house flipped. Note to self : Always check dates with Google.",2020-11-23T23:00:39+00:00,
Climatechange,comment,tax,jylthvj,More-Grocery-1858,,"You: Was the weather different yesterday?

Them: Uh... sure?

You: So you agree that climate change can happen, now we just need to haggle over how much.",2023-09-01T01:36:35+00:00,t3_166sb73
Geopolitics,comment,IRS,dw6j4fv,Squalleke123,,"""obedient"" in a sense that they won't push anti-Russian policies. And that's enough if you hold onto a buffer-state theory.",2018-03-23T20:59:18+00:00,t1_dw5qmff
PoliticalDiscussion,comment,IRS,calcdkl,tsanazi2,,"In support of my last-paragraph prediction:

http://www.schneier.com/blog/archives/2013/06/evidence_that_t.html

Evidence and discussion that NSA captures call content NOT just metadata",2013-06-18T17:39:49+00:00,t3_1g4xc1
Libertarian,comment,income tax,hqk84he,Legio-X,,">America outlawed the slave trade before the Brits.

The US passed a law banning the international slave trade first—though only by a few weeks—but the British ban on the slave trade took effect May 1st, 1807, while the US ban took effect January 1st, 1808.",2021-12-30T16:24:17+00:00,t1_hqk5qf4
Politics,comment,tax,kymlrvl,dathanvp,,What is insidious about this is 6 people can change the outcome of an election with their resources because for some reason people believe taxing a billionaire will hurt them.,2024-04-08T15:05:41+00:00,t3_1by67q2
Conservative,comment,taxpayer,kx28b0u,TRexHasTinyArms,,Last I saw he was crying with literally snot strings carrying on about how ICE has now labeled him a fugitive for escaping custody. Not sure if it was a skit or serious.,2024-03-29T03:36:36+00:00,t3_1bq8bsw
Libertarian,comment,social security,gcgoigz,ExtremeSavings,,😂😂😂,2020-11-16T04:08:11+00:00,t1_gcggrqg
Liberal,comment,taxpayer,jz5f46r,stewartm0205,,What I would support is a law that says student loan is dischargeable through bankruptcy. I would also have the federal government work with state and local governments to make state and community colleges tuition free.,2023-09-04T21:38:35+00:00,t3_169t8b3
Politics,comment,social security,it5i5h4,BlakeDissaproves,,Projection. All of it. Always.,2022-10-21T02:03:44+00:00,t1_it365yz
Progressive,post,tax,hi664q,spaceghoti,Waiting for Trump’s tax returns: Don’t hold your breath,,2020-06-29T18:59:16+00:00,
Libertarian,comment,minimum wage,gny131t,last657,,Mind explaining how your link supports your point?,2021-02-18T23:18:34+00:00,t1_gnxwcoc
Politics,comment,tax,l3kl1ey,Maddy_Wren,,"Yeah, but that wouldnt let people driving practical vehicles subsidize the white boys' half-ton lifted emotional support trucks that they totally need to tow that bass boat they financed from Cabela's with a 12-year loan.",2024-05-11T13:20:48+00:00,t1_l3ik6sg
Republican,comment,tax,j5pecaj,Maverick_Walker,,The only people they *could* tax is military. Cause it’s their registered home address. But that would just make them switch to somewhere like Florida or Michigan,2023-01-24T17:22:47+00:00,t1_j5p8eyx
Conservative,comment,income tax,j3osum7,compugasm,,">**in 2022 lower-income taxpayers were five and half times more likely than millionaires and billionaires to be audited!** This is because low-income taxpayers cannot afford to hire top-notch tax attorneys and accountants to help fight the IRS, so they are more likely to give in to the agency’s demands.

So next time you hear the story that expanding the funding to the IRS is so they can catch billionaire tax cheats, remember that quote.",2023-01-10T01:11:01+00:00,t3_107vfco
Politics,comment,minimum wage,gu34yu0,msplace225,,Do you have any proof here to back up what you’re saying? Any sources other than your opinion that say that a living wage would cause a significant increase in prices and the middle class to become poorer?,2021-04-10T22:04:10+00:00,t1_gu2mohe
Politics,comment,social security,ivtfpb7,GanderAtMyGoose,,You can call yourself whatever you want but if I were a libertarian I wouldn't be at all interested in identifying with the current Republican party.,2022-11-10T14:11:27+00:00,t1_ivt96jv
PoliticalDiscussion,comment,tax,jesdx8o,CapybaraPacaErmine,,Isn't almost all politics about believing you know what's best for people?,2023-04-03T14:14:27+00:00,t1_jes1ce9
PoliticalDiscussion,comment,social security,jgrifja,tracertong3229,,">Does DeSantis have a shot against Trump? If not, did he ever? If yes, what's his path to the nomination?

Desantis' biggest strength is the potential likelihood of Trump being convicted of something in the next year. I find this a Longshot at best given Trump's wealth and power, but if it does happen then Desantis will likely be the next best thing, and I think he understands this.

>DeSantis still the only viable alternative?

I think he's the highest profile Republican who already hasn't run already, which is an interesting problem that's caused by the large primary fields of the last few cycles, where lots of people threw their hat in the ring, and as a result are now tainted by their previous failures. In another timeline its possible that if someone like Ted Cruz hadn't run already and lost, he could run now and do better than he did in our history. However we don't live in that time and this is what the GOP is left with.

>Do the Disney feud and the Heartbeat Bill help him or hurt him in the primary?

It will depend how/if Disney views Desantis as enough of a nuisance to really throw their money around to try and hurt him. Corporations can be spiteful, and they are incredibly powerful but I'm not in  the Disney boardrooms and I don't know if they're really willing to act as aggressively against him as they theoretically could.

As for the Heartbeat Bill, it's unlikely to help in the primary or the general in my opinion. The GOP can't moderate on abortion, the problem with that though is that it makes it more difficult to differentiate any republican when they ALL oppose abortion in someway, it's expected and you don't really get credit fir what you're already expected to do. So it's unlikely to help in the primary, and in the general too much of the population opposes anti abortion laws for it to be a serious asset.


>Will we see any significant swings in polling if/when DeSantis officially announces and starts campaigning?

In video games production there's a concept called early access that allows people to buy and play games as they are being made, this comes with advantages for studios who can get money from customers earlier and put more money into the production. One of the big drawbacks of this idea though, is that it detracts from tgh attention and profits the studio would ordinarilly receive when the game is officially released. In the consumer's eye, there's only really one release and tgats the earliest one. If the game is unpopular when it hits early access that reputation usually defines the game in the public consciousness forever, regardless of how the game is when its officially complete. By  dragging out his announcement so long desantis will likely face similar problems, where he's likely already passed the point where he got whatever polling boost he would have received from announcing his campaign by acting like he's campaigning already. If that makes any sense.",2023-04-18T16:38:04+00:00,t3_12qox19
Politics,comment,IRS,jsoawhl,Greatcookbetterbfr,,What would happen if a male representative printed out picks of the president’s daughters vagina,2023-07-20T01:59:32+00:00,t3_1545i4f
Politics,comment,IRS,l125gc8,TheBodyPolitic1,,Shifty Ted.,2024-04-24T15:44:09+00:00,t3_1cc0d2r
Neoliberal,comment,minimum wage,gqtkx1w,downund3r,,"These seem to be getting a little bit long, IMHO",2021-03-13T18:28:34+00:00,t1_gqoqn43
Climatechange,comment,IRS,kazi2s2,Infamous_Employer_85,,"It has been shown using C12, C13, and C14 isotopes that the increase of 135 ppm over the last 150 years is from ancient carbon",2023-11-27T15:48:51+00:00,t1_kawtqnp
Neoliberal,comment,social security,iqlil7o,spaniel_rage,,"""Russia is the real victim here""",2022-10-01T06:44:37+00:00,t1_iql47ra
Libertarian,comment,income tax,jwgur4l,wormfood86,,"Yeah, they just need to hire 2.4 million more IRS agents to get that work done. Looks like raising taxes is back on the menu boys!",2023-08-16T18:42:49+00:00,t3_15sw5ie
Politics,comment,social security,ik1hiuc,wastingvaluelesstime,,Do those 10 year sentences run concurrently or consecutavely I wonder?,2022-08-12T20:17:31+00:00,t1_ik1h16b
Politics,comment,income tax,exzz4yc,Gentleman_Viking,,"First he says that you *have* to vote for him, because, you know, sunk-cost fallacy.

Now he says that if you vote for him he'll give you money.

pretty soon he's gonna resort to ""Please Clap"" levels of desperate begging.",2019-08-24T18:43:42+00:00,t3_cuwjf6
PoliticalDiscussion,comment,income tax,czq4678,Nyefan,,The plan that he released had a maximum marginal tax rate of 52%.  I'll edit the link in one I get home from the store.,2016-02-06T17:11:07+00:00,t3_44gynq
Libertarian,comment,taxable,ezcxnz2,retrievedFirered,,"> So a contract magically transforms an involuntary act into a voluntary one? 

Assuming the contract was entered voluntary, yes.",2019-09-07T07:40:32+00:00,t1_ezbcc5a
PoliticalDiscussion,comment,sales tax,c2h82tz,repmack,,"How was it not centrally planned? George Bush and Barney Frank said everyone should own their own home. They put plans out there to help people get houses. Also the federal reserve kept interest rates low so all the big banks could have liquidity to loan money to people. This kept interest rates low so people could continue to get loans. You also had a lot of stupid people, especially in California that got interest only loans. You also had people getting adjustable rate mortgages that they wouldn't be able to pay back. Banks made bad decisions and so did people, but at the end of the day they couldn't of done it without the federal reserve creating an artificial market price. So no it isn't stupid to say that. Also you can look to Paul Krugman saying the Federal Reserve needed to create a housing bubble. He advocated for it and that is what they did.",2011-09-03T14:36:59+00:00,t1_c2h5me0
Politics,comment,social security,k9bsrnq,LuthorCorp1938,,I was just gonna scroll past this headline then realized I'm on this app anonymously posting. 😅,2023-11-15T07:07:09+00:00,t3_17vhjew
Politics,post,taxation,2rl6v0,youngestalma,"""[Utah] proposing to raise registration fees for vehicles that are electric, use other alternative fuels or offer high gas mileage. Because they buy less gasoline, they largely escape fuel tax now. 'It’s time we begin to look at fair and equal taxation for fair and equal usage of the roads'""",,2015-01-07T03:08:08+00:00,
Democrats,comment,tax,l38lyo9,bryanc1036,,He had respect for the job by not having a huge meltdown because McCain didn't win.,2024-05-09T04:33:15+00:00,t1_l38agfp
PoliticalDiscussion,comment,tax,hvbweeu,ThatsWhatXiSaid,,"> People don't realize that the middle income pays significantly more taxes in all countries with a single payer system.

People don't pay more in taxes in any country towards healthcare than they do in the US. 

With government in the US covering [65.0% of all health care](https://ajph.aphapublications.org/doi/full/10.2105/AJPH.2015.302997) costs ([$11,539 as of 2019](https://www.cms.gov/files/document/highlights.pdf)) that's $7,500 per person per year in taxes towards health care. The next closest is Norway at [$5,673](https://data.oecd.org/healthres/health-spending.htm). The UK is $3,620. Canada is $3,815. Australia is $3,919. That means over a lifetime Americans are paying a minimum of $143,794 more in taxes compared to any other country towards health care.",2022-02-02T21:21:48+00:00,t1_hvaavp7
PoliticalDiscussion,comment,IRS,czq12y4,Marius414,,"A vote for /u/DeShawnThordason is a vote for Barack Obama, Chuck Schumer, and Harry Reid!

Sorry, I read that while doing a Ted Cruz face and trying a Cruz voice.",2016-02-06T15:33:59+00:00,t1_czpkmo6
Politics,comment,social security,ivt0cz9,spaitken,,"The GOP “won’t compromise” list only contains one item

Unfortunately, that one item is listed as “anything”

It’s understandable that he’s putting out that he’s willing to work with them but it’s a fever dream. The GOP has openly stated that their first and only goal is to see him fail.",2022-11-10T11:53:29+00:00,t3_yr5ywr
Neoliberal,comment,IRS,drrvwnh,qchisq,,">The mod team *HIGHLY* recommends requesting your payment in Ripple as it already has integration with banks in Europe, Mexico, and Turkey.

We do? I thought we liked Dogecoin ",2017-12-26T12:39:57+00:00,t3_7m46ny
Politics,comment,social security,j3z81ox,Positronic_Matrix,,"This is why we will always come in second in the information wars.  Whenever the media promulgates misinformation and propaganda that benefits the left, left-leaning constituents will immediately call them out on their falsehoods (and we wouldn’t have it any other way).",2023-01-12T01:53:43+00:00,t1_j3wur3w
PoliticalDiscussion,comment,tax,hbd2pns,Darthwxman,,"I know this sub is largely an echo chamber and no one wants to hear this but; Republicans see democrats in much the same way... aggressively pushing extreme policies. Uncompromising. Manipulating election laws to seize power etc. Not to mention partnering with big tech to silence opposition voices and persecute their political opponents. They were also very close to ending the filibuster outright and packing the supreme court (and likely would have if 2 democratic senators hadn't rebelled). To someone on the outside it looks a lot like they are trying to rig the system so they can have permeant one party control of the government.

Meanwhile the typical republic voter sees republican politicians as do nothings who never fight for them and who routinely get trounced by democrat politicians who are willing to do anything to win. Trump was largely an exception there, which is one reason he is so popular.",2021-09-02T20:41:19+00:00,t3_pglhch
Politics,comment,IRS,iyu1nci,jackleggjr,,"""If holy people are so interested in politics, government, and public policy, let them   
pay the price of admission like everybody else."" George Carlin",2022-12-04T03:53:22+00:00,t3_zbolk8
Politics,comment,tax,l2ver0s,MoonBatsRule,,"> However, they certainly deserve it. It's important to recognize that they set up an entire system, with the purpose of funneling power. This system takes a variety of skill sets, which change throughout the life cycle of these systems. Give the devil its due, they deserve it as a result of their intentions and actions.

The word ""deserves"" is pretty subjective though. I can't argue that they deserve something. But do they deserve everything they can take? No. So where is the line? I contend that the line is much, much lower than it is at now, it is closer to the amount of money where people can live comfortably, even a life of luxury, but do not have enough money to convert to significant power.",2024-05-06T19:17:17+00:00,t1_l2v5lh7
