subreddit,type,keyword,id,author,title,body,created_utc,parent_id
PoliticalDiscussion,comment,IRS,cfvrfqt,johnpseudo,,What if there were more tea party groups than liberal groups? Just because more tea party groups were targeted doesn't mean they were *unfairly* targeted.,2014-03-06T11:04:46+00:00,t1_cfvq45j
Politics,comment,social security,hy28tog,77bagels77,,">This is not an entitlement. It is the most efficient insurance plan — and I live in an insurance capital of the world — the most efficient insurance program in the world is Social Security.

Okay, if it's a contribution to an insurance program and not a tax, can I opt out of the program entirely? I'd gladly not pay into SS and manage my own money, because I'd do about 100x better.

The truth is that SS **IS** a tax. It's definitely **NOT** an insurance program. It's already insolvent because people right now are getting more back in benefits than they paid into the program. It's a redistribution of wealth from the young to the old, not a contribution to some fund that will pay you back later.",2022-02-23T04:38:36+00:00,t1_hxxvlvu
Politics,comment,taxpayer,gwxsbzi,Charlie_Warlie,,">Who are the chucklefucks

I believe that would be the Arizona republican state senators",2021-05-04T19:29:30+00:00,t1_gwxli5j
Libertarian,comment,taxpayer,gm8bb70,always-paranoid,,This,2021-02-06T13:53:54+00:00,t1_gm7zto1
PoliticalDiscussion,comment,minimum wage,ijhgb9e,Gryffindorcommoner,,"Cool, they lied or whatever. The right does that a bunch too. A lot more in fact, especially about elections they didn’t like the result of. I’m waiting for you to get to the part where you explain how that’s relevant or how that’s  justification  for keeping the filibuster today.",2022-08-08T19:53:24+00:00,t1_ijhd048
Republican,comment,tax,iik4ox2,Comprehensive-Tell13,,Better than that if a Corp has negative profit  regardless of structure would they still have to pay 15% on a loss how are they figuring this exactly. 🤔,2022-08-01T21:10:40+00:00,t1_iik1sfh
Politics,comment,social security,jc1ecwo,lonehawktheseer,,Funny how the GOP pretends there is no other solution. They really take the American voter for fools. All that needs to be done is to raise the cap on the income level that is taxed for social security.,2023-03-13T10:01:50+00:00,t3_11pnjth
Politics,comment,income tax,gpslibv,AutoModerator,,"
As a reminder, this subreddit [is for civil discussion.](/r/politics/wiki/index#wiki_be_civil)

In general, be courteous to others. Debate/discuss/argue the merits of ideas, don't attack people. Personal insults, shill or troll accusations, hate speech, **any** advocating or wishing death/physical harm, and other rule violations can result in a permanent ban. 

If you see comments in violation of our rules, please report them.

 For those who have questions regarding any media outlets being posted on this subreddit, please click [here](https://www.reddit.com/r/politics/wiki/approveddomainslist) to review our details as to our approved domains list and outlet criteria.

***


*I am a bot, and this action was performed automatically. Please [contact the moderators of this subreddit](/message/compose/?to=/r/politics) if you have any questions or concerns.*",2021-03-05T17:25:00+00:00,t3_lygw5o
Libertarian,comment,IRS,ikmk1g9,sclsmdsntwrk,,”Just because the Gestapo murdered a few journalists and political opponents doesnt mean everything they do is bad”,2022-08-17T06:50:29+00:00,t1_ikm28lv
PoliticalDiscussion,comment,minimum wage,coddfg8,BrawnyJava,,"Obviously you can believe what you want.  There's plenty of evidence to support the idea that minimum wage hikes hurt employment.  And it makes sense on the surface, since supply and demand determine the market price of labor.  Proving that basic laws of economics somehow don't apply requires mental gymnastics that seem contrived to me.

https://www.epionline.org/minimum-wage/minimum-wage-teen-unemployment/

Plenty of sources on this.  And its a highly politicized issue as well, since both parties have a financial stake in it.  You could even calculate a formula that tells you exactly how much more Democrats would make.  ",2015-02-06T19:51:33+00:00,t1_codcw0l
Geopolitics,comment,deductible,eabhptg,00000000000000000000,,"from wordsbetweencoasts via /r/activism sent 3 minutes ago

What are the best ways to get involved to help end human trafficking etc?",2018-11-23T20:18:40+00:00,t3_9yjzwd
Politics,comment,taxpayer,j7a3u64,phd2k1,,100 million dollar maximum net worth.,2023-02-05T06:17:01+00:00,t1_j79uz9l
Neoliberal,comment,sales tax,h1g0i7l,SmokeyCosmin,,"'Reparations' will backfire and increase racism.

Equality is the most honest reparation you can do for such issues.",2021-06-11T20:28:29+00:00,t3_nxoa38
Politics,comment,deductible,ehmz01f,thunder_rob,,Wow,2019-03-02T16:59:26+00:00,t1_ehmu9ru
Republican,comment,IRS,dgxxfes,The_seph_i_am,,The moment she is forgotten is when she'll return.,2017-04-30T11:34:56+00:00,t1_dgwnbi6
Politics,comment,tax,kz8fyl8,-43andharsh,,"Soon.  Yes,  very soon /s",2024-04-12T13:57:35+00:00,t1_kz8fp0z
Politics,comment,IRS,iomfl7b,ivertrio,,"This is also better from a data security point of view. Private tax filing companies collect an incredible amount of sensitive personal information. A data breach at one of these companies can be and will be devastating. It's so much safer to have a well funded, federal agency handle tax filing for everyone in the country.",2022-09-16T03:47:07+00:00,t3_xfaqpa
Libertarian,comment,social security,g03xhmi,sacovert97,,This is my dream.,2020-08-02T15:27:20+00:00,t3_i250di
Neoliberal,comment,taxpayer,f165f7l,URZ_,,"> My administration will also take whatever legal steps it can to stop states from preempting local efforts to enact tenant protection laws. More than 30 states have passed laws that explicitly prohibit cities from adopting rent control. Efforts to repeal these state preemption laws have been met with fierce opposition from real estate and private equity giants, who have shelled out massive sums of money to block these proposals. Just last year, firms like New York-based private equity giant Blackstone Group contributed to a $65 million war chest to defeat a ballot initiative in California that would have repealed a state law making it harder for cities to control housing costs.
These state laws effectively permit Wall Street to decide what’s best for cities and towns instead of the residents of those places choosing for themselves. It’s wrong, and as President, I will do whatever I can to stop and reverse these industry-backed efforts to take power away from cities and towns.
My plan will lower rents, take a first step towards closing the racial wealth gap, and make it easier for Americans to access affordable housing. Enacting the plan will be a top priority of my administration — because every American deserves a safe, decent, and affordable place to live.

For the record, that California ballot initiative she claims was defeated due to private equity was Proposition 10, a terrible proposal that would have lead to major Californian cities entrenching themselves even further than they already are. It's great that she wants to throw billions at the problem (billions i for the record would love to know where she would get from), but unless you fundamentally put an end to the problems that have lead to a housing shortage/rent increases, you are merely delaying further shortages down the road. Sadly, Warren has a tendency to fall back on her populist biases as soon as she sees the opportunity.",2019-09-23T01:42:53+00:00,t3_d7zqcn
PoliticalDiscussion,comment,minimum wage,dbo2pny,darngooddogs,,Buddhism works pretty good.,2016-12-27T04:48:20+00:00,t3_5kf655
Politics,comment,income tax,g6xnzqp,tencan23,,"Sad that he must be first voted out, since apparently the president is invincible in office",2020-09-28T08:22:43+00:00,t1_g6xa98r
Libertarian,comment,minimum wage,kgeidww,polishrocket,,I meant depression,2024-01-05T07:18:57+00:00,t1_kgeibql
Neoliberal,comment,minimum wage,h0zdnj2,saudiaramcoshill,,">If you don't think it advances it, don't agree and simultaneously disagree with that notion

Please quote anything I said that agrees with that notion. I explicitly held the opposite view.",2021-06-08T01:44:00+00:00,t1_h0v3b7d
Politics,comment,social security,isxptl2,Acrobatic-Ad3275,,"Don't you dare, you good-for-nothing Republicans.",2022-10-19T13:52:23+00:00,t3_y7o53q
Politics,comment,minimum wage,gsti2e3,Equivalent_Yak8215,,"Right, I agree!

However I am concerned about what the people being tipped in America think about this.

All my service and bartending friends tend to make much more than minimum wage so I'm not sure if the workers are down with it.

I'm not saying you're wrong and I agree with you, however, I feel like the people working the jobs should be the biggest voice in the room.",2021-03-30T16:59:58+00:00,t1_gste3k8
Democrats,comment,social security,iyedxy7,fletcherkildren,,I say start shipping homeless old people to Kevin McCarthy's district,2022-11-30T19:49:12+00:00,t3_z8wxal
PoliticalDiscussion,comment,taxation,c8g7j5k,bearfiesta,,"I completely agree on that front. The specific tax break mentioned in the article was a stock option tax break, which should also be abolished IMO.",2013-02-16T15:36:00+00:00,t1_c8g7hbz
Politics,comment,minimum wage,jc76d4a,sevseg_decoder,,It’s true. That’s how they all convince themselves what they’re doing is ok. They literally don’t talk to people who don’t benefit from it.,2023-03-14T15:22:47+00:00,t1_jc6ymeg
PoliticalDiscussion,comment,income tax,kwhs0p5,curien,,">Yes, for example my sister taught school in Texas. Most schoolteachers in Texas do not pay anything into SS; instead, they pay into a state system, the Texas State Teacher Retirement System.

If your sister -- who has never contributed to SS -- were married a person who has met the work credit contribution requirements, she would become eligible to receive spousal SS benefits.

https://tsta.org/sites/default/files/GPO-WEP-TRS.pdf",2024-03-25T14:54:18+00:00,t1_kwhlhs4
Politics,comment,tax,ktvhdwy,lurch556,,She just came off like a fucking loser. It’s like wearing a t shirt and jeans to a wedding.,2024-03-08T04:44:14+00:00,t1_ktv5jyj
Conservative,comment,taxed,kac8182,quick_justice,,Let’s assume I’m mathematically illiterate. Explain me why this debt is bad.,2023-11-22T19:21:47+00:00,t1_kabllvk
Libertarian,comment,tax,k84j9sh,Ya_Boi_Konzon,,Truth,2023-11-06T21:29:21+00:00,t1_k83hk3s
Politics,comment,taxation,c4dksm3,UtmostGrandPoobah,,I don't want mj to be legalized and regulated. Just legalized.,2012-04-18T03:10:34+00:00,t3_sejfh
Politics,comment,social security,k9aws3k,mintmilanomadness,,Granny needs chill,2023-11-15T02:33:16+00:00,t3_17vhjew
PoliticalDiscussion,comment,IRS,c9yw8ty,ClockOfTheLongNow,,"I think, at this point, we need a little more evidence that an email was fabricated before we take the White House's word on it is what I'm saying.",2013-05-14T23:53:47+00:00,t1_c9yw1lm
Conservatives,comment,IRS,jtc3oit,BroSteveWinter,,Amen!,2023-07-25T02:46:51+00:00,t1_jtbw0ob
PoliticalDiscussion,comment,social security,d18iyks,skybelt,,Yeah I bet she would be really pro Trump if she hadn't been bought by MoveOn.org.,2016-03-22T00:04:53+00:00,t1_d18iq04
Politics,comment,IRS,j5jfxat,aravarth,,"*OH MAN.* Like *Dog the Bounty Hunter*, except it's *Dog the Accountant*.

Problem is, some will still focus on grinding away at lower earners, because these are ""easier"" to close, and it creates a class of accountants comparable to ""ambulance chaser"" lawyers.",2023-01-23T13:05:55+00:00,t1_j5jaq1o
Politics,comment,social security,k4mcdyv,Jbeam222,,Cut it. I just want all my money I put into it back. And then they can stop taking it from my paycheck and we are square.,2023-10-12T21:33:26+00:00,t3_176egan
Politics,comment,tax,k8tucmu,combustioncat,,"He’s openly saying it;

https://edition.cnn.com/2020/08/18/politics/donald-trump-third-term-2024/index.html

https://news.yahoo.com/trump-says-d-negotiate-third-112925976.html

> “And then after that,” he said, “we’ll negotiate, right? Because we’re probably—based on the way we were treated—we are probably entitled to another four after that.”",2023-11-11T19:54:33+00:00,t1_k8sdxx5
GreenParty,post,tax,14g5ah,tdwright,Green Party explain how the cuts affect Brighton and explain why they plan to increase council tax by 2% [xpost/brighton],,2012-12-07T16:00:22+00:00,
Politics,comment,social security,kih2l91,Icy_Pass2220,,"I mean, I can contact my representative but…

I think a lot of people don’t realize just how pointless that is when your Rep is MAGA. 

MAGA reps are quite clear that they aren’t listening or voting based on what their constituents want. 

Hell, mine doesn’t interact with the electorate unless you fork over $500 a head for a shitty dinner. No town halls, nothing. Just a very, very small group of donors even have access to my Rep. she’s locked up pretty tight in her bubble. She’ll claim that she represents the “will of the people” but I don’t see how she even knows what that will is when she doesn’t campaign, doesn’t meet with constituents (unless they’ve paid for the shitty dinner), doesn’t even send out a Fuck You form response to letters. 

My district doesn’t have a high count of seniors because the cities in my district have intentionally pushed seniors out (they don’t really contribute to the tax base) by zoning all the housing to family type homes. Seniors here are downsized out of the district because there’s no housing for them. They’re welcome here while they’re in their high earning years but once they hit the age of knee replacements - GTFO! 

So she literally has no incentive to fight this because her constituency isn’t the people this affects. ",2024-01-18T18:57:35+00:00,t3_199ost8
Neoliberal,comment,income tax,l56n53x,Captain_Quark,,"Here's a couple of decent book reviews: 

https://www.goodreads.com/review/show/5719875941

https://www.cato.org/regulation/winter-2023-2024/book-review-weve-got-you-covered-rebooting-american-health-care",2024-05-22T15:39:22+00:00,t1_l56mcs0
Politics,comment,tax,kb8idh2,voting-jasmine,,"The one exception being Nevada. As long as you don't play, you win.",2023-11-29T07:56:16+00:00,t1_kb8csue
Politics,comment,social security,k91zhpy,Illustrious_Map_3247,,"These billionaires have made it abundantly obvious you don’t need to have too many brain cells holding hands to make it.

But it seems like being a psychopath is also part of the job description.",2023-11-13T11:33:53+00:00,t3_17u84m5
Libertarian,comment,sales tax,gr1in5j,AlbertFairfaxII,,"There's nothing wrong with this getting upvoted. Finally we're getting the tax reform we wanted, lower taxes on the upper class while we extract more from the lower castes. 

-Albert Fairfax II",2021-03-15T18:46:48+00:00,t1_gr1entu
Neoliberal,comment,social security,j9ib9v6,fjdjsbsjsksks,,You’re not OP,2023-02-22T04:12:06+00:00,t1_j9ib7qz
PoliticalDiscussion,comment,minimum wage,d1dmnjt,jckgat,,"> Hillary is already unambiguously in favor of the last 3. 

So why is he demanding them before he'll back her if she already agrees with those?  That makes it seem like he doesn't actually know Clinton's positions.",2016-03-25T23:45:12+00:00,t1_d1dm32h
Republican,comment,minimum wage,ev80psr,WolfPlayz294,,But technically they could all do that because technically it'd be legal.,2019-07-27T22:39:38+00:00,t1_ev80lj8
Conservative,post,sales tax,9ar6x2,IndefinitePresent,What Will Happen When the ANC Takes My Farm - The Plans of a White South African Farmer,"I have no doubt that the ANC Govt has given a lot of thought to the topic of Expropriation Without Compensation (EWC) however I think they might not have fully comprehended the consequences of such a policy. **As a farmer I thought it might be useful to enlighten them as to the course of action I would take once my farm is targeted for EWC.** Before I continue I would like to emphasize that this is not a threat nor delivered with the mindset of a saboteur, it is merely a description of the sequence of events that would unfold in the event of such a policy being enforced.

* I would immediately identify all the moveable assets on my farm and start selling them or placing them in a suitable storage facility. I list these below simply to demonstrate to non-farmers what makes a farm functional and profitable. The first to go would be all the livestock followed by all the machinery including tractors, pumps, silos, centre pivots, electrical transformers, irrigation equipment, water troughs, implements and piping. I would strip the dairy and sell the bulk tanks, milking machines etc. I would take down all internal fencing on the farm and recoup what I could. All sheds would be disassembled and all houses and other buildings would be stripped of anything sellable, including their roofs.

* I would disconnect/cancel the 5 Eskom points on the farm and obtain refunds on the deposits I’ve paid on them.

* I would re-trench all my staff and pay them off in accordance with the Labour Act. I would then strip all the staff accommodation on the farm and sell what I could.

* With the sale of all my livestock and cessation of the farming operation I would immediately default on the R5.5m I owe FNB but I wouldn’t worry as the farm is the loan’s security and I don’t really own anything else.

* When the day came to leave the farm I would hand the ‘keys’ over to the new ‘owners’ but I’m not quite sure what they would do as there’d be no roof on the farm house and there would be nothing to ‘farm’ on the farm. It would just be a piece of land, but that’s ok because the ANC says owning land makes you wealthy.




When you take the sequence of events described above and multiply it on a national scale you see another sequence of events unfolding.

* The new ‘farmers’ arrive on the farm but there is no livestock, machinery or working capital to continue the operation.

* They go to the banks to borrow money (A good farming habit) but the banks are sitting on a R160 Billion defaulted debt book from the ‘old’ farmers and won’t lend a cent to agriculture. They’re fighting for their own survival now.

* The Govt doesn’t have the money, which would be far more than the R160 Billion mentioned above, to re-capitalise and finance all the farms so most of the farms either fall derelict or are farmed at a subsistence level.

* There is a massive but short-term surplus of Beef, Sheep and Poultry products due to the sell-off by the previous farmers. This brings prices down drastically in the short term but eventually the meat runs out and there is nothing to replace it. Meat prices skyrocket.

* Dairy products cease almost immediately after the livestock cull/sell-off and within weeks there is a critical shortage of all dairy products. Importing is impossible due to the Govt’s actions which have decimated the value of the Rand.

* Maize lasts quite a bit longer and with careful rationing will endure until the next season but there is no crop in the ground for next year due to the new ‘farmers’ lack of machinery, experience and access to credit.

* All agricultural Co-Ops and suppliers very quickly cease operation and/or go bankrupt and re-trench all their staff. They cannot survive by selling single bags of seed and fertilizer to subsistence farmers.

* All processors of agricultural products such as meat, dairy and maize cease operation due to lack of product and re-trench all their staff.

* Rural Municipalities start to feel the pinch as there are no longer any farmers paying rates and the agricultural businesses in the towns have also sold up and left.

* Smaller rural towns that depended on agriculture eventually collapse and rural communities are forced to travel long distances to major centres to find ever dwindling supplies.

* Ironically the EWC movement creates more Urbanisation as the rural folk flee the agricultural desert that has been created.

* All food dependent enterprises such as fast food chains and restaurants either disappear or are greatly reduced…along with all their staff.

* With all the unemployed farmworkers, as well as those who have lost their jobs from other sectors, there is an unsustainable demand on the UIF system and it soon collapses.

* The Social Grant system teeters as the ripple effect from the agricultural collapse enters all sectors and the tax-base is shredded.

* Food riots become common and genuine hunger and poverty widespread.

* Unlike Zimbabwe the South African population has nowhere to run.

* With the White Farmer no longer an available target and the true ‘value’ of land revealed in all its fallacy the masses turn on the only target they have left. The ANC.





-[Source](https://www.goldismoney2.com/threads/what-will-happen-when-the-anc-takes-my-farm.196818/)

---

#Atlas Shrugged",2018-08-27T17:55:45+00:00,
Politics,comment,minimum wage,gq09426,Gold_Karma,,"If you have kids, this is a big win for you. You’d still get the $1400 stimulus check for each child and yourself, plus the original child tax credit went up from 2,000 per child to 3,600 or 3,000 if 6 and older.  

They are proposing sending those child tax increases to you directly as a check starting this summer instead of having to wait to get it back as a tax refund like usual. 

So for example. My wife and I have three kids under 6. We will get a $7,000 stimulus check from the $1400.

We will start getting $300 checks for each of our kids for the child tax increase. $900 dollars a month when they start distributing those.

*Edit because I rethought how much I will actually increase by with the child tax because I realized I already receive over half of that $900 currently with the $2000 child tax that is already in place. 

I keep seeing major news articles out there stating people are going to get $300 checks per child with the new tax credit and this is not true because you are already getting a little more than half that now. It’s just most people don’t have their W4’s set up to claim their dependents and they get $2000 back as a refund per child
at the end of the year. 

Right now you are getting $166 a month per child from the current tax credit in place of $2000 per year. 2000/12 = 166. So really you are getting an increase of $134 per month per child, 1600/12 = 133.33. So for me and my 3 children, I can expect the irs to automatically increase my paycheck by $400 total for my 3 children. Since I have my W4 claim my dependents.

Or if they don’t do it automatically a check for about $400 a month. That’s a lot different than what the news about these child tax credits will have you think at first. When I was first looking at it, I thought I would get 300 x 3 children = $900 a month. The problem is, I’ve already been getting more than half that already with the current tax credit.

So, disclaimer, don’t forget about the refund you are already getting. If the government decides to send you your refund in whole with this new child tax increase, but broken up over 12 months, then don’t expect your usual child tax refund at the end of the year.

*Second edit to add, I’m just a fifth grade teacher trying to figure this out like the rest of you. If you have technical questions, contact a cpa after this gets made into law and they will be able to help you a lot more specifically than I can.",2021-03-06T20:02:30+00:00,t1_gpzvip0
Politics,comment,taxpayer,gvygh93,Saybrooke,,"Holy fuck. From now on when conservatives ask ""how are we gonna pay for it"" I'm showing them this.",2021-04-26T18:09:04+00:00,t3_mywz2r
Libertarian,comment,social security,fldbnlr,DairyCanary5,,"Given the gridlock, it looks like both parties give a ton of fucks. They see this as an opportunity to vilify the opposition while the economy nosedives, because they are deeply invested in the outcome of the next election cycle.",2020-03-24T14:45:50+00:00,t1_fld5qy9
Politics,comment,minimum wage,jo0ner1,Ok-Falcon-2041,,"My dad was a skinhead, I was at klan rallies as a kid. These aren't new points, they were said close to 30 years ago.",2023-06-13T18:20:18+00:00,t1_jo0eyqb
Libertarian,comment,income tax,hqf3u3h,me_too_999,,"The US also has the highest prison population outside of China.

And the most political prisoners outside of North Korea. 

More milestones achieved.",2021-12-29T15:33:41+00:00,t1_hqeu8wi
Climatechange,comment,tax,g8f0dal,parsons525,,"The friend isn’t denying anything. He just doesn’t agree on policy.

You guys really need to get out of the bad habit of slurring everyone with the “denier” brush. It’s very fanatical language - anyone who isn’t 100% on board with you, who doesn’t agree 100% with the predictions of Armageddon gets ostracised as “denier”. It’s why people refer to climate alarmism as a cult.",2020-10-11T02:31:15+00:00,t1_g8e11cl
Libertarian,comment,social security,gsz33ef,LibertyLovingLeftist,,I appreciate it.,2021-04-01T00:03:22+00:00,t1_gsz2nte
Neoliberal,comment,minimum wage,jdrurh6,AllCommiesRFascists,,And scarily still 1 sig above the mean of this site,2023-03-26T18:23:06+00:00,t1_jdrimsx
Libertarian,comment,taxpayer,gqr0de3,GarthWaylon,,"So raise the cost of living, the more rural a place is, the higher the cost of living, because it's less and less incentivized for businesses to build the roads, and thus more cost falls on homeowners associations?

If you're worried about rent control or some similar government intervention creating homelessness and causing a lowering of quality in housing to compensate for the raised price, why is imposing a far higher cost, of building hundreds of miles of roads, acceptable?",2021-03-13T00:21:28+00:00,t1_gqqz5d4
