subreddit,type,keyword,id,author,title,body,created_utc,parent_id
Healthcare,comment,deductible,huje6l4,Sea-Emu8897,,"I definitely have to say: 1,000% it’s really true that, even in the best circumstances, it is challenging for providers to give the best of estimates for expected costs of procedures, especially beforehand. There are so many plans, networks, policies, and even plan specific carve outs, et. Al., for every payer! And, the payers all love to warn that benefits are guaranteed and are subject to change, so, even though we can do our absolute best - it isn’t always easy. And that assumes every procedure, code, add on code, etc. is known beforehand and can be included. Definitely not the case in the specialty I work in.",2022-01-28T04:02:22+00:00,t1_hui7tit
Libertarian,comment,social security,gf6akhs,DreadPirateGriswold,,"You only proved to yourself that ""find a vote"" site is suspicious.

You didn't prove the vote excludes dead people either accidentally due to clerical/other errors or more likely on purpose.

In Chicago, our motto is, ""Vote early and often!  The Democratic party can't win without your help!""",2020-12-09T15:25:25+00:00,t3_k9i6mp
Neoliberal,comment,social security,iyiypk6,Circ-Le-Jerk,,"I think reality is, we are going to figure out a way to make modern monetary policy work one way or another. I don't see any other solution. 

Someone once pitched to me a great long term solution that right wingers proposed but was rejected because, you know, politics. But give every American born, a 200k 1% interest loan at birth, put into a government controlled index fund, that they repay over their lifetime. 

That should be plenty of money for retirement, as well as replace QE by helping pump the stock market.",2022-12-01T19:19:27+00:00,t1_iyiceyh
Libertarian,comment,minimum wage,glqq80q,Professional_Draw839,,"Please read. Bloomberg news isn’t exactly pro republicans either. 

https://news.bloomberglaw.com/daily-labor-report/bidens-15-wage-proposal-faces-debate-over-pandemic-era-impact",2021-02-02T15:43:01+00:00,t1_glqommg
Politics,comment,tax,ksya57t,clevsv,,"I am pretty clearly not trying to tell you that Republicans and Democrats are the same, that's just being intentionally obtuse. I'm saying I also do not like much of what the current Democrats do and wish we had more choices. The government is currently a giant sprawling bureaucracy that is horribly inefficient with how it spends our money. I think that both sides contribute to that problem.

The last thing I'll say is about the last true Republican whose way of thinking I had much respect for, though, was Barry Goldwater. He also had some wild far-Right ideas that I strongly disagreed with, but he was pretty prophetic about the Republican party: “Mark my word, if and when these preachers get control of the \[Republican\] party, and they're sure trying to do so, it's going to be a terrible damn problem. Frankly, these people frighten me. Politics and governing demand compromise. But these Christians believe they are acting in the name of God, so they can't and won't compromise. I know, I've tried to deal with them.” - Barry Goldwater

Unfortunately, some of that thinking is now creeping into the Democratic party. Lack of compromise, not religious zealotry. It does not bode well for the future of our democracy, in my opinion.",2024-03-02T03:09:00+00:00,t1_ksy8oa8
Libertarian,post,taxpayer,1bk7pzn,AndrewLucksFlipPhone,"""Just don't break the law and you have nothing to worry about. What do you have to hide?""","Jim Jordan opens investigation into accusations IRS is using AI to spy on taxpayers 'en masse'

https://www.foxnews.com/politics/jim-jordan-opens-investigation-accusations-irs-using-ai-spy-taxpayers-en-masse",2024-03-21T14:23:36+00:00,
Politics,comment,minimum wage,jt8fqj0,Chi-Guy86,,And then on top that you get a louse like Kyrsten Sinema dropping a thumbs down right in your face to rub it in,2023-07-24T10:52:44+00:00,t1_jt8ent9
PoliticalDiscussion,comment,minimum wage,d1clovk,Archer-Saurus,,"No, another Wal Mart or Target could open up, but it would be pretty tough for a start up. ",2016-03-25T02:23:15+00:00,t1_d1clj4j
Libertarian,comment,income tax,l4gzmpp,RaxRestaurantsUganda,,"1876, 1916, 1936, 1948",2024-05-17T15:55:07+00:00,t3_1cu5nn8
Politics,comment,minimum wage,h1lczh4,igottradedforanickel,,You guys are such suckers to support these politicians that have 30+ years in office and every 6 months bring a up a problem that they never give a fuck to fix over the 30+ years,2021-06-13T05:26:55+00:00,t3_nyn1nb
Politics,comment,social security,kvt15kj,Dragoffon,,"And they really don’t want Millennials, gen Y and Z getting into management.   Boomers just can’t stop working.  Or they think work is a hobby",2024-03-20T22:46:33+00:00,t1_kvt040w
Politics,comment,IRS,j3lqw6y,huggles7,,"This is going to be an unpopular opinion that’ll get me downvoted but it’s the truth none the less

Yes the rich pay a lower percentage of income tax then the average joe, but it’s not because they’re cheating on their taxes, it’s because they’re paying very smart accountants who will use every loophole imaginable to pay less taxes

Is it fair? No

But it is legal, yes

The US tax code has something like twice the amount of pages dedicated to tax deductions than it does saying what you should pay

They’re exploiting the system legally (for the most part) even looking at trumps tax returns that are now completely out in the open no one is calling for him to be arrested for tax evasion, why? Because everything he did was legal 

Having more IRS agents won’t make the system fair, rewriting the tax code might",2023-01-09T13:12:53+00:00,t1_j3hzuaz
Climatechange,comment,tax,jymcmgn,Insolator,,Have them try to explain why our seawall walkway in Vancouver now has to be shut down during high tide because it is covered with ocean..,2023-09-01T03:57:47+00:00,t3_166sb73
Libertarian,post,income tax,s6vb8q,mikka2008,Abolish Income Tax,"Income tax punishes production and is less flexible when it comes to financial planning. I think there should be only one tax, which is VAT. It is fairer too because everybody pays according to what he consumes. A self-regulating tax system, if you wish.",2022-01-18T11:22:33+00:00,
PoliticalDiscussion,comment,IRS,cy7e605,awa64,,"That's not what ""abolish"" means.",2015-12-22T03:38:35+00:00,t1_cy7dsg9
Politics,comment,minimum wage,gv35mnk,TBrutus,,"She won't though. If she flips, or even runs for reelection, she'll lose in a landslide. She thinks that she can run the McCain playbook, but I think she missed where the country has really changed beyond just allowing her to be herself.",2021-04-19T14:52:47+00:00,t1_gv328jn
PoliticalDiscussion,comment,income tax,igsvafw,novagenesis,,"Perhaps because I'm from her state, but what I concluded from following it closely was the other way around.  She tried to play clean and honest and got put through the meat grinder by the press and Sanders.

I used to blame Bernie, but now I realize you *need* to fight dirty and backstab even friends to survive as a president",2022-07-19T17:11:26+00:00,t1_igsp2ts
Politics,comment,income tax,g6wlec5,Twoweekswithpay,,"> Undocumented immigrants paid $11.7 billion in state and federal taxes in 2014. Trump paid only $750 the year he became president and only $750 the next year.

> He needs to stop freeloading off Americans.

> https://twitter.com/juliancastro/status/1310351795928039424?s=21

Damn Straight! 🤬😤",2020-09-28T00:25:05+00:00,t3_j11ypp
Libertarian,comment,taxpayer,g4irqd3,5_cat_army,,"Ive been in multiple conversations, in person, where a democrat accused us of being sexist/racist. I basically just told them that i am less racist than they are. As far as im concerned, its none of the governments business what my sex,gender,race, religion, sexual preference is. And i really dont care what anyone elses is. It generally blows their minds",2020-09-09T05:32:45+00:00,t1_g4ipwyy
PoliticalDiscussion,comment,income tax,deylcvo,WasabiBomb,,"> Leak uncontroversial peices of trumps tax returns
> Wait for the MSM to blow there load and hype it up

Then realize that it shows just how little the President would have paid if the AMT were to be repealed as he's planning to do.",2017-03-15T14:45:59+00:00,t1_deydf0g
Libertarian,comment,income tax,hpe35hu,Dr-No-,,If he's paying 53% he's an idiot.,2021-12-21T05:20:14+00:00,t3_rki4bi
Politics,comment,income tax,i4nmc8c,p____p,,"that's fucking gross memey bullshit, so it's totally on brand for muks.",2022-04-14T03:18:06+00:00,t1_i4ngail
Politics,comment,tax,ktzajo1,GoldVictory158,,"So people can buy overpriced homes at high interest? Not a good plan.   As others have mentioned we need no foreign ownership/investment in homes, and progressive tax on properties beyond one’s primary residence.   Biden is a solid OK.",2024-03-08T21:50:25+00:00,t1_ktz72nd
Libertarian,comment,social security,g319vsr,part-three,,"Look at this guy's flair. Says he's a ""libertarian socialist."" The guy needs to fuck off back to r/polictics cuz' there ain't any such thing as ""libertarian socialist."" 

Take your bullshit elsewhere. You pollute this sub.",2020-08-27T16:12:05+00:00,t3_ihmwu9
Progressive,post,income tax,dtyf6,SarahLee,"Robert Reich: ""An unprecedented concentration of income and wealth at the top; a record amount of secret money flooding our democracy; and a public becoming increasingly angry and cynical about a government that's raising its taxes, reducing its services, and unable to get it back to work.""",,2010-10-20T18:09:37+00:00,
Libertarian,comment,income tax,hzrkio3,firedrakes,,this is bs,2022-03-07T22:52:58+00:00,t3_t90azc
Geopolitics,comment,social security,dhmlyyn,CarnegieCivicAct_AUA,,"Hi, thanks for this interesting question. I won't repeat what my colleagues just answered. I think robust civil society also depends on its ability to create an inclusive narrative which enables the mobilisation of broad-based alliances. This inclusive narrative has become extremely difficult in polarised societies such as Thailand, Turkey, Egypt and many others, where protest movements have been accused of siding with one political group or representing an exclusive identity. Janjira",2017-05-16T13:50:47+00:00,t1_dhmiwpy
Politics,comment,tax,kwl13nl,outdoorruckus,,Would register and vote B if he did this.,2024-03-26T02:06:53+00:00,t3_1bnrfmy
PoliticalDiscussion,comment,deductible,hljyeig,cdreid,,"So you want to create a laser sharp tax cut for the middle class that most won't see specifically to appeal to center right districts and protect the dems who are kbeecapping the dems? And a tax cut 99% of people won't understand or be aware of? 
Here's a better solution. Raise the alternative minimum tax and implement a transaction tax on the stock market and gice everyone below 100k a straight up rate cut.
(Where I live 100k is firmly lower upper or upper middle.. in nyc abd sf I it is probably barely middle class)",2021-11-21T20:40:03+00:00,t1_hlivsd3
Neoliberal,comment,taxation,g4vg3f8,oGsMustachio,,For the US?  Pretty firmly a Democrat thats willing to vote for a moderate Republican if the Democratic candidate is nuts.,2020-09-11T22:26:09+00:00,t1_g4up5mx
Geopolitics,comment,income tax,ehsab0b,toke-in-all,,"The most damning thing which made me immediately stop wasting time on this article was how he disingenuously mentions poverty allleviation rate instead of simply comparing the poverty rates of now and then.   Isnt it common sense, alleviation rate will be higher when there are a lot of poor people and will become less when much less poor people remain.


India IS a miracle. How far we have come. Less than 70 million poor remain today.


What has happened to India after 1990 is a wonder, which has drastically improved the lives of each and every Indian.


And we have just started, the potential is crazy.",2019-03-04T19:05:58+00:00,t1_ehryw67
Libertarian,comment,taxation,h8xjx73,ohmanitstheman,,Another thing is we have really poor literacy in a lot of subjects. We end up with a lot of hair-brained critics who unite on whatever aligns with their preconceived notion rather than learn fundamentals involving the subject.,2021-08-14T17:18:12+00:00,t1_h8xfu5s
Libertarian,comment,minimum wage,goy2cw5,TheUserU2,,"Wages are prices, which are created by supply and demand. There really isn't such a thing as a ""minimum wage."" Really, this is just price fixing. When the price is artificially set lower than market equilibrium, a shortage occurs. A surplus occurs if the price is artificially higher. 

So if the minimum wage is higher than market equilibrium, then there will be a surplus of workers relative to jobs, assuming all else is equal. However, all else usually isn't equal, so there is usually a shortage of hours (or something of the sort) instead.",2021-02-27T04:50:10+00:00,t3_ltet90
USpolitics,comment,IRS,g3nh86q,dukeofmadnessmotors,,It's crooks all the way down. There is no bottom.,2020-09-01T22:42:26+00:00,t3_ikufni
Politics,comment,tax,ktutspq,Renegade-Ginger,,"That’s what I can’t stand about living in a red state. “Why is our state infrastructure so bad?” Because we don’t pay shit in taxes, you get what you pay for.",2024-03-08T02:01:25+00:00,t1_ktucp6b
Politics,comment,social security,j0w307u,SeeAllThePlanet,,I'm confused why Clark isn't included in the false statement charge. Dude penned a letter that said DOJ found inconsistencies and the idea was to give it to state governments. Did he dodge the bullet because he never got appointed to the job and never got the opportunity to send it? Still sounds like a big piece of that plan that he was directly involved in.,2022-12-19T21:14:44+00:00,t1_j0w09c0
PoliticalDiscussion,comment,minimum wage,e4orkic,TigerUSF,,"Yes, because the legislation isn't strong enough to stop it.  ",2018-08-23T11:46:39+00:00,t1_e4on7pu
PoliticalDiscussion,comment,IRS,cjtk4oy,bit99,,yeah well whatever don't shoot the messenger buddy. This is how it is. They don't have the resources to audit everyone who stole a DVD. ,2014-08-18T13:55:41+00:00,t1_cjtk3wm
Politics,comment,taxpayer,jtvgxue,Valyriablackdread,,Typical Republican behavior,2023-07-28T23:33:13+00:00,t3_15c7zcs
Conservative,comment,taxation,jnvi2jc,kalirion,,"Taxation isn't theft, but corruption usually is.",2023-06-12T07:29:08+00:00,t3_147epcf
Neoliberal,comment,taxation,ilt3r0a,Dawnlazy,,"How do you have property rights without the power to enforce them? I am a staunch defender of capitalism and private property, but without the government, who's to say what's actually mine? I'm not particularly interested in starting my own private militia just so that I can defend my own property since there's no police or court system to uphold my right of ownership. Taxation isn't theft, it is tied to the functioning of the very thing that allows me to determine what's mine and preserve it from being taken freely.",2022-08-26T00:36:08+00:00,t3_wxnr97
Republican,comment,minimum wage,cxgac1l,captrockwelltorrey,,"Protestors at the local Walmart today were demanding $15/hour. I asked one why $15? Why not $20, $30 or $50? She had no answer.",2015-11-29T01:18:04+00:00,t3_3ujy2o
Libertarian,comment,taxpayer,gmpl27j,JKirkis,,">less government.

""i support legalization but the more we ignore process the more this country falls apart and politicians just do whatever they want because they know they can ignore process.""

If your solution is less government, then you would be opposed to these processes set up by government and used against the people in the first place. You can't be both a government bootlicker and want less government.",2021-02-09T16:14:49+00:00,t1_gmpk6kr
Progressive,comment,minimum wage,cqhrybj,BAXterBEDford,,"He's closer to the 10%. He's a plumbing contractor that owns his own business. And his opinion of other people not doing as well is that they themselves should do something about it. 

I don't agree with him, and I think his views are dangerously simplistic. He strikes me as someone who read *Atlas Shrugged* in his freshman year at college and that set his political/economic views for life.",2015-04-19T20:36:02+00:00,t1_cqhroox
Neoliberal,comment,IRS,hks7pu0,spidersinterweb,,"Your editorializing is kinda nonsense. Whether the republic lives or dies won't hinge on some welfare bill. And the bill isn't dead, they may just need to make more cuts. That's ok. It's not the end of the world. Democrats will win again next decade and get at least a little more done then too before losing power for another decade. It will be ok.",2021-11-15T23:20:54+00:00,t3_qusjzf
Neoliberal,comment,social security,l4rn1ec,RadioRavenRide,,"I see. And what specifically do you mean by ""they politically suppress us""?",2024-05-19T18:22:21+00:00,t1_l4rlsxt
Politics,comment,minimum wage,gpwgdkf,Narrow_Goose3138,,"Cowards.

Nothing more to say",2021-03-06T08:58:55+00:00,t3_lyl6lg
Politics,comment,tax,k8zda78,Nonconformists,,"Good job paying off your student loans. I don’t agree that they should all be forgiven 100%. Lots of people have been tricked into large auto loans, paying high rates and way too much for vehicles. Many are young, poor, military, or all three.  Should those loans be forgiven? Should all auto loans be forgiven because some are bad? All student loans?

Why are student loans so much worse than unscrupulous auto loans? Many student loans and me auto loans are beneficial to the borrower.",2023-11-12T21:34:39+00:00,t1_k8yw2mw
Libertarian,comment,taxpayer,k7oiawe,seobrien,,"Your proof of that?  That's the argument being made right now about public schools vs. private vouchers. 

Respectfully, public school generally already sucks and the Fed / States won't meaningfully pay teachers.  Giving people choice is the ethical and moral thing to do and if it causes the Public system to get their shit together, win-win, because right now, the public system isn't getting better (blaming the private schools will make it bad is a misleading scapegoat)",2023-11-03T17:54:08+00:00,t1_k7ocimb
PoliticalDiscussion,comment,tax,hctto04,CoachSteveOtt,,This sounds like a reasonable place to start. I wonder how much we had budgeted to build roads and schools and shit in Afghanistan?,2021-09-14T15:08:20+00:00,t1_hctt6i4
PoliticalDiscussion,comment,minimum wage,evb1s83,ffball,,Everything in politics is subjective man. That's like the entire point.,2019-07-29T01:23:57+00:00,t1_evb13dz
Politics,comment,minimum wage,gq4qdc4,_sekhmet_,,"I live in WV, even making $14 an hour I still have to work around 52-60 hours a week to make ends meet, about that’s with time and half over time for everything over 40 hours. He only thinks that $11 an hour is enough for WV because he doesn’t have to live on it. If he did he would be singing a completely different tune.",2021-03-07T19:57:57+00:00,t1_gq3s8nf
PoliticalDiscussion,comment,income tax,ef86ti0,Grenshen4px,,"A lot of never trumpers who were mostly republican suburbanite and independents who said they would vote for Johnson came home over the last few months of the campaign.

https://www.realclearpolitics.com/epolls/2016/president/us/general_election_trump_vs_clinton_vs_johnson_vs_stein-5952.html

Both candidates of the biggest party tends to see third party support ""come home"" but its more evident amongst republican voters since theres less of a purity test amongst republicans in regards to their party's candidate like Trump than democrats in regards to the party's candidate.",2019-01-29T02:33:35+00:00,t1_ef7ylxg
Neoliberal,comment,social security,j9j6kxe,RedditUser91805,,"The social security system has been using an unrealistically high cost of living adjustment that has, in effect, been raising the real value of payouts since 1975.

Chained CPI more accurately accounts for consumer behavior to preserve purchasing power of recipients and is usually marginally lower.",2023-02-22T10:21:00+00:00,t1_j9iz0pt
Libertarian,comment,IRS,hdjie31,RagnarDannes34,,"working class has a connotation of ""your average Joe""

Not this clown living in a 1.9mm villa",2021-09-20T02:04:42+00:00,t1_hdjhglr
Neoliberal,comment,minimum wage,hougbcw,groupbot,,"Pinged members of MAMADAS group.

[About & group list](https://reddit.com/r/neoliberal/wiki/userpinger/documentation) | [Subscribe to this group](https://reddit.com/message/compose?to=groupbot&subject=Add%20yourself%20to%20group%20MAMADAS&message=addtogroup%20MAMADAS) | [Unsubscribe from this group](https://reddit.com/message/compose?to=groupbot&subject=Unsubscribe%20from%20group%20MAMADAS&message=unsubscribe%20MAMADAS) | [Unsubscribe from all groups](https://reddit.com/message/compose?to=groupbot&subject=Unsubscribe%20from%20all%20groups&message=unsubscribe%20)",2021-12-16T23:24:52+00:00,t1_houf3sp
PoliticalDiscussion,comment,social security,kv4gxwr,Arcnounds,,In everyone of his proposed budgets while president he recommended trimming entitlements. I do not think it is far fetched to consider that he might be thinkong about slashing entitlements.,2024-03-16T11:03:22+00:00,t1_kv35ens
Neoliberal,comment,minimum wage,jdrk6l5,TheGeneGeena,,"We do pay if we buy their products or services. A business without customers is less a business than a business without employees.

A lot of folks would be more than fine paying a buck more for a burger if the guy serving it got health insurance.",2023-03-26T17:08:29+00:00,t1_jdrfv0t
PoliticalDiscussion,comment,IRS,ii005jd,Greaserpirate,,"> Inflation won't last forever

It will if we keep spending

> Dems are passing legislation that will cover the cost of the CHIPs bill

Ah, they're finally taxing the rich? Or are they just raising corporate taxes?",2022-07-28T15:16:23+00:00,t1_ihzwpni
PoliticalDiscussion,comment,minimum wage,eebbgm6,KarenMcStormy,,"We subsidize their living expenses, their healthcare, their low income....

 ",2019-01-18T00:04:30+00:00,t1_eebb3td
Geopolitics,comment,social security,eeu17m8,exploding_cat_wizard,,"> Most of the austerity measures that cripple the european countries where forced by the European Commission and the ECB, hence it's not far fetched to say that the liberalisation caused most of the important changes in our european society.

There are only a few countries actually crippled by austerity. Those that would be crippled by spending every fucking Euro on interest payments otherwise, because they outspent themselves foolishly. While I disagree with many of the austerity measures that have been imposed on Greece, nobody forced them to become an ineffectual corrupt state that spent far more than it should have. It's just that within the Eurozone, the old standby of devaluing the currency instead of changing the overspending and corruption doesn't work anymore. Similar things could be said of Italy, though they are floating along for now. 

>European institutions which obviously lack representativeness

The central bank? That's independent, as it is in all economically successful liberal democracies, true. The heads of no central bank used to be, or are, elected in Europe, or indeed anywhere I know of.

The parliament? Obviously representative. The Council is basically the US Senate in the 19th century, though with more power - the democratic mandate stems from the people of the individual countries electing representatives to send to the Council. 

The same is true of the Commission - an executive not chosen by the Parliament or a direct election, but by the individual, democratically legitimized nations within Europe. You might complain that this is too much indirection, but in most member states, including France, you've got little say who actually runs the government - the ministers are all appointed, just like the council.

Finally, to get back to the actual point, the Commission has pretty much zero actual power to impose austerity on anyone. It was the majority of member states via the Council (and in Eurozone cases, the unofficial but equivalent gathering of all the member states) that is the driver of this. Without those, nothing can happen. Not even a unanimous vote in both Commission and Parliament could change that - the EU is still a confederation of nation states, not a federation of federal states. And France voted in just as much austerity on European nations as did Germany. It seems that they've got no good alternative story to sell, only crappy ones - those damn Muslims, for example - or ones people don't believe in anymore - see the socialists.",2019-01-24T09:50:39+00:00,t1_eerfqzl
Neoliberal,comment,taxation,j9lp7hv,generalmandrake,,"Yeah, that is basically what I’m getting at. Accurate assessments are a challenge and the whole thing is subject to fuckery.",2023-02-22T21:46:48+00:00,t1_j9kz182
Conservative,comment,taxed,kcgtxho,Krieger117,,Envision the average person in your mind. Got it? Now realize that half the population is dumber than the average person. There's your answer.,2023-12-08T05:38:13+00:00,t1_kcbu6j2
Liberal,comment,tax,ejazx8a,Ncemt1759,,"Cool, as long as red states tax money stayed in red states. ",2019-03-25T00:32:37+00:00,t3_b4kig5
Politics,comment,sales tax,j5t7nke,RemBren03,,"Sales tax disproportionately impacts low/medium wage earners. There was a [study](https://www.bloomberg.com/news/articles/2015-01-20/how-local-sales-taxes-target-the-poor-and-widen-the-income-gap) about it in 2015 at the state level. Sure the rich are spending more money, but are generally spending it in a way that means they aren’t actually paying the sales tax",2023-01-25T12:00:26+00:00,t1_j5sm5mn
Politics,comment,taxpayer,gs2xcg4,user120912,,Next years audit slated to find the “no shit” statement we all uttered at the same time upon reading the headline.,2021-03-24T18:54:16+00:00,t3_mbygb9
Democrats,comment,IRS,ikte11q,urbanlife78,,And he thinks his family are upset when he has to work on holidays.,2022-08-18T16:47:59+00:00,t1_iksofa8
