subreddit,type,keyword,id,author,title,body,created_utc,parent_id
PoliticalDiscussion,comment,minimum wage,dk6cu4z,BrooklynLions,,">**If cities were sovereign** and LA decided to raise their minimum wage to $100 an hour (an amount that would undoubtably destroy the local economy and majorly effect the entire state's economy), CA shouldn't be able to stop it?

I was just pointing out that if you accept a city's sovereignty, then you'd also have to accept their ability to make decisions which may negatively affect a co-sovereign. 

This doesn't mean I believe cities are co-sovereigns (they aren't). That said, my personal believe is that they should be. Any argument for states' rights equally supports cities' rights. If Oklahoma doesn't like citizens in New York and LA telling them what to do, why should bunch of counties in Northern California or Upstate New York or the Texas panhandle be able to dictate how LA, NYC or Austin conduct things in their own city?",2017-07-13T17:42:59+00:00,t1_dk6c5sm
Politics,comment,tax,l3q9b0h,RJoeEL,,Enjoy your long nap,2024-05-12T16:33:56+00:00,t1_l3pzfa3
Neoliberal,comment,deductible,kwnaa4b,illuminatisdeepdish,,">Subsidizing density by lowering tax burdens on yimbys relative to nimbys and encouraging billionaires to build Kowloon cities on their estates



These levels of based shouldn't be possible",2024-03-26T14:32:16+00:00,t1_kwn2y2a
Politics,comment,taxpayer,ia8rn3c,v9Pv,,What kind of fools elect such an obvious scumbag fraud like Putin’s boot polisher and Trump ball twirler Ron Johnson? Pathetic.,2022-05-27T21:41:49+00:00,t3_uz1kf3
Politics,comment,sales tax,d90ylat,sdcinerama,,"You guys just agreed to give the Raiders $750 Million.

You need every dollar you can get.",2016-10-20T22:25:07+00:00,t1_d90bs39
Progressive,comment,social security,c5n4pau,viborg,,I found out today that [Krugman was a principle supporter of the original NAFTA proposal.](http://www.reddit.com/r/radical/comments/xiu22/the_left_vs_the_liberals_by_sean_wilentz_a_review/) I guess we all make mistakes sometimes.,2012-08-02T16:11:16+00:00,t3_xkcpc
Politics,comment,income tax,erpnk7q,TheManWhoWasNotShort,,I've been looking forward to the Flowers decision for a long time thanks to In The Dark,2019-06-21T13:20:50+00:00,t3_c39xfa
Politics,comment,IRS,k7eihte,jakexil323,,So how would the Sinema  voters split if it was just Gallego vs Lake ?,2023-11-01T19:00:59+00:00,t1_k7ef24a
Politics,comment,minimum wage,gptlgcr,thiosk,,"MA and NH are currently having a spat over who gets the income taxes for work remote employees who are staying in NH but doing work in MA. they used to commute, and now they telecommute, so the two states are fighting and arguing about it

NH residents are benefiting from MA wages and not contributing to MA tax base and MA is pissed",2021-03-05T21:56:03+00:00,t1_gpt3sam
PoliticalDiscussion,comment,IRS,c6xnkze,spiff_mcclure,,"[Results](http://vote.sos.ca.gov/returns/ballot-measures/) for the California Ballot Measures.

Looks like death penalty stays. GMOs will not be labeled. Unions can continue using payroll funds. Independent panel redistricting stays.

EDIT: Found [this](http://vote.sos.ca.gov/returns/ballot-measures/) for Oregon measures. Looks like they voted to not legalize marijuana.

EDIT: [Colorado](http://elections.huffingtonpost.com/2012/results/colorado). I think they legalized weed?

EDIT: [Marijuana laws](http://nbcpolitics.nbcnews.com/_news/2012/11/06/14977250-colorado-washington-approve-recreational-marijuana-use?lite)",2012-11-07T05:38:47+00:00,t3_12qdww
Liberal,comment,income tax,d3ds79h,sweatytacos,,Then he will be prosecuted then fined or imprisoned. I don't support him. What law did he break?,2016-05-21T03:44:01+00:00,t1_d3dfnp8
Politics,comment,IRS,kpg2s84,Hobodaklown,,100%,2024-02-08T05:23:50+00:00,t1_kpg22qp
Politics,comment,tax,kty2a4n,jackp0t789,,"It was known as ""Horse and Sparrow"" economics in the 19th century... You feed enough acorns to horses and they'd shit some out for the sparrows in theory...

It's been known to be horse shit for over a century... 

They just rebranded it in the 80s.",2024-03-08T17:43:26+00:00,t1_ktxt1hz
Liberal,comment,taxpayer,c7nyj14,Duncanconstruction,,"I'll clear up your misconceptions about the Canadian welfare system. I've been on Ontario Works while working part time (I was 22 years old, had been laid off from one of my jobs and the other wasn't enough to pay the bills). I was given 650$ per month to cover everything... food, rent, transportation, etc. Every dollar I earned through my part time job went to Ontario Works, up to the 650$. I was required to give them all of my financial information (including a signed document from my landlord stating how much rent was per month with banking statements for the previous 3 months to back that number up). I also had to bring in my paycheck stub every month so they could deduct what I earned from my government cheque. If you think that's too generous, then I don't know what to say. I could barely afford to eat by the time the end of the month came around. I was on OW for 3 months, found a great job and have never been more financially stable in my life.

 Your family member is committing welfare fraud. It has nothing to do with the generosity of the government. It's akin to saying that wal mart gives out free tv's because your family member paid nothing for that flat screen TV she shoplifted.

After reading your post I think that this is just a classic case of somebody who is under-informed and lacking a teensy bit of empathy for anybody who has a different life circumstance than you. Abortion is a medical procedure. By your logic, we shouldn't fund bypass surgery on people who smoke or are overweight. I'll let others respond to your other points, I loathe arguing with low information voters. ",2012-12-29T22:23:12+00:00,t3_15n2xa
PoliticalDiscussion,comment,social security,k3xr5v0,northByNorthZest,,"Oh wow, you actually believe people like you and me paying the same tax rate as a literal billionaire is ""fair"".

If you're wondering why you're getting your ass kicked up and down this thread google ""marginal utility"" and maybe read some Econ 101.",2023-10-08T02:22:19+00:00,t1_k3vkj4f
Neoliberal,comment,income tax,kc0km8y,MaNewt,,"ChatGPT doesn’t have thoughts per se, ChatGPT is showing you the log likelyhood over the text it has read makes that the most likely coherent following text. 

Basically I am saying it can be wrong if the majority of the text it has read on the subject is wrong. Put about as much faith in it as you would a kinda dumb intern who is nevertheless well read and possesses inhuman memory and typing speed.",2023-12-04T22:28:12+00:00,t1_kbzk7t4
PoliticalDiscussion,comment,income tax,kulq90o,hallam81,,"I'm fine with cutting spending. But taxes need to increase on everyone. No one is paying the taxes to make up for the services that they use. The extreme poor may never be able to pay. But everyone else needs to have a tax increase. 

We owe 32 trillion. If we cut all federal spending, not what you want gone, but all of it, and we still won't be able to pay down debt for 7 years. And that is at our current tax rate. Cutting everything is not reasonable. But neither is believing the lie that just cutting of spending will work. We need to do both. A reasonable solution is to cut spending to 80%, add taxes directly for paying down debt, and target 50 to 80 % debt to GDP. Even then it will take decades to do.",2024-03-13T00:07:38+00:00,t1_kulnz2d
Neoliberal,comment,income tax,jb9jxno,that0neGuy22,,We need to raise taxes on a lot more people due to the trump tax cuts. But you guys aren’t ready for this discussion,2023-03-07T13:26:17+00:00,t3_11ky2t0
Politics,comment,taxpayer,k24bi3b,joevinci,,"> Why can't we take care of our own problems here at home before we go around the world creating more

Because for 60 years Republicans have beaten their constituents into believing using tax dollars to help their own communities is somehow socialism (""bad""), but using tax dollars to subsidize capitalism (""good"") and spreading ""democracy"" by bombing brown people is what god wants.

For once we're actually using our ""defense"" budget for defense. But Republicans are still dismantling social programs at home.",2023-09-25T10:55:56+00:00,t1_k2477el
PoliticalDiscussion,comment,social security,hsfsjof,LittleBitchBoy945,,"That’s not fair, if you wanted to, you could’ve fixed it with only tax increases, I just chose not to do it that way because I don’t wanna raise taxes on lower class people when I can means test the program and make the program whole by taking benefits from the wealthy",2022-01-13T03:01:51+00:00,t1_hsfbv06
Politics,comment,minimum wage,h6fnbeg,calamityfriends,,"What do you do if you don't have a car or you support family and can't go to school, can't afford to better yourself, what do you do when you are stuck because there aren't opportunities near where you live? See it's easy to come up with easy solutions like ""get a better job"" or ""stop being lazy"", but this assumes that poverty is an individual problem not a social one",2021-07-25T02:48:44+00:00,t1_h6ee4ma
Neoliberal,comment,income tax,hhg8loo,maexx80,,I don't think any government should have the right to strip its citizens of means to defend themselves.,2021-10-21T03:39:27+00:00,t3_qc9vaz
Conservative,comment,taxpayer,jkqjlka,Secund2nun,,"I agree. White liberals are the worst. Many of them (except the moderates) believe all of the liberal agenda including the lgbqt trans men can become pregnant BS. The non-white liberals actually oppose the lqbqt woke trans BS part at least along with some other woke parts of the platform. They also don't hate the US, unlike most white liberals and many African American liberals.

This is based off of my memory, but Cubans are obviously the highest, especially older ones. Dominican men are up there also. They have high rates of being Republicans. The women not anywhere as much as the men (not a shocker bc we all know men are more likely to be conservative than women), but DR women are still probably somewhat to slightly higher than other female immigrant groups. South Asians are more Republican than most other immigrant groups also, but not as much as whites.  Mexicans (especially the men) are trending Republican thanks to the woke liberal policies, but there are still many liberals among them, especially females.

By far the most liberal groups are Puerto Ricans and African American females. African American men don't see to care about voting, but they are usually liberal but at noticably lower rates than the females. The few MAGA African Americans I have met have all been men.

African American and PR females don't just have high rates of being dems, but through my conversations with them most of them are extreme leftists also. Though sadly many immigrant groups vote mainly democrat.",2023-05-19T05:35:24+00:00,t1_jkqhoa2
Libertarian,comment,social security,kqqz3x2,TellThemISaidHi,,Your terms are acceptable.,2024-02-16T21:50:29+00:00,t1_kqqjzuj
Politics,comment,social security,ivt70ol,thefoodiedentist,,Ppl forget that impeachment is an extremely rare thing because of Trump,2022-11-10T13:00:07+00:00,t1_ivt5g1s
Politics,comment,IRS,ij9jj4z,Parniculus,,Why do churches get any tax breaks at all? They should not.,2022-08-07T02:46:38+00:00,t3_whxh4z
PoliticalDiscussion,comment,tax,gt2ci2q,CChaps75,,The whole point of my comment was to include  minority votes.  Rural areas would be one of those minorities.,2021-04-01T19:29:59+00:00,t1_gt29u1s
Libertarian,comment,income tax,har0s7c,uniquedeke,,"Nope, not even a little bit. 

It was a derisive and mocking dismissal of your poor writing and sad attempt at thought.",2021-08-29T01:05:06+00:00,t1_haqo90a
Democrats,comment,tax,hm24tn8,KrustyBoomer,,Did you not witness the infrastructure fight?  It wasn't really the GOP hanging things up,2021-11-25T17:59:20+00:00,t1_hm1k8fh
Politics,comment,income tax,iu2ziyf,krichard-21,,"Hmmm, I swear he mentioned he would publish his tax returns after he won.

Maybe they are with his new Healthcare plan?",2022-10-28T04:12:46+00:00,t3_yf7yu3
Conservative,comment,minimum wage,gpct86d,RedRightandblue,,Minimum wage should be $0.1. People can negotiate their own salaries,2021-03-01T23:24:53+00:00,t3_lvmazj
PoliticalDiscussion,comment,tax,i6483rv,ge93,,"How exactly does this article debunk anything? Political speech by corporations is different than commercial speech (ie advertising products, billboards etc.) as outlined in the article. The article mentions that political speech rights bu corporations have been expanded by recent decisions, far more than criticizing a policy decision and ceasing donations.",2022-04-25T11:25:43+00:00,t1_i63ne8p
Politics,comment,income tax,j160hcy,stclvr53,,What Trumpican thinks this is OK? CROOK!,2022-12-21T22:37:38+00:00,t3_zrulmg
Politics,comment,minimum wage,j3yg3jr,Lyknow,,Of course. How is this even a question?,2023-01-11T22:43:54+00:00,t3_109icqa
Libertarian,comment,income tax,koz932z,Best_Air_4138,,"Yeah what the fuck does a “living wage” even mean? Each region in the united sates differs in a livable wage. Do these people want middle class wages, because that’s definitely above a living wage. Granted the middle class is shrinking with each year, which is not good. My wife and I combined make $90,000 a year and we are just barely middle class. Though we still live a very comfortable life. We don’t own a huge house, we’ve downsized our home actually, we don’t have shiny new cars and we don’t eat out a lot. We save money to take big trips once a year and we have money set aside for disasters. People our age, 25-30’s, need to learn how to manage their money and not over spend on needless things. You don’t need that new iPhone 15, your iPhone 12 is still good, you don’t need a $500,000 home, you don’t need to run your shower for 30 minutes, you don’t need to eat at a restaurant every other day, you don’t need to pay for door dash every day. It’s ok to put money aside and you don’t need that shiney new item, you saw on TikTok, that you’ll use once and put away forever. People just want to spend money on their wants and complain when things they can control start to add up in costs. Pay down on the principal of your student loans and you will be rewarded later in life. It takes patience which younger people do not have.",2024-02-05T03:51:43+00:00,t1_koxad6v
Geopolitics,post,tax,d619ku,caonim,US debt problem,"At present, the US government's fiscal debt is 22 trillion US dollars, plus the state's debt of 6 trillion US dollars, a total of 28 trillion US dollars, while the US GDP  last year was 20 trillion US dollars.

If the average debt growth rate for the next five years does not change, then the total US debt will reach 38 trillion US dollars. This means that the US government's debt ratio may exceed 150%, while the US government generally requires the debt ceiling not to exceed 70% of GDP, and 100% is in the alarm stage.

If there are 40 trillion US dollars of debt, averagely ten-year debt. The US needs to pay back 4 trillion dollars a year. And the interest of 40 trillion US dollars is almost 1.1 trillion US dollars, which adds up to 5 trillion US dollars each year. It is almost equivalent to the tax that can be generated by US GDP, which means that even if all the taxes are used to pay back debt every year, it is still not enough..

How can US government solve this problem? What is the possibility of a potential financial crisis in next 10 years? If the crisis burst, what's the implication on international relations?",2019-09-18T17:38:54+00:00,
Conservatives,comment,taxpayer,i8unpud,tulip27,,Give me a break. I'd love to have the same benefits as they do!,2022-05-16T18:33:58+00:00,t3_ur1o47
PoliticalDiscussion,comment,social security,kucd9jb,TizonaBlu,,"That’s not what divest means…

Also, Bytedance is 60% owned by non-Chinese entities.",2024-03-11T09:02:14+00:00,t1_kubwdox
Libertarian,comment,FICA,dg7zvau,upthatknowledge,,"Dont get me wrong, i understand the dangers of government overreach..
But taxes are theft? If you hate the 6th amendment so much why don't you all buy some land from another country and move there? I know the ""if you dont like it leave"" argument isnt the best, but taxes will be a part of america forever and if you choose to stay here you choose to accept taxes.  Instantly making it not theft.  

Agreeing not to leave the united states is the same as agreeing that taxes arent theft.",2017-04-13T18:33:45+00:00,t3_656m80
Progressive,post,tax,aqe4o6,progress18,"Republicans Trying, Failing to Come Up With Good Reasons to Conceal Trump Taxes",,2019-02-14T01:16:12+00:00,
Politics,comment,social security,is94hrn,NorCalHermitage,,"Supposedly, but their magic math leaves much to be desired.  A few years ago, they were claiming that inflation was under 2%, which was ludicrous at the time.  The main problem is that they don't count things like groceries and gasoline, because they're ""too volatile"".",2022-10-14T05:06:23+00:00,t1_is7l1s7
Republican,comment,IRS,ije6goi,WranglerVegetable512,,"By the time they’re done catching up with 2020 tax returns, hopefully Trump will be president in 2024 and will fire all of them.",2022-08-08T02:46:18+00:00,t3_wiv53y
Libertarian,comment,income tax,hb27bcm,asilenth,,I own guns... I also never talked about restricting which guns you can own.,2021-08-31T14:26:41+00:00,t1_hb20yh1
Politics,comment,IRS,j13y8s5,HauntingJackfruit,,"Repubs  ""The government doesn't work efficiently because we do everything we can think of so that it doesn't.""",2022-12-21T14:27:43+00:00,t1_j13x0ol
Politics,comment,IRS,kpfpcc4,DemsruleGQPdrool,,"My father's landscaping business was 60% cash for 30 years. He is a Republican. What a fucking surprise.

I always marveled at how much CASH he always had on him...he gave a nice DISCOUNT to allow people to pay in cash. 

I just hate that as I get older, I find out more and more how scummy my family is/was.",2024-02-08T03:32:59+00:00,t1_kpfgc2x
Neoliberal,comment,IRS,kuznbz7,Sea_Flow6302,,"You're assuming people are smart and have all the necessary information, which is not true in any sense. People find themselves in a desperate situation and look to rideshare for quick money. Only problem is, they barely earn more than the costs they incurred. Now they have little additional cash, a more worn and depreciated car and spent a bunch of time that could have been spent pursuing other opportunities to dig themselves out. Maybe they figure it out eventually but only after the corporation has extracted part of what little wealth they had. Does that really sound like a fine situation?",2024-03-15T13:44:58+00:00,t1_kuziis4
Politics,comment,minimum wage,gpuho3x,Chi-Guy86,,"Joe Manchin as it turns out, has 50% ownership in a hotel and other businesses that pay less than 15 per hour.  Shocking",2021-03-06T01:53:54+00:00,t1_gpu7oyd
Politics,comment,minimum wage,h1owj5k,Ironthoramericaman,,"Y'all are all about ""what the market demands"" until the market demands that you start paying people more. Then you'll bend over backwards to do everything but",2021-06-14T03:00:39+00:00,t3_nyw2c2
Conservative,comment,taxed,kbftxcn,Daphur,,This doesn’t feel like fun,2023-11-30T18:52:55+00:00,t1_kbby33e
Politics,comment,income tax,f8stz0m,4high2anal,,"What point are you trying to make?  I am in Tennessee now and there are tons of educational opportunities. I moved several states away, to go to a school that would fit my needs.",2019-11-26T17:24:46+00:00,t1_f8st0pc
Healthcare,comment,deductible,l59ejvv,perhensam,,I don’t disagree with you. But the sign implies that they will begin billing by time and that is already built into the CPT code.,2024-05-23T01:36:17+00:00,t1_l59duc1
Libertarian,comment,IRS,hdiwtod,rchive,,Depends on whether it was custom made for AOC or made by the designer as a political statement before and AOC happened to see it and like it or something.,2021-09-19T23:13:05+00:00,t1_hdioof3
Politics,comment,IRS,ig5e54b,peterabbit456,,"What could possibly be a juicier spot for corruption of the ""help your friends, hurt your enemies"" kind, than the head of the IRS? (Not to mention the profits from taking a cut of the bribes his personal favorite could collect.) Trump must have looked at that appointment as the most important of his presidency.

Edit: Especially considering his vulnerabilities on the tax front. Stalling investigations past the statute of limitations and destroying evidence are Trump specialties.",2022-07-14T16:57:18+00:00,t3_vysnpc
Progressive,post,taxpayer,x0s3g,shallah,"Apples to Twinkies: Taxpayer Subsidies for Junk Food Wasting Billions: Ag Subsidies Pay for 19 Twinkies per Taxpayer, But Only a Quarter of an Apple Apiece ",,2012-07-23T16:14:01+00:00,
Libertarian,comment,income tax,l4ji5so,denzien,,Or their children,2024-05-18T01:34:13+00:00,t1_l4hjq7r
Politics,comment,IRS,jzpb2xd,JesusWantsYouToKnow,,"Reminds me of the adage ""what's the difference between a millionaire and a billionaire? About a billion dollars""

A newly minted millionaire is 0.1% of the way to becoming a billionaire.",2023-09-08T17:43:46+00:00,t1_jzoyogc
PoliticalDiscussion,comment,minimum wage,evdmt6t,richraid21,,"**Pay Gap**

Regarding the pay-gap, I have my own anecdotal evidence as to some of the drivers but I'll start with two quotes and build from there:   

- [Nearly half of US female scientists leave full-time science after first child](https://www.nature.com/articles/d41586-019-00611-1)


- Many employers and industries prioritize traditional work hours rather than flexible
schedules, a preference that tends to put women
with children at a disadvantage (Goldin, 2014)

These two factors have a big impact on how employers view their employees: 

1. Hiring someone is an investment
2. The cost of hiring can be quite large depending on the field
3. If you quantity the cost to hire vs the expected (or duration) of output it begins to become clear why, under some circumstances, a pay gap exists. 

I don't claim the circumstances are fair, but they do exist and it would be quite naive to ignore them as future policies designed to help women could hurt them in the long run if more perverse incentives are created to hiring. 

Regarding my own anecdotal evidence I mentioned at the start, I work in software at a Fortune 100 company. Since I started ~2years ago I've seen 3 women have a child, take their full paid maternity leave then quit immediately once they return. It's a hard situation to balance, especially for a large employer.

---

**Minimum Wage:**

> Pass a $15 federal minimum wage 

Once again we have a proposal to raise the federal minimum wage to a number that is just created out of thin air. Pete provides no justification as to why the minimum wage should be $15 but not $14 or $16.

This kind of policy making is horrible, especially for economic policy. I'm no fan of the minimum wage, but there are much better arguments, and I would even compromise if we made it easier for states to set local minimum wages that are more tailored to the COL in that specific area.",2019-07-29T23:15:18+00:00,t3_cibkyw
Libertarian,comment,income tax,jtpustv,divinecomedian3,,"Just donate your money directly to the church. Geez, what a silly thing a church tax is. But I guess without it the gubment couldn't take its cut.",2023-07-27T21:13:45+00:00,t1_jtbibu5
PoliticalDiscussion,comment,income tax,cxuezhd,OccupyGravelpit,,This should be the top post. Any revenue plan looks great if you suppose a huge set of spending cuts TBD. ,2015-12-10T19:20:09+00:00,t1_cxuara6
PoliticalDiscussion,comment,income tax,dnk94kj,the_calibre_cat,,"> Nobody is proposing a program that depends on continued GDP growth.

Respectfully, I do disagree with that.  There's no way Bernie's system could possibly be funded without that, and that is a proposal from a prominent politician.",2017-09-27T02:18:35+00:00,t1_dnk72y2
Conservative,comment,deductible,cfz9ax6,zaikanekochan,,"I am in favor of one single tax, a sales tax.  No property tax, no wage deductions, just a straight sales tax.  This really is the only ""fair"" way to steal money.  If a billionaire wants to buy a yacht, he will pay tax on that at the same rate that a poverty-stricken person pays for a loaf of bread...simple, and effective.  ",2014-03-10T20:49:35+00:00,t3_202s3f
PoliticalDiscussion,comment,IRS,cy78jxr,tenthreeleader,,"You don't need an apparatus of the IRS' size to interpret a giant tax code when none exists, and you don't need employees whose purpose seems to be to intimidate political opponents of the President.  

Both of these are solid accomplishments no matter who is in office.  Democrats talk about wanting smaller government.  Well, here's their chance.",2015-12-22T01:00:37+00:00,t1_cy76jeg
USpolitics,post,tax,15ukbj0,BitterFuture,Judge dismisses Hunter Biden misdemeanor tax charges,,2023-08-18T13:16:06+00:00,
Politics,comment,sales tax,j5679g6,Vladd_the_Retailer,,"Maybe that’s the plan? Finally end the government, then the capitalist owners an hire private armies and be corporate feudal lords.",2023-01-20T18:00:29+00:00,t1_j55fy7q
Libertarian,comment,deductible,fgrlfjg,Dudehitscar,,"Wealth at those levels is only attainable with violations of the NAP (warlords) or government interventions of the free market.  

F them.",2020-02-07T04:31:13+00:00,t3_f007j0
