subreddit,type,keyword,id,author,title,body,created_utc,parent_id,pro_immigration,anti_immigration,pro_climateAction,anti_climateAction,public_healthcare,private_healthcare,pro_israel,pro_palestine,pro_middle_low_tax,pro_wealthy_corpo_tax,neutral,irrelevant
Neoliberal,comment,antisemitic,k9f8ovx,Tookoofox,,Are there *good* places for politically charged topics like this? This seems like one of those topics that creeps into every possible crevice of neutrality.,2023-11-15T22:45:16+00:00,t1_k9e8obf,0.0,0.0,0.0,0.0,0.0,0.0,0.0,0.0,0.0,0.0,0.0,1.0
PoliticalDiscussion,comment,Israel,l0kdpad,bishpa,,Pelosi did not promise things and then renege. No leader can do that and remain a leader. That’s all I’m saying.,2024-04-21T07:19:07+00:00,t1_l0jn891,0.0,0.0,0.0,0.0,0.0,0.0,0.0,0.0,0.0,0.0,0.0,1.0
Politics,comment,Netanyahu,ky90o6t,bl1eveucanfly,,"Aid corridors... Or as Israel calls them, ""kill zones""",2024-04-05T23:47:59+00:00,t3_1bwb62l,0.0,0.0,0.0,0.0,0.0,0.0,0.0,0.0,0.0,0.0,1.0,0.0
Conservative,comment,Palestine,l32ryrj,nofaplove-it,,They might care because their summer trip to Europe would be affected,2024-05-08T02:38:44+00:00,t1_l315f6u,0.0,0.0,0.0,0.0,0.0,0.0,0.0,0.0,0.0,0.0,0.0,1.0
Politics,comment,Hamas,ksjxqan,mattyoclock,,"If you read the article:  


1.) It was just a single member of Hamas, not the organization as a whole, speaking in text messages

2.) They said they were comitted to an actual long term ceasefire, not a temporary halt as we have already had a few of.

3.) They were just saying they haven't recieved any proposals from Israel yet

4.) They didn't reject anything, merely stated that they don't feel an agreement is near.

5.) The neutral Qatar moderator agreed with them  


Taken together it sounds like Biden just said what he wanted to be happen in the hopes it would force both sides to come to something.",2024-02-28T16:20:40+00:00,t1_ksj8vx7,0.0,0.0,0.0,0.0,0.0,0.0,0.0,0.0,0.0,0.0,1.0,0.0
Politics,comment,Hamas,ktb5fxt,Javelin-x,,"I don't see how. Hamas's whole tactical advantage is to put their civilians in front of the shooting. Israel is already telegraphing their attacks, There is no magic here. this is what Hamas wants to happen and they've even said that out loud. what else do you want Israel to do?  If Hamas wants to use their people that way this is not Israel's problem. Israel is not the one that started this war. Why are we not demanding they surrender? seems to me thats the only way civilians will not continue to be put in harms way.",2024-03-04T15:44:01+00:00,t1_ktb0d8t,0.0,0.0,0.0,0.0,0.0,0.0,1.0,0.0,0.0,0.0,0.0,0.0
PoliticalDiscussion,comment,Gaza,k7bqe1f,DanforthWhitcomb_,,"> They already are dropping bombs directly on civilians, refugee centers, hospitals, medical centers, mosques.  

And? When you start direct infantry assaults you can add things like refugee shelters, apartment buildings, etc. to that list.   

> No. They already are displacing the entire Gaza strip.  

Displace does not equate to kill. Under the current situation in Gaza the result would be thousands of dead civilians from the crossfire.   

> Everything you just said, they are already doing. A ground force would not be nearly as bad for civilians, unless Israel wanted it to be.  

No, you’re just handwaving away the reality of urban combat in populated areas because you don’t like it.",2023-11-01T04:12:54+00:00,t1_k7borap,0.0,0.0,0.0,0.0,0.0,0.0,1.0,0.0,0.0,0.0,0.0,0.0
PoliticalDiscussion,comment,Israeli,cj7icnt,salvation122,,">the blockaded goods are largely goods that can be refined into high explosives.

TIL chocolate can be refined into high explosives",2014-07-25T15:41:29+00:00,t1_cj7hatp,0.0,0.0,0.0,0.0,0.0,0.0,0.0,0.0,0.0,0.0,0.0,1.0
Geopolitics,comment,Gaza,k4lcoos,termsnconditions85,,Collective guilt and willful targeting of civilians is a war crime.,2023-10-12T17:58:46+00:00,t1_k4kjit0,0.0,0.0,0.0,0.0,0.0,0.0,0.0,0.0,0.0,0.0,1.0,0.0
Politics,comment,Israeli,kxxqty4,RollTideYall47,,Then here's a thought.  Cut all aid to Isreal and let them stand on their own in their big boy pants.,2024-04-03T23:56:14+00:00,t3_1buf250,0.0,0.0,0.0,0.0,0.0,0.0,0.0,0.0,0.0,0.0,1.0,0.0
Politics,comment,Israel,l3ud9i7,favnh2011,,Very true,2024-05-13T12:48:07+00:00,t3_1cqrpmj,0.0,0.0,0.0,0.0,0.0,0.0,0.0,1.0,0.0,0.0,0.0,0.0
Neoliberal,comment,Netanyahu,gzunfgj,Bagdana,,">  but it was an unreasonable thing to not let Palestinians control most of the West Bank

They would control 91% of the West Bank + 1% from land swaps.",2021-05-29T07:42:18+00:00,t1_gzucya7,0.0,0.0,0.0,0.0,0.0,0.0,1.0,0.0,0.0,0.0,0.0,0.0
Politics,comment,antisemitic,l1p9zfp,10th__Dimension,,"The protesters weren't peaceful.  They were violent.

[‘I have become traumatized.’ Jewish students describe campus antisemitism](https://www.cnn.com/2024/02/29/business/antisemitism-college-harvard-upenn/index.html)

[73% of Jewish college students have experienced or seen antisemitism since start of school year, new survey finds](https://www.nbcnews.com/news/us-news/73-jewish-college-students-experienced-seen-antisemitism-start-school-rcna127014)

[UC Berkeley leaders denounce violent protest that forced evacuation of Jewish student event](https://www.cbsnews.com/sanfrancisco/news/uc-berkeley-leaders-denounce-violent-protest-jewish-student-event-evacuated-ran-bar-yoshafat-lecture/)

[Biden administration faces pressure to step up its response to antisemitic incidents on college campuses](https://www.nbcnews.com/politics/white-house/biden-pressure-response-antisemitic-incidents-college-campuses-rcna148822)

[Jewish Yale student says pro-Palestinian protester assaulted her. Here's why she feels targeted.](https://www.cbsnews.com/newyork/news/yale-protests-jewish-student-assaulted-pro-palestinian-rally/)

[Former Cornell Student Pleads Guilty to Posting Online Threats Against Jewish Students on Campus](https://www.justice.gov/opa/pr/former-cornell-student-pleads-guilty-posting-online-threats-against-jewish-students-campus)",2024-04-28T21:59:38+00:00,t1_l1obwnj,0.0,0.0,0.0,0.0,0.0,0.0,0.0,0.0,0.0,0.0,1.0,0.0
Politics,comment,antisemitic,krz0ajn,PetPsychicDetective,,"...are in an entirely different country, with a different political system, and are not taking place at a political conference.",2024-02-24T20:57:23+00:00,t1_kryzg52,0.0,0.0,0.0,0.0,0.0,0.0,0.0,0.0,0.0,0.0,1.0,0.0
Geopolitics,comment,Palestinian,k4nqaik,meister2983,,Half the land is farms. Just look at a satellite view,2023-10-13T03:23:28+00:00,t1_k4nplii,0.0,0.0,0.0,0.0,0.0,0.0,0.0,0.0,0.0,0.0,0.0,1.0
Geopolitics,comment,Gaza,kciyzg8,shillforyou,,Can’t we have a single thread without whataboutism?,2023-12-08T17:45:52+00:00,t1_kci4f02,0.0,0.0,0.0,0.0,0.0,0.0,0.0,0.0,0.0,0.0,0.0,1.0
Geopolitics,comment,Israel,ksd4yab,Gen8Master,,Israel returned the stolen lands to Egypt and Jordan. Thats what got you peace ffs. You really imagine that land theft and occupation has zero consequences.,2024-02-27T12:13:14+00:00,t1_ksbw9na,0.0,0.0,0.0,0.0,0.0,0.0,0.0,1.0,0.0,0.0,0.0,0.0
Politics,comment,Netanyahu,kg2o8en,gameryamen,,"This is the argument I always hear, but it doesn't address the dramatic difference in support that the DNC offered to their preferred candidates while actively interfering with the Sanders campaign and withholding campaign resources. Yes, Hillary absolutely won the vote, but could she have done it with Sanders being taken as a serious candidate? We don't get to know. What we do know is he's still pushing for what he believes in and Hillary puts our snarky tweets from time to time.",2024-01-03T02:55:51+00:00,t1_kg2831t,0.0,0.0,0.0,0.0,0.0,0.0,0.0,0.0,0.0,0.0,1.0,0.0
Neoliberal,comment,Netanyahu,h80t3ge,JaceFlores,,"It was a bitch to research this one. His Wikipedia just says he’s president of Mongolia pretty much, and the last major news articles about him date from 2018 when he was PM. Thankfully the next few (the koreas and China) are not nearly as obscure",2021-08-07T04:44:16+00:00,t1_h80qlc1,0.0,0.0,0.0,0.0,0.0,0.0,0.0,0.0,0.0,0.0,0.0,1.0
Geopolitics,comment,Gaza,kp36tt7,jyper,,None of the previous wars had a goal of getting rid of Hamas or removing them from power.,2024-02-05T21:58:25+00:00,t1_kp2y3gj,0.0,0.0,0.0,0.0,0.0,0.0,0.0,0.0,0.0,0.0,1.0,0.0
Geopolitics,comment,Gaza,l2g7r51,CMAJ-7,,Can’t wait for the ‘Homer building a grill’ meme adaption. ,2024-05-03T20:45:29+00:00,t3_1cjhkfw,0.0,0.0,0.0,0.0,0.0,0.0,0.0,0.0,0.0,0.0,0.0,1.0
Politics,comment,Israel,l0hhw6h,thefugue,,"How fucking wild would it be if the U.S., out of nowhere, suddenly held Israel to the law?",2024-04-20T18:30:46+00:00,t3_1c8vm0v,0.0,0.0,0.0,0.0,0.0,0.0,0.0,0.0,0.0,0.0,1.0,0.0
Libertarian,comment,Israel,kft0eok,slightofhand1,,You're missing Conservative SC justice deaths. Those would rock the boat a million times more than Biden or Tucker dying.,2024-01-01T06:47:22+00:00,t3_18vnwx9,0.0,0.0,0.0,0.0,0.0,0.0,0.0,0.0,0.0,0.0,0.0,1.0
Neoliberal,comment,Gaza,gy6s0lw,Ordinary_Ratio1656,,"https://www.google.com/amp/s/www.timesofisrael.com/israeli-airstrike-hits-gaza-house-killing-at-least-7-including-kids/amp/

Is Times of Israel fake too?",2021-05-15T06:00:52+00:00,t1_gy6rwsb,0.0,0.0,0.0,0.0,0.0,0.0,0.0,0.0,0.0,0.0,1.0,0.0
Geopolitics,comment,Gaza,kpvfqj7,2dTom,,"> It’s not tone deaf, it’s literally true. Anybody who has worked in or adjacent to NGO work knows that organisations develop competence and have to deliver within their expertise.


OK, but this completely disregards just how closely UNRWA worked with Hamas over the last 20 years. 


> Before this conflict it was not within the remit of the UNRWA to manage the security situation of the region and they wouldn’t have specialists looking on this topic. 


Some of these tunnels were literally drawing power from the UNRWA headquarters. ""The military claimed that the headquarters supplied the tunnels with electricity."" 


> Apparently Israel missed a lot of the tunneling so why would a non security agency be specifically looking for these signs.


Because Israel was not managing Gaza during this period, and had no actual oversight of Gaza during this period, except for its borders.


The UNRWA should at least be responsible for what is happening in their own headquarters, and failure to notice this is either collaboration with Hamas, or complete incompetence from the UNRWA. 


Even the UNRWA acknowledge that this is within their purview ""UNRWA Commissioner-General Philippe Lazzarini said the agency had no knowledge of the facility’s underground, but the findings merit an independent inquiry, which the agency is unable to perform due to the ongoing war.""",2024-02-11T02:59:34+00:00,t1_kpuywwv,0.0,0.0,0.0,0.0,0.0,0.0,1.0,0.0,0.0,0.0,0.0,0.0
Politics,comment,Hamas,ktsll70,SecondaryWombat,,"https://old.reddit.com/r/politics/comments/1b907q0/biden_to_announce_us_will_build_port_on_gaza/

Just funny to see these two posts literally right next to each other.",2024-03-07T17:35:32+00:00,t3_1b907py,0.0,0.0,0.0,0.0,0.0,0.0,0.0,0.0,0.0,0.0,1.0,0.0
Neoliberal,comment,Israel,k3tss3t,iron_and_carbon,,It’s to break the Israeli Saudi normalisation talks,2023-10-07T08:01:49+00:00,t1_k3tqnq6,0.0,0.0,0.0,0.0,0.0,0.0,0.0,0.0,0.0,0.0,1.0,0.0
Geopolitics,comment,Israelis,kfa5c2b,Gajanvihari,,"Isreal can pursue a war in Lebanon against Hezbollah who are largely occupied in the south. This will bring the front line in direct contact with unstable Syria and its porus militarized border. Lebonon today vs 1982 is weak and crippled, its people are poor and desperate.

This could potentially draw Turkey into a military conflict, probably to a limited extent. Turkey has been fence sitting in the past, but current events can change that. There is even the possibility of Cyprus flairing up again further overextending Western military aide. 

There is the possibility of Ethiopia pursing a larger war against Eritrea, dragging itself into the Sudan conflict. This could leave Egypt in a position where it will need to pick a side which to my knowledge is a coin flip, they are concerned with their own interests, like the Saudis. 

Both Egypt and Saudi Arabia have been chasing mega projects that demand large investment and freetrade. With a collapsing freedom of movement they will destabilize. The Houthi attacks are digging their grave interupting this.

I think there is a possibility of Iran courting Qatar for a economic embargo against the West. Angola withdrawing from Opec shows a lot of internal discord. This could also trigger Venezuela into action. 
Iran could overtley puruse its intetests in an unstable Iraq sweeping up militants to its cause in an AntiIsreali Alliance. 

The Sahel states would further spill into violence, with larger scale operations especially against Nigeria pressuring Oil states across the world. Even though tbe US has ramped up its oil production it still consumes more than it produces leaving it and the EU vulnerable.

India will continue to take advantage of the chaos breaking from the West more and more into its ugly alliance of convienence with Russia.

Pakistan, poor and unstable as it is could feed Islamust militant groups with its poor and angry. 

The US does not have the resources to manage all of these small upsets as well as loss of political will after 18 years of ME War.",2023-12-28T16:12:48+00:00,t3_18swxeq,0.0,0.0,0.0,0.0,0.0,0.0,1.0,0.0,0.0,0.0,0.0,0.0
Politics,comment,antisemitic,js6js1w,RickKassidy,,"Batshit crazy man with famous dead dad is batshit crazy, but gets news coverage anyway.",2023-07-16T12:12:39+00:00,t3_1514pac,0.0,0.0,0.0,0.0,0.0,0.0,0.0,0.0,0.0,0.0,0.0,1.0
Politics,comment,Israel,l4iht40,icouldusemorecoffee,,It's not that much but here's a nice resource to see where most of our foreign aid goes: https://www.foreignassistance.gov,2024-05-17T21:17:00+00:00,t1_l4i2nj4,0.0,0.0,0.0,0.0,0.0,0.0,0.0,0.0,0.0,0.0,1.0,0.0
Politics,comment,Gaza,l3f9xf4,Heated13shot,,"What's fucked is *both* bibi and hamas want Trump in office.


Russia wants Trump to destabilize the US, and they have massive influence over hamas. 


Bibi wants a blank check to do whatever he wants. 


Really, threatening to let trump win if they don't do what you want will just result in them doing the opposite. ",2024-05-10T12:44:00+00:00,t1_l3f1dls,0.0,0.0,0.0,0.0,0.0,0.0,0.0,0.0,0.0,0.0,1.0,0.0
Geopolitics,comment,Israelis,kgz06gw,blazekaplan,,??? Are you not embarrassed by this comment? There’s a thoughtful way to discuss OPs points without being totally historically blind and racist…please read a book,2024-01-08T23:36:18+00:00,t1_kgyqktd,0.0,0.0,0.0,0.0,0.0,0.0,0.0,0.0,0.0,0.0,0.0,1.0
Politics,comment,antisemitic,l36ancv,Pack_Your_Trash,,"Not racist, just popular with racists.",2024-05-08T19:25:22+00:00,t1_l35z833,0.0,0.0,0.0,0.0,0.0,0.0,0.0,0.0,0.0,0.0,0.0,1.0
Neoliberal,comment,Netanyahu,ghsjq7e,throwaway_cay,,lol,2021-01-02T03:34:41+00:00,t3_koo9m6,0.0,0.0,0.0,0.0,0.0,0.0,0.0,0.0,0.0,0.0,0.0,1.0
PoliticalDiscussion,comment,Gaza,l4vzhr2,calguy1955,,They are already blaming the U.S. for the crash.,2024-05-20T15:40:50+00:00,t1_l4vurbm,0.0,0.0,0.0,0.0,0.0,0.0,0.0,0.0,0.0,0.0,0.0,1.0
Libertarian,comment,Israel,k559gzh,Ascend29102,,"He ran for president three times; once as a Libertarian in 1988, as a Republican in 2008 and 2012. America wasn’t ready for his message.",2023-10-16T18:01:05+00:00,t1_k556pw8,0.0,0.0,0.0,0.0,0.0,0.0,0.0,0.0,0.0,0.0,0.0,1.0
Libertarian,comment,Israel,kvufk4m,Chicken_Col_Sanders,,Pretty simple. Turn your eyes away from other nations issues and focus on our own.,2024-03-21T04:27:42+00:00,t3_1bjvvwd,0.0,0.0,0.0,0.0,0.0,0.0,0.0,0.0,0.0,0.0,1.0,0.0
Politics,comment,Zionist,dynl4y3,ae232,,"I like how during his campaign he vowed to bring back jobs for oil and gas workers because oil prices were in the shitter.

Then, a couple of weeks ago, Trump went on a tirade against OPEC saying that prices were too high. Now he plans on implementing the largest possible sanctions against Iran, cutting off their supply to the rest of the world, which will drive oil prices even higher. 

God damn. This guy is so fucking stupid. ",2018-05-08T18:28:41+00:00,t3_8hz0a4,0.0,0.0,0.0,0.0,0.0,0.0,0.0,0.0,0.0,0.0,0.0,1.0
Republican,comment,Gaza,l5tqqvq,CMMGUY2,,MuTuAl CoMbAt dEsTrUcTiOn,2024-05-27T01:44:21+00:00,t3_1d13yqp,0.0,0.0,0.0,0.0,0.0,0.0,0.0,0.0,0.0,0.0,0.0,1.0
PoliticalDiscussion,comment,Gaza,k43eimq,HolidaySpiriter,,So you think the person in the trailer should be able to kill the person who was wealthy because of what their grandparents did? You're literally advocating for generational trauma as a good thing that should be acted on.,2023-10-09T05:28:29+00:00,t1_k42i92g,0.0,0.0,0.0,0.0,0.0,0.0,0.0,0.0,0.0,0.0,0.0,1.0
Republican,post,Israelis,1bz3xva,RedBaronsBrother,Hamas Treats Captive Israeli Women as Animals — for ‘All Are Ridden’,,2024-04-08T17:31:55+00:00,,0.0,0.0,0.0,0.0,0.0,0.0,0.0,0.0,0.0,0.0,1.0,0.0
Neoliberal,post,Gaza,phkms9,zkela,"Israel allows construction materials into Gaza without prisoner exchange; Israel seems to have let go of its demand for a prisoner release in exchange for reconstruction, allowing the entry of some building materials into the Gaza Strip.",,2021-09-04T04:13:59+00:00,,0.0,0.0,0.0,0.0,0.0,0.0,0.0,0.0,0.0,0.0,1.0,0.0
Geopolitics,comment,Gaza,kewda88,GullibleAntelope,,The proposition that the UN will be complicit in smuggling in weapons to Hamas in shipments of food and medicine in nonsense.  It is as much of a lie as the claim that Israel deliberately wants to kill Palestinian children by starvation.  In short: bullshit.,2023-12-25T20:04:26+00:00,t1_kew8j6u,0.0,0.0,0.0,0.0,0.0,0.0,0.0,0.0,0.0,0.0,1.0,0.0
Neoliberal,comment,Israel,kxyvkc0,meister2983,,"As another poster [notes](https://www.reddit.com/r/neoliberal/comments/1buv260/comment/kxw1i59/), that's not much above the US threshold. ",2024-04-04T04:39:57+00:00,t1_kxvx5t7,0.0,0.0,0.0,0.0,0.0,0.0,0.0,0.0,0.0,0.0,0.0,1.0
Neoliberal,comment,Israel,k7dq7yz,Naive_Coast_8919,,"Encirclement of Gaza City in the north seems to be proceeding relatively smoothly.  Obviously, that's the simple part militarily. The urban warfare within and underneath the city is where the world is going to go to shit.",2023-11-01T16:09:25+00:00,t3_17ldqkh,0.0,0.0,0.0,0.0,0.0,0.0,0.0,0.0,0.0,0.0,1.0,0.0
Politics,comment,antisemitic,l3803l2,Ok-Awareness2575,,That's why so many of them vote democrat. Makes perfect sense,2024-05-09T01:45:44+00:00,t3_1cna5p4,0.0,0.0,0.0,0.0,0.0,0.0,0.0,0.0,0.0,0.0,0.0,1.0
Politics,comment,Rafah,kvcc5jy,HonoredPeople,,"Humanitarian aid is still being delivered.

Unless they can live without food and water for up 6 months.

Plus, Jordan, some EU and now US aid is being allowed. 

Are they hungry? Yes. Are they being denied aid completely? No.

Hamas is pretty slippery when it comes to stealing aid, smuggling and other bad habits that affect said aid. Which means Israel has to inspect a lot of it. Which slows things down.

But it's not stopped.",2024-03-17T21:57:54+00:00,t1_kvc02tn,0.0,0.0,0.0,0.0,0.0,0.0,0.0,0.0,0.0,0.0,1.0,0.0
Politics,comment,antisemitic,l24lmwq,worstatit,,Are they woke now?,2024-05-01T18:15:05+00:00,t3_1chs1lw,0.0,0.0,0.0,0.0,0.0,0.0,0.0,0.0,0.0,0.0,0.0,1.0
Politics,comment,antisemitic,k9y7uwd,JanFromEarth,,"Ol ""Short stuff"" is still hoping for a huge cash donation from Musk.  Just imagine the money he could raise for himself if he was president! /s",2023-11-19T23:16:57+00:00,t3_17z2q2w,0.0,0.0,0.0,0.0,0.0,0.0,0.0,0.0,0.0,0.0,0.0,1.0
PoliticalDiscussion,comment,antisemitic,cz1qvmo,Isz82,,Did Cuomo insult the Republicans of his state by telling them that they embodied Staten Island values?  ,2016-01-17T18:49:12+00:00,t1_cz1qg53,0.0,0.0,0.0,0.0,0.0,0.0,0.0,0.0,0.0,0.0,0.0,1.0
Geopolitics,comment,Gaza,l3rx2tp,houinator,,"There was a lot of outrage at the time, leading to a substantial pullback of US weapons sales and military assistance to Saudi.


But the Saudis and the Huthis have had a ceasefire for 2 years or so, so Saudi hasn't been bombing Yemen for quite a while.  The Civil War continues though, because the Huthis are still trying to take over the UN recognized Republic of Yemen government.


Why the world doesn't care about hostile actions by the Huthis is an interesting question, and one that i have a couple theories for but no hard evidence.",2024-05-12T23:03:13+00:00,t3_1cqkbfc,0.0,0.0,0.0,0.0,0.0,0.0,0.0,0.0,0.0,0.0,0.0,1.0
Climatechange,comment,Israel,ihore8r,nasty-dragon,,"desalination is not really the answer, we need to adopt wide spread regenerative farming and permaculture techniques, these two methods of food production will enrich soils, trap water that falls better making the land more productive while also enhancing wildlife and the natural eco systems.

[https://youtu.be/43bmtqKDhBE](https://youtu.be/43bmtqKDhBE)

This is just one vid Andrew Millison uses to explain using natural systems to fix degraded land, marginal land while enriching marginalized people and the environment. The Paani foundation is doing truly incredible work across India, Bangladesh and Pakistan.",2022-07-26T07:30:59+00:00,t3_w83v0s,0.0,0.0,1.0,0.0,0.0,0.0,0.0,0.0,0.0,0.0,0.0,0.0
Neoliberal,comment,Israel,ig4kv9s,ignavusaur,,">Out of good options, they are left with the status quo.

I vehemently disagree with this characterization. Israel is actively changing the status quo with continued settlement expansion and changing the situation on the ground, making any sort of disentanglement from the west bank impossible.",2022-07-14T13:46:21+00:00,t1_ig3g6q2,0.0,0.0,0.0,0.0,0.0,0.0,0.0,1.0,0.0,0.0,0.0,0.0
PoliticalDiscussion,comment,Gaza,kq1u046,Gotisdabest,,"They waited when it was clear waiting would no longer lead to better results. If someone's enemy is dying of cancer, no reason to go after them physically. If the cancer gets cured, now there's absolutely a reason.",2024-02-12T06:29:21+00:00,t1_kq1t1ra,0.0,0.0,0.0,0.0,0.0,0.0,0.0,0.0,0.0,0.0,0.0,1.0
Geopolitics,comment,Israelis,kbbywvi,BillyJoeMac9095,,"The hope would be that the more Palestinians have to lose, the less they will focus on violence. The West Bank is different from Gaza in a number of ways. On the whole, a bit less fundamentally religious, wealthier, and used to a better standard of living. The PA, while not perfect, is a significant improvement over Hamas. They need to be prepared for independance, but it is a risk worth taking for all involved.",2023-11-29T23:32:56+00:00,t1_kban7yy,0.0,0.0,0.0,0.0,0.0,0.0,0.0,0.0,0.0,0.0,1.0,0.0
Politics,comment,Israel,l3s0xwa,RIP_RBG,,That's a weak argument in part because it's all a matter of perspective. Bernie Sanders is about as lowly regarded as they come in some circles.,2024-05-12T23:31:22+00:00,t1_l3rdh8a,0.0,0.0,0.0,0.0,0.0,0.0,0.0,0.0,0.0,0.0,0.0,1.0
Republican,post,Palestinian,nymt2x,intelligentreviews,"Pro-Palestinian Protesters Chant 'Allahu Akhbar,' Torch Israeli Flag in NYC",,2021-06-13T02:31:37+00:00,,0.0,0.0,0.0,0.0,0.0,0.0,0.0,0.0,0.0,0.0,1.0,0.0
Neoliberal,comment,Israel,kylev3q,chemysterious,,"Yes, you are right. But we are writing strange rules here. The point is that Israel is running a sloppy operation which ends up killing lots of aid workers. That itself is shocking. We now know they also directly target them in some cases. I am unaware of any other recent war where humanitarian aid was specifically targeted and killed.

For some reason we are still twisting ourselves into pretzels to pretend they are honest and that they are the ""good guys"". It's absurd. They are committing a genocide in broad daylight.",2024-04-08T09:14:21+00:00,t1_kyinqck,0.0,0.0,0.0,0.0,0.0,0.0,0.0,1.0,0.0,0.0,0.0,0.0
Politics,comment,Gaza,kvzwze5,AutoModerator,,"
As a reminder, this subreddit [is for civil discussion.](/r/politics/wiki/index#wiki_be_civil)

In general, be courteous to others. Debate/discuss/argue the merits of ideas, don't attack people. Personal insults, shill or troll accusations, hate speech, any suggestion or support of harm, violence, or death, and other rule violations can result in a permanent ban. 

If you see comments in violation of our rules, please report them.

 For those who have questions regarding any media outlets being posted on this subreddit, please click [here](https://www.reddit.com/r/politics/wiki/approveddomainslist) to review our details as to our approved domains list and outlet criteria.
 
 We are actively looking for new moderators.  If you have any interest in helping to make this subreddit a place for quality discussion, please fill out [this form](https://docs.google.com/forms/d/1y2swHD0KXFhStGFjW6k54r9iuMjzcFqDIVwuvdLBjSA).
 

***


*I am a bot, and this action was performed automatically. Please [contact the moderators of this subreddit](/message/compose/?to=/r/politics) if you have any questions or concerns.*",2024-03-22T03:48:15+00:00,t3_1bkq6m7,0.0,0.0,0.0,0.0,0.0,0.0,0.0,0.0,0.0,0.0,0.0,1.0
Neoliberal,comment,Rafah,kuo2vq9,ImperialAndy,,"Well we clearly have no capability of limiting bloodshed over there, I’d rather not have US weapons be party to it.",2024-03-13T12:43:55+00:00,t1_kuo0gvg,0.0,0.0,0.0,0.0,0.0,0.0,0.0,0.0,0.0,0.0,1.0,0.0
Neoliberal,comment,Gaza,l5cw9ar,I_lie_on_reddit_alot,,I’m not sure what’s odd. A person who got laid off from there 80k year job with benefits that goes on to take one of the millions of available 15/hr jobs with no healthcare or benefits is employed but I’m not going to tell them the economy is strong.,2024-05-23T18:15:28+00:00,t1_l5c4q56,0.0,0.0,0.0,0.0,0.0,0.0,0.0,0.0,0.0,0.0,0.0,1.0
