subreddit,type,keyword,id,author,title,body,created_utc,parent_id,pro_immigration,anti_immigration,pro_climateAction,anti_climateAction,public_healthcare,private_healthcare,pro_israel,pro_palestine,pro_middle_low_tax,pro_wealthy_corpo_tax,neutral,irrelevant
Politics,comment,Gaza,kw0dqqu,aslan_is_on_the_move,,This is 100% incorrect.  They literally aren't doing that.  They do honor all cease fires.  [Here's](https://www.adl.org/resources/backgrounder/allegation-israel-apartheid-state?gad_source=1&gclid=EAIaIQobChMIn8TXgZ-HhQMVXhStBh2ttQMcEAAYASAAEgLcgfD_BwE&gclsrc=aw.ds) a good article about the lie of apartheid.,2024-03-22T06:30:02+00:00,t1_kv77jvy,0.0,0.0,0.0,0.0,0.0,0.0,1.0,0.0,0.0,0.0,0.0,0.0
Politics,comment,Hamas,kpayzs8,MoveMitchGetOutDaWay,,Ah the Torygraph...fuck off.,2024-02-07T08:04:20+00:00,t3_1akx128,0.0,0.0,0.0,0.0,0.0,0.0,0.0,0.0,0.0,0.0,0.0,1.0
Politics,comment,Netanyahu,kycivfj,Pretend-Cheesecake67,,"5 eyes is a group of nations that share intelligence with each other. The group includes the 4 plus New Zealand. It’s an intelligence alliance. They’re responsible for a lot of counter intelligence and early warnings. 
Probably shouldn’t piss off the people that know your dirty laundry.",2024-04-06T17:15:31+00:00,t1_kychisz,0.0,0.0,0.0,0.0,0.0,0.0,0.0,0.0,0.0,0.0,0.0,1.0
Conservative,comment,Netanyahu,l5c78cv,MerlynTrump,,"I wonder, what would happen if Serbia referred Bill Clinton to the ICC or Iraq referred Dubya, or Iran referred Trump, or Libya referred Obama?",2024-05-23T15:52:44+00:00,t3_1cyqu2n,0.0,0.0,0.0,0.0,0.0,0.0,0.0,0.0,0.0,0.0,0.0,1.0
Politics,comment,Israeli,k4edekr,transbeca,,"Because the media won't cover Israel's crimes while running Hamas 24/7. It will be the exact same playbook the media has always used for every other incident where the media wants people to have a black/white reaction to a rainbow of a situation. Average people can't be trusted to have an understanding of a situation beyond ""good guys vs. Bad guys"".",2023-10-11T10:27:14+00:00,t1_k4cyu0m,0.0,0.0,0.0,0.0,0.0,0.0,0.0,0.0,0.0,0.0,1.0,0.0
Politics,comment,Palestine,j9kq7h3,vahntitrio,,"I think you are being too pessimistic. The chemical in question is a gas that was compressed into a liquid for transport. You really can't spill it - it for the most part would just blow off somewhere else and dissipate.

The only car the train had that could spill and was also a carcinogen was the one containing benzene. However, the EPA isn't finding any benzene in it's sampling - so it either didn't spill or it just burned up (benzene is a part of gasoline, very flammable).

Some of the others can be toxic in high doses - but they are also going to break down pretty quickly outside of storage. It's entirely possible that in a month there will be absolutely nothing toxic from the train derailment remaining in the environment.",2023-02-22T18:13:44+00:00,t1_j9kn1ly,0.0,0.0,0.0,0.0,0.0,0.0,0.0,0.0,0.0,0.0,1.0,0.0
Politics,comment,antisemitic,js83arz,ChoogsBoogman,,Is there anything big media wouldn’t say about this guy? Listen to him on Rogan if you want a real insight into the man. He has my vote,2023-07-16T19:00:45+00:00,t3_1514pac,0.0,0.0,0.0,0.0,0.0,0.0,0.0,0.0,0.0,0.0,0.0,1.0
Politics,comment,Israeli,jshdyl8,Interestisk5256,,"I am sure he will be happy to return them in exchange for a modest finders fee, maintenance fee, processing fee, and display fee.",2023-07-18T18:04:36+00:00,t1_jsg1a0i,0.0,0.0,0.0,0.0,0.0,0.0,0.0,0.0,0.0,0.0,0.0,1.0
Politics,comment,Zionist,l1hl3vk,murphymc,,There’s a natural response question to that too about in what reality are they expecting the Israelis to just accept that and roll over.,2024-04-27T11:43:00+00:00,t1_l1giwth,0.0,0.0,0.0,0.0,0.0,0.0,1.0,0.0,0.0,0.0,0.0,0.0
Neoliberal,comment,Israel,k7qyqix,DEEP_STATE_NATE,,"[Israel's Army Plans to Recruit Settlers With No IDF Experience to Defend Ultra-orthodox West Bank Settlements](https://www.haaretz.com/israel-news/2023-11-02/ty-article/.premium/israels-army-to-recruit-settlers-with-no-army-experience-to-guard-west-bank-settlements/0000018b-8f63-d7a8-afcf-afe3a9b00000)

I see no way in which this goes poorly",2023-11-04T04:11:08+00:00,t3_17mmzkb,0.0,0.0,0.0,0.0,0.0,0.0,0.0,0.0,0.0,0.0,0.0,1.0
Neoliberal,comment,Israeli,i5xyn7e,jibjaba4,,"There were a lot of pro-Snowden and fence sitting comments in [this post yesterday](https://www.reddit.com/r/neoliberal/comments/u9eqdq/treacherous_bastard/). There is a substantial contingent on reddit that treats him like a hero, outside of this sub it's a pretty large majority.",2022-04-24T00:38:27+00:00,t1_i5xcqh3,0.0,0.0,0.0,0.0,0.0,0.0,0.0,0.0,0.0,0.0,0.0,1.0
Politics,comment,Palestine,d25y3mp,tsanazi2,,"True, but do not his views reflect a considerable element of the Republican party?",2016-04-17T03:14:26+00:00,t1_d25tjj5,0.0,0.0,0.0,0.0,0.0,0.0,0.0,0.0,0.0,0.0,0.0,1.0
Geopolitics,comment,Israelis,eqcn72h,dr_set,,"They are copying and improving on the British empire model. Read  [ Tragedy and Hope: A History of the World in Our Time ](https://www.goodreads.com/book/show/726546.Tragedy_and_Hope?from_search=true)  by  [Carroll Quigley](https://www.goodreads.com/author/show/386296.Carroll_Quigley?from_search=true)  and  [ Diplomacy ](https://www.goodreads.com/book/show/781183.Diplomacy?from_search=true)  by  [Henry Kissinger](https://www.goodreads.com/author/show/28442.Henry_Kissinger?from_search=true) . The concept that you need to understand is “[Balance of power](https://en.wikipedia.org/wiki/Balance_of_power_(international_relations))”, basically you want to keep your competitors and resource rich states fighting among themselves and each other and you continually switch sides to support the weaker side to keep the balance of power and to keep them fighting indefinitely consuming all their energies at it. Also, you want to install a minority in power, so they need the help of foreign powers to keep themselves in government. So, for example, you install a Shia government in a Sunni country and vice-versa.

&#x200B;

Israel is just perfect. It’s small, very different from its neighbors and surrounded by enemies. So, it badly needs the Us. Its presence destabilizes the entire region and that is what you want to keep control. Weak, chaotic needy small states constantly fighting each other or at the brink of it. On the other hand, if the states organize well you get things like OPEC and the 70’ embargo and they impose conditions to you instead of the other way around.",2019-06-08T06:08:17+00:00,t3_by1kla,0.0,0.0,0.0,0.0,0.0,0.0,0.0,0.0,0.0,0.0,1.0,0.0
Geopolitics,comment,Israelis,k5e0ea3,RastaBooties,,"The region would be in peace if the US was AT LEAST fair, but no, the US has used it's Veto powers more than 40 times to block UN resolutions related to Israel that would have facilitated the peace process in the region, in order to MAKE SURE Israel remains in conflict and never integrates with it's Arab neighbors, so that they can continue using them as a western tool to serve US interests.",2023-10-18T11:36:02+00:00,t1_k4yco1z,0.0,0.0,0.0,0.0,0.0,0.0,0.0,1.0,0.0,0.0,0.0,0.0
Neoliberal,comment,Israel,koqzt81,Key_Environment8179,,Too late. Going back on a deal that led to normalization with Israel would only cause bad things.,2024-02-03T15:56:57+00:00,t3_1ahyj5e,0.0,0.0,0.0,0.0,0.0,0.0,0.0,0.0,0.0,0.0,1.0,0.0
PoliticalDiscussion,comment,Gaza,l1ttjan,noration-hellson,,"I think the one sentence answer is the obama presidency.

 He did a lot of evil but one of the most monstrous things was convincing 'decent', 'thoughtful' liberals that detonating innocent civilians with bombs from the other side of the world with cavalier disregard was actually the sensible adult thing to do and if you think its bad then you're a child who doesnt understand politics.",2024-04-29T19:04:43+00:00,t1_l1trttp,0.0,0.0,0.0,0.0,0.0,0.0,0.0,0.0,0.0,0.0,0.0,1.0
Libertarian,comment,Israel,l33h1jm,ZombiezzzPlz,,"You forgot about the 4.6 trillion dollar bail out for the banks just a few years ago. These privatized banks have direct ties overseas governments through the industrial military complex and through the BIS.  Trillions are going overseas during an event/wartime

Trillions.",2024-05-08T06:28:36+00:00,t1_l30ixj2,0.0,0.0,0.0,0.0,0.0,0.0,0.0,0.0,0.0,0.0,0.0,1.0
Politics,comment,Hamas,k6f3eoi,occorpattorney,,"I believe the user’s point is that Hamas is not a credible source. They make public statements that are rarely honest and straightforward. For example, when they refused to release more than a couple of hostages to obtain said cease fire…",2023-10-25T17:13:56+00:00,t1_k6f2rb5,0.0,0.0,0.0,0.0,0.0,0.0,0.0,0.0,0.0,0.0,1.0,0.0
Conservative,comment,Netanyahu,kvetrt8,BlueJayWC,,I don't think Hamas is the cause of this conflict,2024-03-18T11:20:32+00:00,t1_kverql6,0.0,0.0,0.0,0.0,0.0,0.0,0.0,1.0,0.0,0.0,0.0,0.0
Neoliberal,comment,Israel,k4o3ojt,concommie,,"Japan, South Korea, and Singapore: Very heavy amount of central planning in their growth, still true to this day. Germany too, to a lesser extent. I think it's interesting you use these examples as all (except Israel) had a very large degree of state intervention, it's just that their industrial policy actually ended up working. They could better be described as ""technocratic"" I guess. 
Real answer? 🇺🇸",2023-10-13T05:28:16+00:00,t3_176px0f,0.0,0.0,0.0,0.0,0.0,0.0,0.0,0.0,0.0,0.0,0.0,1.0
Neoliberal,comment,Palestine,kcb5god,KeikakuAccelerator,,"I feel the skills required for Math/Stats PhD is very different from say PhD in engineering fields or economics. 

Most of the stuff is geared towards college folks who go into engineering fields like comp sci, electrical, mechanical, civil or finance, business, econ stuff. In each of these fields, practicing many problems gives a much deeper understanding and can be applied to their respective fields.",2023-12-07T01:35:29+00:00,t1_kc93287,0.0,0.0,0.0,0.0,0.0,0.0,0.0,0.0,0.0,0.0,0.0,1.0
PoliticalDiscussion,comment,Palestinian,l5935q4,Gryffindorcommoner,,"Didn’t Hamas accept a peace deal by Qatar and Evgypt to return all Israeli hostages?

>No.

So what’s this? https://www.reuters.com/world/middle-east/three-phase-ceasefire-deal-hamas-backs-israel-does-not-2024-05-06/

And who said they need all Israel dissolved and returned to Palestine? 
.",2024-05-23T00:19:40+00:00,t1_l591htj,0.0,0.0,0.0,0.0,0.0,0.0,1.0,0.0,0.0,0.0,0.0,0.0
Geopolitics,comment,Gaza,k5vebda,SnowGN,,"Why is this post being downvoted? OP is correct. Leaving Hamas in power (thus perpetuating the conditions of Gazan radicalization) is the worst outcome of all, worse even than a temporary condition of war.

This thread is being clicked on by all the Hamas supporters, I guess.",2023-10-21T19:33:03+00:00,t1_k5tj49w,0.0,0.0,0.0,0.0,0.0,0.0,1.0,0.0,0.0,0.0,0.0,0.0
Politics,comment,antisemitic,k0wtr0x,fungobat,,">Trump, who was president at the time, was criticized for initially saying there were ""fine people on both sides"" after the rally devolved into violent clashes.

>""That is when I decided I had to stay engaged instead of walking away,"" Biden said in the call on Thursday, quoting Trump's remarks from then. The president added: ""Silence is complicity.""",2023-09-17T00:17:36+00:00,t1_k0wi8ja,0.0,0.0,0.0,0.0,0.0,0.0,0.0,0.0,0.0,0.0,0.0,1.0
Politics,comment,Israel,l66ymvn,shobidoo2,,"Right, it’s a craven political move that should be critiqued. ",2024-05-29T16:16:08+00:00,t1_l66vmda,0.0,0.0,0.0,0.0,0.0,0.0,0.0,0.0,0.0,0.0,0.0,1.0
Neoliberal,comment,antisemitic,i7p7onl,Poopdoomie,,Yes,2022-05-07T17:35:40+00:00,t1_i7p720i,0.0,0.0,0.0,0.0,0.0,0.0,0.0,0.0,0.0,0.0,0.0,1.0
Conservative,comment,IDF,gxssulh,FormerBandmate,,"I wonder who initially held the land 4000 years ago when civilization started there. Whoever that is should probably get it, there's some famous group who controlled it but I can't put my finger on who they are",2021-05-12T00:57:25+00:00,t1_gxslphg,0.0,0.0,0.0,0.0,0.0,0.0,0.0,0.0,0.0,0.0,0.0,1.0
Politics,comment,Gaza,kyu6j7m,HIVnotAdeathSentence,,"How is he trying to curb Israel?

Since December Biden has bypassed Congress twice to sell $240 million in weapons. He was in a rush and could have let Congress handle it one or two weeks later.

He's made over one hundred undisclosed weapons sales to Israel all while pushing Congress to pass $14 billion in aid to Israel.

[Biden is currently trying to get Congress to approve of a $18 billion sale of F-15s and ammo to Israel.](https://www.politico.com/news/2024/04/01/us-new-fighter-jets-missiles-israel-00149976)",2024-04-09T22:29:15+00:00,t1_kyl79pu,0.0,0.0,0.0,0.0,0.0,0.0,0.0,1.0,0.0,0.0,0.0,0.0
Politics,comment,Israel,l3snvta,AutoModerator,,"
As a reminder, this subreddit [is for civil discussion.](/r/politics/wiki/index#wiki_be_civil)

In general, be courteous to others. Debate/discuss/argue the merits of ideas, don't attack people. Personal insults, shill or troll accusations, hate speech, any suggestion or support of harm, violence, or death, and other rule violations can result in a permanent ban. 

If you see comments in violation of our rules, please report them.

 For those who have questions regarding any media outlets being posted on this subreddit, please click [here](https://www.reddit.com/r/politics/wiki/approveddomainslist) to review our details as to our approved domains list and outlet criteria.
 
 We are actively looking for new moderators.  If you have any interest in helping to make this subreddit a place for quality discussion, please fill out [this form](https://docs.google.com/forms/d/1y2swHD0KXFhStGFjW6k54r9iuMjzcFqDIVwuvdLBjSA).
 

***


*I am a bot, and this action was performed automatically. Please [contact the moderators of this subreddit](/message/compose/?to=/r/politics) if you have any questions or concerns.*",2024-05-13T02:19:59+00:00,t3_1cqofv9,0.0,0.0,0.0,0.0,0.0,0.0,0.0,0.0,0.0,0.0,0.0,1.0
Politics,comment,Hamas,l19fu4f,duffys4lyf,,When is Biden and the rest of the world leaders going to demand that Israel release the 8700 Palestinians that have been arrested in the west bank since 10/7?,2024-04-25T22:02:37+00:00,t3_1ccyept,0.0,0.0,0.0,0.0,0.0,0.0,0.0,1.0,0.0,0.0,0.0,0.0
Neoliberal,post,Israel,vysqtw,AgainstSomeLogic,Biden to sign joint pledge with Israel to prevent Iran going nuclear,,2022-07-14T10:36:33+00:00,,0.0,0.0,0.0,0.0,0.0,0.0,0.0,0.0,0.0,0.0,1.0,0.0
PoliticalDiscussion,comment,Israeli,k70d9lw,Worried-Notice8509,,Ariel Sharon was minister of Israel at that time. He gave in to international pressure. Netanyahu is a total Zionist authoritarian Even his people are protesting him. He wants  Gaza at no cost.,2023-10-29T21:54:26+00:00,t1_k6ovjwj,0.0,0.0,0.0,0.0,0.0,0.0,0.0,0.0,0.0,0.0,1.0,0.0
Politics,comment,Palestine,k4a7cz9,keninsd,,"If Hamas had the money to buy our weapons, we'd be supporting them.",2023-10-10T15:10:33+00:00,t3_174l0yo,0.0,0.0,0.0,0.0,0.0,0.0,0.0,0.0,0.0,0.0,1.0,0.0
Neoliberal,comment,Israel,ihkvphi,chrisq823,,That theoretically could work but there is no where in the world it exists or is even close to existing now. You can see what no unions do wages and benefits by seeing how utterly fucked any minimum wage worker is.,2022-07-25T14:11:26+00:00,t1_ihk2of9,0.0,0.0,0.0,0.0,0.0,0.0,0.0,0.0,0.0,0.0,0.0,1.0
Politics,post,Gaza,1ckahdf,SocialDemocracies,Sanders on the Nationwide Student Protests and the Ongoing Humanitarian Disaster in Gaza,,2024-05-04T21:04:05+00:00,,0.0,0.0,0.0,0.0,0.0,0.0,0.0,0.0,0.0,0.0,1.0,0.0
Geopolitics,comment,Palestine,k45kfcj,RYajnesh,,"Or This attack could also help netanyahu popularity by turning more moderate Israeli to his side
Like:
Hamas did this
We don't like hamas
Let's put a person that doesn't tolerate them

A bit like the same effect Pakistani terrorist attack on URI had in the 2019 Indian elections, that is if Netanyahu is able to give a strong and successful response that will satisfy the Israeli",2023-10-09T17:07:03+00:00,t1_k3zxeii,0.0,0.0,0.0,0.0,0.0,0.0,1.0,0.0,0.0,0.0,0.0,0.0
Conservative,post,Netanyahu,loidd5,Foubar_ghost,"Netanyahu plays Churchill, but where’s his FDR? The days of full-blown Pax Americana in the Middle East are over",,2021-02-20T22:28:47+00:00,,0.0,0.0,0.0,0.0,0.0,0.0,0.0,0.0,0.0,0.0,0.0,1.0
Politics,comment,Rafah,l62wxcl,TruthSeeekeer,,It’s disgusting how the world watches by as Israel does whatever the fuck it wants in Gaza,2024-05-28T21:05:56+00:00,t3_1d2uaa5,0.0,0.0,0.0,0.0,0.0,0.0,0.0,1.0,0.0,0.0,0.0,0.0
Conservative,comment,Israel,kzg4jko,ufdan15,,"I mean thats what they wanted anyway

They hate the west and America. Don't care how it gets harmed",2024-04-13T22:05:07+00:00,t1_kzfpy06,0.0,0.0,0.0,0.0,0.0,0.0,0.0,0.0,0.0,0.0,1.0,0.0
Conservative,comment,Israeli,k9kb29g,Grimaldehyde,,She is one of the most ignorant people on TV.,2023-11-16T22:37:42+00:00,t3_17wzesi,0.0,0.0,0.0,0.0,0.0,0.0,0.0,0.0,0.0,0.0,1.0,0.0
Politics,comment,Gaza,kux56ua,davi_meu_dues,,maybe in California. after I graduate I’m actually fucking considering moving to Texas or smith so I don’t have to see red green and black and keffiyahs everyday and hostage posters torn down so I’m not reminded of how much the world hates me everyday,2024-03-15T00:24:18+00:00,t1_kuwbrgt,0.0,0.0,0.0,0.0,0.0,0.0,0.0,0.0,0.0,0.0,0.0,1.0
Politics,comment,Israeli,l654i0f,Coolegespam,,"I'm pretty sure the far left want Trump to win. At least in my group of (semi-ex) left wing friends, they seem pretty determined to see Biden lose no matter what. The only good thing, is most never registered to vote in either 2016 or 2020's election. 

At a wider level, many are just so far down the rabbit hole of misinformation and lies, they're as far gone as the right was in 2015/2016, and they're only going to get worse. I mean hell, just look at the misinformation and out right lies they're spreading about this conflict. Even the explosion at the refugee camp is a perfect example.",2024-05-29T07:01:33+00:00,t1_l63bnn4,0.0,0.0,0.0,0.0,0.0,0.0,0.0,0.0,0.0,0.0,0.0,1.0
Politics,comment,Netanyahu,kyd3wt0,Pusfilledonut,,"This is exactly what I’ve been saying to friends and acquaintances for months. Netanyahu has wanted to continue this war, the last thing he wants is any kind of peaceful or even a strategic resolution. He refuses to watch a good crisis go to waste, especially since, just like Trump, he will be prosecuted if he is no longer in power. 

Hamas, and Bibi, are aligned at least in that aspect. Hamas also wants to continue the war, albeit on their terms, ensuring there can never be peace, or a resolution that ends with their leadership at the end of a rope, where they all belong.",2024-04-06T19:21:56+00:00,t3_1bx9fw5,0.0,0.0,0.0,0.0,0.0,0.0,0.0,0.0,0.0,0.0,1.0,0.0
Neoliberal,comment,Israel,k44eoyl,BurrowForPresident,,"They've been doing the ""Ukraine war is fake and they're funneling DOD money to Hunter Biden's shadow corporation subsidiaries"" for a while

Which would make it extra hilarious that Putin can't take out Ukraine that supposedly *isn't* getting real military aid lol",2023-10-09T12:33:30+00:00,t1_k44egqz,0.0,0.0,0.0,0.0,0.0,0.0,0.0,0.0,0.0,0.0,0.0,1.0
Politics,comment,antisemitic,l1nholk,Smallios,,"In Austin they’re protesting outside of synagogues during Shabbat. Far from the university, no government buildings around. Explain how antisemitism isn’t getting worse; isn’t rampant right now.",2024-04-28T15:27:54+00:00,t1_l0s9sdj,0.0,0.0,0.0,0.0,0.0,0.0,0.0,0.0,0.0,0.0,0.0,1.0
Neoliberal,comment,Israel,ig4nmmr,Vecrin,,"Swiss and swedes would literally need to militarily occupy it. Americans don't want to occupy another ME nation. I have doubts the UN would agree. Also, why should Israel ask? Why can't other nations just offer?",2022-07-14T14:06:14+00:00,t1_ig4mh1k,0.0,0.0,0.0,0.0,0.0,0.0,0.0,0.0,0.0,0.0,0.0,1.0
Geopolitics,comment,Gaza,ky87x31,HearthFiend,,"Its very specific mentality too, they all behave in very odd jittery ways and quite aloof most of the time.",2024-04-05T20:49:08+00:00,t1_ky7q3zi,0.0,0.0,0.0,0.0,0.0,0.0,0.0,0.0,0.0,0.0,1.0,0.0
Politics,comment,Israel,l1y6b4a,B4dr003,,Biden is as responsible for killing tens of thousands of children and women as much as the Israeli government,2024-04-30T15:03:04+00:00,t3_1cgajqc,0.0,0.0,0.0,0.0,0.0,0.0,0.0,0.0,0.0,0.0,1.0,0.0
Libertarian,comment,Israel,k71nodk,JamesBongd,,There aren’t Israeli libertarians.,2023-10-30T03:31:03+00:00,t3_17iocqh,0.0,0.0,0.0,0.0,0.0,0.0,0.0,0.0,0.0,0.0,1.0,0.0
Democrats,comment,Hamas,kapju3y,wstone5594,,Michael Bolton has short hair now.,2023-11-25T16:01:18+00:00,t1_kaog4ik,0.0,0.0,0.0,0.0,0.0,0.0,0.0,0.0,0.0,0.0,0.0,1.0
PoliticalDiscussion,comment,Israeli,kz04n1n,SeanB2003,,"These psychological explanations are awful, but the attempt to convert it back into realpolitik by suggesting it's a long term military strategy based on some kind of stochastic terrorism is really unhinged. 

Ireland and Irish people don't have a view that they supported terrorists. They have a view that they supported an unavoidable insurrection against an oppressive colonial power. It is that difference in viewpoint that we are discussing. It isn't a psychological illness, it is a valid interpretation of the struggle for Irish independence and is equally validly applied to many other struggles for independence against an oppressive colonial power worldwide. 

In dismissing the pursuit of full Irish independence as support for extremists you merely reaffirm your own values - colonial, imperialist - which then stand in stark relief in what they are opposing, values that are Republican and self-determining.",2024-04-11T00:11:27+00:00,t1_kz02col,0.0,0.0,0.0,0.0,0.0,0.0,0.0,1.0,0.0,0.0,0.0,0.0
Neoliberal,comment,Israel,kxyhbfm,Raudskeggr,,"> Palestine

There is no nation state of Palestine.",2024-04-04T02:47:55+00:00,t1_kxwuzxh,0.0,0.0,0.0,0.0,0.0,0.0,1.0,0.0,0.0,0.0,0.0,0.0
PoliticalDiscussion,comment,Israeli,gy47fu8,grilled_cheese1865,,SoS Hillary Clinton caused peace there and it fell apart after she left. Stop giving trump credit for other people accomplishments,2021-05-14T16:30:02+00:00,t1_gy1ey3c,0.0,0.0,0.0,0.0,0.0,0.0,0.0,0.0,0.0,0.0,0.0,1.0
Politics,comment,Zionist,kd3bl5j,ChicagoAuPair,,"95% of people don’t know what Zionism means. 

Granted, it is a fucking loaded term at this point and probably should be retired, but yeah. It’s sort of like socialist at this point; like, I get what Bernie Sanders means when he calls himself a DS, but",2023-12-12T21:26:45+00:00,t1_kd32fpb,0.0,0.0,0.0,0.0,0.0,0.0,0.0,0.0,0.0,0.0,0.0,1.0
Politics,comment,Netanyahu,ky56ozu,underalltheradar,,"Under the circumstances, Biden can delay the execution of these pacts.

Let Bibi complain. There is nothing he can say that will make him look good.",2024-04-05T08:44:00+00:00,t1_ky2sxbz,0.0,0.0,0.0,0.0,0.0,0.0,0.0,0.0,0.0,0.0,1.0,0.0
PoliticalDiscussion,comment,Gaza,k5xzrmv,dirtyoldmikegza,,"Exactly, as one of the first victims of modern colonialism the Irish have a tendency towards solidarity with other colonized people. I've never been prouder of the old country than I have been in the last few years.",2023-10-22T08:47:22+00:00,t1_k5xyioe,0.0,0.0,0.0,0.0,0.0,0.0,0.0,0.0,0.0,0.0,0.0,1.0
Geopolitics,comment,Gaza,l4yhxrt,Nervous-Basis-1707,,"And they would enact peace that Palestinians as a nation state would have to accept since they lost a war. Obviously this lasting conflict isn’t working for anyone. Even the US and Europe didn’t want to permanently keep the Japanese or Germans under occupation after ww2. 

Israel’s security can be guaranteed and Palestine can become a state. That is the eventual necessity here unless we’d prefer a mass migration of Arabs from the West Bank and Gaza (which is what the Israeli right wing seeks). 

If a free Palestinian man and woman have a choice between living normally in a Free Palestine or fighting a never ending and impossible war with Israel then we can call them foolish.",2024-05-21T01:09:21+00:00,t1_l4yecdv,0.0,0.0,0.0,0.0,0.0,0.0,0.0,0.0,0.0,0.0,1.0,0.0
Conservative,comment,Palestine,kxtbrpo,LittleStar854,,"It's because they ""fight"" against the ""oppressive"" west. And by fight I mean intentionally murders civilians. Pure brain rot. Unfortunately there's far to many ""Conservatives"" that simp for Russia for what appears to be very similar reasons. No Russia isn't ""owning the libs"", they're also a terrorist ""state"" that enjoys raping, torturing and murdering civilians.",2024-04-03T05:39:03+00:00,t3_1btxuqq,0.0,0.0,0.0,0.0,0.0,0.0,0.0,0.0,0.0,0.0,1.0,0.0
Libertarian,comment,Israel,hp6cjwg,The_Unnamed_Feeling,,TIL that people don’t know the Taliban was funded by the US Government LOL,2021-12-19T15:27:18+00:00,t1_hp5i8ae,0.0,0.0,0.0,0.0,0.0,0.0,0.0,0.0,0.0,0.0,0.0,1.0
PoliticalDiscussion,comment,Israeli,kjhzc6y,tradingupnotdown,,"There is no truth to the idea that Biden is ""fed up"". Americans largely aren't paying attention and the folks protesting are ignored by the large chunk of the left that is more moderate. Polls about one conflict across the map don't mean anything when it's Superbowl season and the stock market it rallying. Americans by and large aren't paying attention and are more annoyed than supportive about protests one way or the other. 

Oh and European politicians seem to be gravitating towards supporting Israel, not against.",2024-01-25T13:23:00+00:00,t1_kjaogf2,0.0,0.0,0.0,0.0,0.0,0.0,0.0,0.0,0.0,0.0,1.0,0.0
Conservatives,comment,Gaza,ka3t6ny,NickTesla2018,,Toasty!,2023-11-21T02:35:22+00:00,t3_1805o72,0.0,0.0,0.0,0.0,0.0,0.0,0.0,0.0,0.0,0.0,0.0,1.0
Politics,comment,Rafah,kudoz8l,meharryp,,biden could have ended this months ago and yet the US is still providing funding and support to Israel,2024-03-11T15:42:38+00:00,t3_1bbi55p,0.0,0.0,0.0,0.0,0.0,0.0,0.0,0.0,0.0,0.0,1.0,0.0
