subreddit,type,keyword,id,author,title,body,created_utc,parent_id,pro_immigration,anti_immigration,pro_climateAction,anti_climateAction,public_healthcare,private_healthcare,pro_israel,pro_palestine,pro_middle_low_tax,pro_wealthy_corpo_tax,neutral,irrelevant
Politics,comment,antisemitic,kc6rva6,thatnameagain,,Anti-Zionism is not the “criticism” of the government of israel,2023-12-06T04:25:23+00:00,t1_kc5wo75,0.0,0.0,0.0,0.0,0.0,0.0,0.0,0.0,0.0,0.0,1.0,0.0
PoliticalDiscussion,comment,Israeli,gz2ji7v,olivegreenperi35,,"Thats not what rights are lol, they don't stop being a right once someone starts violating them, it just means someone is violating your rights.",2021-05-22T16:42:59+00:00,t1_gz0eol5,0.0,0.0,0.0,0.0,0.0,0.0,0.0,0.0,0.0,0.0,0.0,1.0
Geopolitics,comment,Palestinian,kolrm4b,ADP_God,,I would also like to know this...,2024-02-02T16:15:50+00:00,t1_kk31uyv,0.0,0.0,0.0,0.0,0.0,0.0,0.0,0.0,0.0,0.0,0.0,1.0
Neoliberal,comment,Gaza,kwjrc0q,I-Like-Ike_52,,"> He added that the text was legally binding on Israel but not on Hamas, as the Palestinian group is not a state. 

Dam",2024-03-25T21:27:06+00:00,t1_kwjq7gy,0.0,0.0,0.0,0.0,0.0,0.0,0.0,0.0,0.0,0.0,1.0,0.0
Neoliberal,post,Israeli,1ctscwi,John3262005,"Seeking Access to Congo’s Metals, White House Aims to Ease Sanctions","Three years after Biden administration officials tightened sanctions on a billionaire Israeli mining executive for corrupt business practices in the Democratic Republic of Congo, they have reversed themselves and are offering the executive a deal they hope will bolster the supply of a metal vital to electric vehicles.

The plan would allow the executive, Dan Gertler, to sell off his remaining stakes in three giant copper and cobalt mining operations in Congo.

Those in the Biden administration pushing for the settlement deal see it as a solution to a competitive disadvantage for the United States, one that could only grow as automotive manufacturers continue to expand their production of electric vehicles. And it is in keeping with the administration’s policy positions that embrace alternative energy solutions to fossil fuels.

“To ease sanctions now seems ludicrous, giving Gertler a free pass to profit from ill-gotten gains,” said Anneke Van Woudenberg, the executive director of RAID, a nonprofit that monitors mining transactions in Congo and other countries. “The deal leaves Gertler enriched, unscathed and unaccountable — with little regard for those who matter most: the people of the D.R.C.”",2024-05-17T00:33:06+00:00,,0.0,0.0,1.0,0.0,0.0,0.0,0.0,0.0,0.0,0.0,0.0,0.0
Politics,comment,Gaza,l516omq,CarrotChunx,,"if it doesnt change the situation either way, then why is biden tanking his support by sending billions of our taxes in cash and weapons to a nation responsible for war crimes, hmm? lmao. sorry, im not voting for someone who has remained complicit in this, we'll all face the consequences of his decisions. the uncommited vote and campus protests were supposed to be leverage. since hes ignored all of that, im out.",2024-05-21T15:27:12+00:00,t1_l50wbbv,0.0,0.0,0.0,0.0,0.0,0.0,0.0,0.0,0.0,0.0,1.0,0.0
Politics,comment,antisemitic,kchtund,headypete42033,,Communism with Pol Pot,2023-12-08T12:57:22+00:00,t1_kceg3kt,0.0,0.0,0.0,0.0,0.0,0.0,0.0,0.0,0.0,0.0,0.0,1.0
Libertarian,post,Hamas,2cnmyb,galt1776,Hannity: Israel resolute in bid to destroy Hamas terror tunnels,,2014-08-05T03:49:39+00:00,,0.0,0.0,0.0,0.0,0.0,0.0,0.0,0.0,0.0,0.0,1.0,0.0
Politics,comment,antisemitic,krzbv9j,Baulderdash77,,"They really are not.  Nothing they follow and they act is Christian the way.

The religion they have exists only as breakaway churches from mainstream Christianity and only really exists like this in the U.S.

They may call themselves Christians but they just really aren’t.",2024-02-24T22:07:23+00:00,t1_krz4dcy,0.0,0.0,0.0,0.0,0.0,0.0,0.0,0.0,0.0,0.0,0.0,1.0
Neoliberal,comment,antisemitic,k8xgf1f,marinesol,,"Boring answer.

Le Pen hates Jews less than she hates Muslim immigrants and pushing her party from a hardcore Nazi party to a generic hard conservative anti immigration party is desirable for achieving those goals.

Its also easy free PR.

Melenchon is just a hardcore anti-semite.",2023-11-12T14:16:40+00:00,t1_k8xcv5a,0.0,0.0,0.0,0.0,0.0,0.0,1.0,0.0,0.0,0.0,0.0,0.0
USpolitics,post,Israel,1allepq,Barch3,Senate Adjourns Until Noon Thursday Without Vote on Aid for Ukraine and Israel,,2024-02-08T02:51:54+00:00,,0.0,0.0,0.0,0.0,0.0,0.0,1.0,0.0,0.0,0.0,0.0,0.0
Politics,comment,Gaza,kwjq6gf,time_drifter,,"Trump sees the fading support of the U.S. for Israel’s war and changes his stance.  

_When you have no morals it’s easy, they just let you do it!_",2024-03-25T21:20:37+00:00,t3_1bngmba,0.0,0.0,0.0,0.0,0.0,0.0,0.0,0.0,0.0,0.0,1.0,0.0
Neoliberal,comment,Israel,k7itezh,LineGoingUp,,"I'm sure nothing bad is going to come out of this

https://preview.redd.it/lam7ydk9jyxb1.png?width=1064&format=pjpg&auto=webp&s=0787dad7ae4090c45a6688683f4aa0404809ea9b",2023-11-02T16:00:11+00:00,t3_17ldqkh,0.0,0.0,0.0,0.0,0.0,0.0,0.0,0.0,0.0,0.0,1.0,0.0
Politics,comment,Hamas,k7tdjgu,wish1977,,How about the fact that Islamic Jihad accidentally bombed that hospital causing a ton of deaths. To my knowledge she's never changed her story after she blamed Israel.,2023-11-04T17:48:29+00:00,t1_k7tcu5c,0.0,0.0,0.0,0.0,0.0,0.0,0.0,0.0,0.0,0.0,1.0,0.0
Geopolitics,comment,Gaza,k7q62s7,WilliamWyattD,,"Palestinians have to be second class citizens. Israel is meant to be a Jewish state. If you treated Palestinians as equals then it would become a Muslim state in time. The only solution has to be a two state one. 

I believe zionism was wrong and the original sin. And both sides behaved poorly prior to 1948. Probably not equally poorly, but I am not educated enough on the issue to adjudicate that. 

But it seems to me that post-1948, the Palestinians became weaponized by external and internal forces in a way that is hard to comprehend in the West. Increasingly, it seemed like their offer to Israel was basically 'You are intruders in our home. Leave, submit to Muslim rule again, or die.' Right or wrong in the beginning, what options have the Jews really had since then assuming just packing up and saying 'We were wrong. We took your land. We are going to give it all back.' have the Israelis had? 

I dunno. Maybe I am missing something. Why have the Palestinians always rejected the peace deals? Do they really think they can just wait the Jews out and one day turn back the clock?",2023-11-04T00:22:17+00:00,t1_k7odqn0,0.0,0.0,0.0,0.0,0.0,0.0,1.0,0.0,0.0,0.0,0.0,0.0
Politics,comment,Netanyahu,l1toszf,JBHUTT09,,"I got permanently banned from there because I brought up the death of Shireen Abu Akleh as an example of the IDF killing an American with no repercussions. Apparently that's ""disinformation"". Suddenly the pro-genocide nature of that sub made sense. Everyone who speaks out against is (especially people who made good arguments) are banned. All that are left are people who support the genocide and people who argue against it ineffectively, to make the opposing side look bad.",2024-04-29T18:37:52+00:00,t1_l1t3of9,0.0,0.0,0.0,0.0,0.0,0.0,0.0,0.0,0.0,0.0,0.0,1.0
Politics,comment,IDF,c0r8wlu,ghettron,,"Oh, I get it! Violence works every time!",2010-06-02T12:30:08+00:00,t1_c0r8whg,0.0,0.0,0.0,0.0,0.0,0.0,0.0,0.0,0.0,0.0,0.0,1.0
Conservative,comment,Israel,kzlully,Minimum-Enthusiasm14,,"No, like the guy who responded already said, they killed an IRGC commander involved in the Oct 7th attack right next to the consulate.",2024-04-14T23:44:55+00:00,t1_kzlquzh,0.0,0.0,0.0,0.0,0.0,0.0,0.0,0.0,0.0,0.0,1.0,0.0
PoliticalDiscussion,comment,Israeli,kflmxq4,xXxdethl0rdxXx,,"Where, exactly, is a Jewish genocide explicitly called for? Give me the quote. Take your time, i know you’ll need it!",2023-12-30T20:27:01+00:00,t1_kfllwmy,0.0,0.0,0.0,0.0,0.0,0.0,1.0,0.0,0.0,0.0,0.0,0.0
Republican,comment,Israel,kzpxgoc,RedBaronsBrother,,"> Bruh do we stand with Israel or not.

The Biden admin would prefer not.

> Honestly I don’t care, both sides just want to kill everyone on the other side.

The Israelis mostly would like for people to stop trying to kill them.  If they wanted to kill everyone on the other side, it would be done already.

Israel has hundreds of nukes.",2024-04-15T18:58:12+00:00,t1_kzpwsg5,0.0,0.0,0.0,0.0,0.0,0.0,1.0,0.0,0.0,0.0,0.0,0.0
Politics,comment,Israel,l423zzt,GCU_ZeroCredibility,,"What do you mean when you say they're massively falling behind?  They sure aren't _polling_ behind.  The polling could be wrong, and I hope it is, but the polling says they're ahead in most of the key swing states.",2024-05-14T20:48:06+00:00,t1_l41xxs1,0.0,0.0,0.0,0.0,0.0,0.0,0.0,0.0,0.0,0.0,0.0,1.0
Conservatives,comment,Gaza,k6g4f9d,WeirdTalentStack,,"They should have tweeted that, hit the tanks with an air strike, then tweeted again, “Oops, about that.”",2023-10-25T20:52:30+00:00,t1_k6f7e8h,0.0,0.0,0.0,0.0,0.0,0.0,0.0,0.0,0.0,0.0,0.0,1.0
Neoliberal,comment,Israel,je3fkux,BBQ_HaX0r,,"I liked him on Iran and Cuba. Hated Russian Reset and that looks worse with hindsight. He was in a bad spot with Europe (wars and Dubya). He was fine on China (could have been stricter), but TPP would have been amazeballs! Fuck you Trump and Bernie.",2023-03-29T03:07:12+00:00,t1_je2uoom,0.0,0.0,0.0,0.0,0.0,0.0,0.0,0.0,0.0,0.0,0.0,1.0
Politics,comment,Palestine,l2ohsxl,Wernher_VonKerman,,"Segregation still exists up north, it's just more under-the-radar and insidious. I went to college in Boulder, Colorado, which is supposed to be a ""liberal/progressive"" town, but the local white homeowners have conspired to fuck over students and keep the working-class out for decades in a way that just happens to disproportionately affect black people. They're starting to lose power in local politics, but reversing what they built will be a long process.

I checked student demographics for both schools a couple months ago, the % ratio of black CU students to black Coloradans is about the same as between ""Ole Miss"" and Mississippi. 1% for every 4%.",2024-05-05T12:41:48+00:00,t1_l2obyck,0.0,0.0,0.0,0.0,0.0,0.0,0.0,0.0,0.0,0.0,0.0,1.0
PoliticalDiscussion,comment,Palestine,j984ua4,Mason11987,,"> He’s come out and explained why he won’t.

Could you link to where he's explained why he won't?

(The tweet below, about what they can't do is not that)",2023-02-19T23:57:22+00:00,t1_j97c5a8,0.0,0.0,0.0,0.0,0.0,0.0,0.0,0.0,0.0,0.0,1.0,0.0
Politics,comment,Netanyahu,kcghkim,gregcm1,,There's the balls I went Blue for so many years ago...,2023-12-08T03:51:08+00:00,t3_18d2yf9,0.0,0.0,0.0,0.0,0.0,0.0,0.0,0.0,0.0,0.0,0.0,1.0
Politics,comment,Palestine,de7ru3e,classic_douche,,No. The only connection between the two is entirely in your head.,2017-02-25T23:30:08+00:00,t1_de7qjmv,0.0,0.0,0.0,0.0,0.0,0.0,0.0,0.0,0.0,0.0,0.0,1.0
PoliticalDiscussion,comment,Israeli,c74lsie,hassani1387,,whatever,2012-11-21T05:55:05+00:00,t1_c74kcbm,0.0,0.0,0.0,0.0,0.0,0.0,0.0,0.0,0.0,0.0,0.0,1.0
Neoliberal,comment,Israel,kxvz42u,Elguero1991,,Omg,2024-04-03T18:02:58+00:00,t1_kxvorjs,0.0,0.0,0.0,0.0,0.0,0.0,0.0,0.0,0.0,0.0,0.0,1.0
Politics,comment,Israeli,kwalx0f,deadcatbounce22,,"In part would be all the Palestinians of Gaza, but leaving the Palestinians in the WB alone. It’s still not clear Israel is trying to eliminate all of Gaza.",2024-03-24T03:46:57+00:00,t1_kw9ir3d,0.0,0.0,0.0,0.0,0.0,0.0,0.0,1.0,0.0,0.0,0.0,0.0
Republican,comment,Palestinian,kppcvkj,Snoo54249,,"The great Obama strategically traded 5 terrorists for Joe Bergdahl, Biden just as dumb, Democrats are making us look like a clown show",2024-02-09T22:48:22+00:00,t3_1aliso0,0.0,0.0,0.0,0.0,0.0,0.0,0.0,0.0,0.0,0.0,0.0,1.0
Politics,comment,Palestine,gy7hhr9,Aggregate_Browser,,What a dick.,2021-05-15T12:20:46+00:00,t3_ncuymt,0.0,0.0,0.0,0.0,0.0,0.0,0.0,0.0,0.0,0.0,0.0,1.0
Geopolitics,comment,Palestine,h2s5bth,BoardriderX,,I'm sorry I don't see it ending anytime soon. I 52 and it has changed much in all that time and it doesn't seem much different now,2021-06-23T16:10:25+00:00,t3_o6aeep,0.0,0.0,0.0,0.0,0.0,0.0,0.0,0.0,0.0,0.0,1.0,0.0
Libertarian,comment,Israel,l3qgl1t,RyWol,,You are welcome!,2024-05-12T17:19:58+00:00,t1_l3qfasy,0.0,0.0,0.0,0.0,0.0,0.0,0.0,0.0,0.0,0.0,0.0,1.0
PoliticalDiscussion,comment,Gaza,k5da815,MoreThanBored,,Their children are blown up by Israeli bombs.,2023-10-18T06:13:11+00:00,t1_k5c0zut,0.0,0.0,0.0,0.0,0.0,0.0,0.0,1.0,0.0,0.0,0.0,0.0
Politics,comment,Palestine,coazocf,caferrell,,"In the USA, that leaves you very few politicians to vote for...",2015-02-04T16:17:45+00:00,t1_coaz58x,0.0,0.0,0.0,0.0,0.0,0.0,0.0,0.0,0.0,0.0,1.0,0.0
