subreddit,type,keyword,id,author,title,body,created_utc,parent_id,pro_immigration,anti_immigration,pro_climateAction,anti_climateAction,public_healthcare,private_healthcare,pro_israel,pro_palestine,pro_middle_low_tax,pro_wealthy_corpo_tax,neutral,irrelevant
PoliticalDiscussion,comment,Gaza,ky75f6z,Admirable-Cherry6614,,"*What is antisemitism to you? Very telling that after you said “they have they typically side with the pro-Palestine movement” you immediately said they have higher rates of antisemitism than other social groups.*

Okay, I'd be interested if you could find me one prominent black movement that sides with Israel. I've never actually seen it.

*Since you’re making the claim, you can back it up with sources.*

[https://www.jewishvirtuallibrary.org/adl-survey-finds-anti-semitism-high-in-black-community](https://www.jewishvirtuallibrary.org/adl-survey-finds-anti-semitism-high-in-black-community)

If you don't believe that, this has been documented in academia for years, actually.

[https://www.jstor.org/stable/3791499](https://www.jstor.org/stable/3791499)

[*https://scholar.harvard.edu/files/jsimes/files/ssj\_simes\_2009.pdf*](https://scholar.harvard.edu/files/jsimes/files/ssj_simes_2009.pdf)",2024-04-05T17:12:19+00:00,t1_ky72nzd,0.0,0.0,0.0,0.0,0.0,0.0,1.0,0.0,0.0,0.0,0.0,0.0
Neoliberal,comment,Israel,in6evxi,EtonSAtom,,"Only with Israel, will you see users in this sub running defense for illiberal policies. It does not make sense. People's common sense turns off when it comes to Israel.",2022-09-05T12:47:15+00:00,t3_x5v92j,0.0,0.0,0.0,0.0,0.0,0.0,0.0,0.0,0.0,0.0,1.0,0.0
Conservative,comment,Israeli,kxpxhze,Fedballin,,"Sorry, I knew it had the same vowel twice and got them mixed up.",2024-04-02T16:40:49+00:00,t1_kxow2fr,0.0,0.0,0.0,0.0,0.0,0.0,0.0,0.0,0.0,0.0,0.0,1.0
Politics,comment,Israeli,k69u8i2,newsspotter,,"Pentagon to send military advisers and air defense systems to Israel
[the guardian](https://www.theguardian.com/world/2023/oct/23/pentagon-military-advisers-air-defense-israel-hamas-war-gaza)",2023-10-24T17:05:48+00:00,t1_k67l6jt,0.0,0.0,0.0,0.0,0.0,0.0,0.0,0.0,0.0,0.0,1.0,0.0
Politics,comment,antisemitic,l2dn9bd,Spundro,,"Smells fishy, doesn't it? Rotten even?

Why would two opposing parties, famously disagreeable with eachother, come together so easily and readily for such a targeted and opinion restricting bit of legislation? What common desire could they share? What would make them cooperate so swimmingly? Don't look up, I guess...

Careful, dig around or ask too many questions and you might start wanting answers, connecting dots, thinking for yourself.... can't have that now can we?",2024-05-03T10:41:55+00:00,t1_l297p5a,0.0,0.0,0.0,0.0,0.0,0.0,0.0,1.0,0.0,0.0,0.0,0.0
PoliticalDiscussion,comment,Palestinian,k93jnpp,123mop,,When the bank robbers open fire to clear a path through the police and more innocent civilians right behind them you can expect to see them return fire. At the end of the day allowing the terrorists to kill without opposition because their hostages might get hurt if you fight back causes more death than fighting back and potentially killing the hostages.,2023-11-13T18:15:02+00:00,t1_k935vbq,0.0,0.0,0.0,0.0,0.0,0.0,1.0,0.0,0.0,0.0,0.0,0.0
PoliticalDiscussion,comment,Israeli,edsuwly,MemberforMcMurray,,"I don’t think the Israel-Palestine is even a Top 20 issue for most Americans.

Considering the majority of the American population is neither Jewish nor Muslim.

That whole region is completely fucked, I think any US government should be moving as far away from the Middle East as possible",2019-01-11T12:44:45+00:00,t3_aekosw,0.0,0.0,0.0,0.0,0.0,0.0,0.0,0.0,0.0,0.0,1.0,0.0
Politics,comment,antisemitic,l1pm2po,Danyal782,,"“they” are not one group of people. Many of the organizers have set clear rules against hate speech, and there are plenty of examples of Jewish students being part of these encampments. There have even been students [celebrating Passover Sedar](https://abcnews.go.com/amp/US/jewish-student-protesters-celebrate-passover-seder-encampments/story?id=109538075) in the encampments. 

Obviously with any large protest, some people are going to join it to push their own agenda. Anyone joining with an anti-semitic agenda should be condemned and punished by the university, but these incidents don’t invalidate the goals of the larger movement, which is divestment from Israel.",2024-04-28T23:20:32+00:00,t1_l1pieq6,0.0,0.0,0.0,0.0,0.0,0.0,0.0,1.0,0.0,0.0,0.0,0.0
Neoliberal,comment,antisemitic,iixpbol,GodOfTime,,Succs and antisemitism. Name a more iconic duo.,2022-08-04T16:41:10+00:00,t3_wg59xg,0.0,0.0,0.0,0.0,0.0,0.0,0.0,0.0,0.0,0.0,1.0,0.0
Politics,comment,Hamas,kex0hsn,Lounginghog64,,How utterly worthless.,2023-12-25T22:55:35+00:00,t3_18qrkzn,0.0,0.0,0.0,0.0,0.0,0.0,0.0,0.0,0.0,0.0,0.0,1.0
Republican,comment,Israel,l17u8w3,AutoModerator,,"/r/Republican is a partisan subreddit.  This is a place for Republicans to discuss issues with other Republicans.
To those visiting this thread, we ask that unless you identify as Republican that you refrain from commenting and [leave the vote button alone](https://www.reddit.com/r/MetaRepublican/comments/5t017a/this_sub_is_for_republicans_if_you_do_not/). Non republicans who come to our sub looking for a 'different perspective' [subvert that very perspective with their own views when they vote or comment.](http://i.imgur.com/XqL0wfR.jpg)

*I am a bot, and this action was performed automatically. Please [contact the moderators of this subreddit](/message/compose/?to=/r/Republican) if you have any questions or concerns.*",2024-04-25T15:55:29+00:00,t3_1ccvipl,0.0,0.0,0.0,0.0,0.0,0.0,0.0,0.0,0.0,0.0,0.0,1.0
Neoliberal,comment,Rafah,l5uxogj,Khar-Selim,,"This is a simplistic and foolish way of thinking. Like, yeah we crossed lines and nothing happened, because we crossed them correctly. When you're negotiating with an unstable person who has a hostage, and you manage to keep things calm enough to get your guy in closer, that doesn't mean getting that close from the get go was always a viable option, nor does it mean you can keep getting closer right away without consequence. You can argue that Biden has been working too slowly but it's stupid to think that if he'd just crossed all the red lines he's crossed so far right at the beginning of the conflict that we wouldn't be facing massively increased risks.",2024-05-27T08:49:24+00:00,t1_l5upvyk,0.0,0.0,0.0,0.0,0.0,0.0,0.0,0.0,0.0,0.0,1.0,0.0
Neoliberal,comment,Israel,kzhh2pb,DouglasDauntless,,"https://preview.redd.it/755447sa8duc1.jpeg?width=1170&format=pjpg&auto=webp&s=07ffce43028380cf871d5008d2518562d141cff4

“Some of you may die, but that is a sacrifice I’m willing to make”",2024-04-14T03:38:33+00:00,t3_1c3cd2u,0.0,0.0,0.0,0.0,0.0,0.0,0.0,0.0,0.0,0.0,1.0,0.0
Politics,comment,Gaza,l2miz2x,Southern_Agent6096,,"About 200,000 Arabs in Michigan. Biden won the state by about 150k. That's not counting the progressives protesting at universities.",2024-05-05T00:57:03+00:00,t1_l2l53e0,0.0,0.0,0.0,0.0,0.0,0.0,0.0,0.0,0.0,0.0,0.0,1.0
Republican,comment,antisemitic,k7k0ocz,pineappleshnapps,,Damn.  You might have a point.,2023-11-02T20:20:29+00:00,t1_k7issi5,0.0,0.0,0.0,0.0,0.0,0.0,0.0,0.0,0.0,0.0,0.0,1.0
Conservative,comment,antisemitic,kcjai6w,ShockApprehensive392,,"I don’t want any civilians to die. But name a war where there weren’t civilian casualties??? You think Hamas gives a shit about Israeli civilian casualties? They literally sought it out. In WW2 would you consider both the nazi AND the ally forces as terrorists? After all, more German civilians died then western civilians. I’d like there to be restrictions on our funding in exchange for ttp’s that reduce civilian casualties, sure. But to sit here and equate Hamas and Israel is insanity. The only solution to this conflict is the eradication of Hamas, because they will not stop until they wipe out Israel. Palestine has been the aggressor each and every time there has been a conflict. It boils down to this, if Hamas put down their weapons there would be a Palestinian state, if Israel put down its weapons they would be annihilated end of story.",2023-12-08T18:59:35+00:00,t1_kcj739k,0.0,0.0,0.0,0.0,0.0,0.0,1.0,0.0,0.0,0.0,0.0,0.0
PoliticalDiscussion,comment,Israeli,hd5q36q,squeek1984,,"If only we had some sort of partnership across the pacific that would provide an economic wall against China....like a Trans Pacific alliance or something like that. 

Nah could never happen",2021-09-17T02:16:53+00:00,t3_ppjcoq,0.0,0.0,0.0,0.0,0.0,0.0,0.0,0.0,0.0,0.0,0.0,1.0
Politics,comment,Netanyahu,l1t2500,Tisamonsarmspines,,lol no,2024-04-29T16:29:52+00:00,t1_l1t1bry,0.0,0.0,0.0,0.0,0.0,0.0,0.0,0.0,0.0,0.0,1.0,0.0
Politics,post,Hamas,1agb9bn,Old_Pen9843,New York Times Puts “Daily” Episode on Ice Amid Internal Firestorm Over Hamas Sexual Violence Article,,2024-02-01T13:41:44+00:00,,0.0,0.0,0.0,0.0,0.0,0.0,0.0,0.0,0.0,0.0,1.0,0.0
Republican,comment,Hamas,k7277xk,Fus_Roh_Potato,,There are already articles saying he's going to deport all Muslims again. yeah...,2023-10-30T07:21:21+00:00,t1_k70ahiy,0.0,0.0,0.0,0.0,0.0,0.0,0.0,0.0,0.0,0.0,0.0,1.0
Conservatives,post,Hamas,19du7lo,MojoV100,Not Babylon Bee: Jerusalem Post Agonizes Over the ‘Climate Crisis’ of Israel’s War Against Hamas,,2024-01-23T17:50:02+00:00,,0.0,0.0,0.0,0.0,0.0,0.0,0.0,0.0,0.0,0.0,1.0,0.0
Politics,comment,Israel,l46zgta,ScholarZero,,Yeah obviously any reddit comment should be backed up with sources cited with proper MLA formatting.  And at least three paragraphs double spaced.  Due date is Friday.,2024-05-15T18:29:26+00:00,t1_l4605lf,0.0,0.0,0.0,0.0,0.0,0.0,0.0,0.0,0.0,0.0,0.0,1.0
Neoliberal,comment,Netanyahu,krtstzn,Substantial_Cat_8991,,It's not gonna have much support from Israelis. Him and his coalition are already projected for massive elections losses,2024-02-23T21:34:45+00:00,t1_krtrvqr,0.0,0.0,0.0,0.0,0.0,0.0,0.0,0.0,0.0,0.0,1.0,0.0
PoliticalDiscussion,comment,Palestinian,cio6bno,proindrakenzol,,"Then what *do* you mean? Because, as you admitted, you're uninformed; so what *specific* abuses are you talking about? And are you sure they're actual abuses and not, say, perfectly justifiable actions that any other country in the world would be able to perform with both full support from other nations and without risk of censure?",2014-07-04T04:30:12+00:00,t1_cio6994,0.0,0.0,0.0,0.0,0.0,0.0,0.0,0.0,0.0,0.0,1.0,0.0
Neoliberal,comment,Netanyahu,h0ezy6c,lets_chill_dude,,Can someone give a brief overview of the expected changes in policy that will come from this change?,2021-06-03T08:18:09+00:00,t3_nqvjus,0.0,0.0,0.0,0.0,0.0,0.0,0.0,0.0,0.0,0.0,1.0,0.0
Politics,comment,Palestine,jvpje1m,Oh-Cool-Story-Bro,,"They aren’t, “people,” they’re people. De-humanizing political opponents is what fascists do. They’re people. Elected by people. Some terrible. Some well intentioned but misinformed or just stupid.",2023-08-11T09:43:42+00:00,t1_jvo4o7b,0.0,0.0,0.0,0.0,0.0,0.0,0.0,0.0,0.0,0.0,1.0,0.0
Conservatives,comment,Israel,kdmgpwi,praetorfenix,,I wouldn’t vote for him by any stretch of the imagination but him saying this is quite a breath of fresh air.,2023-12-16T15:44:41+00:00,t3_18jbgt2,0.0,0.0,0.0,0.0,0.0,0.0,0.0,0.0,0.0,0.0,0.0,1.0
Geopolitics,post,Gaza,18657bg,the_stormapproaching,"A Turkish Perspective on Ukraine, Israel and NATO","| Part Two of [A Turkish Perspective on the World](https://www.reddit.com/r/geopolitics/comments/17u3zpi/a_turkish_perspective_on_the_world/?utm_source=share&utm_medium=web2x&context=3), I think reading that first is quite essential to this post. |  


  
Now that we've looked at the time period of 1980-2016, it's time to look at the present and the future. I'll try to stay as objective as I can in this post and mostly parrot what other turkish people around me think rather than my own opinions.

&#x200B;

\_\_\_\_\_\_\_\_\_\_\_\_\_\_\_\_\_\_\_\_\_\_\_\_\_\_\_\_\_\_\_\_\_

# Palestine, Israel and the Israel-Hamas War

The turkish view on this conflict has always been very complicated, because both Islam and xenophobia and racism against arabs are popular in Turkey. There are two extremes, and you will not get any answers other than these two if you ask a turkish person about this conflict. It's either ""Good, less arabs in the world"" or ""Israel are evil terrorists"".,

 With the recent Gaza Conflict, there were a lot of islamist Turks, mostly in more conservative areas, that boycotted western items, even going so far as to harass people sitting at Starbucks or drinking Cola. What that has to do with Israel, don't ask me. Meanwhile more secular turks have just stuck to ""Good, less arabs in the world"". For the future of this conflict, everyone agrees that Israel will win and keep winning, whether begrudgingly or happily.  


  
\_\_\_\_\_\_\_\_\_\_\_\_\_\_\_\_\_\_\_\_\_\_\_\_\_\_\_\_\_\_\_\_\_

# War in Ukraine and Russia's Future

The Ukraine War was never a big topic in Turkey, interestingly. I'm pretty much the only person I know that knows much about it. The Western view that Russia has messed up bad in this war and will never recover is denied by most Turks, as Russia is simply seen as too big and strong to fall. Most people also buy into the Russian propaganda that they're fighting NATO, not just Ukraine. Putin is seen usually as a strong and capable leader that's far more capable than any western leaders. 

Make no mistake though, Russia is still a clear enemy to Turks, as it has been for centuries. Russia is expected to eventually win, no matter how long it takes. Erdogan's policy of neutrality and trying to become the negotiator between two sides has been praised by most Turks, and even anti-Erdogan people usually say ""He's terrible at everything but good at foreign policy."".

&#x200B;

\_\_\_\_\_\_\_\_\_\_\_\_\_\_\_\_\_\_\_\_\_\_\_\_\_\_\_\_\_\_\_\_\_\_

# Sweden, Finland and NATO

As all of you probably know, on 18 May 2022, Sweden and Finland jointly applied to join NATO. Finland has been approved but Sweden still hasn't, and we even held Finland up for a long while. Why is this?  


Minor political gains for Erdogan, mostly. There is some stuff with Sweden harboring PKK terrorists but Finland really didn't do anything to us. The west has (in my opinion, rightfully) been pretty upset at Erdogan for throwing good will under the bus for some minor concessions. But most Turks think he played this well. But why?

Well, from a cold geopolitics perspective, he did. Turkey is indispensable to NATO. It is never getting kicked out. Turkey has the second largest military in NATO and is the strongest military in both the Balkans and the Middle East, while also controlling the Bosphorus, which completely checkmates Russia's strongest fleet, the Black Sea fleet. There is simply nothing the West can do other than accept Erdogan's demands as long as he doesn't go too far, and he knows it. As long as Erdogan is in charge, keep expecting these kinds of stunts.

&#x200B;

\_\_\_\_\_\_\_\_\_\_\_\_\_\_\_\_\_\_\_\_\_\_\_\_\_\_\_\_\_\_\_\_\_\_\_

# End Notes

Sorry if this wasn't as interesting as the first one, there's just a lot less to talk about here. As always, I'd love to hear your own thoughts and comments below, we had some interesting debates in the comments last time (except for the guy that advocated for a Romano-Turkic culture to be created, he needs to stop playing HOI4). Thanks for reading.",2023-11-28T20:02:03+00:00,,0.0,0.0,0.0,0.0,0.0,0.0,1.0,0.0,0.0,0.0,0.0,0.0
Politics,comment,Rafah,c0twrgi,zenje,,[Is this a myth?](http://i.imgur.com/oScsh.jpg),2010-07-09T22:15:32+00:00,t3_cnr20,0.0,0.0,0.0,0.0,0.0,0.0,0.0,0.0,0.0,0.0,0.0,1.0
Geopolitics,comment,Hamas,khqtrmm,dclovers4,,"Considering they are the biggest funders to Hamas and atleast the main Hamas leadership resides in Qatar, which must have received instructions about the attack, there's no way that qatar was unaware about the attack by 10/6. 


I'd argue they must have taken the risk because IMEC is a big issue for them and moreover Saudi Israel reproachar would lead them very isolated!",2024-01-14T00:23:56+00:00,t1_khqpeby,0.0,0.0,0.0,0.0,0.0,0.0,0.0,0.0,0.0,0.0,1.0,0.0
Politics,comment,Netanyahu,kpqdsfj,SpiritualOrangutan,,Sure and hamas isn't on the same side as Bernie?? He's literally Jewish like what? You only see in black and white?,2024-02-10T03:02:07+00:00,t1_kpq0wt6,0.0,0.0,0.0,0.0,0.0,0.0,1.0,0.0,0.0,0.0,0.0,0.0
Politics,comment,antisemitic,l2ofjvq,History_isCool,,"That would absolutely be antisemitism. Calling for genocide of jews is absolutely antisemitism. No gray areas in that department. And most protest, from the US to my own country has experienced protests where that call has been front and centre. «From the river to sea» is being chanted at pretty much any pro-palestinian protest. A common chant and slogan also used and very popular among Hamas and its supporters. That chant is a call for Israel’s destruction. Divest campaigns would also be antisemitism if the reasoning behind it is to destroy, weaken or delegitimize Israel’s existence in order to eventually destroy it.",2024-05-05T12:22:18+00:00,t1_l2oekvl,0.0,0.0,0.0,0.0,0.0,0.0,0.0,1.0,0.0,0.0,0.0,0.0
Republican,comment,Hamas,k7pl7bc,gregcm1,,"I did not. Saw they signed some ill advised letter, but the letter was critical of the Israeli government. That is not anti-Semitism, a government is not above criticism bc of the religious demographics of their populace",2023-11-03T21:56:54+00:00,t1_k7pg42u,0.0,0.0,0.0,0.0,0.0,0.0,0.0,0.0,0.0,0.0,1.0,0.0
Geopolitics,comment,Gaza,k80lr1b,rondpompon,,Their history of dealing with Jews isn't exactly stellar.,2023-11-06T02:10:20+00:00,t1_k7zf18h,0.0,0.0,0.0,0.0,0.0,0.0,0.0,0.0,0.0,0.0,1.0,0.0
Neoliberal,comment,Israeli,hfxgh7t,DungeonCanuck1,,The Mosque is private property and is run by Jordan and an Islamic organization. Israel’s only job is provide security. The people who run Al-Aqsa don’t want Jewish prayer there and Israel respects their wishes.,2021-10-09T01:40:09+00:00,t1_hfwxyke,0.0,0.0,0.0,0.0,0.0,0.0,0.0,0.0,0.0,0.0,1.0,0.0
Politics,comment,Israel,l5n60b4,randomnighmare,,"Is Joe Biden perfect no. But not voting and/or voting third party at this point is a win for Trump. I am honestly tired of the deflections. Only because the Republicans will be in locked step with voting for Trump come November but this idea of forsaken Biden because he isn't your ideal candidate is party why Trump won on 2016. It doesn't help with anything and honestly like 90-95% of people in the US support Israel and wants it to exist.

Edit",2024-05-25T18:21:16+00:00,t1_l5msr6q,0.0,0.0,0.0,0.0,0.0,0.0,0.0,0.0,0.0,0.0,1.0,0.0
Conservatives,comment,Israel,ke6v0m0,RaspberryPill,,This cockroach is still crawling around?,2023-12-20T15:33:37+00:00,t3_18mwwut,0.0,0.0,0.0,0.0,0.0,0.0,0.0,0.0,0.0,0.0,1.0,0.0
Politics,comment,antisemitic,kc3g1g0,headypete42033,,"pretty cool, need to ban hate speech in all forms.",2023-12-05T14:13:10+00:00,t3_18b0zdg,0.0,0.0,0.0,0.0,0.0,0.0,0.0,0.0,0.0,0.0,1.0,0.0
Libertarian,comment,Gaza,dyzapzc,MetsMan71,,"If the suggestion is that libertarians don't care, I think you're way off. If your suggestion is that libertarians have grown weary of the apartheid policies of our so-called ally, then, yeah, you're probably right. Israel can fuck straight off to hell, but there ain't jack shit any of us can do anything about it. Both parties are so far up the pro-Israel lobby's ass, ain't nothing ever going to change. ",2018-05-14T20:57:46+00:00,t1_dyyzh5p,0.0,0.0,0.0,0.0,0.0,0.0,0.0,1.0,0.0,0.0,0.0,0.0
Politics,comment,Netanyahu,kux7gkj,whverman,,I agree entirely,2024-03-15T00:38:40+00:00,t1_kux77mu,0.0,0.0,0.0,0.0,0.0,0.0,0.0,1.0,0.0,0.0,0.0,0.0
Neoliberal,post,Israel,1bzcxpa,87568354,Trump has some deeply questionable policy positions and outright incorrect statements on his campaign website. Here’s a look at some.,"Everything quoted comes directly from Trump’s website: [https://www.donaldjtrump.com](https://www.donaldjtrump.com). In some cases, I have bolded certain statements that I take particular issue with. This isn’t about everything Trump endorses on there; I focused on what I think are the most objectionable or least coherent views.

>***Secure Borders and Reclaim National Sovereignty***  
>  
>President Donald J. Trump created the most secure border in U.S. history. He ended catch-and-release, took down human traffickers, deported record numbers of illegal alien gang members, and built 450 miles of powerful new wall. Joe Biden turned our country into one giant sanctuary for dangerous criminal aliens when he suspended all immigration enforcement in the middle of a global pandemic and reversed landmark agreements that safely returned asylum-seekers to Mexico, Guatemala, Honduras, and El Salvador. The onslaught of illegal aliens invading our wide-open borders threatens public safety, drains the treasury, undermines U.S. workers, and burdens schools and hospitals. President Trump will shut down Biden’s border disaster. He will again end catch-and-release, restore Remain in Mexico, and eliminate asylum fraud. In cooperative states, **President Trump will deputize the National Guard and local law enforcement to assist with rapidly removing illegal alien gang members and criminals**. He will also deliver a merit-based immigration system that protects American labor and promotes American values.

It is generally agreed on here that immigrating to the US is far harder than it should be, so I don’t believe that I have to elaborate much on why I find this section objectionable. I also don’t think it comes as a surprise for anybody that Trump once again wants to tighten the border. I suspect that empowering law enforcement to rapidly remove people will end up violating any concept of due process.

>***Renew American Strength and Leadership***  
>  
>President Donald J. Trump replaced the failed policy of never-ending war, regime change and nation-building with a bold vision to pursue peace through strength. He fully rebuilt American military might, modernized our nuclear arsenal, and launched the Space Force. **He obliterated 100 percent of the ISIS caliphate**, killed its founder and leader Abu-Bakar Al Baghdadi, and eliminated the world's number one terrorist, Qasem Soleimani. President Trump kept America out of new wars and brought thousands of brave troops home from Afghanistan, Iraq, Somalia, and many other countries. Joe Biden has undermined our military readiness and surrendered our strength to the Taliban. President Trump will defend America against all threats, protect America against all dangers, and keep America out of unnecessary foreign wars. He will also get Biden’s radical left ideology out of our military and rehire every patriot who was unjustly fired. To protect our people from the threat of nuclear weapons and hypersonic missiles, President Trump will also build a state-of-the-art next-generation missile defense shield.

In this section, Trump seems to be advocating for a greater US presence abroad, in particular characterizing Biden’s withdrawal from Afghanistan as a sign of weakness and “surrendering our strength to the Taliban”, while also advocating for staying out of foreign wars. I find that to be inherently self contradictory. Also, his statement about destroying ISIS is objectively incorrect. ISIS still exists, and two of its international affiliates—IS-WAP and IS-KP—are concerning in the actions they have taken, with IS-WAP being the single biggest source of unrest and bloodshed in the Sahel, while IS-KP is not inconsiderable, as shown by their actions in Afghanistan and recent attack on a Russian concert hall, which killed over a hundred people. In short, Trump’s claim about ISIS is a blatant lie.

>***Reject Globalism and Embrace Patriotism***  
>  
>President Donald J. Trump forged international cooperation among strong, sovereign, and independent nations to create a future of peace, prosperity, and promise for the world. He combatted Radical Islamic terrorism, withdrew from the disastrous Iran Nuclear Deal, and suspended travel and refugee resettlement from the world’s most dangerous regions. **He recognized Israel's true capital and moved the American Embassy to Jerusalem and acknowledged Israeli sovereignty over the Golan Heights**. As a result of his bold diplomacy and principled realism, President Trump brokered four Middle East peace deals, collectively called the Abraham Accords, and our NATO allies agreed to pay $400 billion more in defense spending. Joe Biden’s humiliating defeat in Afghanistan has emboldened rogue regimes, terrorist groups, and rivals like China, Russia, North Korea, and Iran that were in retreat. Under President Trump, we will restore our standing in the world and American leadership abroad.

The title of this section speaks for itself. I shouldn’t need to elaborate on why this is bad, since this sub is staunchly pro-globalist and generally understands why globalism is good. That section about Israel is the most worrying part of this section, especially in light of Israel’s conduct in their ongoing war in the Gaza Strip. The remark about “Israel’s true capital” shows that Trump has little to no respect for the UN’s attempts to establish peace in the region, suggesting that he intends to generally disregard international consensus (such as it is) on this issue. The remark about “Israeli sovereignty over the Golan Heights” makes it clear once again that Trump supports Israeli expansion and settlements, a position both illegal and immoral.

What are your thoughts on Trump’s policy?",2024-04-08T23:24:47+00:00,,0.0,0.0,0.0,0.0,0.0,0.0,0.0,1.0,0.0,0.0,0.0,0.0
